>>obey TEST010(setup);
>>--------------------------------------------------------------------------
>>
>>cqd hbase_max_column_name_length '10';

--- SQL operation complete.
>>cqd hbase_max_column_val_length '20';

--- SQL operation complete.
>>cqd hbase_max_column_info_length '60';

--- SQL operation complete.
>>
>>
>>cqd hbase_serialization 'OFF';

--- SQL operation complete.
>>cqd hbase_filter_preds 'OFF';

--- SQL operation complete.
>>
>>-- query_cache on(default), mdam_scan_method on(default)
>>cqd query_cache '1024';

--- SQL operation complete.
>>cqd mdam_scan_method 'ON';

--- SQL operation complete.
>>obey TEST010(clean_up);
>>--------------------------------------------------------------------------
>>drop table if exists t010t1;

--- SQL operation complete.
>>drop table if exists t010t2;

--- SQL operation complete.
>>drop table if exists t010t3;

--- SQL operation complete.
>>
>>obey TEST010(tests);
>>--------------------------------------------------------------------------
>>
>>create table if not exists t010t1 (a int not null, b char(10), primary key(a));

--- SQL operation complete.
>>create table if not exists t010t2 (a int not null, b char(10) not null, c int not null, d char(10), primary key(a,b,c));

--- SQL operation complete.
>>create table if not exists t010t3 (a int not null, b char(10) not null, c int not null, d char(10), primary key(a,b,c))
+>  salt using 4 partitions on (a,b);

--- SQL operation complete.
>>
>>invoke t010t1;

-- Definition of Trafodion table TRAFODION.SCH.T010T1
-- Definition current  Thu Sep 11 15:41:46 2014

  (
    A                                INT NO DEFAULT NOT NULL NOT DROPPABLE
  , B                                CHAR(10) CHARACTER SET ISO88591 COLLATE
      DEFAULT DEFAULT NULL
  )

--- SQL operation complete.
>>invoke hbase."_CELL_"."TRAFODION.SCH.T010T1";

-- Definition of Trafodion table HBASE."_CELL_"."TRAFODION.SCH.T010T1"
-- Definition current  Thu Sep 11 15:41:46 2014

  (
    ROW_ID                           VARCHAR(10) CHARACTER SET ISO88591 COLLATE
      DEFAULT NO DEFAULT NOT NULL NOT DROPPABLE
  , COL_FAMILY                       VARCHAR(10) CHARACTER SET ISO88591 COLLATE
      DEFAULT NO DEFAULT NOT NULL NOT DROPPABLE
  , COL_NAME                         VARCHAR(10) CHARACTER SET ISO88591 COLLATE
      DEFAULT NO DEFAULT NOT NULL NOT DROPPABLE
  , COL_TIMESTAMP                    LARGEINT NO DEFAULT NOT NULL NOT DROPPABLE
  , COL_VALUE                        VARCHAR(20) CHARACTER SET ISO88591 COLLATE
      DEFAULT NO DEFAULT NOT NULL NOT DROPPABLE
  )

--- SQL operation complete.
>>invoke hbase."_ROW_"."TRAFODION.SCH.T010T1";

-- Definition of Trafodion table HBASE."_ROW_"."TRAFODION.SCH.T010T1"
-- Definition current  Thu Sep 11 15:41:46 2014

  (
    ROW_ID                           VARCHAR(10) CHARACTER SET ISO88591 COLLATE
      DEFAULT NO DEFAULT NOT NULL NOT DROPPABLE
  , COLUMN_DETAILS                   VARCHAR(60) CHARACTER SET ISO88591 COLLATE
      DEFAULT NO DEFAULT NOT NULL NOT DROPPABLE
  )

--- SQL operation complete.
>>
>>insert into t010t1 values (1, 'a'), (2, 'b'), (3, 'c');

--- 3 row(s) inserted.
>>
>>select * from t010t1;

A            B         
-----------  ----------

          1  a         
          2  b         
          3  c         

--- 3 row(s) selected.
>>
>>select * from t010t1 where a = 2;

A            B         
-----------  ----------

          2  b         

--- 1 row(s) selected.
>>
>>select * from t010t1 where a = 2 or a = 3;

A            B         
-----------  ----------

          2  b         
          3  c         

--- 2 row(s) selected.
>>
>>delete from t010t1 where a = 4;

--- 0 row(s) deleted.
>>
>>select * from t010t1;

A            B         
-----------  ----------

          1  a         
          2  b         
          3  c         

--- 3 row(s) selected.
>>
>>delete from t010t1 where a = 2;

--- 1 row(s) deleted.
>>
>>select * from t010t1;

A            B         
-----------  ----------

          1  a         
          3  c         

--- 2 row(s) selected.
>>
>>select converttohex(cast(row_id as char(4))) rowid,
+>          converttohex(cast(col_family as char(2))) colfamily,
+>          converttohex(cast(col_name as char(1))) colname,
+>          converttohex(cast(col_value as char(4))) colvalue
+>                from hbase."_CELL_"."TRAFODION.SCH.T010T1";

ROWID     COLFAMILY  COLNAME  COLVALUE
--------  ---------  -------  --------

80000001  2331       01       01000000
80000001  2331       02       00612020
80000003  2331       01       03000000
80000003  2331       02       00632020

--- 4 row(s) selected.
>>
>>select converttohex(cast(row_id as char(4))) rowid,
+>          converttohex(cast(col_family as char(2))) colfamily,
+>          converttohex(cast(col_name as char(1))) colname,
+>          converttohex(cast(col_value as char(4))) colvalue
+>                from hbase."_CELL_"."TRAFODION.SCH.T010T1"
+>          where converttohex(cast(row_id as char(4))) = '80000001';

ROWID     COLFAMILY  COLNAME  COLVALUE
--------  ---------  -------  --------

80000001  2331       01       01000000
80000001  2331       02       00612020

--- 2 row(s) selected.
>>
>>select converttohex(cast(row_id as char(4))) rowid,
+>          converttohex(cast(column_details as char(40))) coldetails
+>                 from hbase."_ROW_"."TRAFODION.SCH.T010T1";

ROWID     COLDETAILS
--------  --------------------------------------------------------------------------------

80000001  040023313A010400000001000000040023313A020B00000000612020202020202020202020202020
80000003  040023313A010400000003000000040023313A020B00000000632020202020202020202020202020

--- 2 row(s) selected.
>>select converttohex(cast(row_id as char(4))) rowid,
+>          converttohex(cast(column_details as char(40))) coldetails
+>                 from hbase."_ROW_"."TRAFODION.SCH.T010T1"
+>          where converttohex(cast(row_id as char(4))) = '80000001';

ROWID     COLDETAILS
--------  --------------------------------------------------------------------------------

80000001  040023313A010400000001000000040023313A020B00000000612020202020202020202020202020

--- 1 row(s) selected.
>>
>>-------------------
>>-- check query plan
>>-------------------
>>
>>-- no sort operator should present when order by on primary key column
>>prepare xx from select * from t010t1 order by a;

--- SQL command prepared.
>>explain options 'f' xx;

LC   RC   OP   OPERATOR              OPT       DESCRIPTION           CARD
---- ---- ---- --------------------  --------  --------------------  ---------

1    .    2    root                                                  1.00E+002
.    .    1    trafodion_scan                  T010T1                1.00E+002

--- SQL operation complete.
>>
>>-- should see a sort when order by on non key column
>>prepare xx from select * from t010t1 order by b;

--- SQL command prepared.
>>explain options 'f' xx;

LC   RC   OP   OPERATOR              OPT       DESCRIPTION           CARD
---- ---- ---- --------------------  --------  --------------------  ---------

2    .    3    root                                                  1.00E+002
1    .    2    sort                                                  1.00E+002
.    .    1    trafodion_scan                  T010T1                1.00E+002

--- SQL operation complete.
>>
>>-- selectPred should present due to the 2nd disjunct b='1'
>>prepare xx from select * from t010t1 where a=1 or b='1';

--- SQL command prepared.
>>explain xx;

------------------------------------------------------------------ PLAN SUMMARY
MODULE_NAME .............. DYNAMICALLY COMPILED
STATEMENT_NAME ........... XX
PLAN_ID .................. 212277210106984587
ROWS_OUT ................ 11
EST_TOTAL_COST ........... 0.01
STATEMENT ................ select * from t010t1 where a=1 or b='1';


------------------------------------------------------------------ NODE LISTING
ROOT ======================================  SEQ_NO 2        ONLY CHILD 1
REQUESTS_IN .............. 1
ROWS_OUT ................ 11
EST_OPER_COST ............ 0
EST_TOTAL_COST ........... 0.01
DESCRIPTION
  max_card_est .......... 51
  fragment_id ............ 0
  parent_frag ............ (none)
  fragment_type .......... master
  statement_index ........ 0
  affinity_value ......... 0
  max_max_cardinality ... 11
  total_overflow_size .... 0.00 KB
  xn_access_mode ......... read_only
  xn_autoabort_interval    0
  auto_query_retry ....... enabled
  plan_version ....... 2,600
  embedded_arkcmp ........ used
  IS_SQLCI ............... ON
  LDAP_USERNAME
  MODE_SEABASE ........... ON
  SEABASE_VOLATILE_TABLES  ON
  HBASE_ASYNC_DROP_TABLE   OFF
  SCHEMA ................. TRAFODION.SCH
  HBASE_MAX_COLUMN_NAME_  10
  HBASE_MAX_COLUMN_VAL_L  20
  HBASE_MAX_COLUMN_INFO_  60
  HBASE_SERIALIZATION .... OFF
  HBASE_FILTER_PREDS ..... OFF
  QUERY_CACHE ........ 1,024
  MDAM_SCAN_METHOD ....... ON
  select_list ............ TRAFODION.SCH.T010T1.A, TRAFODION.SCH.T010T1.B


TRAFODION_SCAN ============================  SEQ_NO 1        NO CHILDREN
TABLE_NAME ............... T010T1
REQUESTS_IN .............. 1
ROWS_OUT ................ 11
EST_OPER_COST ............ 0.01
EST_TOTAL_COST ........... 0.01
DESCRIPTION
  max_card_est .......... 51
  fragment_id ............ 0
  parent_frag ............ (none)
  fragment_type .......... master
  scan_type .............. subset scan of table TRAFODION.SCH.T010T1
  columns ................ all
  begin_keys(incl)
  end_keys(incl)
  cache_size ........... 100
  probes ................. 1
  rows_accessed ........ 100
  key_columns ............ A
  executor_predicates .... ((A = 1) or (B = '1'))

--- SQL operation complete.
>>
>>-- Optimization: with only one disjunct, the selectPred should be empty
>>-- and the executor predicate should contain the non-key predicate
>>prepare xx from select * from t010t1 where a=1 and b='1';

--- SQL command prepared.
>>explain xx;

------------------------------------------------------------------ PLAN SUMMARY
MODULE_NAME .............. DYNAMICALLY COMPILED
STATEMENT_NAME ........... XX
PLAN_ID .................. 212277210107032079
ROWS_OUT ................. 1
EST_TOTAL_COST ........... 0.01
STATEMENT ................ select * from t010t1 where a=1 and b='1';


------------------------------------------------------------------ NODE LISTING
ROOT ======================================  SEQ_NO 2        ONLY CHILD 1
REQUESTS_IN .............. 1
ROWS_OUT ................. 1
EST_OPER_COST ............ 0
EST_TOTAL_COST ........... 0.01
DESCRIPTION
  olt_optimization ....... used
  max_card_est ........... 1
  fragment_id ............ 0
  parent_frag ............ (none)
  fragment_type .......... master
  statement_index ........ 0
  affinity_value ......... 0
  max_max_cardinality .... 1
  total_overflow_size .... 0.00 KB
  xn_access_mode ......... read_only
  xn_autoabort_interval    0
  auto_query_retry ....... enabled
  plan_version ....... 2,600
  embedded_arkcmp ........ used
  IS_SQLCI ............... ON
  LDAP_USERNAME
  MODE_SEABASE ........... ON
  SEABASE_VOLATILE_TABLES  ON
  HBASE_ASYNC_DROP_TABLE   OFF
  SCHEMA ................. TRAFODION.SCH
  HBASE_MAX_COLUMN_NAME_  10
  HBASE_MAX_COLUMN_VAL_L  20
  HBASE_MAX_COLUMN_INFO_  60
  HBASE_SERIALIZATION .... OFF
  HBASE_FILTER_PREDS ..... OFF
  QUERY_CACHE ........ 1,024
  MDAM_SCAN_METHOD ....... ON
  select_list ............ %(1), %('1')
  input_variables ........ %(1), %('1')


TRAFODION_SCAN ============================  SEQ_NO 1        NO CHILDREN
TABLE_NAME ............... T010T1
REQUESTS_IN .............. 1
ROWS_OUT ................. 1
EST_OPER_COST ............ 0.01
EST_TOTAL_COST ........... 0.01
DESCRIPTION
  max_card_est ........... 1
  fragment_id ............ 0
  parent_frag ............ (none)
  fragment_type .......... master
  scan_type .............. subset scan of table TRAFODION.SCH.T010T1
  cache_size ........... 100
  probes ................. 1
  rows_accessed .......... 1
  key_columns ............ A
  executor_predicates .... (B = %('1'))
  begin_key .............. (A = %(1))
  end_key ................ (A = %(1))

--- SQL operation complete.
>>
>>-- should see a full hbase SCAN
>>prepare xx from select * from t010t1 where b='1';

--- SQL command prepared.
>>explain xx;

------------------------------------------------------------------ PLAN SUMMARY
MODULE_NAME .............. DYNAMICALLY COMPILED
STATEMENT_NAME ........... XX
PLAN_ID .................. 212277210107083079
ROWS_OUT ................ 10
EST_TOTAL_COST ........... 0.01
STATEMENT ................ select * from t010t1 where b='1';


------------------------------------------------------------------ NODE LISTING
ROOT ======================================  SEQ_NO 2        ONLY CHILD 1
REQUESTS_IN .............. 1
ROWS_OUT ................ 10
EST_OPER_COST ............ 0
EST_TOTAL_COST ........... 0.01
DESCRIPTION
  max_card_est .......... 99
  fragment_id ............ 0
  parent_frag ............ (none)
  fragment_type .......... master
  statement_index ........ 0
  affinity_value ......... 0
  max_max_cardinality ... 10
  total_overflow_size .... 0.00 KB
  xn_access_mode ......... read_only
  xn_autoabort_interval    0
  auto_query_retry ....... enabled
  plan_version ....... 2,600
  embedded_arkcmp ........ used
  IS_SQLCI ............... ON
  LDAP_USERNAME
  MODE_SEABASE ........... ON
  SEABASE_VOLATILE_TABLES  ON
  HBASE_ASYNC_DROP_TABLE   OFF
  SCHEMA ................. TRAFODION.SCH
  HBASE_MAX_COLUMN_NAME_  10
  HBASE_MAX_COLUMN_VAL_L  20
  HBASE_MAX_COLUMN_INFO_  60
  HBASE_SERIALIZATION .... OFF
  HBASE_FILTER_PREDS ..... OFF
  QUERY_CACHE ........ 1,024
  MDAM_SCAN_METHOD ....... ON
  select_list ............ TRAFODION.SCH.T010T1.A, %('1')
  input_variables ........ %('1')


TRAFODION_SCAN ============================  SEQ_NO 1        NO CHILDREN
TABLE_NAME ............... T010T1
REQUESTS_IN .............. 1
ROWS_OUT ................ 10
EST_OPER_COST ............ 0.01
EST_TOTAL_COST ........... 0.01
DESCRIPTION
  max_card_est .......... 99
  fragment_id ............ 0
  parent_frag ............ (none)
  fragment_type .......... master
  scan_type .............. subset scan of table TRAFODION.SCH.T010T1
  columns ................ all
  begin_keys(incl)
  end_keys(incl)
  cache_size ........... 100
  probes ................. 1
  rows_accessed ........ 100
  key_columns ............ A
  executor_predicates .... (B = %('1'))

--- SQL operation complete.
>>
>>-- should see a unique hbase GET 
>>prepare xx from select * from t010t1 where a=1;

--- SQL command prepared.
>>explain xx;

------------------------------------------------------------------ PLAN SUMMARY
MODULE_NAME .............. DYNAMICALLY COMPILED
STATEMENT_NAME ........... XX
PLAN_ID .................. 212277210106477709
ROWS_OUT ................. 1
EST_TOTAL_COST ........... 0.01
STATEMENT ................ select * from t010t1 where a = 2;


------------------------------------------------------------------ NODE LISTING
ROOT ======================================  SEQ_NO 2        ONLY CHILD 1
REQUESTS_IN .............. 1
ROWS_OUT ................. 1
EST_OPER_COST ............ 0
EST_TOTAL_COST ........... 0.01
DESCRIPTION
  olt_optimization ....... used
  max_card_est ........... 1
  fragment_id ............ 0
  parent_frag ............ (none)
  fragment_type .......... master
  statement_index ........ 0
  affinity_value ......... 0
  max_max_cardinality .... 1
  total_overflow_size .... 0.00 KB
  xn_access_mode ......... read_only
  xn_autoabort_interval    0
  auto_query_retry ....... enabled
  plan_version ....... 2,600
  embedded_arkcmp ........ used
  IS_SQLCI ............... ON
  LDAP_USERNAME
  MODE_SEABASE ........... ON
  SEABASE_VOLATILE_TABLES  ON
  HBASE_ASYNC_DROP_TABLE   OFF
  SCHEMA ................. TRAFODION.SCH
  HBASE_MAX_COLUMN_NAME_  10
  HBASE_MAX_COLUMN_VAL_L  20
  HBASE_MAX_COLUMN_INFO_  60
  HBASE_SERIALIZATION .... OFF
  HBASE_FILTER_PREDS ..... OFF
  QUERY_CACHE ........ 1,024
  MDAM_SCAN_METHOD ....... ON
  select_list ............ %(2), TRAFODION.SCH.T010T1.B
  input_variables ........ %(2)


TRAFODION_SCAN ============================  SEQ_NO 1        NO CHILDREN
TABLE_NAME ............... T010T1
REQUESTS_IN .............. 1
ROWS_OUT ................. 1
EST_OPER_COST ............ 0.01
EST_TOTAL_COST ........... 0.01
DESCRIPTION
  max_card_est ........... 1
  fragment_id ............ 0
  parent_frag ............ (none)
  fragment_type .......... master
  scan_type .............. subset scan of table TRAFODION.SCH.T010T1
  cache_size ........... 100
  probes ................. 1
  rows_accessed .......... 1
  key_columns ............ A
  begin_key .............. (A = %(2))
  end_key ................ (A = %(2))

--- SQL operation complete.
>>
>>insert into t010t2 values
+>(1, 'a', 1, '1a1'),
+>(1, 'a', 3, '1a3'),
+>(1, 'a', 5, '1a5'),
+>(1, 'c', 1, '1c1'),
+>(2, 'a', 1, '2a1'),
+>(2, 'a', 2, '2a2'),
+>(2, 'c', 3, '2c3'),
+>(4, 'a', 1, '4a1'),
+>(4, 'b', 1, '4b1'),
+>(4, 'b', 2, '4b2');

--- 10 row(s) inserted.
>>
>>insert into t010t3 select * from t010t2;

--- 10 row(s) inserted.
>>
>>prepare x1 from
+>select * from t010t2 where a in (1,4) and b='a' and c = 1;

--- SQL command prepared.
>>
>>execute x1;

A            B           C            D         
-----------  ----------  -----------  ----------

          1  a                     1  1a1       
          4  a                     1  4a1       

--- 2 row(s) selected.
>>-- expect 1a1, 4a1
>>
>>prepare x2 from
+>select * from t010t2 where a in (1,2,4) and b='a' and (c in (1,3) or c>=5);

--- SQL command prepared.
>>execute x2;

A            B           C            D         
-----------  ----------  -----------  ----------

          1  a                     1  1a1       
          1  a                     3  1a3       
          1  a                     5  1a5       
          2  a                     1  2a1       
          4  a                     1  4a1       

--- 5 row(s) selected.
>>-- expect 1a1, 1a3, 1a5, 2a1, 4a1
>>
>>prepare x3 from
+>select * from t010t2 where a in (1,2,4) and b='a' and c in (1,3);

--- SQL command prepared.
>>execute x3;

A            B           C            D         
-----------  ----------  -----------  ----------

          1  a                     1  1a1       
          1  a                     3  1a3       
          2  a                     1  2a1       
          4  a                     1  4a1       

--- 4 row(s) selected.
>>-- expect 1a1, 1a3, 2a1, 4a1
>>
>>prepare x4 from
+>delete from t010t2 where a in (2,4,6) and b='a' and c in (1,3);

--- SQL command prepared.
>>execute x4;

--- 2 row(s) deleted.
>>-- expect 2 rows deleted, 2a1 and 4a1
>>execute x3;

A            B           C            D         
-----------  ----------  -----------  ----------

          1  a                     1  1a1       
          1  a                     3  1a3       

--- 2 row(s) selected.
>>-- expect 1a1, 1a3
>>
>>insert into t010t2 values
+>(2, 'a', 1, '2a1'),
+>(4, 'a', 1, '4a1');

--- 2 row(s) inserted.
>>
>>prepare x5 from 
+>update t010t2 set d='upd' where a=4 and b in ('a', 'b') and c < 2;

--- SQL command prepared.
>>execute x5;

--- 2 row(s) updated.
>>-- execute 2 rows updated, 4a1 and 4b1
>>select * from t010t2;

A            B           C            D         
-----------  ----------  -----------  ----------

          1  a                     1  1a1       
          1  a                     3  1a3       
          1  a                     5  1a5       
          1  c                     1  1c1       
          2  a                     1  2a1       
          2  a                     2  2a2       
          2  c                     3  2c3       
          4  a                     1  upd       
          4  b                     1  upd       
          4  b                     2  4b2       

--- 10 row(s) selected.
>>
>>cqd HBASE_MAX_NUM_SEARCH_KEYS '1';

--- SQL operation complete.
>>
>>prepare y1 from
+>select * from t010t2 where a in (1,4) and b='a' and c = 1;

--- SQL command prepared.
>>execute y1;

A            B           C            D         
-----------  ----------  -----------  ----------

          1  a                     1  1a1       
          4  a                     1  upd       

--- 2 row(s) selected.
>>-- expect 1a1, 4a1
>>
>>prepare y2 from
+>select * from t010t2 where a in (1,2,4) and b='a' and (c in (1,3) or c>=5);

--- SQL command prepared.
>>execute y2;

A            B           C            D         
-----------  ----------  -----------  ----------

          1  a                     1  1a1       
          1  a                     3  1a3       
          1  a                     5  1a5       
          2  a                     1  2a1       
          4  a                     1  upd       

--- 5 row(s) selected.
>>-- expect 1a1, 1a3, 1a5, 2a1, 4a1
>>
>>prepare y3 from
+>select * from t010t2 where a in (1,2,4) and b='a' and c in (1,3);

--- SQL command prepared.
>>execute y3;

A            B           C            D         
-----------  ----------  -----------  ----------

          1  a                     1  1a1       
          1  a                     3  1a3       
          2  a                     1  2a1       
          4  a                     1  upd       

--- 4 row(s) selected.
>>-- expect 1a1, 1a3, 2a1, 4a1
>>
>>prepare y4 from
+>delete from t010t2 where a in (2,4,6) and b='a' and c in (1,3);

--- SQL command prepared.
>>execute y4;

--- 2 row(s) deleted.
>>-- expect 2 rows deleted, 2a1 and 4a1
>>execute y3;

A            B           C            D         
-----------  ----------  -----------  ----------

          1  a                     1  1a1       
          1  a                     3  1a3       

--- 2 row(s) selected.
>>-- expect 1a1, 1a3
>>
>>insert into t010t2 values
+>(2, 'a', 1, '2a1'),
+>(4, 'a', 1, '4a1');

--- 2 row(s) inserted.
>>
>>prepare y5 from 
+>update t010t2 set d='uuu' where a=4 and b in ('a', 'b') and c < 2;

--- SQL command prepared.
>>execute y5;

--- 2 row(s) updated.
>>-- execute 2 rows updated, 4a1 and 4b1
>>select * from t010t2;

A            B           C            D         
-----------  ----------  -----------  ----------

          1  a                     1  1a1       
          1  a                     3  1a3       
          1  a                     5  1a5       
          1  c                     1  1c1       
          2  a                     1  2a1       
          2  a                     2  2a2       
          2  c                     3  2c3       
          4  a                     1  uuu       
          4  b                     1  uuu       
          4  b                     2  4b2       

--- 10 row(s) selected.
>>
>>cqd HBASE_MAX_NUM_SEARCH_KEYS reset;

--- SQL operation complete.
>>
>>explain x1;

------------------------------------------------------------------ PLAN SUMMARY
MODULE_NAME .............. DYNAMICALLY COMPILED
STATEMENT_NAME ........... X1
PLAN_ID .................. 212277210108959629
ROWS_OUT ................. 2
EST_TOTAL_COST ........... 0
STATEMENT ................ select *
                           from t010t2
                           where a in (1,4) and b='a' and c = 1;


------------------------------------------------------------------ NODE LISTING
ROOT ======================================  SEQ_NO 2        ONLY CHILD 1
REQUESTS_IN .............. 1
ROWS_OUT ................. 2
EST_OPER_COST ............ 0
EST_TOTAL_COST ........... 0
DESCRIPTION
  max_card_est .......... 99
  fragment_id ............ 0
  parent_frag ............ (none)
  fragment_type .......... master
  statement_index ........ 0
  affinity_value ......... 0
  max_max_cardinality .... 2
  total_overflow_size .... 0.00 KB
  xn_access_mode ......... read_only
  xn_autoabort_interval    0
  auto_query_retry ....... enabled
  plan_version ....... 2,600
  embedded_arkcmp ........ used
  IS_SQLCI ............... ON
  LDAP_USERNAME
  MODE_SEABASE ........... ON
  SEABASE_VOLATILE_TABLES  ON
  HBASE_ASYNC_DROP_TABLE   OFF
  SCHEMA ................. TRAFODION.SCH
  HBASE_MAX_COLUMN_NAME_  10
  HBASE_MAX_COLUMN_VAL_L  20
  HBASE_MAX_COLUMN_INFO_  60
  HBASE_SERIALIZATION .... OFF
  HBASE_FILTER_PREDS ..... OFF
  QUERY_CACHE ........ 1,024
  MDAM_SCAN_METHOD ....... ON
  select_list ............ TRAFODION.SCH.T010T2.A, %('a'), %(1),
                             TRAFODION.SCH.T010T2.D
  input_variables ........ %('a'), %(1)


TRAFODION_SCAN ============================  SEQ_NO 1        NO CHILDREN
TABLE_NAME ............... T010T2
REQUESTS_IN .............. 1
ROWS_OUT ................. 2
EST_OPER_COST ............ 0
EST_TOTAL_COST ........... 0
DESCRIPTION
  max_card_est .......... 99
  fragment_id ............ 0
  parent_frag ............ (none)
  fragment_type .......... master
  scan_type .............. subset scan limited by mdam of table
                             TRAFODION.SCH.T010T2
  cache_size ........... 100
  probes ................. 1
  rows_accessed ........ 100
  key_columns ............ A, B, C
  mdam_disjunct .......... ((A = 1) or (A = 4)) and (B = %('a')) and (C = %(1))

--- SQL operation complete.
>>explain x2;

------------------------------------------------------------------ PLAN SUMMARY
MODULE_NAME .............. DYNAMICALLY COMPILED
STATEMENT_NAME ........... X2
PLAN_ID .................. 212277210109020095
ROWS_OUT ................. 5
EST_TOTAL_COST ........... 0
STATEMENT ................ select *
                           from t010t2
                           where a in (1,2,4) and b='a' and (c in (1,
                             3) or c>=5);


------------------------------------------------------------------ NODE LISTING
ROOT ======================================  SEQ_NO 2        ONLY CHILD 1
REQUESTS_IN .............. 1
ROWS_OUT ................. 5
EST_OPER_COST ............ 0
EST_TOTAL_COST ........... 0
DESCRIPTION
  max_card_est .......... 99
  fragment_id ............ 0
  parent_frag ............ (none)
  fragment_type .......... master
  statement_index ........ 0
  affinity_value ......... 0
  max_max_cardinality .... 5
  total_overflow_size .... 0.00 KB
  xn_access_mode ......... read_only
  xn_autoabort_interval    0
  auto_query_retry ....... enabled
  plan_version ....... 2,600
  embedded_arkcmp ........ used
  IS_SQLCI ............... ON
  LDAP_USERNAME
  MODE_SEABASE ........... ON
  SEABASE_VOLATILE_TABLES  ON
  HBASE_ASYNC_DROP_TABLE   OFF
  SCHEMA ................. TRAFODION.SCH
  HBASE_MAX_COLUMN_NAME_  10
  HBASE_MAX_COLUMN_VAL_L  20
  HBASE_MAX_COLUMN_INFO_  60
  HBASE_SERIALIZATION .... OFF
  HBASE_FILTER_PREDS ..... OFF
  QUERY_CACHE ........ 1,024
  MDAM_SCAN_METHOD ....... ON
  select_list ............ TRAFODION.SCH.T010T2.A, %('a'),
                             TRAFODION.SCH.T010T2.C, TRAFODION.SCH.T010T2.D
  input_variables ........ %('a')


TRAFODION_SCAN ============================  SEQ_NO 1        NO CHILDREN
TABLE_NAME ............... T010T2
REQUESTS_IN .............. 1
ROWS_OUT ................. 5
EST_OPER_COST ............ 0
EST_TOTAL_COST ........... 0
DESCRIPTION
  max_card_est .......... 99
  fragment_id ............ 0
  parent_frag ............ (none)
  fragment_type .......... master
  scan_type .............. subset scan limited by mdam of table
                             TRAFODION.SCH.T010T2
  cache_size ........... 100
  probes ................. 1
  rows_accessed ........ 100
  key_columns ............ A, B, C
  mdam_disjunct .......... (((A = 1) or (A = 2)) or (A = 4)) and (B = %('a'))
                             and (((C = 1) or (C = 3)) or (C >= 5))

--- SQL operation complete.
>>explain x3;

------------------------------------------------------------------ PLAN SUMMARY
MODULE_NAME .............. DYNAMICALLY COMPILED
STATEMENT_NAME ........... X3
PLAN_ID .................. 212277210109103655
ROWS_OUT ................. 4
EST_TOTAL_COST ........... 0
STATEMENT ................ select *
                           from t010t2
                           where a in (1,2,4) and b='a' and c in (1,3);


------------------------------------------------------------------ NODE LISTING
ROOT ======================================  SEQ_NO 2        ONLY CHILD 1
REQUESTS_IN .............. 1
ROWS_OUT ................. 4
EST_OPER_COST ............ 0
EST_TOTAL_COST ........... 0
DESCRIPTION
  max_card_est .......... 99
  fragment_id ............ 0
  parent_frag ............ (none)
  fragment_type .......... master
  statement_index ........ 0
  affinity_value ......... 0
  max_max_cardinality .... 4
  total_overflow_size .... 0.00 KB
  xn_access_mode ......... read_only
  xn_autoabort_interval    0
  auto_query_retry ....... enabled
  plan_version ....... 2,600
  embedded_arkcmp ........ used
  IS_SQLCI ............... ON
  LDAP_USERNAME
  MODE_SEABASE ........... ON
  SEABASE_VOLATILE_TABLES  ON
  HBASE_ASYNC_DROP_TABLE   OFF
  SCHEMA ................. TRAFODION.SCH
  HBASE_MAX_COLUMN_NAME_  10
  HBASE_MAX_COLUMN_VAL_L  20
  HBASE_MAX_COLUMN_INFO_  60
  HBASE_SERIALIZATION .... OFF
  HBASE_FILTER_PREDS ..... OFF
  QUERY_CACHE ........ 1,024
  MDAM_SCAN_METHOD ....... ON
  select_list ............ TRAFODION.SCH.T010T2.A, %('a'),
                             TRAFODION.SCH.T010T2.C, TRAFODION.SCH.T010T2.D
  input_variables ........ %('a')


TRAFODION_SCAN ============================  SEQ_NO 1        NO CHILDREN
TABLE_NAME ............... T010T2
REQUESTS_IN .............. 1
ROWS_OUT ................. 4
EST_OPER_COST ............ 0
EST_TOTAL_COST ........... 0
DESCRIPTION
  max_card_est .......... 99
  fragment_id ............ 0
  parent_frag ............ (none)
  fragment_type .......... master
  scan_type .............. subset scan limited by mdam of table
                             TRAFODION.SCH.T010T2
  cache_size ........... 100
  probes ................. 1
  rows_accessed ........ 100
  key_columns ............ A, B, C
  mdam_disjunct .......... (((A = 1) or (A = 2)) or (A = 4)) and ((C = 1) or (C
                             = 3)) and (B = %('a'))

--- SQL operation complete.
>>explain x4;

------------------------------------------------------------------ PLAN SUMMARY
MODULE_NAME .............. DYNAMICALLY COMPILED
STATEMENT_NAME ........... X4
PLAN_ID .................. 212277210109182771
ROWS_OUT ................. 4
EST_TOTAL_COST ........... 0.01
STATEMENT ................ delete from t010t2
                           where a in (2,4,6) and b='a' and c in (1,3);


------------------------------------------------------------------ NODE LISTING
ROOT ======================================  SEQ_NO 4        ONLY CHILD 3
REQUESTS_IN .............. 1
ROWS_OUT ................. 4
EST_OPER_COST ............ 0
EST_TOTAL_COST ........... 0.01
DESCRIPTION
  max_card_est ........... 4
  fragment_id ............ 0
  parent_frag ............ (none)
  fragment_type .......... master
  statement_index ........ 0
  affinity_value ......... 0
  max_max_cardinality .... 4
  total_overflow_size .... 0.00 KB
  upd_action_on_error .... xn_rollback
  xn_access_mode ......... read_only
  xn_autoabort_interval    0
  auto_query_retry ....... enabled
  plan_version ....... 2,600
  embedded_arkcmp ........ used
  IS_SQLCI ............... ON
  LDAP_USERNAME
  MODE_SEABASE ........... ON
  SEABASE_VOLATILE_TABLES  ON
  HBASE_ASYNC_DROP_TABLE   OFF
  SCHEMA ................. TRAFODION.SCH
  HBASE_MAX_COLUMN_NAME_  10
  HBASE_MAX_COLUMN_VAL_L  20
  HBASE_MAX_COLUMN_INFO_  60
  HBASE_SERIALIZATION .... OFF
  HBASE_FILTER_PREDS ..... OFF
  QUERY_CACHE ........ 1,024
  MDAM_SCAN_METHOD ....... ON
  input_variables ........ %('a')


TUPLE_FLOW ================================  SEQ_NO 3        CHILDREN 1, 2
REQUESTS_IN .............. 1
ROWS_OUT ................. 4
EST_OPER_COST ............ 0.01
EST_TOTAL_COST ........... 0.01
DESCRIPTION
  max_card_est ........... 4
  fragment_id ............ 0
  parent_frag ............ (none)
  fragment_type .......... master
  join_type .............. inner
  join_method ............ in-order nested


TRAFODION_DELETE ==========================  SEQ_NO 2        NO CHILDREN
TABLE_NAME ............... TRAFODION.SCH.T010T2
REQUESTS_IN .............. 1
ROWS_OUT ................. 1
EST_OPER_COST ............ 0
EST_TOTAL_COST ........... 0
DESCRIPTION
  max_card_est .......... 99
  fragment_id ............ 0
  parent_frag ............ (none)
  fragment_type .......... master
  iud_type ............... trafodion_delete TRAFODION.SCH.T010T2
  begin_key .............. (A = A) and (B = %('a')) and (C = C)
  end_key ................ (A = A) and (B = %('a')) and (C = C)


TRAFODION_SCAN ============================  SEQ_NO 1        NO CHILDREN
TABLE_NAME ............... T010T2
REQUESTS_IN .............. 1
ROWS_OUT ................. 4
EST_OPER_COST ............ 0
EST_TOTAL_COST ........... 0
DESCRIPTION
  max_card_est .......... 99
  fragment_id ............ 0
  parent_frag ............ (none)
  fragment_type .......... master
  scan_type .............. subset scan limited by mdam of table
                             TRAFODION.SCH.T010T2
  cache_size ........... 100
  probes ................. 1
  rows_accessed ........ 100
  key_columns ............ A, B, C
  executor_predicates .... (B = %('a'))
  mdam_disjunct .......... (((A = 2) or (A = 4)) or (A = 6)) and ((C = 1) or (C
                             = 3)) and (B = %('a'))

--- SQL operation complete.
>>explain x5;

------------------------------------------------------------------ PLAN SUMMARY
MODULE_NAME .............. DYNAMICALLY COMPILED
STATEMENT_NAME ........... X5
PLAN_ID .................. 212277210109327281
ROWS_OUT ................. 2
EST_TOTAL_COST ........... 0
STATEMENT ................ update t010t2
                           set d='upd'
                           where a=4 and b in ('a', 'b') and c < 2;


------------------------------------------------------------------ NODE LISTING
ROOT ======================================  SEQ_NO 2        ONLY CHILD 1
REQUESTS_IN .............. 1
ROWS_OUT ................. 2
EST_OPER_COST ............ 0
EST_TOTAL_COST ........... 0
DESCRIPTION
  olt_optimization ....... used
  max_card_est ........... 2
  fragment_id ............ 0
  parent_frag ............ (none)
  fragment_type .......... master
  statement_index ........ 0
  affinity_value ......... 0
  max_max_cardinality .... 2
  total_overflow_size .... 0.00 KB
  upd_action_on_error .... xn_rollback
  xn_access_mode ......... read_only
  xn_autoabort_interval    0
  auto_query_retry ....... enabled
  plan_version ....... 2,600
  embedded_arkcmp ........ used
  IS_SQLCI ............... ON
  LDAP_USERNAME
  MODE_SEABASE ........... ON
  SEABASE_VOLATILE_TABLES  ON
  HBASE_ASYNC_DROP_TABLE   OFF
  SCHEMA ................. TRAFODION.SCH
  HBASE_MAX_COLUMN_NAME_  10
  HBASE_MAX_COLUMN_VAL_L  20
  HBASE_MAX_COLUMN_INFO_  60
  HBASE_SERIALIZATION .... OFF
  HBASE_FILTER_PREDS ..... OFF
  QUERY_CACHE ........ 1,024
  MDAM_SCAN_METHOD ....... ON
  input_variables ........ %('upd'), %(4)


TRAFODION_UPDATE ==========================  SEQ_NO 1        NO CHILDREN
TABLE_NAME ............... TRAFODION.SCH.T010T2
REQUESTS_IN .............. 1
ROWS_OUT ................. 2
EST_OPER_COST ............ 0
EST_TOTAL_COST ........... 0
DESCRIPTION
  max_card_est ........... 2
  fragment_id ............ 0
  parent_frag ............ (none)
  fragment_type .......... master
  iud_type ............... trafodion_update TRAFODION.SCH.T010T2
  new_rec_expr ........... (D assign %('upd'))
  predicate .............. (C < 2) and ((B = 'a') or (B = 'b'))
  begin_key .............. (A = %(4)) and (B = '<min>') and (C = <min>)
  end_key ................ (A = %(4)) and (B = '<max>') and (C = 2)

--- SQL operation complete.
>>explain y1;

------------------------------------------------------------------ PLAN SUMMARY
MODULE_NAME .............. DYNAMICALLY COMPILED
STATEMENT_NAME ........... Y1
PLAN_ID .................. 212277210109388319
ROWS_OUT ................. 2
EST_TOTAL_COST ........... 0
STATEMENT ................ select *
                           from t010t2
                           where a in (1,4) and b='a' and c = 1;


------------------------------------------------------------------ NODE LISTING
ROOT ======================================  SEQ_NO 2        ONLY CHILD 1
REQUESTS_IN .............. 1
ROWS_OUT ................. 2
EST_OPER_COST ............ 0
EST_TOTAL_COST ........... 0
DESCRIPTION
  max_card_est .......... 99
  fragment_id ............ 0
  parent_frag ............ (none)
  fragment_type .......... master
  statement_index ........ 0
  affinity_value ......... 0
  max_max_cardinality .... 2
  total_overflow_size .... 0.00 KB
  xn_access_mode ......... read_only
  xn_autoabort_interval    0
  auto_query_retry ....... enabled
  plan_version ....... 2,600
  embedded_arkcmp ........ used
  IS_SQLCI ............... ON
  LDAP_USERNAME
  MODE_SEABASE ........... ON
  SEABASE_VOLATILE_TABLES  ON
  HBASE_ASYNC_DROP_TABLE   OFF
  SCHEMA ................. TRAFODION.SCH
  HBASE_MAX_COLUMN_NAME_  10
  HBASE_MAX_COLUMN_VAL_L  20
  HBASE_MAX_COLUMN_INFO_  60
  HBASE_SERIALIZATION .... OFF
  HBASE_FILTER_PREDS ..... OFF
  QUERY_CACHE ........ 1,024
  MDAM_SCAN_METHOD ....... ON
  HBASE_MAX_NUM_SEARCH_KE  1
  select_list ............ TRAFODION.SCH.T010T2.A, %('a'), %(1),
                             TRAFODION.SCH.T010T2.D
  input_variables ........ %('a'), %(1)


TRAFODION_SCAN ============================  SEQ_NO 1        NO CHILDREN
TABLE_NAME ............... T010T2
REQUESTS_IN .............. 1
ROWS_OUT ................. 2
EST_OPER_COST ............ 0
EST_TOTAL_COST ........... 0
DESCRIPTION
  max_card_est .......... 99
  fragment_id ............ 0
  parent_frag ............ (none)
  fragment_type .......... master
  scan_type .............. subset scan limited by mdam of table
                             TRAFODION.SCH.T010T2
  cache_size ........... 100
  probes ................. 1
  rows_accessed ........ 100
  key_columns ............ A, B, C
  mdam_disjunct .......... ((A = 1) or (A = 4)) and (B = %('a')) and (C = %(1))

--- SQL operation complete.
>>explain y2;

------------------------------------------------------------------ PLAN SUMMARY
MODULE_NAME .............. DYNAMICALLY COMPILED
STATEMENT_NAME ........... Y2
PLAN_ID .................. 212277210109445879
ROWS_OUT ................. 5
EST_TOTAL_COST ........... 0
STATEMENT ................ select *
                           from t010t2
                           where a in (1,2,4) and b='a' and (c in (1,
                             3) or c>=5);


------------------------------------------------------------------ NODE LISTING
ROOT ======================================  SEQ_NO 2        ONLY CHILD 1
REQUESTS_IN .............. 1
ROWS_OUT ................. 5
EST_OPER_COST ............ 0
EST_TOTAL_COST ........... 0
DESCRIPTION
  max_card_est .......... 99
  fragment_id ............ 0
  parent_frag ............ (none)
  fragment_type .......... master
  statement_index ........ 0
  affinity_value ......... 0
  max_max_cardinality .... 5
  total_overflow_size .... 0.00 KB
  xn_access_mode ......... read_only
  xn_autoabort_interval    0
  auto_query_retry ....... enabled
  plan_version ....... 2,600
  embedded_arkcmp ........ used
  IS_SQLCI ............... ON
  LDAP_USERNAME
  MODE_SEABASE ........... ON
  SEABASE_VOLATILE_TABLES  ON
  HBASE_ASYNC_DROP_TABLE   OFF
  SCHEMA ................. TRAFODION.SCH
  HBASE_MAX_COLUMN_NAME_  10
  HBASE_MAX_COLUMN_VAL_L  20
  HBASE_MAX_COLUMN_INFO_  60
  HBASE_SERIALIZATION .... OFF
  HBASE_FILTER_PREDS ..... OFF
  QUERY_CACHE ........ 1,024
  MDAM_SCAN_METHOD ....... ON
  HBASE_MAX_NUM_SEARCH_KE  1
  select_list ............ TRAFODION.SCH.T010T2.A, %('a'),
                             TRAFODION.SCH.T010T2.C, TRAFODION.SCH.T010T2.D
  input_variables ........ %('a')


TRAFODION_SCAN ============================  SEQ_NO 1        NO CHILDREN
TABLE_NAME ............... T010T2
REQUESTS_IN .............. 1
ROWS_OUT ................. 5
EST_OPER_COST ............ 0
EST_TOTAL_COST ........... 0
DESCRIPTION
  max_card_est .......... 99
  fragment_id ............ 0
  parent_frag ............ (none)
  fragment_type .......... master
  scan_type .............. subset scan limited by mdam of table
                             TRAFODION.SCH.T010T2
  cache_size ........... 100
  probes ................. 1
  rows_accessed ........ 100
  key_columns ............ A, B, C
  mdam_disjunct .......... (((A = 1) or (A = 2)) or (A = 4)) and (B = %('a'))
                             and (((C = 1) or (C = 3)) or (C >= 5))

--- SQL operation complete.
>>explain y3;

------------------------------------------------------------------ PLAN SUMMARY
MODULE_NAME .............. DYNAMICALLY COMPILED
STATEMENT_NAME ........... Y3
PLAN_ID .................. 212277210109538622
ROWS_OUT ................. 4
EST_TOTAL_COST ........... 0
STATEMENT ................ select *
                           from t010t2
                           where a in (1,2,4) and b='a' and c in (1,3);


------------------------------------------------------------------ NODE LISTING
ROOT ======================================  SEQ_NO 2        ONLY CHILD 1
REQUESTS_IN .............. 1
ROWS_OUT ................. 4
EST_OPER_COST ............ 0
EST_TOTAL_COST ........... 0
DESCRIPTION
  max_card_est .......... 99
  fragment_id ............ 0
  parent_frag ............ (none)
  fragment_type .......... master
  statement_index ........ 0
  affinity_value ......... 0
  max_max_cardinality .... 4
  total_overflow_size .... 0.00 KB
  xn_access_mode ......... read_only
  xn_autoabort_interval    0
  auto_query_retry ....... enabled
  plan_version ....... 2,600
  embedded_arkcmp ........ used
  IS_SQLCI ............... ON
  LDAP_USERNAME
  MODE_SEABASE ........... ON
  SEABASE_VOLATILE_TABLES  ON
  HBASE_ASYNC_DROP_TABLE   OFF
  SCHEMA ................. TRAFODION.SCH
  HBASE_MAX_COLUMN_NAME_  10
  HBASE_MAX_COLUMN_VAL_L  20
  HBASE_MAX_COLUMN_INFO_  60
  HBASE_SERIALIZATION .... OFF
  HBASE_FILTER_PREDS ..... OFF
  QUERY_CACHE ........ 1,024
  MDAM_SCAN_METHOD ....... ON
  HBASE_MAX_NUM_SEARCH_KE  1
  select_list ............ TRAFODION.SCH.T010T2.A, %('a'),
                             TRAFODION.SCH.T010T2.C, TRAFODION.SCH.T010T2.D
  input_variables ........ %('a')


TRAFODION_SCAN ============================  SEQ_NO 1        NO CHILDREN
TABLE_NAME ............... T010T2
REQUESTS_IN .............. 1
ROWS_OUT ................. 4
EST_OPER_COST ............ 0
EST_TOTAL_COST ........... 0
DESCRIPTION
  max_card_est .......... 99
  fragment_id ............ 0
  parent_frag ............ (none)
  fragment_type .......... master
  scan_type .............. subset scan limited by mdam of table
                             TRAFODION.SCH.T010T2
  cache_size ........... 100
  probes ................. 1
  rows_accessed ........ 100
  key_columns ............ A, B, C
  mdam_disjunct .......... (((A = 1) or (A = 2)) or (A = 4)) and ((C = 1) or (C
                             = 3)) and (B = %('a'))

--- SQL operation complete.
>>explain y4;

------------------------------------------------------------------ PLAN SUMMARY
MODULE_NAME .............. DYNAMICALLY COMPILED
STATEMENT_NAME ........... Y4
PLAN_ID .................. 212277210109612563
ROWS_OUT ................. 4
EST_TOTAL_COST ........... 0.01
STATEMENT ................ delete from t010t2
                           where a in (2,4,6) and b='a' and c in (1,3);


------------------------------------------------------------------ NODE LISTING
ROOT ======================================  SEQ_NO 4        ONLY CHILD 3
REQUESTS_IN .............. 1
ROWS_OUT ................. 4
EST_OPER_COST ............ 0
EST_TOTAL_COST ........... 0.01
DESCRIPTION
  max_card_est ........... 4
  fragment_id ............ 0
  parent_frag ............ (none)
  fragment_type .......... master
  statement_index ........ 0
  affinity_value ......... 0
  max_max_cardinality .... 4
  total_overflow_size .... 0.00 KB
  upd_action_on_error .... xn_rollback
  xn_access_mode ......... read_only
  xn_autoabort_interval    0
  auto_query_retry ....... enabled
  plan_version ....... 2,600
  embedded_arkcmp ........ used
  IS_SQLCI ............... ON
  LDAP_USERNAME
  MODE_SEABASE ........... ON
  SEABASE_VOLATILE_TABLES  ON
  HBASE_ASYNC_DROP_TABLE   OFF
  SCHEMA ................. TRAFODION.SCH
  HBASE_MAX_COLUMN_NAME_  10
  HBASE_MAX_COLUMN_VAL_L  20
  HBASE_MAX_COLUMN_INFO_  60
  HBASE_SERIALIZATION .... OFF
  HBASE_FILTER_PREDS ..... OFF
  QUERY_CACHE ........ 1,024
  MDAM_SCAN_METHOD ....... ON
  HBASE_MAX_NUM_SEARCH_KE  1
  input_variables ........ %('a')


TUPLE_FLOW ================================  SEQ_NO 3        CHILDREN 1, 2
REQUESTS_IN .............. 1
ROWS_OUT ................. 4
EST_OPER_COST ............ 0.01
EST_TOTAL_COST ........... 0.01
DESCRIPTION
  max_card_est ........... 4
  fragment_id ............ 0
  parent_frag ............ (none)
  fragment_type .......... master
  join_type .............. inner
  join_method ............ in-order nested


TRAFODION_DELETE ==========================  SEQ_NO 2        NO CHILDREN
TABLE_NAME ............... TRAFODION.SCH.T010T2
REQUESTS_IN .............. 1
ROWS_OUT ................. 1
EST_OPER_COST ............ 0
EST_TOTAL_COST ........... 0
DESCRIPTION
  max_card_est .......... 99
  fragment_id ............ 0
  parent_frag ............ (none)
  fragment_type .......... master
  iud_type ............... trafodion_delete TRAFODION.SCH.T010T2
  begin_key .............. (A = A) and (B = %('a')) and (C = C)
  end_key ................ (A = A) and (B = %('a')) and (C = C)


TRAFODION_SCAN ============================  SEQ_NO 1        NO CHILDREN
TABLE_NAME ............... T010T2
REQUESTS_IN .............. 1
ROWS_OUT ................. 4
EST_OPER_COST ............ 0
EST_TOTAL_COST ........... 0
DESCRIPTION
  max_card_est .......... 99
  fragment_id ............ 0
  parent_frag ............ (none)
  fragment_type .......... master
  scan_type .............. subset scan limited by mdam of table
                             TRAFODION.SCH.T010T2
  cache_size ........... 100
  probes ................. 1
  rows_accessed ........ 100
  key_columns ............ A, B, C
  executor_predicates .... (B = %('a'))
  mdam_disjunct .......... (((A = 2) or (A = 4)) or (A = 6)) and ((C = 1) or (C
                             = 3)) and (B = %('a'))

--- SQL operation complete.
>>explain y5;

------------------------------------------------------------------ PLAN SUMMARY
MODULE_NAME .............. DYNAMICALLY COMPILED
STATEMENT_NAME ........... Y5
PLAN_ID .................. 212277210109750694
ROWS_OUT ................. 2
EST_TOTAL_COST ........... 0
STATEMENT ................ update t010t2
                           set d='uuu'
                           where a=4 and b in ('a', 'b') and c < 2;


------------------------------------------------------------------ NODE LISTING
ROOT ======================================  SEQ_NO 2        ONLY CHILD 1
REQUESTS_IN .............. 1
ROWS_OUT ................. 2
EST_OPER_COST ............ 0
EST_TOTAL_COST ........... 0
DESCRIPTION
  olt_optimization ....... used
  max_card_est ........... 2
  fragment_id ............ 0
  parent_frag ............ (none)
  fragment_type .......... master
  statement_index ........ 0
  affinity_value ......... 0
  max_max_cardinality .... 2
  total_overflow_size .... 0.00 KB
  upd_action_on_error .... xn_rollback
  xn_access_mode ......... read_only
  xn_autoabort_interval    0
  auto_query_retry ....... enabled
  plan_version ....... 2,600
  embedded_arkcmp ........ used
  IS_SQLCI ............... ON
  LDAP_USERNAME
  MODE_SEABASE ........... ON
  SEABASE_VOLATILE_TABLES  ON
  HBASE_ASYNC_DROP_TABLE   OFF
  SCHEMA ................. TRAFODION.SCH
  HBASE_MAX_COLUMN_NAME_  10
  HBASE_MAX_COLUMN_VAL_L  20
  HBASE_MAX_COLUMN_INFO_  60
  HBASE_SERIALIZATION .... OFF
  HBASE_FILTER_PREDS ..... OFF
  QUERY_CACHE ........ 1,024
  MDAM_SCAN_METHOD ....... ON
  HBASE_MAX_NUM_SEARCH_KE  1
  input_variables ........ %('uuu'), %(4)


TRAFODION_UPDATE ==========================  SEQ_NO 1        NO CHILDREN
TABLE_NAME ............... TRAFODION.SCH.T010T2
REQUESTS_IN .............. 1
ROWS_OUT ................. 2
EST_OPER_COST ............ 0
EST_TOTAL_COST ........... 0
DESCRIPTION
  max_card_est ........... 2
  fragment_id ............ 0
  parent_frag ............ (none)
  fragment_type .......... master
  iud_type ............... trafodion_update TRAFODION.SCH.T010T2
  new_rec_expr ........... (D assign %('uuu'))
  predicate .............. (C < 2) and ((B = 'a') or (B = 'b'))
  begin_key .............. (A = %(4)) and (B = '<min>') and (C = <min>)
  end_key ................ (A = %(4)) and (B = '<max>') and (C = 2)

--- SQL operation complete.
>>
>>select "_SALT_", * from t010t3 order by a,b,c;

_SALT_      A            B           C            D         
----------  -----------  ----------  -----------  ----------

         2            1  a                     1  1a1       
         2            1  a                     3  1a3       
         2            1  a                     5  1a5       
         1            1  c                     1  1c1       
         3            2  a                     1  2a1       
         3            2  a                     2  2a2       
         0            2  c                     3  2c3       
         2            4  a                     1  4a1       
         1            4  b                     1  4b1       
         1            4  b                     2  4b2       

--- 10 row(s) selected.
>>select "_SALT_", * from t010t3 where a=1 and b='c';

_SALT_      A            B           C            D         
----------  -----------  ----------  -----------  ----------

         1            1  c                     1  1c1       

--- 1 row(s) selected.
>>
>>update t010t3 set d='2axu' where a=2 and b='a';

--- 2 row(s) updated.
>>-- 2 rows updated
>>update t010t3 set d='4b1u' where a=4 and b='b' and c <= 1;

--- 1 row(s) updated.
>>-- 1 row updated
>>update t010t3 set a=3 where a=2;

--- 3 row(s) updated.
>>-- 3 rows updated
>>delete from t010t3 where a=3 and b='c' and c=3;

--- 1 row(s) deleted.
>>-- 1 row deleted
>>delete from t010t3 where d like '2%u %';

--- 2 row(s) deleted.
>>-- 2 rows deleted
>>select "_SALT_", * from t010t3;

_SALT_      A            B           C            D         
----------  -----------  ----------  -----------  ----------

         1            1  c                     1  1c1       
         1            4  b                     1  4b1u      
         1            4  b                     2  4b2       
         2            1  a                     1  1a1       
         2            1  a                     3  1a3       
         2            1  a                     5  1a5       
         2            4  a                     1  4a1       

--- 7 row(s) selected.
>>-- 7 rows
>>merge into t010t3
+>  using (select * from t010t2) as src
+>  on ((src.a, src.b, src.c) = (a,b,c))
+>when matched
+>  then update set d = src.d
+>when not matched
+>  then insert values (src.a, src.b, src.c, src.d)
+>;

--- 10 row(s) updated.
>>-- 10 rows updated
>>select "_SALT_", * from t010t2 natural join t010t3 order by a,b,c;

_SALT_      A            B           C            D         
----------  -----------  ----------  -----------  ----------

         2            1  a                     1  1a1       
         2            1  a                     3  1a3       
         2            1  a                     5  1a5       
         1            1  c                     1  1c1       
         3            2  a                     1  2a1       
         3            2  a                     2  2a2       
         0            2  c                     3  2c3       
         2            4  a                     1  uuu       
         1            4  b                     1  uuu       
         1            4  b                     2  4b2       

--- 10 row(s) selected.
>>-- expect 10 rows, same as each individual table
>>
>>select "_SALT_", * from table(table t010t3, partition number 4);

_SALT_      A            B           C            D         
----------  -----------  ----------  -----------  ----------

         3            2  a                     1  2a1       
         3            2  a                     2  2a2       

--- 2 row(s) selected.
>>select "_SALT_", * from table(table t010t3, partition number from 1 to 3);

_SALT_      A            B           C            D         
----------  -----------  ----------  -----------  ----------

         0            2  c                     3  2c3       
         1            1  c                     1  1c1       
         1            4  b                     1  uuu       
         1            4  b                     2  4b2       
         2            1  a                     1  1a1       
         2            1  a                     3  1a3       
         2            1  a                     5  1a5       
         2            4  a                     1  uuu       

--- 8 row(s) selected.
>>-- 2 statements above must return 10 rows total
>>
>>
>>-- query_cache off, mdam_scan_method off
>>cqd query_cache '0';

--- SQL operation complete.
>>cqd mdam_scan_method 'OFF';

--- SQL operation complete.
>>obey TEST010(clean_up);
>>--------------------------------------------------------------------------
>>drop table if exists t010t1;

--- SQL operation complete.
>>drop table if exists t010t2;

--- SQL operation complete.
>>drop table if exists t010t3;

--- SQL operation complete.
>>
>>obey TEST010(tests);
>>--------------------------------------------------------------------------
>>
>>create table if not exists t010t1 (a int not null, b char(10), primary key(a));

--- SQL operation complete.
>>create table if not exists t010t2 (a int not null, b char(10) not null, c int not null, d char(10), primary key(a,b,c));

--- SQL operation complete.
>>create table if not exists t010t3 (a int not null, b char(10) not null, c int not null, d char(10), primary key(a,b,c))
+>  salt using 4 partitions on (a,b);

--- SQL operation complete.
>>
>>invoke t010t1;

-- Definition of Trafodion table TRAFODION.SCH.T010T1
-- Definition current  Thu Sep 11 15:42:15 2014

  (
    A                                INT NO DEFAULT NOT NULL NOT DROPPABLE
  , B                                CHAR(10) CHARACTER SET ISO88591 COLLATE
      DEFAULT DEFAULT NULL
  )

--- SQL operation complete.
>>invoke hbase."_CELL_"."TRAFODION.SCH.T010T1";

-- Definition of Trafodion table HBASE."_CELL_"."TRAFODION.SCH.T010T1"
-- Definition current  Thu Sep 11 15:42:15 2014

  (
    ROW_ID                           VARCHAR(10) CHARACTER SET ISO88591 COLLATE
      DEFAULT NO DEFAULT NOT NULL NOT DROPPABLE
  , COL_FAMILY                       VARCHAR(10) CHARACTER SET ISO88591 COLLATE
      DEFAULT NO DEFAULT NOT NULL NOT DROPPABLE
  , COL_NAME                         VARCHAR(10) CHARACTER SET ISO88591 COLLATE
      DEFAULT NO DEFAULT NOT NULL NOT DROPPABLE
  , COL_TIMESTAMP                    LARGEINT NO DEFAULT NOT NULL NOT DROPPABLE
  , COL_VALUE                        VARCHAR(20) CHARACTER SET ISO88591 COLLATE
      DEFAULT NO DEFAULT NOT NULL NOT DROPPABLE
  )

--- SQL operation complete.
>>invoke hbase."_ROW_"."TRAFODION.SCH.T010T1";

-- Definition of Trafodion table HBASE."_ROW_"."TRAFODION.SCH.T010T1"
-- Definition current  Thu Sep 11 15:42:15 2014

  (
    ROW_ID                           VARCHAR(10) CHARACTER SET ISO88591 COLLATE
      DEFAULT NO DEFAULT NOT NULL NOT DROPPABLE
  , COLUMN_DETAILS                   VARCHAR(60) CHARACTER SET ISO88591 COLLATE
      DEFAULT NO DEFAULT NOT NULL NOT DROPPABLE
  )

--- SQL operation complete.
>>
>>insert into t010t1 values (1, 'a'), (2, 'b'), (3, 'c');

--- 3 row(s) inserted.
>>
>>select * from t010t1;

A            B         
-----------  ----------

          1  a         
          2  b         
          3  c         

--- 3 row(s) selected.
>>
>>select * from t010t1 where a = 2;

A            B         
-----------  ----------

          2  b         

--- 1 row(s) selected.
>>
>>select * from t010t1 where a = 2 or a = 3;

A            B         
-----------  ----------

          2  b         
          3  c         

--- 2 row(s) selected.
>>
>>delete from t010t1 where a = 4;

--- 0 row(s) deleted.
>>
>>select * from t010t1;

A            B         
-----------  ----------

          1  a         
          2  b         
          3  c         

--- 3 row(s) selected.
>>
>>delete from t010t1 where a = 2;

--- 1 row(s) deleted.
>>
>>select * from t010t1;

A            B         
-----------  ----------

          1  a         
          3  c         

--- 2 row(s) selected.
>>
>>select converttohex(cast(row_id as char(4))) rowid,
+>          converttohex(cast(col_family as char(2))) colfamily,
+>          converttohex(cast(col_name as char(1))) colname,
+>          converttohex(cast(col_value as char(4))) colvalue
+>                from hbase."_CELL_"."TRAFODION.SCH.T010T1";

ROWID     COLFAMILY  COLNAME  COLVALUE
--------  ---------  -------  --------

80000001  2331       01       01000000
80000001  2331       02       00612020
80000003  2331       01       03000000
80000003  2331       02       00632020

--- 4 row(s) selected.
>>
>>select converttohex(cast(row_id as char(4))) rowid,
+>          converttohex(cast(col_family as char(2))) colfamily,
+>          converttohex(cast(col_name as char(1))) colname,
+>          converttohex(cast(col_value as char(4))) colvalue
+>                from hbase."_CELL_"."TRAFODION.SCH.T010T1"
+>          where converttohex(cast(row_id as char(4))) = '80000001';

ROWID     COLFAMILY  COLNAME  COLVALUE
--------  ---------  -------  --------

80000001  2331       01       01000000
80000001  2331       02       00612020

--- 2 row(s) selected.
>>
>>select converttohex(cast(row_id as char(4))) rowid,
+>          converttohex(cast(column_details as char(40))) coldetails
+>                 from hbase."_ROW_"."TRAFODION.SCH.T010T1";

ROWID     COLDETAILS
--------  --------------------------------------------------------------------------------

80000001  040023313A010400000001000000040023313A020B00000000612020202020202020202020202020
80000003  040023313A010400000003000000040023313A020B00000000632020202020202020202020202020

--- 2 row(s) selected.
>>select converttohex(cast(row_id as char(4))) rowid,
+>          converttohex(cast(column_details as char(40))) coldetails
+>                 from hbase."_ROW_"."TRAFODION.SCH.T010T1"
+>          where converttohex(cast(row_id as char(4))) = '80000001';

ROWID     COLDETAILS
--------  --------------------------------------------------------------------------------

80000001  040023313A010400000001000000040023313A020B00000000612020202020202020202020202020

--- 1 row(s) selected.
>>
>>-------------------
>>-- check query plan
>>-------------------
>>
>>-- no sort operator should present when order by on primary key column
>>prepare xx from select * from t010t1 order by a;

--- SQL command prepared.
>>explain options 'f' xx;

LC   RC   OP   OPERATOR              OPT       DESCRIPTION           CARD
---- ---- ---- --------------------  --------  --------------------  ---------

1    .    2    root                                                  1.00E+002
.    .    1    trafodion_scan                  T010T1                1.00E+002

--- SQL operation complete.
>>
>>-- should see a sort when order by on non key column
>>prepare xx from select * from t010t1 order by b;

--- SQL command prepared.
>>explain options 'f' xx;

LC   RC   OP   OPERATOR              OPT       DESCRIPTION           CARD
---- ---- ---- --------------------  --------  --------------------  ---------

2    .    3    root                                                  1.00E+002
1    .    2    sort                                                  1.00E+002
.    .    1    trafodion_scan                  T010T1                1.00E+002

--- SQL operation complete.
>>
>>-- selectPred should present due to the 2nd disjunct b='1'
>>prepare xx from select * from t010t1 where a=1 or b='1';

--- SQL command prepared.
>>explain xx;

------------------------------------------------------------------ PLAN SUMMARY
MODULE_NAME .............. DYNAMICALLY COMPILED
STATEMENT_NAME ........... XX
PLAN_ID .................. 212277210136108677
ROWS_OUT ................ 11
EST_TOTAL_COST ........... 0.01
STATEMENT ................ select * from t010t1 where a=1 or b='1';


------------------------------------------------------------------ NODE LISTING
ROOT ======================================  SEQ_NO 2        ONLY CHILD 1
REQUESTS_IN .............. 1
ROWS_OUT ................ 11
EST_OPER_COST ............ 0
EST_TOTAL_COST ........... 0.01
DESCRIPTION
  max_card_est .......... 51
  fragment_id ............ 0
  parent_frag ............ (none)
  fragment_type .......... master
  statement_index ........ 0
  affinity_value ......... 0
  max_max_cardinality ... 11
  total_overflow_size .... 0.00 KB
  xn_access_mode ......... read_only
  xn_autoabort_interval    0
  auto_query_retry ....... enabled
  plan_version ....... 2,600
  embedded_arkcmp ........ used
  IS_SQLCI ............... ON
  LDAP_USERNAME
  MODE_SEABASE ........... ON
  SEABASE_VOLATILE_TABLES  ON
  HBASE_ASYNC_DROP_TABLE   OFF
  SCHEMA ................. TRAFODION.SCH
  HBASE_MAX_COLUMN_NAME_  10
  HBASE_MAX_COLUMN_VAL_L  20
  HBASE_MAX_COLUMN_INFO_  60
  HBASE_SERIALIZATION .... OFF
  HBASE_FILTER_PREDS ..... OFF
  QUERY_CACHE ............ 0
  MDAM_SCAN_METHOD ....... OFF
  select_list ............ TRAFODION.SCH.T010T1.A, TRAFODION.SCH.T010T1.B


TRAFODION_SCAN ============================  SEQ_NO 1        NO CHILDREN
TABLE_NAME ............... T010T1
REQUESTS_IN .............. 1
ROWS_OUT ................ 11
EST_OPER_COST ............ 0.01
EST_TOTAL_COST ........... 0.01
DESCRIPTION
  max_card_est .......... 51
  fragment_id ............ 0
  parent_frag ............ (none)
  fragment_type .......... master
  scan_type .............. subset scan of table TRAFODION.SCH.T010T1
  columns ................ all
  begin_keys(incl)
  end_keys(incl)
  cache_size ........... 100
  probes ................. 1
  rows_accessed ........ 100
  key_columns ............ A
  executor_predicates .... ((A = 1) or (B = '1'))

--- SQL operation complete.
>>
>>-- Optimization: with only one disjunct, the selectPred should be empty
>>-- and the executor predicate should contain the non-key predicate
>>prepare xx from select * from t010t1 where a=1 and b='1';

--- SQL command prepared.
>>explain xx;

------------------------------------------------------------------ PLAN SUMMARY
MODULE_NAME .............. DYNAMICALLY COMPILED
STATEMENT_NAME ........... XX
PLAN_ID .................. 212277210136155331
ROWS_OUT ................. 1
EST_TOTAL_COST ........... 0.01
STATEMENT ................ select * from t010t1 where a=1 and b='1';


------------------------------------------------------------------ NODE LISTING
ROOT ======================================  SEQ_NO 2        ONLY CHILD 1
REQUESTS_IN .............. 1
ROWS_OUT ................. 1
EST_OPER_COST ............ 0
EST_TOTAL_COST ........... 0.01
DESCRIPTION
  olt_optimization ....... used
  max_card_est ........... 1
  fragment_id ............ 0
  parent_frag ............ (none)
  fragment_type .......... master
  statement_index ........ 0
  affinity_value ......... 0
  max_max_cardinality .... 1
  total_overflow_size .... 0.00 KB
  xn_access_mode ......... read_only
  xn_autoabort_interval    0
  auto_query_retry ....... enabled
  plan_version ....... 2,600
  embedded_arkcmp ........ used
  IS_SQLCI ............... ON
  LDAP_USERNAME
  MODE_SEABASE ........... ON
  SEABASE_VOLATILE_TABLES  ON
  HBASE_ASYNC_DROP_TABLE   OFF
  SCHEMA ................. TRAFODION.SCH
  HBASE_MAX_COLUMN_NAME_  10
  HBASE_MAX_COLUMN_VAL_L  20
  HBASE_MAX_COLUMN_INFO_  60
  HBASE_SERIALIZATION .... OFF
  HBASE_FILTER_PREDS ..... OFF
  QUERY_CACHE ............ 0
  MDAM_SCAN_METHOD ....... OFF
  select_list ............ 1, '1'


TRAFODION_SCAN ============================  SEQ_NO 1        NO CHILDREN
TABLE_NAME ............... T010T1
REQUESTS_IN .............. 1
ROWS_OUT ................. 1
EST_OPER_COST ............ 0.01
EST_TOTAL_COST ........... 0.01
DESCRIPTION
  max_card_est ........... 1
  fragment_id ............ 0
  parent_frag ............ (none)
  fragment_type .......... master
  scan_type .............. subset scan of table TRAFODION.SCH.T010T1
  columns ................ all
  unique_rows ............ 1
  cache_size ........... 100
  probes ................. 1
  rows_accessed .......... 1
  key_columns ............ A
  executor_predicates .... (B = '1')

--- SQL operation complete.
>>
>>-- should see a full hbase SCAN
>>prepare xx from select * from t010t1 where b='1';

--- SQL command prepared.
>>explain xx;

------------------------------------------------------------------ PLAN SUMMARY
MODULE_NAME .............. DYNAMICALLY COMPILED
STATEMENT_NAME ........... XX
PLAN_ID .................. 212277210136199613
ROWS_OUT ................ 10
EST_TOTAL_COST ........... 0.01
STATEMENT ................ select * from t010t1 where b='1';


------------------------------------------------------------------ NODE LISTING
ROOT ======================================  SEQ_NO 2        ONLY CHILD 1
REQUESTS_IN .............. 1
ROWS_OUT ................ 10
EST_OPER_COST ............ 0
EST_TOTAL_COST ........... 0.01
DESCRIPTION
  max_card_est .......... 99
  fragment_id ............ 0
  parent_frag ............ (none)
  fragment_type .......... master
  statement_index ........ 0
  affinity_value ......... 0
  max_max_cardinality ... 10
  total_overflow_size .... 0.00 KB
  xn_access_mode ......... read_only
  xn_autoabort_interval    0
  auto_query_retry ....... enabled
  plan_version ....... 2,600
  embedded_arkcmp ........ used
  IS_SQLCI ............... ON
  LDAP_USERNAME
  MODE_SEABASE ........... ON
  SEABASE_VOLATILE_TABLES  ON
  HBASE_ASYNC_DROP_TABLE   OFF
  SCHEMA ................. TRAFODION.SCH
  HBASE_MAX_COLUMN_NAME_  10
  HBASE_MAX_COLUMN_VAL_L  20
  HBASE_MAX_COLUMN_INFO_  60
  HBASE_SERIALIZATION .... OFF
  HBASE_FILTER_PREDS ..... OFF
  QUERY_CACHE ............ 0
  MDAM_SCAN_METHOD ....... OFF
  select_list ............ TRAFODION.SCH.T010T1.A, '1'


TRAFODION_SCAN ============================  SEQ_NO 1        NO CHILDREN
TABLE_NAME ............... T010T1
REQUESTS_IN .............. 1
ROWS_OUT ................ 10
EST_OPER_COST ............ 0.01
EST_TOTAL_COST ........... 0.01
DESCRIPTION
  max_card_est .......... 99
  fragment_id ............ 0
  parent_frag ............ (none)
  fragment_type .......... master
  scan_type .............. subset scan of table TRAFODION.SCH.T010T1
  columns ................ all
  begin_keys(incl)
  end_keys(incl)
  cache_size ........... 100
  probes ................. 1
  rows_accessed ........ 100
  key_columns ............ A
  executor_predicates .... (B = '1')

--- SQL operation complete.
>>
>>-- should see a unique hbase GET 
>>prepare xx from select * from t010t1 where a=1;

--- SQL command prepared.
>>explain xx;

------------------------------------------------------------------ PLAN SUMMARY
MODULE_NAME .............. DYNAMICALLY COMPILED
STATEMENT_NAME ........... XX
PLAN_ID .................. 212277210136244181
ROWS_OUT ................. 1
EST_TOTAL_COST ........... 0.01
STATEMENT ................ select * from t010t1 where a=1;


------------------------------------------------------------------ NODE LISTING
ROOT ======================================  SEQ_NO 2        ONLY CHILD 1
REQUESTS_IN .............. 1
ROWS_OUT ................. 1
EST_OPER_COST ............ 0
EST_TOTAL_COST ........... 0.01
DESCRIPTION
  olt_optimization ....... used
  max_card_est ........... 1
  fragment_id ............ 0
  parent_frag ............ (none)
  fragment_type .......... master
  statement_index ........ 0
  affinity_value ......... 0
  max_max_cardinality .... 1
  total_overflow_size .... 0.00 KB
  xn_access_mode ......... read_only
  xn_autoabort_interval    0
  auto_query_retry ....... enabled
  plan_version ....... 2,600
  embedded_arkcmp ........ used
  IS_SQLCI ............... ON
  LDAP_USERNAME
  MODE_SEABASE ........... ON
  SEABASE_VOLATILE_TABLES  ON
  HBASE_ASYNC_DROP_TABLE   OFF
  SCHEMA ................. TRAFODION.SCH
  HBASE_MAX_COLUMN_NAME_  10
  HBASE_MAX_COLUMN_VAL_L  20
  HBASE_MAX_COLUMN_INFO_  60
  HBASE_SERIALIZATION .... OFF
  HBASE_FILTER_PREDS ..... OFF
  QUERY_CACHE ............ 0
  MDAM_SCAN_METHOD ....... OFF
  select_list ............ 1, TRAFODION.SCH.T010T1.B


TRAFODION_SCAN ============================  SEQ_NO 1        NO CHILDREN
TABLE_NAME ............... T010T1
REQUESTS_IN .............. 1
ROWS_OUT ................. 1
EST_OPER_COST ............ 0.01
EST_TOTAL_COST ........... 0.01
DESCRIPTION
  max_card_est ........... 1
  fragment_id ............ 0
  parent_frag ............ (none)
  fragment_type .......... master
  scan_type .............. subset scan of table TRAFODION.SCH.T010T1
  columns ................ all
  unique_rows ............ 1
  cache_size ........... 100
  probes ................. 1
  rows_accessed .......... 1
  key_columns ............ A

--- SQL operation complete.
>>
>>insert into t010t2 values
+>(1, 'a', 1, '1a1'),
+>(1, 'a', 3, '1a3'),
+>(1, 'a', 5, '1a5'),
+>(1, 'c', 1, '1c1'),
+>(2, 'a', 1, '2a1'),
+>(2, 'a', 2, '2a2'),
+>(2, 'c', 3, '2c3'),
+>(4, 'a', 1, '4a1'),
+>(4, 'b', 1, '4b1'),
+>(4, 'b', 2, '4b2');

--- 10 row(s) inserted.
>>
>>insert into t010t3 select * from t010t2;

--- 10 row(s) inserted.
>>
>>prepare x1 from
+>select * from t010t2 where a in (1,4) and b='a' and c = 1;

--- SQL command prepared.
>>
>>execute x1;

A            B           C            D         
-----------  ----------  -----------  ----------

          1  a                     1  1a1       
          4  a                     1  4a1       

--- 2 row(s) selected.
>>-- expect 1a1, 4a1
>>
>>prepare x2 from
+>select * from t010t2 where a in (1,2,4) and b='a' and (c in (1,3) or c>=5);

--- SQL command prepared.
>>execute x2;

A            B           C            D         
-----------  ----------  -----------  ----------

          1  a                     5  1a5       
          1  a                     1  1a1       
          1  a                     3  1a3       
          2  a                     1  2a1       
          4  a                     1  4a1       

--- 5 row(s) selected.
>>-- expect 1a1, 1a3, 1a5, 2a1, 4a1
>>
>>prepare x3 from
+>select * from t010t2 where a in (1,2,4) and b='a' and c in (1,3);

--- SQL command prepared.
>>execute x3;

A            B           C            D         
-----------  ----------  -----------  ----------

          1  a                     1  1a1       
          1  a                     3  1a3       
          2  a                     1  2a1       
          4  a                     1  4a1       

--- 4 row(s) selected.
>>-- expect 1a1, 1a3, 2a1, 4a1
>>
>>prepare x4 from
+>delete from t010t2 where a in (2,4,6) and b='a' and c in (1,3);

--- SQL command prepared.
>>execute x4;

--- 2 row(s) deleted.
>>-- expect 2 rows deleted, 2a1 and 4a1
>>execute x3;

A            B           C            D         
-----------  ----------  -----------  ----------

          1  a                     1  1a1       
          1  a                     3  1a3       

--- 2 row(s) selected.
>>-- expect 1a1, 1a3
>>
>>insert into t010t2 values
+>(2, 'a', 1, '2a1'),
+>(4, 'a', 1, '4a1');

--- 2 row(s) inserted.
>>
>>prepare x5 from 
+>update t010t2 set d='upd' where a=4 and b in ('a', 'b') and c < 2;

--- SQL command prepared.
>>execute x5;

--- 2 row(s) updated.
>>-- execute 2 rows updated, 4a1 and 4b1
>>select * from t010t2;

A            B           C            D         
-----------  ----------  -----------  ----------

          1  a                     1  1a1       
          1  a                     3  1a3       
          1  a                     5  1a5       
          1  c                     1  1c1       
          2  a                     1  2a1       
          2  a                     2  2a2       
          2  c                     3  2c3       
          4  a                     1  upd       
          4  b                     1  upd       
          4  b                     2  4b2       

--- 10 row(s) selected.
>>
>>cqd HBASE_MAX_NUM_SEARCH_KEYS '1';

--- SQL operation complete.
>>
>>prepare y1 from
+>select * from t010t2 where a in (1,4) and b='a' and c = 1;

--- SQL command prepared.
>>execute y1;

A            B           C            D         
-----------  ----------  -----------  ----------

          1  a                     1  1a1       
          4  a                     1  upd       

--- 2 row(s) selected.
>>-- expect 1a1, 4a1
>>
>>prepare y2 from
+>select * from t010t2 where a in (1,2,4) and b='a' and (c in (1,3) or c>=5);

--- SQL command prepared.
>>execute y2;

A            B           C            D         
-----------  ----------  -----------  ----------

          1  a                     1  1a1       
          1  a                     3  1a3       
          1  a                     5  1a5       
          2  a                     1  2a1       
          4  a                     1  upd       

--- 5 row(s) selected.
>>-- expect 1a1, 1a3, 1a5, 2a1, 4a1
>>
>>prepare y3 from
+>select * from t010t2 where a in (1,2,4) and b='a' and c in (1,3);

--- SQL command prepared.
>>execute y3;

A            B           C            D         
-----------  ----------  -----------  ----------

          1  a                     1  1a1       
          1  a                     3  1a3       
          2  a                     1  2a1       
          4  a                     1  upd       

--- 4 row(s) selected.
>>-- expect 1a1, 1a3, 2a1, 4a1
>>
>>prepare y4 from
+>delete from t010t2 where a in (2,4,6) and b='a' and c in (1,3);

--- SQL command prepared.
>>execute y4;

--- 2 row(s) deleted.
>>-- expect 2 rows deleted, 2a1 and 4a1
>>execute y3;

A            B           C            D         
-----------  ----------  -----------  ----------

          1  a                     1  1a1       
          1  a                     3  1a3       

--- 2 row(s) selected.
>>-- expect 1a1, 1a3
>>
>>insert into t010t2 values
+>(2, 'a', 1, '2a1'),
+>(4, 'a', 1, '4a1');

--- 2 row(s) inserted.
>>
>>prepare y5 from 
+>update t010t2 set d='uuu' where a=4 and b in ('a', 'b') and c < 2;

--- SQL command prepared.
>>execute y5;

--- 2 row(s) updated.
>>-- execute 2 rows updated, 4a1 and 4b1
>>select * from t010t2;

A            B           C            D         
-----------  ----------  -----------  ----------

          1  a                     1  1a1       
          1  a                     3  1a3       
          1  a                     5  1a5       
          1  c                     1  1c1       
          2  a                     1  2a1       
          2  a                     2  2a2       
          2  c                     3  2c3       
          4  a                     1  uuu       
          4  b                     1  uuu       
          4  b                     2  4b2       

--- 10 row(s) selected.
>>
>>cqd HBASE_MAX_NUM_SEARCH_KEYS reset;

--- SQL operation complete.
>>
>>explain x1;

------------------------------------------------------------------ PLAN SUMMARY
MODULE_NAME .............. DYNAMICALLY COMPILED
STATEMENT_NAME ........... X1
PLAN_ID .................. 212277210137949312
ROWS_OUT ................. 2
EST_TOTAL_COST ........... 0.01
STATEMENT ................ select *
                           from t010t2
                           where a in (1,4) and b='a' and c = 1;


------------------------------------------------------------------ NODE LISTING
ROOT ======================================  SEQ_NO 2        ONLY CHILD 1
REQUESTS_IN .............. 1
ROWS_OUT ................. 2
EST_OPER_COST ............ 0
EST_TOTAL_COST ........... 0.01
DESCRIPTION
  max_card_est .......... 99
  fragment_id ............ 0
  parent_frag ............ (none)
  fragment_type .......... master
  statement_index ........ 0
  affinity_value ......... 0
  max_max_cardinality .... 2
  total_overflow_size .... 0.00 KB
  xn_access_mode ......... read_only
  xn_autoabort_interval    0
  auto_query_retry ....... enabled
  plan_version ....... 2,600
  embedded_arkcmp ........ used
  IS_SQLCI ............... ON
  LDAP_USERNAME
  MODE_SEABASE ........... ON
  SEABASE_VOLATILE_TABLES  ON
  HBASE_ASYNC_DROP_TABLE   OFF
  SCHEMA ................. TRAFODION.SCH
  HBASE_MAX_COLUMN_NAME_  10
  HBASE_MAX_COLUMN_VAL_L  20
  HBASE_MAX_COLUMN_INFO_  60
  HBASE_SERIALIZATION .... OFF
  HBASE_FILTER_PREDS ..... OFF
  QUERY_CACHE ............ 0
  MDAM_SCAN_METHOD ....... OFF
  select_list ............ TRAFODION.SCH.T010T2.A, 'a', 1,
                             TRAFODION.SCH.T010T2.D


TRAFODION_SCAN ============================  SEQ_NO 1        NO CHILDREN
TABLE_NAME ............... T010T2
REQUESTS_IN .............. 1
ROWS_OUT ................. 2
EST_OPER_COST ............ 0.01
EST_TOTAL_COST ........... 0.01
DESCRIPTION
  max_card_est .......... 99
  fragment_id ............ 0
  parent_frag ............ (none)
  fragment_type .......... master
  scan_type .............. subset scan of table TRAFODION.SCH.T010T2
  columns ................ all
  unique_rows ............ 1,a,1
  unique_rows ............ 4,a,1
  cache_size ........... 100
  probes ................. 1
  rows_accessed ........ 100
  key_columns ............ A, B, C

--- SQL operation complete.
>>explain x2;

------------------------------------------------------------------ PLAN SUMMARY
MODULE_NAME .............. DYNAMICALLY COMPILED
STATEMENT_NAME ........... X2
PLAN_ID .................. 212277210137976348
ROWS_OUT ................. 5
EST_TOTAL_COST ........... 0.01
STATEMENT ................ select *
                           from t010t2
                           where a in (1,2,4) and b='a' and (c in (1,
                             3) or c>=5);


------------------------------------------------------------------ NODE LISTING
ROOT ======================================  SEQ_NO 2        ONLY CHILD 1
REQUESTS_IN .............. 1
ROWS_OUT ................. 5
EST_OPER_COST ............ 0
EST_TOTAL_COST ........... 0.01
DESCRIPTION
  max_card_est .......... 99
  fragment_id ............ 0
  parent_frag ............ (none)
  fragment_type .......... master
  statement_index ........ 0
  affinity_value ......... 0
  max_max_cardinality .... 5
  total_overflow_size .... 0.00 KB
  xn_access_mode ......... read_only
  xn_autoabort_interval    0
  auto_query_retry ....... enabled
  plan_version ....... 2,600
  embedded_arkcmp ........ used
  IS_SQLCI ............... ON
  LDAP_USERNAME
  MODE_SEABASE ........... ON
  SEABASE_VOLATILE_TABLES  ON
  HBASE_ASYNC_DROP_TABLE   OFF
  SCHEMA ................. TRAFODION.SCH
  HBASE_MAX_COLUMN_NAME_  10
  HBASE_MAX_COLUMN_VAL_L  20
  HBASE_MAX_COLUMN_INFO_  60
  HBASE_SERIALIZATION .... OFF
  HBASE_FILTER_PREDS ..... OFF
  QUERY_CACHE ............ 0
  MDAM_SCAN_METHOD ....... OFF
  select_list ............ TRAFODION.SCH.T010T2.A, 'a', TRAFODION.SCH.T010T2.C,
                             TRAFODION.SCH.T010T2.D


TRAFODION_SCAN ============================  SEQ_NO 1        NO CHILDREN
TABLE_NAME ............... T010T2
REQUESTS_IN .............. 1
ROWS_OUT ................. 5
EST_OPER_COST ............ 0.01
EST_TOTAL_COST ........... 0.01
DESCRIPTION
  max_card_est .......... 99
  fragment_id ............ 0
  parent_frag ............ (none)
  fragment_type .......... master
  scan_type .............. subset scan of table TRAFODION.SCH.T010T2
  columns ................ all
  unique_rows ............ 1,a,1
  unique_rows ............ 1,a,3
  unique_rows ............ 2,a,1
  unique_rows ............ 2,a,3
  unique_rows ............ 4,a,1
  unique_rows ............ 4,a,3
  columns ................ all
  begin_keys(incl) ....... 1,a,5
  end_keys(incl) ......... 1,a,2147483647
  columns ................ all
  begin_keys(incl) ....... 2,a,5
  end_keys(incl) ......... 2,a,2147483647
  columns ................ all
  begin_keys(incl) ....... 4,a,5
  end_keys(incl) ......... 4,a,2147483647
  cache_size ........... 100
  probes ................. 1
  rows_accessed ........ 100
  key_columns ............ A, B, C

--- SQL operation complete.
>>explain x3;

------------------------------------------------------------------ PLAN SUMMARY
MODULE_NAME .............. DYNAMICALLY COMPILED
STATEMENT_NAME ........... X3
PLAN_ID .................. 212277210138007122
ROWS_OUT ................. 4
EST_TOTAL_COST ........... 0.01
STATEMENT ................ select *
                           from t010t2
                           where a in (1,2,4) and b='a' and c in (1,3);


------------------------------------------------------------------ NODE LISTING
ROOT ======================================  SEQ_NO 2        ONLY CHILD 1
REQUESTS_IN .............. 1
ROWS_OUT ................. 4
EST_OPER_COST ............ 0
EST_TOTAL_COST ........... 0.01
DESCRIPTION
  max_card_est .......... 99
  fragment_id ............ 0
  parent_frag ............ (none)
  fragment_type .......... master
  statement_index ........ 0
  affinity_value ......... 0
  max_max_cardinality .... 4
  total_overflow_size .... 0.00 KB
  xn_access_mode ......... read_only
  xn_autoabort_interval    0
  auto_query_retry ....... enabled
  plan_version ....... 2,600
  embedded_arkcmp ........ used
  IS_SQLCI ............... ON
  LDAP_USERNAME
  MODE_SEABASE ........... ON
  SEABASE_VOLATILE_TABLES  ON
  HBASE_ASYNC_DROP_TABLE   OFF
  SCHEMA ................. TRAFODION.SCH
  HBASE_MAX_COLUMN_NAME_  10
  HBASE_MAX_COLUMN_VAL_L  20
  HBASE_MAX_COLUMN_INFO_  60
  HBASE_SERIALIZATION .... OFF
  HBASE_FILTER_PREDS ..... OFF
  QUERY_CACHE ............ 0
  MDAM_SCAN_METHOD ....... OFF
  select_list ............ TRAFODION.SCH.T010T2.A, 'a', TRAFODION.SCH.T010T2.C,
                             TRAFODION.SCH.T010T2.D


TRAFODION_SCAN ============================  SEQ_NO 1        NO CHILDREN
TABLE_NAME ............... T010T2
REQUESTS_IN .............. 1
ROWS_OUT ................. 4
EST_OPER_COST ............ 0.01
EST_TOTAL_COST ........... 0.01
DESCRIPTION
  max_card_est .......... 99
  fragment_id ............ 0
  parent_frag ............ (none)
  fragment_type .......... master
  scan_type .............. subset scan of table TRAFODION.SCH.T010T2
  columns ................ all
  unique_rows ............ 1,a,1
  unique_rows ............ 1,a,3
  unique_rows ............ 2,a,1
  unique_rows ............ 2,a,3
  unique_rows ............ 4,a,1
  unique_rows ............ 4,a,3
  cache_size ........... 100
  probes ................. 1
  rows_accessed ........ 100
  key_columns ............ A, B, C

--- SQL operation complete.
>>explain x4;

------------------------------------------------------------------ PLAN SUMMARY
MODULE_NAME .............. DYNAMICALLY COMPILED
STATEMENT_NAME ........... X4
PLAN_ID .................. 212277210138035414
ROWS_OUT ................. 4
EST_TOTAL_COST ........... 0.01
STATEMENT ................ delete from t010t2
                           where a in (2,4,6) and b='a' and c in (1,3);


------------------------------------------------------------------ NODE LISTING
ROOT ======================================  SEQ_NO 4        ONLY CHILD 3
REQUESTS_IN .............. 1
ROWS_OUT ................. 4
EST_OPER_COST ............ 0
EST_TOTAL_COST ........... 0.01
DESCRIPTION
  max_card_est ........... 4
  fragment_id ............ 0
  parent_frag ............ (none)
  fragment_type .......... master
  statement_index ........ 0
  affinity_value ......... 0
  max_max_cardinality .... 4
  total_overflow_size .... 0.00 KB
  upd_action_on_error .... xn_rollback
  xn_access_mode ......... read_only
  xn_autoabort_interval    0
  auto_query_retry ....... enabled
  plan_version ....... 2,600
  embedded_arkcmp ........ used
  IS_SQLCI ............... ON
  LDAP_USERNAME
  MODE_SEABASE ........... ON
  SEABASE_VOLATILE_TABLES  ON
  HBASE_ASYNC_DROP_TABLE   OFF
  SCHEMA ................. TRAFODION.SCH
  HBASE_MAX_COLUMN_NAME_  10
  HBASE_MAX_COLUMN_VAL_L  20
  HBASE_MAX_COLUMN_INFO_  60
  HBASE_SERIALIZATION .... OFF
  HBASE_FILTER_PREDS ..... OFF
  QUERY_CACHE ............ 0
  MDAM_SCAN_METHOD ....... OFF


TUPLE_FLOW ================================  SEQ_NO 3        CHILDREN 1, 2
REQUESTS_IN .............. 1
ROWS_OUT ................. 4
EST_OPER_COST ............ 0.01
EST_TOTAL_COST ........... 0.01
DESCRIPTION
  max_card_est ........... 4
  fragment_id ............ 0
  parent_frag ............ (none)
  fragment_type .......... master
  join_type .............. inner
  join_method ............ in-order nested


TRAFODION_DELETE ==========================  SEQ_NO 2        NO CHILDREN
TABLE_NAME ............... TRAFODION.SCH.T010T2
REQUESTS_IN .............. 1
ROWS_OUT ................. 1
EST_OPER_COST ............ 0
EST_TOTAL_COST ........... 0
DESCRIPTION
  max_card_est .......... 99
  fragment_id ............ 0
  parent_frag ............ (none)
  fragment_type .......... master
  iud_type ............... trafodion_delete TRAFODION.SCH.T010T2
  begin_key .............. (A = A) and (B = 'a') and (C = C)
  end_key ................ (A = A) and (B = 'a') and (C = C)


TRAFODION_SCAN ============================  SEQ_NO 1        NO CHILDREN
TABLE_NAME ............... T010T2
REQUESTS_IN .............. 1
ROWS_OUT ................. 4
EST_OPER_COST ............ 0.01
EST_TOTAL_COST ........... 0.01
DESCRIPTION
  max_card_est .......... 99
  fragment_id ............ 0
  parent_frag ............ (none)
  fragment_type .......... master
  scan_type .............. subset scan of table TRAFODION.SCH.T010T2
  columns ................ all
  unique_rows ............ 2,a,1
  unique_rows ............ 2,a,3
  unique_rows ............ 4,a,1
  unique_rows ............ 4,a,3
  unique_rows ............ 6,a,1
  unique_rows ............ 6,a,3
  cache_size ........... 100
  probes ................. 1
  rows_accessed ........ 100
  key_columns ............ A, B, C
  executor_predicates .... (B = 'a')

--- SQL operation complete.
>>explain x5;

------------------------------------------------------------------ PLAN SUMMARY
MODULE_NAME .............. DYNAMICALLY COMPILED
STATEMENT_NAME ........... X5
PLAN_ID .................. 212277210138098998
ROWS_OUT ................. 2
EST_TOTAL_COST ........... 0
STATEMENT ................ update t010t2
                           set d='upd'
                           where a=4 and b in ('a', 'b') and c < 2;


------------------------------------------------------------------ NODE LISTING
ROOT ======================================  SEQ_NO 2        ONLY CHILD 1
REQUESTS_IN .............. 1
ROWS_OUT ................. 2
EST_OPER_COST ............ 0
EST_TOTAL_COST ........... 0
DESCRIPTION
  olt_optimization ....... used
  max_card_est ........... 2
  fragment_id ............ 0
  parent_frag ............ (none)
  fragment_type .......... master
  statement_index ........ 0
  affinity_value ......... 0
  max_max_cardinality .... 2
  total_overflow_size .... 0.00 KB
  upd_action_on_error .... xn_rollback
  xn_access_mode ......... read_only
  xn_autoabort_interval    0
  auto_query_retry ....... enabled
  plan_version ....... 2,600
  embedded_arkcmp ........ used
  IS_SQLCI ............... ON
  LDAP_USERNAME
  MODE_SEABASE ........... ON
  SEABASE_VOLATILE_TABLES  ON
  HBASE_ASYNC_DROP_TABLE   OFF
  SCHEMA ................. TRAFODION.SCH
  HBASE_MAX_COLUMN_NAME_  10
  HBASE_MAX_COLUMN_VAL_L  20
  HBASE_MAX_COLUMN_INFO_  60
  HBASE_SERIALIZATION .... OFF
  HBASE_FILTER_PREDS ..... OFF
  QUERY_CACHE ............ 0
  MDAM_SCAN_METHOD ....... OFF


TRAFODION_UPDATE ==========================  SEQ_NO 1        NO CHILDREN
TABLE_NAME ............... TRAFODION.SCH.T010T2
REQUESTS_IN .............. 1
ROWS_OUT ................. 2
EST_OPER_COST ............ 0
EST_TOTAL_COST ........... 0
DESCRIPTION
  max_card_est ........... 2
  fragment_id ............ 0
  parent_frag ............ (none)
  fragment_type .......... master
  iud_type ............... trafodion_update TRAFODION.SCH.T010T2
  columns ................ all
  begin_keys(incl) ....... 4,a,-2147483648
  end_keys(excl) ......... 4,a,2
  columns ................ all
  begin_keys(incl) ....... 4,b,-2147483648
  end_keys(excl) ......... 4,b,2
  new_rec_expr ........... (D assign 'upd')

--- SQL operation complete.
>>explain y1;

------------------------------------------------------------------ PLAN SUMMARY
MODULE_NAME .............. DYNAMICALLY COMPILED
STATEMENT_NAME ........... Y1
PLAN_ID .................. 212277210138150943
ROWS_OUT ................. 2
EST_TOTAL_COST ........... 0.01
STATEMENT ................ select *
                           from t010t2
                           where a in (1,4) and b='a' and c = 1;


------------------------------------------------------------------ NODE LISTING
ROOT ======================================  SEQ_NO 2        ONLY CHILD 1
REQUESTS_IN .............. 1
ROWS_OUT ................. 2
EST_OPER_COST ............ 0
EST_TOTAL_COST ........... 0.01
DESCRIPTION
  max_card_est .......... 99
  fragment_id ............ 0
  parent_frag ............ (none)
  fragment_type .......... master
  statement_index ........ 0
  affinity_value ......... 0
  max_max_cardinality .... 2
  total_overflow_size .... 0.00 KB
  xn_access_mode ......... read_only
  xn_autoabort_interval    0
  auto_query_retry ....... enabled
  plan_version ....... 2,600
  embedded_arkcmp ........ used
  IS_SQLCI ............... ON
  LDAP_USERNAME
  MODE_SEABASE ........... ON
  SEABASE_VOLATILE_TABLES  ON
  HBASE_ASYNC_DROP_TABLE   OFF
  SCHEMA ................. TRAFODION.SCH
  HBASE_MAX_COLUMN_NAME_  10
  HBASE_MAX_COLUMN_VAL_L  20
  HBASE_MAX_COLUMN_INFO_  60
  HBASE_SERIALIZATION .... OFF
  HBASE_FILTER_PREDS ..... OFF
  QUERY_CACHE ............ 0
  MDAM_SCAN_METHOD ....... OFF
  HBASE_MAX_NUM_SEARCH_KE  1
  select_list ............ TRAFODION.SCH.T010T2.A, 'a', 1,
                             TRAFODION.SCH.T010T2.D


TRAFODION_SCAN ============================  SEQ_NO 1        NO CHILDREN
TABLE_NAME ............... T010T2
REQUESTS_IN .............. 1
ROWS_OUT ................. 2
EST_OPER_COST ............ 0.01
EST_TOTAL_COST ........... 0.01
DESCRIPTION
  max_card_est .......... 99
  fragment_id ............ 0
  parent_frag ............ (none)
  fragment_type .......... master
  scan_type .............. subset scan of table TRAFODION.SCH.T010T2
  columns ................ all
  begin_keys(incl)
  end_keys(incl)
  cache_size ........... 100
  probes ................. 1
  rows_accessed ........ 100
  key_columns ............ A, B, C
  executor_predicates .... (B = 'a') and (C = 1) and ((A = 1) or (A = 4))

--- SQL operation complete.
>>explain y2;

------------------------------------------------------------------ PLAN SUMMARY
MODULE_NAME .............. DYNAMICALLY COMPILED
STATEMENT_NAME ........... Y2
PLAN_ID .................. 212277210138179869
ROWS_OUT ................. 5
EST_TOTAL_COST ........... 0.01
STATEMENT ................ select *
                           from t010t2
                           where a in (1,2,4) and b='a' and (c in (1,
                             3) or c>=5);


------------------------------------------------------------------ NODE LISTING
ROOT ======================================  SEQ_NO 2        ONLY CHILD 1
REQUESTS_IN .............. 1
ROWS_OUT ................. 5
EST_OPER_COST ............ 0
EST_TOTAL_COST ........... 0.01
DESCRIPTION
  max_card_est .......... 99
  fragment_id ............ 0
  parent_frag ............ (none)
  fragment_type .......... master
  statement_index ........ 0
  affinity_value ......... 0
  max_max_cardinality .... 5
  total_overflow_size .... 0.00 KB
  xn_access_mode ......... read_only
  xn_autoabort_interval    0
  auto_query_retry ....... enabled
  plan_version ....... 2,600
  embedded_arkcmp ........ used
  IS_SQLCI ............... ON
  LDAP_USERNAME
  MODE_SEABASE ........... ON
  SEABASE_VOLATILE_TABLES  ON
  HBASE_ASYNC_DROP_TABLE   OFF
  SCHEMA ................. TRAFODION.SCH
  HBASE_MAX_COLUMN_NAME_  10
  HBASE_MAX_COLUMN_VAL_L  20
  HBASE_MAX_COLUMN_INFO_  60
  HBASE_SERIALIZATION .... OFF
  HBASE_FILTER_PREDS ..... OFF
  QUERY_CACHE ............ 0
  MDAM_SCAN_METHOD ....... OFF
  HBASE_MAX_NUM_SEARCH_KE  1
  select_list ............ TRAFODION.SCH.T010T2.A, 'a', TRAFODION.SCH.T010T2.C,
                             TRAFODION.SCH.T010T2.D


TRAFODION_SCAN ============================  SEQ_NO 1        NO CHILDREN
TABLE_NAME ............... T010T2
REQUESTS_IN .............. 1
ROWS_OUT ................. 5
EST_OPER_COST ............ 0.01
EST_TOTAL_COST ........... 0.01
DESCRIPTION
  max_card_est .......... 99
  fragment_id ............ 0
  parent_frag ............ (none)
  fragment_type .......... master
  scan_type .............. subset scan of table TRAFODION.SCH.T010T2
  columns ................ all
  begin_keys(incl)
  end_keys(incl)
  cache_size ........... 100
  probes ................. 1
  rows_accessed ........ 100
  key_columns ............ A, B, C
  executor_predicates .... (B = 'a') and (((A = 1) or (A = 2)) or (A = 4)) and
                             (((C = 1) or (C = 3)) or (C >= 5))

--- SQL operation complete.
>>explain y3;

------------------------------------------------------------------ PLAN SUMMARY
MODULE_NAME .............. DYNAMICALLY COMPILED
STATEMENT_NAME ........... Y3
PLAN_ID .................. 212277210138208764
ROWS_OUT ................. 4
EST_TOTAL_COST ........... 0.01
STATEMENT ................ select *
                           from t010t2
                           where a in (1,2,4) and b='a' and c in (1,3);


------------------------------------------------------------------ NODE LISTING
ROOT ======================================  SEQ_NO 2        ONLY CHILD 1
REQUESTS_IN .............. 1
ROWS_OUT ................. 4
EST_OPER_COST ............ 0
EST_TOTAL_COST ........... 0.01
DESCRIPTION
  max_card_est .......... 99
  fragment_id ............ 0
  parent_frag ............ (none)
  fragment_type .......... master
  statement_index ........ 0
  affinity_value ......... 0
  max_max_cardinality .... 4
  total_overflow_size .... 0.00 KB
  xn_access_mode ......... read_only
  xn_autoabort_interval    0
  auto_query_retry ....... enabled
  plan_version ....... 2,600
  embedded_arkcmp ........ used
  IS_SQLCI ............... ON
  LDAP_USERNAME
  MODE_SEABASE ........... ON
  SEABASE_VOLATILE_TABLES  ON
  HBASE_ASYNC_DROP_TABLE   OFF
  SCHEMA ................. TRAFODION.SCH
  HBASE_MAX_COLUMN_NAME_  10
  HBASE_MAX_COLUMN_VAL_L  20
  HBASE_MAX_COLUMN_INFO_  60
  HBASE_SERIALIZATION .... OFF
  HBASE_FILTER_PREDS ..... OFF
  QUERY_CACHE ............ 0
  MDAM_SCAN_METHOD ....... OFF
  HBASE_MAX_NUM_SEARCH_KE  1
  select_list ............ TRAFODION.SCH.T010T2.A, 'a', TRAFODION.SCH.T010T2.C,
                             TRAFODION.SCH.T010T2.D


TRAFODION_SCAN ============================  SEQ_NO 1        NO CHILDREN
TABLE_NAME ............... T010T2
REQUESTS_IN .............. 1
ROWS_OUT ................. 4
EST_OPER_COST ............ 0.01
EST_TOTAL_COST ........... 0.01
DESCRIPTION
  max_card_est .......... 99
  fragment_id ............ 0
  parent_frag ............ (none)
  fragment_type .......... master
  scan_type .............. subset scan of table TRAFODION.SCH.T010T2
  columns ................ all
  begin_keys(incl)
  end_keys(incl)
  cache_size ........... 100
  probes ................. 1
  rows_accessed ........ 100
  key_columns ............ A, B, C
  executor_predicates .... (B = 'a') and (((A = 1) or (A = 2)) or (A = 4)) and
                             ((C = 1) or (C = 3))

--- SQL operation complete.
>>explain y4;

------------------------------------------------------------------ PLAN SUMMARY
MODULE_NAME .............. DYNAMICALLY COMPILED
STATEMENT_NAME ........... Y4
PLAN_ID .................. 212277210138241001
ROWS_OUT ................. 4
EST_TOTAL_COST ........... 0.01
STATEMENT ................ delete from t010t2
                           where a in (2,4,6) and b='a' and c in (1,3);


------------------------------------------------------------------ NODE LISTING
ROOT ======================================  SEQ_NO 4        ONLY CHILD 3
REQUESTS_IN .............. 1
ROWS_OUT ................. 4
EST_OPER_COST ............ 0
EST_TOTAL_COST ........... 0.01
DESCRIPTION
  max_card_est ........... 4
  fragment_id ............ 0
  parent_frag ............ (none)
  fragment_type .......... master
  statement_index ........ 0
  affinity_value ......... 0
  max_max_cardinality .... 4
  total_overflow_size .... 0.00 KB
  upd_action_on_error .... xn_rollback
  xn_access_mode ......... read_only
  xn_autoabort_interval    0
  auto_query_retry ....... enabled
  plan_version ....... 2,600
  embedded_arkcmp ........ used
  IS_SQLCI ............... ON
  LDAP_USERNAME
  MODE_SEABASE ........... ON
  SEABASE_VOLATILE_TABLES  ON
  HBASE_ASYNC_DROP_TABLE   OFF
  SCHEMA ................. TRAFODION.SCH
  HBASE_MAX_COLUMN_NAME_  10
  HBASE_MAX_COLUMN_VAL_L  20
  HBASE_MAX_COLUMN_INFO_  60
  HBASE_SERIALIZATION .... OFF
  HBASE_FILTER_PREDS ..... OFF
  QUERY_CACHE ............ 0
  MDAM_SCAN_METHOD ....... OFF
  HBASE_MAX_NUM_SEARCH_KE  1


TUPLE_FLOW ================================  SEQ_NO 3        CHILDREN 1, 2
REQUESTS_IN .............. 1
ROWS_OUT ................. 4
EST_OPER_COST ............ 0.01
EST_TOTAL_COST ........... 0.01
DESCRIPTION
  max_card_est ........... 4
  fragment_id ............ 0
  parent_frag ............ (none)
  fragment_type .......... master
  join_type .............. inner
  join_method ............ in-order nested


TRAFODION_DELETE ==========================  SEQ_NO 2        NO CHILDREN
TABLE_NAME ............... TRAFODION.SCH.T010T2
REQUESTS_IN .............. 1
ROWS_OUT ................. 1
EST_OPER_COST ............ 0
EST_TOTAL_COST ........... 0
DESCRIPTION
  max_card_est .......... 99
  fragment_id ............ 0
  parent_frag ............ (none)
  fragment_type .......... master
  iud_type ............... trafodion_delete TRAFODION.SCH.T010T2
  begin_key .............. (A = A) and (B = 'a') and (C = C)
  end_key ................ (A = A) and (B = 'a') and (C = C)


TRAFODION_SCAN ============================  SEQ_NO 1        NO CHILDREN
TABLE_NAME ............... T010T2
REQUESTS_IN .............. 1
ROWS_OUT ................. 4
EST_OPER_COST ............ 0.01
EST_TOTAL_COST ........... 0.01
DESCRIPTION
  max_card_est .......... 99
  fragment_id ............ 0
  parent_frag ............ (none)
  fragment_type .......... master
  scan_type .............. subset scan of table TRAFODION.SCH.T010T2
  columns ................ all
  begin_keys(incl)
  end_keys(incl)
  cache_size ........... 100
  probes ................. 1
  rows_accessed ........ 100
  key_columns ............ A, B, C
  executor_predicates .... (B = 'a') and (((A = 2) or (A = 4)) or (A = 6)) and
                             ((C = 1) or (C = 3))

--- SQL operation complete.
>>explain y5;

------------------------------------------------------------------ PLAN SUMMARY
MODULE_NAME .............. DYNAMICALLY COMPILED
STATEMENT_NAME ........... Y5
PLAN_ID .................. 212277210138317485
ROWS_OUT ................. 2
EST_TOTAL_COST ........... 0
STATEMENT ................ update t010t2
                           set d='uuu'
                           where a=4 and b in ('a', 'b') and c < 2;


------------------------------------------------------------------ NODE LISTING
ROOT ======================================  SEQ_NO 2        ONLY CHILD 1
REQUESTS_IN .............. 1
ROWS_OUT ................. 2
EST_OPER_COST ............ 0
EST_TOTAL_COST ........... 0
DESCRIPTION
  olt_optimization ....... used
  max_card_est ........... 2
  fragment_id ............ 0
  parent_frag ............ (none)
  fragment_type .......... master
  statement_index ........ 0
  affinity_value ......... 0
  max_max_cardinality .... 2
  total_overflow_size .... 0.00 KB
  upd_action_on_error .... xn_rollback
  xn_access_mode ......... read_only
  xn_autoabort_interval    0
  auto_query_retry ....... enabled
  plan_version ....... 2,600
  embedded_arkcmp ........ used
  IS_SQLCI ............... ON
  LDAP_USERNAME
  MODE_SEABASE ........... ON
  SEABASE_VOLATILE_TABLES  ON
  HBASE_ASYNC_DROP_TABLE   OFF
  SCHEMA ................. TRAFODION.SCH
  HBASE_MAX_COLUMN_NAME_  10
  HBASE_MAX_COLUMN_VAL_L  20
  HBASE_MAX_COLUMN_INFO_  60
  HBASE_SERIALIZATION .... OFF
  HBASE_FILTER_PREDS ..... OFF
  QUERY_CACHE ............ 0
  MDAM_SCAN_METHOD ....... OFF
  HBASE_MAX_NUM_SEARCH_KE  1


TRAFODION_UPDATE ==========================  SEQ_NO 1        NO CHILDREN
TABLE_NAME ............... TRAFODION.SCH.T010T2
REQUESTS_IN .............. 1
ROWS_OUT ................. 2
EST_OPER_COST ............ 0
EST_TOTAL_COST ........... 0
DESCRIPTION
  max_card_est ........... 2
  fragment_id ............ 0
  parent_frag ............ (none)
  fragment_type .......... master
  iud_type ............... trafodion_update TRAFODION.SCH.T010T2
  columns ................ all
  begin_keys(incl) ....... 4,,-2147483648
  end_keys(incl) ......... 4,??????????,2
  new_rec_expr ........... (D assign 'uuu')
  predicate .............. ((B = 'a') or (B = 'b')) and (C < 2)

--- SQL operation complete.
>>
>>select "_SALT_", * from t010t3 order by a,b,c;

_SALT_      A            B           C            D         
----------  -----------  ----------  -----------  ----------

         2            1  a                     1  1a1       
         2            1  a                     3  1a3       
         2            1  a                     5  1a5       
         1            1  c                     1  1c1       
         3            2  a                     1  2a1       
         3            2  a                     2  2a2       
         0            2  c                     3  2c3       
         2            4  a                     1  4a1       
         1            4  b                     1  4b1       
         1            4  b                     2  4b2       

--- 10 row(s) selected.
>>select "_SALT_", * from t010t3 where a=1 and b='c';

_SALT_      A            B           C            D         
----------  -----------  ----------  -----------  ----------

         1            1  c                     1  1c1       

--- 1 row(s) selected.
>>
>>update t010t3 set d='2axu' where a=2 and b='a';

--- 2 row(s) updated.
>>-- 2 rows updated
>>update t010t3 set d='4b1u' where a=4 and b='b' and c <= 1;

--- 1 row(s) updated.
>>-- 1 row updated
>>update t010t3 set a=3 where a=2;

--- 3 row(s) updated.
>>-- 3 rows updated
>>delete from t010t3 where a=3 and b='c' and c=3;

--- 1 row(s) deleted.
>>-- 1 row deleted
>>delete from t010t3 where d like '2%u %';

--- 2 row(s) deleted.
>>-- 2 rows deleted
>>select "_SALT_", * from t010t3;

_SALT_      A            B           C            D         
----------  -----------  ----------  -----------  ----------

         1            1  c                     1  1c1       
         1            4  b                     1  4b1u      
         1            4  b                     2  4b2       
         2            1  a                     1  1a1       
         2            1  a                     3  1a3       
         2            1  a                     5  1a5       
         2            4  a                     1  4a1       

--- 7 row(s) selected.
>>-- 7 rows
>>merge into t010t3
+>  using (select * from t010t2) as src
+>  on ((src.a, src.b, src.c) = (a,b,c))
+>when matched
+>  then update set d = src.d
+>when not matched
+>  then insert values (src.a, src.b, src.c, src.d)
+>;

--- 10 row(s) updated.
>>-- 10 rows updated
>>select "_SALT_", * from t010t2 natural join t010t3 order by a,b,c;

_SALT_      A            B           C            D         
----------  -----------  ----------  -----------  ----------

         2            1  a                     1  1a1       
         2            1  a                     3  1a3       
         2            1  a                     5  1a5       
         1            1  c                     1  1c1       
         3            2  a                     1  2a1       
         3            2  a                     2  2a2       
         0            2  c                     3  2c3       
         2            4  a                     1  uuu       
         1            4  b                     1  uuu       
         1            4  b                     2  4b2       

--- 10 row(s) selected.
>>-- expect 10 rows, same as each individual table
>>
>>select "_SALT_", * from table(table t010t3, partition number 4);

_SALT_      A            B           C            D         
----------  -----------  ----------  -----------  ----------

         3            2  a                     1  2a1       
         3            2  a                     2  2a2       

--- 2 row(s) selected.
>>select "_SALT_", * from table(table t010t3, partition number from 1 to 3);

_SALT_      A            B           C            D         
----------  -----------  ----------  -----------  ----------

         0            2  c                     3  2c3       
         1            1  c                     1  1c1       
         1            4  b                     1  uuu       
         1            4  b                     2  4b2       
         2            1  a                     1  1a1       
         2            1  a                     3  1a3       
         2            1  a                     5  1a5       
         2            4  a                     1  uuu       

--- 8 row(s) selected.
>>-- 2 statements above must return 10 rows total
>>
>>
>>-- query_cache on, mdam_scan_method off
>>cqd query_cache '1024';

--- SQL operation complete.
>>cqd mdam_scan_method 'OFF';

--- SQL operation complete.
>>obey TEST010(clean_up);
>>--------------------------------------------------------------------------
>>drop table if exists t010t1;

--- SQL operation complete.
>>drop table if exists t010t2;

--- SQL operation complete.
>>drop table if exists t010t3;

--- SQL operation complete.
>>
>>obey TEST010(tests);
>>--------------------------------------------------------------------------
>>
>>create table if not exists t010t1 (a int not null, b char(10), primary key(a));

--- SQL operation complete.
>>create table if not exists t010t2 (a int not null, b char(10) not null, c int not null, d char(10), primary key(a,b,c));

--- SQL operation complete.
>>create table if not exists t010t3 (a int not null, b char(10) not null, c int not null, d char(10), primary key(a,b,c))
+>  salt using 4 partitions on (a,b);

--- SQL operation complete.
>>
>>invoke t010t1;

-- Definition of Trafodion table TRAFODION.SCH.T010T1
-- Definition current  Thu Sep 11 15:42:41 2014

  (
    A                                INT NO DEFAULT NOT NULL NOT DROPPABLE
  , B                                CHAR(10) CHARACTER SET ISO88591 COLLATE
      DEFAULT DEFAULT NULL
  )

--- SQL operation complete.
>>invoke hbase."_CELL_"."TRAFODION.SCH.T010T1";

-- Definition of Trafodion table HBASE."_CELL_"."TRAFODION.SCH.T010T1"
-- Definition current  Thu Sep 11 15:42:41 2014

  (
    ROW_ID                           VARCHAR(10) CHARACTER SET ISO88591 COLLATE
      DEFAULT NO DEFAULT NOT NULL NOT DROPPABLE
  , COL_FAMILY                       VARCHAR(10) CHARACTER SET ISO88591 COLLATE
      DEFAULT NO DEFAULT NOT NULL NOT DROPPABLE
  , COL_NAME                         VARCHAR(10) CHARACTER SET ISO88591 COLLATE
      DEFAULT NO DEFAULT NOT NULL NOT DROPPABLE
  , COL_TIMESTAMP                    LARGEINT NO DEFAULT NOT NULL NOT DROPPABLE
  , COL_VALUE                        VARCHAR(20) CHARACTER SET ISO88591 COLLATE
      DEFAULT NO DEFAULT NOT NULL NOT DROPPABLE
  )

--- SQL operation complete.
>>invoke hbase."_ROW_"."TRAFODION.SCH.T010T1";

-- Definition of Trafodion table HBASE."_ROW_"."TRAFODION.SCH.T010T1"
-- Definition current  Thu Sep 11 15:42:41 2014

  (
    ROW_ID                           VARCHAR(10) CHARACTER SET ISO88591 COLLATE
      DEFAULT NO DEFAULT NOT NULL NOT DROPPABLE
  , COLUMN_DETAILS                   VARCHAR(60) CHARACTER SET ISO88591 COLLATE
      DEFAULT NO DEFAULT NOT NULL NOT DROPPABLE
  )

--- SQL operation complete.
>>
>>insert into t010t1 values (1, 'a'), (2, 'b'), (3, 'c');

--- 3 row(s) inserted.
>>
>>select * from t010t1;

A            B         
-----------  ----------

          1  a         
          2  b         
          3  c         

--- 3 row(s) selected.
>>
>>select * from t010t1 where a = 2;

A            B         
-----------  ----------

          2  b         

--- 1 row(s) selected.
>>
>>select * from t010t1 where a = 2 or a = 3;

A            B         
-----------  ----------

          2  b         
          3  c         

--- 2 row(s) selected.
>>
>>delete from t010t1 where a = 4;

--- 0 row(s) deleted.
>>
>>select * from t010t1;

A            B         
-----------  ----------

          1  a         
          2  b         
          3  c         

--- 3 row(s) selected.
>>
>>delete from t010t1 where a = 2;

--- 1 row(s) deleted.
>>
>>select * from t010t1;

A            B         
-----------  ----------

          1  a         
          3  c         

--- 2 row(s) selected.
>>
>>select converttohex(cast(row_id as char(4))) rowid,
+>          converttohex(cast(col_family as char(2))) colfamily,
+>          converttohex(cast(col_name as char(1))) colname,
+>          converttohex(cast(col_value as char(4))) colvalue
+>                from hbase."_CELL_"."TRAFODION.SCH.T010T1";

ROWID     COLFAMILY  COLNAME  COLVALUE
--------  ---------  -------  --------

80000001  2331       01       01000000
80000001  2331       02       00612020
80000003  2331       01       03000000
80000003  2331       02       00632020

--- 4 row(s) selected.
>>
>>select converttohex(cast(row_id as char(4))) rowid,
+>          converttohex(cast(col_family as char(2))) colfamily,
+>          converttohex(cast(col_name as char(1))) colname,
+>          converttohex(cast(col_value as char(4))) colvalue
+>                from hbase."_CELL_"."TRAFODION.SCH.T010T1"
+>          where converttohex(cast(row_id as char(4))) = '80000001';

ROWID     COLFAMILY  COLNAME  COLVALUE
--------  ---------  -------  --------

80000001  2331       01       01000000
80000001  2331       02       00612020

--- 2 row(s) selected.
>>
>>select converttohex(cast(row_id as char(4))) rowid,
+>          converttohex(cast(column_details as char(40))) coldetails
+>                 from hbase."_ROW_"."TRAFODION.SCH.T010T1";

ROWID     COLDETAILS
--------  --------------------------------------------------------------------------------

80000001  040023313A010400000001000000040023313A020B00000000612020202020202020202020202020
80000003  040023313A010400000003000000040023313A020B00000000632020202020202020202020202020

--- 2 row(s) selected.
>>select converttohex(cast(row_id as char(4))) rowid,
+>          converttohex(cast(column_details as char(40))) coldetails
+>                 from hbase."_ROW_"."TRAFODION.SCH.T010T1"
+>          where converttohex(cast(row_id as char(4))) = '80000001';

ROWID     COLDETAILS
--------  --------------------------------------------------------------------------------

80000001  040023313A010400000001000000040023313A020B00000000612020202020202020202020202020

--- 1 row(s) selected.
>>
>>-------------------
>>-- check query plan
>>-------------------
>>
>>-- no sort operator should present when order by on primary key column
>>prepare xx from select * from t010t1 order by a;

--- SQL command prepared.
>>explain options 'f' xx;

LC   RC   OP   OPERATOR              OPT       DESCRIPTION           CARD
---- ---- ---- --------------------  --------  --------------------  ---------

1    .    2    root                                                  1.00E+002
.    .    1    trafodion_scan                  T010T1                1.00E+002

--- SQL operation complete.
>>
>>-- should see a sort when order by on non key column
>>prepare xx from select * from t010t1 order by b;

--- SQL command prepared.
>>explain options 'f' xx;

LC   RC   OP   OPERATOR              OPT       DESCRIPTION           CARD
---- ---- ---- --------------------  --------  --------------------  ---------

2    .    3    root                                                  1.00E+002
1    .    2    sort                                                  1.00E+002
.    .    1    trafodion_scan                  T010T1                1.00E+002

--- SQL operation complete.
>>
>>-- selectPred should present due to the 2nd disjunct b='1'
>>prepare xx from select * from t010t1 where a=1 or b='1';

--- SQL command prepared.
>>explain xx;

------------------------------------------------------------------ PLAN SUMMARY
MODULE_NAME .............. DYNAMICALLY COMPILED
STATEMENT_NAME ........... XX
PLAN_ID .................. 212277210161605993
ROWS_OUT ................ 11
EST_TOTAL_COST ........... 0.01
STATEMENT ................ select * from t010t1 where a=1 or b='1';


------------------------------------------------------------------ NODE LISTING
ROOT ======================================  SEQ_NO 2        ONLY CHILD 1
REQUESTS_IN .............. 1
ROWS_OUT ................ 11
EST_OPER_COST ............ 0
EST_TOTAL_COST ........... 0.01
DESCRIPTION
  max_card_est .......... 51
  fragment_id ............ 0
  parent_frag ............ (none)
  fragment_type .......... master
  statement_index ........ 0
  affinity_value ......... 0
  max_max_cardinality ... 11
  total_overflow_size .... 0.00 KB
  xn_access_mode ......... read_only
  xn_autoabort_interval    0
  auto_query_retry ....... enabled
  plan_version ....... 2,600
  embedded_arkcmp ........ used
  IS_SQLCI ............... ON
  LDAP_USERNAME
  MODE_SEABASE ........... ON
  SEABASE_VOLATILE_TABLES  ON
  HBASE_ASYNC_DROP_TABLE   OFF
  SCHEMA ................. TRAFODION.SCH
  HBASE_MAX_COLUMN_NAME_  10
  HBASE_MAX_COLUMN_VAL_L  20
  HBASE_MAX_COLUMN_INFO_  60
  HBASE_SERIALIZATION .... OFF
  HBASE_FILTER_PREDS ..... OFF
  QUERY_CACHE ........ 1,024
  MDAM_SCAN_METHOD ....... OFF
  select_list ............ TRAFODION.SCH.T010T1.A, TRAFODION.SCH.T010T1.B


TRAFODION_SCAN ============================  SEQ_NO 1        NO CHILDREN
TABLE_NAME ............... T010T1
REQUESTS_IN .............. 1
ROWS_OUT ................ 11
EST_OPER_COST ............ 0.01
EST_TOTAL_COST ........... 0.01
DESCRIPTION
  max_card_est .......... 51
  fragment_id ............ 0
  parent_frag ............ (none)
  fragment_type .......... master
  scan_type .............. subset scan of table TRAFODION.SCH.T010T1
  columns ................ all
  begin_keys(incl)
  end_keys(incl)
  cache_size ........... 100
  probes ................. 1
  rows_accessed ........ 100
  key_columns ............ A
  executor_predicates .... ((A = 1) or (B = '1'))

--- SQL operation complete.
>>
>>-- Optimization: with only one disjunct, the selectPred should be empty
>>-- and the executor predicate should contain the non-key predicate
>>prepare xx from select * from t010t1 where a=1 and b='1';

--- SQL command prepared.
>>explain xx;

------------------------------------------------------------------ PLAN SUMMARY
MODULE_NAME .............. DYNAMICALLY COMPILED
STATEMENT_NAME ........... XX
PLAN_ID .................. 212277210161651999
ROWS_OUT ................. 1
EST_TOTAL_COST ........... 0.01
STATEMENT ................ select * from t010t1 where a=1 and b='1';


------------------------------------------------------------------ NODE LISTING
ROOT ======================================  SEQ_NO 2        ONLY CHILD 1
REQUESTS_IN .............. 1
ROWS_OUT ................. 1
EST_OPER_COST ............ 0
EST_TOTAL_COST ........... 0.01
DESCRIPTION
  olt_optimization ....... used
  max_card_est ........... 1
  fragment_id ............ 0
  parent_frag ............ (none)
  fragment_type .......... master
  statement_index ........ 0
  affinity_value ......... 0
  max_max_cardinality .... 1
  total_overflow_size .... 0.00 KB
  xn_access_mode ......... read_only
  xn_autoabort_interval    0
  auto_query_retry ....... enabled
  plan_version ....... 2,600
  embedded_arkcmp ........ used
  IS_SQLCI ............... ON
  LDAP_USERNAME
  MODE_SEABASE ........... ON
  SEABASE_VOLATILE_TABLES  ON
  HBASE_ASYNC_DROP_TABLE   OFF
  SCHEMA ................. TRAFODION.SCH
  HBASE_MAX_COLUMN_NAME_  10
  HBASE_MAX_COLUMN_VAL_L  20
  HBASE_MAX_COLUMN_INFO_  60
  HBASE_SERIALIZATION .... OFF
  HBASE_FILTER_PREDS ..... OFF
  QUERY_CACHE ........ 1,024
  MDAM_SCAN_METHOD ....... OFF
  select_list ............ %(1), %('1')
  input_variables ........ %(1), %('1')


TRAFODION_SCAN ============================  SEQ_NO 1        NO CHILDREN
TABLE_NAME ............... T010T1
REQUESTS_IN .............. 1
ROWS_OUT ................. 1
EST_OPER_COST ............ 0.01
EST_TOTAL_COST ........... 0.01
DESCRIPTION
  max_card_est ........... 1
  fragment_id ............ 0
  parent_frag ............ (none)
  fragment_type .......... master
  scan_type .............. subset scan of table TRAFODION.SCH.T010T1
  cache_size ........... 100
  probes ................. 1
  rows_accessed .......... 1
  key_columns ............ A
  executor_predicates .... (B = %('1'))
  begin_key .............. (A = %(1))
  end_key ................ (A = %(1))

--- SQL operation complete.
>>
>>-- should see a full hbase SCAN
>>prepare xx from select * from t010t1 where b='1';

--- SQL command prepared.
>>explain xx;

------------------------------------------------------------------ PLAN SUMMARY
MODULE_NAME .............. DYNAMICALLY COMPILED
STATEMENT_NAME ........... XX
PLAN_ID .................. 212277210161702732
ROWS_OUT ................ 10
EST_TOTAL_COST ........... 0.01
STATEMENT ................ select * from t010t1 where b='1';


------------------------------------------------------------------ NODE LISTING
ROOT ======================================  SEQ_NO 2        ONLY CHILD 1
REQUESTS_IN .............. 1
ROWS_OUT ................ 10
EST_OPER_COST ............ 0
EST_TOTAL_COST ........... 0.01
DESCRIPTION
  max_card_est .......... 99
  fragment_id ............ 0
  parent_frag ............ (none)
  fragment_type .......... master
  statement_index ........ 0
  affinity_value ......... 0
  max_max_cardinality ... 10
  total_overflow_size .... 0.00 KB
  xn_access_mode ......... read_only
  xn_autoabort_interval    0
  auto_query_retry ....... enabled
  plan_version ....... 2,600
  embedded_arkcmp ........ used
  IS_SQLCI ............... ON
  LDAP_USERNAME
  MODE_SEABASE ........... ON
  SEABASE_VOLATILE_TABLES  ON
  HBASE_ASYNC_DROP_TABLE   OFF
  SCHEMA ................. TRAFODION.SCH
  HBASE_MAX_COLUMN_NAME_  10
  HBASE_MAX_COLUMN_VAL_L  20
  HBASE_MAX_COLUMN_INFO_  60
  HBASE_SERIALIZATION .... OFF
  HBASE_FILTER_PREDS ..... OFF
  QUERY_CACHE ........ 1,024
  MDAM_SCAN_METHOD ....... OFF
  select_list ............ TRAFODION.SCH.T010T1.A, %('1')
  input_variables ........ %('1')


TRAFODION_SCAN ============================  SEQ_NO 1        NO CHILDREN
TABLE_NAME ............... T010T1
REQUESTS_IN .............. 1
ROWS_OUT ................ 10
EST_OPER_COST ............ 0.01
EST_TOTAL_COST ........... 0.01
DESCRIPTION
  max_card_est .......... 99
  fragment_id ............ 0
  parent_frag ............ (none)
  fragment_type .......... master
  scan_type .............. subset scan of table TRAFODION.SCH.T010T1
  columns ................ all
  begin_keys(incl)
  end_keys(incl)
  cache_size ........... 100
  probes ................. 1
  rows_accessed ........ 100
  key_columns ............ A
  executor_predicates .... (B = %('1'))

--- SQL operation complete.
>>
>>-- should see a unique hbase GET 
>>prepare xx from select * from t010t1 where a=1;

--- SQL command prepared.
>>explain xx;

------------------------------------------------------------------ PLAN SUMMARY
MODULE_NAME .............. DYNAMICALLY COMPILED
STATEMENT_NAME ........... XX
PLAN_ID .................. 212277210161376255
ROWS_OUT ................. 1
EST_TOTAL_COST ........... 0.01
STATEMENT ................ select * from t010t1 where a = 2;


------------------------------------------------------------------ NODE LISTING
ROOT ======================================  SEQ_NO 2        ONLY CHILD 1
REQUESTS_IN .............. 1
ROWS_OUT ................. 1
EST_OPER_COST ............ 0
EST_TOTAL_COST ........... 0.01
DESCRIPTION
  olt_optimization ....... used
  max_card_est ........... 1
  fragment_id ............ 0
  parent_frag ............ (none)
  fragment_type .......... master
  statement_index ........ 0
  affinity_value ......... 0
  max_max_cardinality .... 1
  total_overflow_size .... 0.00 KB
  xn_access_mode ......... read_only
  xn_autoabort_interval    0
  auto_query_retry ....... enabled
  plan_version ....... 2,600
  embedded_arkcmp ........ used
  IS_SQLCI ............... ON
  LDAP_USERNAME
  MODE_SEABASE ........... ON
  SEABASE_VOLATILE_TABLES  ON
  HBASE_ASYNC_DROP_TABLE   OFF
  SCHEMA ................. TRAFODION.SCH
  HBASE_MAX_COLUMN_NAME_  10
  HBASE_MAX_COLUMN_VAL_L  20
  HBASE_MAX_COLUMN_INFO_  60
  HBASE_SERIALIZATION .... OFF
  HBASE_FILTER_PREDS ..... OFF
  QUERY_CACHE ........ 1,024
  MDAM_SCAN_METHOD ....... OFF
  select_list ............ %(2), TRAFODION.SCH.T010T1.B
  input_variables ........ %(2)


TRAFODION_SCAN ============================  SEQ_NO 1        NO CHILDREN
TABLE_NAME ............... T010T1
REQUESTS_IN .............. 1
ROWS_OUT ................. 1
EST_OPER_COST ............ 0.01
EST_TOTAL_COST ........... 0.01
DESCRIPTION
  max_card_est ........... 1
  fragment_id ............ 0
  parent_frag ............ (none)
  fragment_type .......... master
  scan_type .............. subset scan of table TRAFODION.SCH.T010T1
  cache_size ........... 100
  probes ................. 1
  rows_accessed .......... 1
  key_columns ............ A
  begin_key .............. (A = %(2))
  end_key ................ (A = %(2))

--- SQL operation complete.
>>
>>insert into t010t2 values
+>(1, 'a', 1, '1a1'),
+>(1, 'a', 3, '1a3'),
+>(1, 'a', 5, '1a5'),
+>(1, 'c', 1, '1c1'),
+>(2, 'a', 1, '2a1'),
+>(2, 'a', 2, '2a2'),
+>(2, 'c', 3, '2c3'),
+>(4, 'a', 1, '4a1'),
+>(4, 'b', 1, '4b1'),
+>(4, 'b', 2, '4b2');

--- 10 row(s) inserted.
>>
>>insert into t010t3 select * from t010t2;

--- 10 row(s) inserted.
>>
>>prepare x1 from
+>select * from t010t2 where a in (1,4) and b='a' and c = 1;

--- SQL command prepared.
>>
>>execute x1;

A            B           C            D         
-----------  ----------  -----------  ----------

          1  a                     1  1a1       
          4  a                     1  4a1       

--- 2 row(s) selected.
>>-- expect 1a1, 4a1
>>
>>prepare x2 from
+>select * from t010t2 where a in (1,2,4) and b='a' and (c in (1,3) or c>=5);

--- SQL command prepared.
>>execute x2;

A            B           C            D         
-----------  ----------  -----------  ----------

          1  a                     1  1a1       
          1  a                     3  1a3       
          1  a                     5  1a5       
          2  a                     1  2a1       
          4  a                     1  4a1       

--- 5 row(s) selected.
>>-- expect 1a1, 1a3, 1a5, 2a1, 4a1
>>
>>prepare x3 from
+>select * from t010t2 where a in (1,2,4) and b='a' and c in (1,3);

--- SQL command prepared.
>>execute x3;

A            B           C            D         
-----------  ----------  -----------  ----------

          1  a                     1  1a1       
          1  a                     3  1a3       
          2  a                     1  2a1       
          4  a                     1  4a1       

--- 4 row(s) selected.
>>-- expect 1a1, 1a3, 2a1, 4a1
>>
>>prepare x4 from
+>delete from t010t2 where a in (2,4,6) and b='a' and c in (1,3);

--- SQL command prepared.
>>execute x4;

--- 2 row(s) deleted.
>>-- expect 2 rows deleted, 2a1 and 4a1
>>execute x3;

A            B           C            D         
-----------  ----------  -----------  ----------

          1  a                     1  1a1       
          1  a                     3  1a3       

--- 2 row(s) selected.
>>-- expect 1a1, 1a3
>>
>>insert into t010t2 values
+>(2, 'a', 1, '2a1'),
+>(4, 'a', 1, '4a1');

--- 2 row(s) inserted.
>>
>>prepare x5 from 
+>update t010t2 set d='upd' where a=4 and b in ('a', 'b') and c < 2;

--- SQL command prepared.
>>execute x5;

--- 2 row(s) updated.
>>-- execute 2 rows updated, 4a1 and 4b1
>>select * from t010t2;

A            B           C            D         
-----------  ----------  -----------  ----------

          1  a                     1  1a1       
          1  a                     3  1a3       
          1  a                     5  1a5       
          1  c                     1  1c1       
          2  a                     1  2a1       
          2  a                     2  2a2       
          2  c                     3  2c3       
          4  a                     1  upd       
          4  b                     1  upd       
          4  b                     2  4b2       

--- 10 row(s) selected.
>>
>>cqd HBASE_MAX_NUM_SEARCH_KEYS '1';

--- SQL operation complete.
>>
>>prepare y1 from
+>select * from t010t2 where a in (1,4) and b='a' and c = 1;

--- SQL command prepared.
>>execute y1;

A            B           C            D         
-----------  ----------  -----------  ----------

          1  a                     1  1a1       
          4  a                     1  upd       

--- 2 row(s) selected.
>>-- expect 1a1, 4a1
>>
>>prepare y2 from
+>select * from t010t2 where a in (1,2,4) and b='a' and (c in (1,3) or c>=5);

--- SQL command prepared.
>>execute y2;

A            B           C            D         
-----------  ----------  -----------  ----------

          1  a                     1  1a1       
          1  a                     3  1a3       
          1  a                     5  1a5       
          2  a                     1  2a1       
          4  a                     1  upd       

--- 5 row(s) selected.
>>-- expect 1a1, 1a3, 1a5, 2a1, 4a1
>>
>>prepare y3 from
+>select * from t010t2 where a in (1,2,4) and b='a' and c in (1,3);

--- SQL command prepared.
>>execute y3;

A            B           C            D         
-----------  ----------  -----------  ----------

          1  a                     1  1a1       
          1  a                     3  1a3       
          2  a                     1  2a1       
          4  a                     1  upd       

--- 4 row(s) selected.
>>-- expect 1a1, 1a3, 2a1, 4a1
>>
>>prepare y4 from
+>delete from t010t2 where a in (2,4,6) and b='a' and c in (1,3);

--- SQL command prepared.
>>execute y4;

--- 2 row(s) deleted.
>>-- expect 2 rows deleted, 2a1 and 4a1
>>execute y3;

A            B           C            D         
-----------  ----------  -----------  ----------

          1  a                     1  1a1       
          1  a                     3  1a3       

--- 2 row(s) selected.
>>-- expect 1a1, 1a3
>>
>>insert into t010t2 values
+>(2, 'a', 1, '2a1'),
+>(4, 'a', 1, '4a1');

--- 2 row(s) inserted.
>>
>>prepare y5 from 
+>update t010t2 set d='uuu' where a=4 and b in ('a', 'b') and c < 2;

--- SQL command prepared.
>>execute y5;

--- 2 row(s) updated.
>>-- execute 2 rows updated, 4a1 and 4b1
>>select * from t010t2;

A            B           C            D         
-----------  ----------  -----------  ----------

          1  a                     1  1a1       
          1  a                     3  1a3       
          1  a                     5  1a5       
          1  c                     1  1c1       
          2  a                     1  2a1       
          2  a                     2  2a2       
          2  c                     3  2c3       
          4  a                     1  uuu       
          4  b                     1  uuu       
          4  b                     2  4b2       

--- 10 row(s) selected.
>>
>>cqd HBASE_MAX_NUM_SEARCH_KEYS reset;

--- SQL operation complete.
>>
>>explain x1;

------------------------------------------------------------------ PLAN SUMMARY
MODULE_NAME .............. DYNAMICALLY COMPILED
STATEMENT_NAME ........... X1
PLAN_ID .................. 212277210163278211
ROWS_OUT ................. 2
EST_TOTAL_COST ........... 0.01
STATEMENT ................ select *
                           from t010t2
                           where a in (1,4) and b='a' and c = 1;


------------------------------------------------------------------ NODE LISTING
ROOT ======================================  SEQ_NO 2        ONLY CHILD 1
REQUESTS_IN .............. 1
ROWS_OUT ................. 2
EST_OPER_COST ............ 0
EST_TOTAL_COST ........... 0.01
DESCRIPTION
  max_card_est .......... 99
  fragment_id ............ 0
  parent_frag ............ (none)
  fragment_type .......... master
  statement_index ........ 0
  affinity_value ......... 0
  max_max_cardinality .... 2
  total_overflow_size .... 0.00 KB
  xn_access_mode ......... read_only
  xn_autoabort_interval    0
  auto_query_retry ....... enabled
  plan_version ....... 2,600
  embedded_arkcmp ........ used
  IS_SQLCI ............... ON
  LDAP_USERNAME
  MODE_SEABASE ........... ON
  SEABASE_VOLATILE_TABLES  ON
  HBASE_ASYNC_DROP_TABLE   OFF
  SCHEMA ................. TRAFODION.SCH
  HBASE_MAX_COLUMN_NAME_  10
  HBASE_MAX_COLUMN_VAL_L  20
  HBASE_MAX_COLUMN_INFO_  60
  HBASE_SERIALIZATION .... OFF
  HBASE_FILTER_PREDS ..... OFF
  QUERY_CACHE ........ 1,024
  MDAM_SCAN_METHOD ....... OFF
  select_list ............ TRAFODION.SCH.T010T2.A, %('a'), %(1),
                             TRAFODION.SCH.T010T2.D
  input_variables ........ %('a'), %(1)


TRAFODION_SCAN ============================  SEQ_NO 1        NO CHILDREN
TABLE_NAME ............... T010T2
REQUESTS_IN .............. 1
ROWS_OUT ................. 2
EST_OPER_COST ............ 0.01
EST_TOTAL_COST ........... 0.01
DESCRIPTION
  max_card_est .......... 99
  fragment_id ............ 0
  parent_frag ............ (none)
  fragment_type .......... master
  scan_type .............. subset scan of table TRAFODION.SCH.T010T2
  cache_size ........... 100
  probes ................. 1
  rows_accessed ........ 100
  key_columns ............ A, B, C
  executor_predicates .... (B = %('a')) and (C = %(1)) and ((A = 1) or (A = 4))
  begin_key .............. (A = <min>), (B = %('a')), (C = %(1))
  end_key ................ (A = <max>), (B = %('a')), (C = %(1))

--- SQL operation complete.
>>explain x2;

------------------------------------------------------------------ PLAN SUMMARY
MODULE_NAME .............. DYNAMICALLY COMPILED
STATEMENT_NAME ........... X2
PLAN_ID .................. 212277210163309621
ROWS_OUT ................. 5
EST_TOTAL_COST ........... 0.01
STATEMENT ................ select *
                           from t010t2
                           where a in (1,2,4) and b='a' and (c in (1,
                             3) or c>=5);


------------------------------------------------------------------ NODE LISTING
ROOT ======================================  SEQ_NO 2        ONLY CHILD 1
REQUESTS_IN .............. 1
ROWS_OUT ................. 5
EST_OPER_COST ............ 0
EST_TOTAL_COST ........... 0.01
DESCRIPTION
  max_card_est .......... 99
  fragment_id ............ 0
  parent_frag ............ (none)
  fragment_type .......... master
  statement_index ........ 0
  affinity_value ......... 0
  max_max_cardinality .... 5
  total_overflow_size .... 0.00 KB
  xn_access_mode ......... read_only
  xn_autoabort_interval    0
  auto_query_retry ....... enabled
  plan_version ....... 2,600
  embedded_arkcmp ........ used
  IS_SQLCI ............... ON
  LDAP_USERNAME
  MODE_SEABASE ........... ON
  SEABASE_VOLATILE_TABLES  ON
  HBASE_ASYNC_DROP_TABLE   OFF
  SCHEMA ................. TRAFODION.SCH
  HBASE_MAX_COLUMN_NAME_  10
  HBASE_MAX_COLUMN_VAL_L  20
  HBASE_MAX_COLUMN_INFO_  60
  HBASE_SERIALIZATION .... OFF
  HBASE_FILTER_PREDS ..... OFF
  QUERY_CACHE ........ 1,024
  MDAM_SCAN_METHOD ....... OFF
  select_list ............ TRAFODION.SCH.T010T2.A, %('a'),
                             TRAFODION.SCH.T010T2.C, TRAFODION.SCH.T010T2.D
  input_variables ........ %('a')


TRAFODION_SCAN ============================  SEQ_NO 1        NO CHILDREN
TABLE_NAME ............... T010T2
REQUESTS_IN .............. 1
ROWS_OUT ................. 5
EST_OPER_COST ............ 0.01
EST_TOTAL_COST ........... 0.01
DESCRIPTION
  max_card_est .......... 99
  fragment_id ............ 0
  parent_frag ............ (none)
  fragment_type .......... master
  scan_type .............. subset scan of table TRAFODION.SCH.T010T2
  cache_size ........... 100
  probes ................. 1
  rows_accessed ........ 100
  key_columns ............ A, B, C
  executor_predicates .... (B = %('a')) and (((A = 1) or (A = 2)) or (A = 4))
                             and (((C = 1) or (C = 3)) or (C >= 5))
  begin_key .............. (A = <min>), (B = %('a')), (C = <min>)
  end_key ................ (A = <max>), (B = %('a')), (C = <max>)

--- SQL operation complete.
>>explain x3;

------------------------------------------------------------------ PLAN SUMMARY
MODULE_NAME .............. DYNAMICALLY COMPILED
STATEMENT_NAME ........... X3
PLAN_ID .................. 212277210163339758
ROWS_OUT ................. 4
EST_TOTAL_COST ........... 0.01
STATEMENT ................ select *
                           from t010t2
                           where a in (1,2,4) and b='a' and c in (1,3);


------------------------------------------------------------------ NODE LISTING
ROOT ======================================  SEQ_NO 2        ONLY CHILD 1
REQUESTS_IN .............. 1
ROWS_OUT ................. 4
EST_OPER_COST ............ 0
EST_TOTAL_COST ........... 0.01
DESCRIPTION
  max_card_est .......... 99
  fragment_id ............ 0
  parent_frag ............ (none)
  fragment_type .......... master
  statement_index ........ 0
  affinity_value ......... 0
  max_max_cardinality .... 4
  total_overflow_size .... 0.00 KB
  xn_access_mode ......... read_only
  xn_autoabort_interval    0
  auto_query_retry ....... enabled
  plan_version ....... 2,600
  embedded_arkcmp ........ used
  IS_SQLCI ............... ON
  LDAP_USERNAME
  MODE_SEABASE ........... ON
  SEABASE_VOLATILE_TABLES  ON
  HBASE_ASYNC_DROP_TABLE   OFF
  SCHEMA ................. TRAFODION.SCH
  HBASE_MAX_COLUMN_NAME_  10
  HBASE_MAX_COLUMN_VAL_L  20
  HBASE_MAX_COLUMN_INFO_  60
  HBASE_SERIALIZATION .... OFF
  HBASE_FILTER_PREDS ..... OFF
  QUERY_CACHE ........ 1,024
  MDAM_SCAN_METHOD ....... OFF
  select_list ............ TRAFODION.SCH.T010T2.A, %('a'),
                             TRAFODION.SCH.T010T2.C, TRAFODION.SCH.T010T2.D
  input_variables ........ %('a')


TRAFODION_SCAN ============================  SEQ_NO 1        NO CHILDREN
TABLE_NAME ............... T010T2
REQUESTS_IN .............. 1
ROWS_OUT ................. 4
EST_OPER_COST ............ 0.01
EST_TOTAL_COST ........... 0.01
DESCRIPTION
  max_card_est .......... 99
  fragment_id ............ 0
  parent_frag ............ (none)
  fragment_type .......... master
  scan_type .............. subset scan of table TRAFODION.SCH.T010T2
  cache_size ........... 100
  probes ................. 1
  rows_accessed ........ 100
  key_columns ............ A, B, C
  executor_predicates .... (B = %('a')) and (((A = 1) or (A = 2)) or (A = 4))
                             and ((C = 1) or (C = 3))
  begin_key .............. (A = <min>), (B = %('a')), (C = <min>)
  end_key ................ (A = <max>), (B = %('a')), (C = <max>)

--- SQL operation complete.
>>explain x4;

------------------------------------------------------------------ PLAN SUMMARY
MODULE_NAME .............. DYNAMICALLY COMPILED
STATEMENT_NAME ........... X4
PLAN_ID .................. 212277210163373202
ROWS_OUT ................. 4
EST_TOTAL_COST ........... 0.01
STATEMENT ................ delete from t010t2
                           where a in (2,4,6) and b='a' and c in (1,3);


------------------------------------------------------------------ NODE LISTING
ROOT ======================================  SEQ_NO 4        ONLY CHILD 3
REQUESTS_IN .............. 1
ROWS_OUT ................. 4
EST_OPER_COST ............ 0
EST_TOTAL_COST ........... 0.01
DESCRIPTION
  max_card_est ........... 4
  fragment_id ............ 0
  parent_frag ............ (none)
  fragment_type .......... master
  statement_index ........ 0
  affinity_value ......... 0
  max_max_cardinality .... 4
  total_overflow_size .... 0.00 KB
  upd_action_on_error .... xn_rollback
  xn_access_mode ......... read_only
  xn_autoabort_interval    0
  auto_query_retry ....... enabled
  plan_version ....... 2,600
  embedded_arkcmp ........ used
  IS_SQLCI ............... ON
  LDAP_USERNAME
  MODE_SEABASE ........... ON
  SEABASE_VOLATILE_TABLES  ON
  HBASE_ASYNC_DROP_TABLE   OFF
  SCHEMA ................. TRAFODION.SCH
  HBASE_MAX_COLUMN_NAME_  10
  HBASE_MAX_COLUMN_VAL_L  20
  HBASE_MAX_COLUMN_INFO_  60
  HBASE_SERIALIZATION .... OFF
  HBASE_FILTER_PREDS ..... OFF
  QUERY_CACHE ........ 1,024
  MDAM_SCAN_METHOD ....... OFF
  input_variables ........ %('a')


TUPLE_FLOW ================================  SEQ_NO 3        CHILDREN 1, 2
REQUESTS_IN .............. 1
ROWS_OUT ................. 4
EST_OPER_COST ............ 0.01
EST_TOTAL_COST ........... 0.01
DESCRIPTION
  max_card_est ........... 4
  fragment_id ............ 0
  parent_frag ............ (none)
  fragment_type .......... master
  join_type .............. inner
  join_method ............ in-order nested


TRAFODION_DELETE ==========================  SEQ_NO 2        NO CHILDREN
TABLE_NAME ............... TRAFODION.SCH.T010T2
REQUESTS_IN .............. 1
ROWS_OUT ................. 1
EST_OPER_COST ............ 0
EST_TOTAL_COST ........... 0
DESCRIPTION
  max_card_est .......... 99
  fragment_id ............ 0
  parent_frag ............ (none)
  fragment_type .......... master
  iud_type ............... trafodion_delete TRAFODION.SCH.T010T2
  begin_key .............. (A = A) and (B = %('a')) and (C = C)
  end_key ................ (A = A) and (B = %('a')) and (C = C)


TRAFODION_SCAN ============================  SEQ_NO 1        NO CHILDREN
TABLE_NAME ............... T010T2
REQUESTS_IN .............. 1
ROWS_OUT ................. 4
EST_OPER_COST ............ 0.01
EST_TOTAL_COST ........... 0.01
DESCRIPTION
  max_card_est .......... 99
  fragment_id ............ 0
  parent_frag ............ (none)
  fragment_type .......... master
  scan_type .............. subset scan of table TRAFODION.SCH.T010T2
  cache_size ........... 100
  probes ................. 1
  rows_accessed ........ 100
  key_columns ............ A, B, C
  executor_predicates .... (B = %('a')) and (((A = 2) or (A = 4)) or (A = 6))
                             and ((C = 1) or (C = 3))
  begin_key .............. (A = <min>), (B = %('a')), (C = <min>)
  end_key ................ (A = <max>), (B = %('a')), (C = <max>)

--- SQL operation complete.
>>explain x5;

------------------------------------------------------------------ PLAN SUMMARY
MODULE_NAME .............. DYNAMICALLY COMPILED
STATEMENT_NAME ........... X5
PLAN_ID .................. 212277210163443023
ROWS_OUT ................. 2
EST_TOTAL_COST ........... 0
STATEMENT ................ update t010t2
                           set d='upd'
                           where a=4 and b in ('a', 'b') and c < 2;


------------------------------------------------------------------ NODE LISTING
ROOT ======================================  SEQ_NO 2        ONLY CHILD 1
REQUESTS_IN .............. 1
ROWS_OUT ................. 2
EST_OPER_COST ............ 0
EST_TOTAL_COST ........... 0
DESCRIPTION
  olt_optimization ....... used
  max_card_est ........... 2
  fragment_id ............ 0
  parent_frag ............ (none)
  fragment_type .......... master
  statement_index ........ 0
  affinity_value ......... 0
  max_max_cardinality .... 2
  total_overflow_size .... 0.00 KB
  upd_action_on_error .... xn_rollback
  xn_access_mode ......... read_only
  xn_autoabort_interval    0
  auto_query_retry ....... enabled
  plan_version ....... 2,600
  embedded_arkcmp ........ used
  IS_SQLCI ............... ON
  LDAP_USERNAME
  MODE_SEABASE ........... ON
  SEABASE_VOLATILE_TABLES  ON
  HBASE_ASYNC_DROP_TABLE   OFF
  SCHEMA ................. TRAFODION.SCH
  HBASE_MAX_COLUMN_NAME_  10
  HBASE_MAX_COLUMN_VAL_L  20
  HBASE_MAX_COLUMN_INFO_  60
  HBASE_SERIALIZATION .... OFF
  HBASE_FILTER_PREDS ..... OFF
  QUERY_CACHE ........ 1,024
  MDAM_SCAN_METHOD ....... OFF
  input_variables ........ %('upd'), %(4)


TRAFODION_UPDATE ==========================  SEQ_NO 1        NO CHILDREN
TABLE_NAME ............... TRAFODION.SCH.T010T2
REQUESTS_IN .............. 1
ROWS_OUT ................. 2
EST_OPER_COST ............ 0
EST_TOTAL_COST ........... 0
DESCRIPTION
  max_card_est ........... 2
  fragment_id ............ 0
  parent_frag ............ (none)
  fragment_type .......... master
  iud_type ............... trafodion_update TRAFODION.SCH.T010T2
  new_rec_expr ........... (D assign %('upd'))
  predicate .............. (C < 2) and ((B = 'a') or (B = 'b'))
  begin_key .............. (A = %(4)) and (B = '<min>') and (C = <min>)
  end_key ................ (A = %(4)) and (B = '<max>') and (C = 2)

--- SQL operation complete.
>>explain y1;

------------------------------------------------------------------ PLAN SUMMARY
MODULE_NAME .............. DYNAMICALLY COMPILED
STATEMENT_NAME ........... Y1
PLAN_ID .................. 212277210163502684
ROWS_OUT ................. 2
EST_TOTAL_COST ........... 0.01
STATEMENT ................ select *
                           from t010t2
                           where a in (1,4) and b='a' and c = 1;


------------------------------------------------------------------ NODE LISTING
ROOT ======================================  SEQ_NO 2        ONLY CHILD 1
REQUESTS_IN .............. 1
ROWS_OUT ................. 2
EST_OPER_COST ............ 0
EST_TOTAL_COST ........... 0.01
DESCRIPTION
  max_card_est .......... 99
  fragment_id ............ 0
  parent_frag ............ (none)
  fragment_type .......... master
  statement_index ........ 0
  affinity_value ......... 0
  max_max_cardinality .... 2
  total_overflow_size .... 0.00 KB
  xn_access_mode ......... read_only
  xn_autoabort_interval    0
  auto_query_retry ....... enabled
  plan_version ....... 2,600
  embedded_arkcmp ........ used
  IS_SQLCI ............... ON
  LDAP_USERNAME
  MODE_SEABASE ........... ON
  SEABASE_VOLATILE_TABLES  ON
  HBASE_ASYNC_DROP_TABLE   OFF
  SCHEMA ................. TRAFODION.SCH
  HBASE_MAX_COLUMN_NAME_  10
  HBASE_MAX_COLUMN_VAL_L  20
  HBASE_MAX_COLUMN_INFO_  60
  HBASE_SERIALIZATION .... OFF
  HBASE_FILTER_PREDS ..... OFF
  QUERY_CACHE ........ 1,024
  MDAM_SCAN_METHOD ....... OFF
  HBASE_MAX_NUM_SEARCH_KE  1
  select_list ............ TRAFODION.SCH.T010T2.A, %('a'), %(1),
                             TRAFODION.SCH.T010T2.D
  input_variables ........ %('a'), %(1)


TRAFODION_SCAN ============================  SEQ_NO 1        NO CHILDREN
TABLE_NAME ............... T010T2
REQUESTS_IN .............. 1
ROWS_OUT ................. 2
EST_OPER_COST ............ 0.01
EST_TOTAL_COST ........... 0.01
DESCRIPTION
  max_card_est .......... 99
  fragment_id ............ 0
  parent_frag ............ (none)
  fragment_type .......... master
  scan_type .............. subset scan of table TRAFODION.SCH.T010T2
  cache_size ........... 100
  probes ................. 1
  rows_accessed ........ 100
  key_columns ............ A, B, C
  executor_predicates .... (B = %('a')) and (C = %(1)) and ((A = 1) or (A = 4))
  begin_key .............. (A = <min>), (B = %('a')), (C = %(1))
  end_key ................ (A = <max>), (B = %('a')), (C = %(1))

--- SQL operation complete.
>>explain y2;

------------------------------------------------------------------ PLAN SUMMARY
MODULE_NAME .............. DYNAMICALLY COMPILED
STATEMENT_NAME ........... Y2
PLAN_ID .................. 212277210163533216
ROWS_OUT ................. 5
EST_TOTAL_COST ........... 0.01
STATEMENT ................ select *
                           from t010t2
                           where a in (1,2,4) and b='a' and (c in (1,
                             3) or c>=5);


------------------------------------------------------------------ NODE LISTING
ROOT ======================================  SEQ_NO 2        ONLY CHILD 1
REQUESTS_IN .............. 1
ROWS_OUT ................. 5
EST_OPER_COST ............ 0
EST_TOTAL_COST ........... 0.01
DESCRIPTION
  max_card_est .......... 99
  fragment_id ............ 0
  parent_frag ............ (none)
  fragment_type .......... master
  statement_index ........ 0
  affinity_value ......... 0
  max_max_cardinality .... 5
  total_overflow_size .... 0.00 KB
  xn_access_mode ......... read_only
  xn_autoabort_interval    0
  auto_query_retry ....... enabled
  plan_version ....... 2,600
  embedded_arkcmp ........ used
  IS_SQLCI ............... ON
  LDAP_USERNAME
  MODE_SEABASE ........... ON
  SEABASE_VOLATILE_TABLES  ON
  HBASE_ASYNC_DROP_TABLE   OFF
  SCHEMA ................. TRAFODION.SCH
  HBASE_MAX_COLUMN_NAME_  10
  HBASE_MAX_COLUMN_VAL_L  20
  HBASE_MAX_COLUMN_INFO_  60
  HBASE_SERIALIZATION .... OFF
  HBASE_FILTER_PREDS ..... OFF
  QUERY_CACHE ........ 1,024
  MDAM_SCAN_METHOD ....... OFF
  HBASE_MAX_NUM_SEARCH_KE  1
  select_list ............ TRAFODION.SCH.T010T2.A, %('a'),
                             TRAFODION.SCH.T010T2.C, TRAFODION.SCH.T010T2.D
  input_variables ........ %('a')


TRAFODION_SCAN ============================  SEQ_NO 1        NO CHILDREN
TABLE_NAME ............... T010T2
REQUESTS_IN .............. 1
ROWS_OUT ................. 5
EST_OPER_COST ............ 0.01
EST_TOTAL_COST ........... 0.01
DESCRIPTION
  max_card_est .......... 99
  fragment_id ............ 0
  parent_frag ............ (none)
  fragment_type .......... master
  scan_type .............. subset scan of table TRAFODION.SCH.T010T2
  cache_size ........... 100
  probes ................. 1
  rows_accessed ........ 100
  key_columns ............ A, B, C
  executor_predicates .... (B = %('a')) and (((A = 1) or (A = 2)) or (A = 4))
                             and (((C = 1) or (C = 3)) or (C >= 5))
  begin_key .............. (A = <min>), (B = %('a')), (C = <min>)
  end_key ................ (A = <max>), (B = %('a')), (C = <max>)

--- SQL operation complete.
>>explain y3;

------------------------------------------------------------------ PLAN SUMMARY
MODULE_NAME .............. DYNAMICALLY COMPILED
STATEMENT_NAME ........... Y3
PLAN_ID .................. 212277210163563117
ROWS_OUT ................. 4
EST_TOTAL_COST ........... 0.01
STATEMENT ................ select *
                           from t010t2
                           where a in (1,2,4) and b='a' and c in (1,3);


------------------------------------------------------------------ NODE LISTING
ROOT ======================================  SEQ_NO 2        ONLY CHILD 1
REQUESTS_IN .............. 1
ROWS_OUT ................. 4
EST_OPER_COST ............ 0
EST_TOTAL_COST ........... 0.01
DESCRIPTION
  max_card_est .......... 99
  fragment_id ............ 0
  parent_frag ............ (none)
  fragment_type .......... master
  statement_index ........ 0
  affinity_value ......... 0
  max_max_cardinality .... 4
  total_overflow_size .... 0.00 KB
  xn_access_mode ......... read_only
  xn_autoabort_interval    0
  auto_query_retry ....... enabled
  plan_version ....... 2,600
  embedded_arkcmp ........ used
  IS_SQLCI ............... ON
  LDAP_USERNAME
  MODE_SEABASE ........... ON
  SEABASE_VOLATILE_TABLES  ON
  HBASE_ASYNC_DROP_TABLE   OFF
  SCHEMA ................. TRAFODION.SCH
  HBASE_MAX_COLUMN_NAME_  10
  HBASE_MAX_COLUMN_VAL_L  20
  HBASE_MAX_COLUMN_INFO_  60
  HBASE_SERIALIZATION .... OFF
  HBASE_FILTER_PREDS ..... OFF
  QUERY_CACHE ........ 1,024
  MDAM_SCAN_METHOD ....... OFF
  HBASE_MAX_NUM_SEARCH_KE  1
  select_list ............ TRAFODION.SCH.T010T2.A, %('a'),
                             TRAFODION.SCH.T010T2.C, TRAFODION.SCH.T010T2.D
  input_variables ........ %('a')


TRAFODION_SCAN ============================  SEQ_NO 1        NO CHILDREN
TABLE_NAME ............... T010T2
REQUESTS_IN .............. 1
ROWS_OUT ................. 4
EST_OPER_COST ............ 0.01
EST_TOTAL_COST ........... 0.01
DESCRIPTION
  max_card_est .......... 99
  fragment_id ............ 0
  parent_frag ............ (none)
  fragment_type .......... master
  scan_type .............. subset scan of table TRAFODION.SCH.T010T2
  cache_size ........... 100
  probes ................. 1
  rows_accessed ........ 100
  key_columns ............ A, B, C
  executor_predicates .... (B = %('a')) and (((A = 1) or (A = 2)) or (A = 4))
                             and ((C = 1) or (C = 3))
  begin_key .............. (A = <min>), (B = %('a')), (C = <min>)
  end_key ................ (A = <max>), (B = %('a')), (C = <max>)

--- SQL operation complete.
>>explain y4;

------------------------------------------------------------------ PLAN SUMMARY
MODULE_NAME .............. DYNAMICALLY COMPILED
STATEMENT_NAME ........... Y4
PLAN_ID .................. 212277210163596677
ROWS_OUT ................. 4
EST_TOTAL_COST ........... 0.01
STATEMENT ................ delete from t010t2
                           where a in (2,4,6) and b='a' and c in (1,3);


------------------------------------------------------------------ NODE LISTING
ROOT ======================================  SEQ_NO 4        ONLY CHILD 3
REQUESTS_IN .............. 1
ROWS_OUT ................. 4
EST_OPER_COST ............ 0
EST_TOTAL_COST ........... 0.01
DESCRIPTION
  max_card_est ........... 4
  fragment_id ............ 0
  parent_frag ............ (none)
  fragment_type .......... master
  statement_index ........ 0
  affinity_value ......... 0
  max_max_cardinality .... 4
  total_overflow_size .... 0.00 KB
  upd_action_on_error .... xn_rollback
  xn_access_mode ......... read_only
  xn_autoabort_interval    0
  auto_query_retry ....... enabled
  plan_version ....... 2,600
  embedded_arkcmp ........ used
  IS_SQLCI ............... ON
  LDAP_USERNAME
  MODE_SEABASE ........... ON
  SEABASE_VOLATILE_TABLES  ON
  HBASE_ASYNC_DROP_TABLE   OFF
  SCHEMA ................. TRAFODION.SCH
  HBASE_MAX_COLUMN_NAME_  10
  HBASE_MAX_COLUMN_VAL_L  20
  HBASE_MAX_COLUMN_INFO_  60
  HBASE_SERIALIZATION .... OFF
  HBASE_FILTER_PREDS ..... OFF
  QUERY_CACHE ........ 1,024
  MDAM_SCAN_METHOD ....... OFF
  HBASE_MAX_NUM_SEARCH_KE  1
  input_variables ........ %('a')


TUPLE_FLOW ================================  SEQ_NO 3        CHILDREN 1, 2
REQUESTS_IN .............. 1
ROWS_OUT ................. 4
EST_OPER_COST ............ 0.01
EST_TOTAL_COST ........... 0.01
DESCRIPTION
  max_card_est ........... 4
  fragment_id ............ 0
  parent_frag ............ (none)
  fragment_type .......... master
  join_type .............. inner
  join_method ............ in-order nested


TRAFODION_DELETE ==========================  SEQ_NO 2        NO CHILDREN
TABLE_NAME ............... TRAFODION.SCH.T010T2
REQUESTS_IN .............. 1
ROWS_OUT ................. 1
EST_OPER_COST ............ 0
EST_TOTAL_COST ........... 0
DESCRIPTION
  max_card_est .......... 99
  fragment_id ............ 0
  parent_frag ............ (none)
  fragment_type .......... master
  iud_type ............... trafodion_delete TRAFODION.SCH.T010T2
  begin_key .............. (A = A) and (B = %('a')) and (C = C)
  end_key ................ (A = A) and (B = %('a')) and (C = C)


TRAFODION_SCAN ============================  SEQ_NO 1        NO CHILDREN
TABLE_NAME ............... T010T2
REQUESTS_IN .............. 1
ROWS_OUT ................. 4
EST_OPER_COST ............ 0.01
EST_TOTAL_COST ........... 0.01
DESCRIPTION
  max_card_est .......... 99
  fragment_id ............ 0
  parent_frag ............ (none)
  fragment_type .......... master
  scan_type .............. subset scan of table TRAFODION.SCH.T010T2
  cache_size ........... 100
  probes ................. 1
  rows_accessed ........ 100
  key_columns ............ A, B, C
  executor_predicates .... (B = %('a')) and (((A = 2) or (A = 4)) or (A = 6))
                             and ((C = 1) or (C = 3))
  begin_key .............. (A = <min>), (B = %('a')), (C = <min>)
  end_key ................ (A = <max>), (B = %('a')), (C = <max>)

--- SQL operation complete.
>>explain y5;

------------------------------------------------------------------ PLAN SUMMARY
MODULE_NAME .............. DYNAMICALLY COMPILED
STATEMENT_NAME ........... Y5
PLAN_ID .................. 212277210163666502
ROWS_OUT ................. 2
EST_TOTAL_COST ........... 0
STATEMENT ................ update t010t2
                           set d='uuu'
                           where a=4 and b in ('a', 'b') and c < 2;


------------------------------------------------------------------ NODE LISTING
ROOT ======================================  SEQ_NO 2        ONLY CHILD 1
REQUESTS_IN .............. 1
ROWS_OUT ................. 2
EST_OPER_COST ............ 0
EST_TOTAL_COST ........... 0
DESCRIPTION
  olt_optimization ....... used
  max_card_est ........... 2
  fragment_id ............ 0
  parent_frag ............ (none)
  fragment_type .......... master
  statement_index ........ 0
  affinity_value ......... 0
  max_max_cardinality .... 2
  total_overflow_size .... 0.00 KB
  upd_action_on_error .... xn_rollback
  xn_access_mode ......... read_only
  xn_autoabort_interval    0
  auto_query_retry ....... enabled
  plan_version ....... 2,600
  embedded_arkcmp ........ used
  IS_SQLCI ............... ON
  LDAP_USERNAME
  MODE_SEABASE ........... ON
  SEABASE_VOLATILE_TABLES  ON
  HBASE_ASYNC_DROP_TABLE   OFF
  SCHEMA ................. TRAFODION.SCH
  HBASE_MAX_COLUMN_NAME_  10
  HBASE_MAX_COLUMN_VAL_L  20
  HBASE_MAX_COLUMN_INFO_  60
  HBASE_SERIALIZATION .... OFF
  HBASE_FILTER_PREDS ..... OFF
  QUERY_CACHE ........ 1,024
  MDAM_SCAN_METHOD ....... OFF
  HBASE_MAX_NUM_SEARCH_KE  1
  input_variables ........ %('uuu'), %(4)


TRAFODION_UPDATE ==========================  SEQ_NO 1        NO CHILDREN
TABLE_NAME ............... TRAFODION.SCH.T010T2
REQUESTS_IN .............. 1
ROWS_OUT ................. 2
EST_OPER_COST ............ 0
EST_TOTAL_COST ........... 0
DESCRIPTION
  max_card_est ........... 2
  fragment_id ............ 0
  parent_frag ............ (none)
  fragment_type .......... master
  iud_type ............... trafodion_update TRAFODION.SCH.T010T2
  new_rec_expr ........... (D assign %('uuu'))
  predicate .............. (C < 2) and ((B = 'a') or (B = 'b'))
  begin_key .............. (A = %(4)) and (B = '<min>') and (C = <min>)
  end_key ................ (A = %(4)) and (B = '<max>') and (C = 2)

--- SQL operation complete.
>>
>>select "_SALT_", * from t010t3 order by a,b,c;

_SALT_      A            B           C            D         
----------  -----------  ----------  -----------  ----------

         2            1  a                     1  1a1       
         2            1  a                     3  1a3       
         2            1  a                     5  1a5       
         1            1  c                     1  1c1       
         3            2  a                     1  2a1       
         3            2  a                     2  2a2       
         0            2  c                     3  2c3       
         2            4  a                     1  4a1       
         1            4  b                     1  4b1       
         1            4  b                     2  4b2       

--- 10 row(s) selected.
>>select "_SALT_", * from t010t3 where a=1 and b='c';

_SALT_      A            B           C            D         
----------  -----------  ----------  -----------  ----------

         1            1  c                     1  1c1       

--- 1 row(s) selected.
>>
>>update t010t3 set d='2axu' where a=2 and b='a';

--- 2 row(s) updated.
>>-- 2 rows updated
>>update t010t3 set d='4b1u' where a=4 and b='b' and c <= 1;

--- 1 row(s) updated.
>>-- 1 row updated
>>update t010t3 set a=3 where a=2;

--- 3 row(s) updated.
>>-- 3 rows updated
>>delete from t010t3 where a=3 and b='c' and c=3;

--- 1 row(s) deleted.
>>-- 1 row deleted
>>delete from t010t3 where d like '2%u %';

--- 2 row(s) deleted.
>>-- 2 rows deleted
>>select "_SALT_", * from t010t3;

_SALT_      A            B           C            D         
----------  -----------  ----------  -----------  ----------

         1            1  c                     1  1c1       
         1            4  b                     1  4b1u      
         1            4  b                     2  4b2       
         2            1  a                     1  1a1       
         2            1  a                     3  1a3       
         2            1  a                     5  1a5       
         2            4  a                     1  4a1       

--- 7 row(s) selected.
>>-- 7 rows
>>merge into t010t3
+>  using (select * from t010t2) as src
+>  on ((src.a, src.b, src.c) = (a,b,c))
+>when matched
+>  then update set d = src.d
+>when not matched
+>  then insert values (src.a, src.b, src.c, src.d)
+>;

--- 10 row(s) updated.
>>-- 10 rows updated
>>select "_SALT_", * from t010t2 natural join t010t3 order by a,b,c;

_SALT_      A            B           C            D         
----------  -----------  ----------  -----------  ----------

         2            1  a                     1  1a1       
         2            1  a                     3  1a3       
         2            1  a                     5  1a5       
         1            1  c                     1  1c1       
         3            2  a                     1  2a1       
         3            2  a                     2  2a2       
         0            2  c                     3  2c3       
         2            4  a                     1  uuu       
         1            4  b                     1  uuu       
         1            4  b                     2  4b2       

--- 10 row(s) selected.
>>-- expect 10 rows, same as each individual table
>>
>>select "_SALT_", * from table(table t010t3, partition number 4);

_SALT_      A            B           C            D         
----------  -----------  ----------  -----------  ----------

         3            2  a                     1  2a1       
         3            2  a                     2  2a2       

--- 2 row(s) selected.
>>select "_SALT_", * from table(table t010t3, partition number from 1 to 3);

_SALT_      A            B           C            D         
----------  -----------  ----------  -----------  ----------

         0            2  c                     3  2c3       
         1            1  c                     1  1c1       
         1            4  b                     1  uuu       
         1            4  b                     2  4b2       
         2            1  a                     1  1a1       
         2            1  a                     3  1a3       
         2            1  a                     5  1a5       
         2            4  a                     1  uuu       

--- 8 row(s) selected.
>>-- 2 statements above must return 10 rows total
>>
>>
>>-- query_cache off, mdam_scan_method on
>>cqd query_cache '0';

--- SQL operation complete.
>>cqd mdam_scan_method 'ON';

--- SQL operation complete.
>>obey TEST010(clean_up);
>>--------------------------------------------------------------------------
>>drop table if exists t010t1;

--- SQL operation complete.
>>drop table if exists t010t2;

--- SQL operation complete.
>>drop table if exists t010t3;

--- SQL operation complete.
>>
>>obey TEST010(tests);
>>--------------------------------------------------------------------------
>>
>>create table if not exists t010t1 (a int not null, b char(10), primary key(a));

--- SQL operation complete.
>>create table if not exists t010t2 (a int not null, b char(10) not null, c int not null, d char(10), primary key(a,b,c));

--- SQL operation complete.
>>create table if not exists t010t3 (a int not null, b char(10) not null, c int not null, d char(10), primary key(a,b,c))
+>  salt using 4 partitions on (a,b);

--- SQL operation complete.
>>
>>invoke t010t1;

-- Definition of Trafodion table TRAFODION.SCH.T010T1
-- Definition current  Thu Sep 11 15:43:06 2014

  (
    A                                INT NO DEFAULT NOT NULL NOT DROPPABLE
  , B                                CHAR(10) CHARACTER SET ISO88591 COLLATE
      DEFAULT DEFAULT NULL
  )

--- SQL operation complete.
>>invoke hbase."_CELL_"."TRAFODION.SCH.T010T1";

-- Definition of Trafodion table HBASE."_CELL_"."TRAFODION.SCH.T010T1"
-- Definition current  Thu Sep 11 15:43:06 2014

  (
    ROW_ID                           VARCHAR(10) CHARACTER SET ISO88591 COLLATE
      DEFAULT NO DEFAULT NOT NULL NOT DROPPABLE
  , COL_FAMILY                       VARCHAR(10) CHARACTER SET ISO88591 COLLATE
      DEFAULT NO DEFAULT NOT NULL NOT DROPPABLE
  , COL_NAME                         VARCHAR(10) CHARACTER SET ISO88591 COLLATE
      DEFAULT NO DEFAULT NOT NULL NOT DROPPABLE
  , COL_TIMESTAMP                    LARGEINT NO DEFAULT NOT NULL NOT DROPPABLE
  , COL_VALUE                        VARCHAR(20) CHARACTER SET ISO88591 COLLATE
      DEFAULT NO DEFAULT NOT NULL NOT DROPPABLE
  )

--- SQL operation complete.
>>invoke hbase."_ROW_"."TRAFODION.SCH.T010T1";

-- Definition of Trafodion table HBASE."_ROW_"."TRAFODION.SCH.T010T1"
-- Definition current  Thu Sep 11 15:43:06 2014

  (
    ROW_ID                           VARCHAR(10) CHARACTER SET ISO88591 COLLATE
      DEFAULT NO DEFAULT NOT NULL NOT DROPPABLE
  , COLUMN_DETAILS                   VARCHAR(60) CHARACTER SET ISO88591 COLLATE
      DEFAULT NO DEFAULT NOT NULL NOT DROPPABLE
  )

--- SQL operation complete.
>>
>>insert into t010t1 values (1, 'a'), (2, 'b'), (3, 'c');

--- 3 row(s) inserted.
>>
>>select * from t010t1;

A            B         
-----------  ----------

          1  a         
          2  b         
          3  c         

--- 3 row(s) selected.
>>
>>select * from t010t1 where a = 2;

A            B         
-----------  ----------

          2  b         

--- 1 row(s) selected.
>>
>>select * from t010t1 where a = 2 or a = 3;

A            B         
-----------  ----------

          2  b         
          3  c         

--- 2 row(s) selected.
>>
>>delete from t010t1 where a = 4;

--- 0 row(s) deleted.
>>
>>select * from t010t1;

A            B         
-----------  ----------

          1  a         
          2  b         
          3  c         

--- 3 row(s) selected.
>>
>>delete from t010t1 where a = 2;

--- 1 row(s) deleted.
>>
>>select * from t010t1;

A            B         
-----------  ----------

          1  a         
          3  c         

--- 2 row(s) selected.
>>
>>select converttohex(cast(row_id as char(4))) rowid,
+>          converttohex(cast(col_family as char(2))) colfamily,
+>          converttohex(cast(col_name as char(1))) colname,
+>          converttohex(cast(col_value as char(4))) colvalue
+>                from hbase."_CELL_"."TRAFODION.SCH.T010T1";

ROWID     COLFAMILY  COLNAME  COLVALUE
--------  ---------  -------  --------

80000001  2331       01       01000000
80000001  2331       02       00612020
80000003  2331       01       03000000
80000003  2331       02       00632020

--- 4 row(s) selected.
>>
>>select converttohex(cast(row_id as char(4))) rowid,
+>          converttohex(cast(col_family as char(2))) colfamily,
+>          converttohex(cast(col_name as char(1))) colname,
+>          converttohex(cast(col_value as char(4))) colvalue
+>                from hbase."_CELL_"."TRAFODION.SCH.T010T1"
+>          where converttohex(cast(row_id as char(4))) = '80000001';

ROWID     COLFAMILY  COLNAME  COLVALUE
--------  ---------  -------  --------

80000001  2331       01       01000000
80000001  2331       02       00612020

--- 2 row(s) selected.
>>
>>select converttohex(cast(row_id as char(4))) rowid,
+>          converttohex(cast(column_details as char(40))) coldetails
+>                 from hbase."_ROW_"."TRAFODION.SCH.T010T1";

ROWID     COLDETAILS
--------  --------------------------------------------------------------------------------

80000001  040023313A010400000001000000040023313A020B00000000612020202020202020202020202020
80000003  040023313A010400000003000000040023313A020B00000000632020202020202020202020202020

--- 2 row(s) selected.
>>select converttohex(cast(row_id as char(4))) rowid,
+>          converttohex(cast(column_details as char(40))) coldetails
+>                 from hbase."_ROW_"."TRAFODION.SCH.T010T1"
+>          where converttohex(cast(row_id as char(4))) = '80000001';

ROWID     COLDETAILS
--------  --------------------------------------------------------------------------------

80000001  040023313A010400000001000000040023313A020B00000000612020202020202020202020202020

--- 1 row(s) selected.
>>
>>-------------------
>>-- check query plan
>>-------------------
>>
>>-- no sort operator should present when order by on primary key column
>>prepare xx from select * from t010t1 order by a;

--- SQL command prepared.
>>explain options 'f' xx;

LC   RC   OP   OPERATOR              OPT       DESCRIPTION           CARD
---- ---- ---- --------------------  --------  --------------------  ---------

1    .    2    root                                                  1.00E+002
.    .    1    trafodion_scan                  T010T1                1.00E+002

--- SQL operation complete.
>>
>>-- should see a sort when order by on non key column
>>prepare xx from select * from t010t1 order by b;

--- SQL command prepared.
>>explain options 'f' xx;

LC   RC   OP   OPERATOR              OPT       DESCRIPTION           CARD
---- ---- ---- --------------------  --------  --------------------  ---------

2    .    3    root                                                  1.00E+002
1    .    2    sort                                                  1.00E+002
.    .    1    trafodion_scan                  T010T1                1.00E+002

--- SQL operation complete.
>>
>>-- selectPred should present due to the 2nd disjunct b='1'
>>prepare xx from select * from t010t1 where a=1 or b='1';

--- SQL command prepared.
>>explain xx;

------------------------------------------------------------------ PLAN SUMMARY
MODULE_NAME .............. DYNAMICALLY COMPILED
STATEMENT_NAME ........... XX
PLAN_ID .................. 212277210186647543
ROWS_OUT ................ 11
EST_TOTAL_COST ........... 0.01
STATEMENT ................ select * from t010t1 where a=1 or b='1';


------------------------------------------------------------------ NODE LISTING
ROOT ======================================  SEQ_NO 2        ONLY CHILD 1
REQUESTS_IN .............. 1
ROWS_OUT ................ 11
EST_OPER_COST ............ 0
EST_TOTAL_COST ........... 0.01
DESCRIPTION
  max_card_est .......... 51
  fragment_id ............ 0
  parent_frag ............ (none)
  fragment_type .......... master
  statement_index ........ 0
  affinity_value ......... 0
  max_max_cardinality ... 11
  total_overflow_size .... 0.00 KB
  xn_access_mode ......... read_only
  xn_autoabort_interval    0
  auto_query_retry ....... enabled
  plan_version ....... 2,600
  embedded_arkcmp ........ used
  IS_SQLCI ............... ON
  LDAP_USERNAME
  MODE_SEABASE ........... ON
  SEABASE_VOLATILE_TABLES  ON
  HBASE_ASYNC_DROP_TABLE   OFF
  SCHEMA ................. TRAFODION.SCH
  HBASE_MAX_COLUMN_NAME_  10
  HBASE_MAX_COLUMN_VAL_L  20
  HBASE_MAX_COLUMN_INFO_  60
  HBASE_SERIALIZATION .... OFF
  HBASE_FILTER_PREDS ..... OFF
  QUERY_CACHE ............ 0
  MDAM_SCAN_METHOD ....... ON
  select_list ............ TRAFODION.SCH.T010T1.A, TRAFODION.SCH.T010T1.B


TRAFODION_SCAN ============================  SEQ_NO 1        NO CHILDREN
TABLE_NAME ............... T010T1
REQUESTS_IN .............. 1
ROWS_OUT ................ 11
EST_OPER_COST ............ 0.01
EST_TOTAL_COST ........... 0.01
DESCRIPTION
  max_card_est .......... 51
  fragment_id ............ 0
  parent_frag ............ (none)
  fragment_type .......... master
  scan_type .............. subset scan of table TRAFODION.SCH.T010T1
  columns ................ all
  begin_keys(incl)
  end_keys(incl)
  cache_size ........... 100
  probes ................. 1
  rows_accessed ........ 100
  key_columns ............ A
  executor_predicates .... ((A = 1) or (B = '1'))

--- SQL operation complete.
>>
>>-- Optimization: with only one disjunct, the selectPred should be empty
>>-- and the executor predicate should contain the non-key predicate
>>prepare xx from select * from t010t1 where a=1 and b='1';

--- SQL command prepared.
>>explain xx;

------------------------------------------------------------------ PLAN SUMMARY
MODULE_NAME .............. DYNAMICALLY COMPILED
STATEMENT_NAME ........... XX
PLAN_ID .................. 212277210186694147
ROWS_OUT ................. 1
EST_TOTAL_COST ........... 0.01
STATEMENT ................ select * from t010t1 where a=1 and b='1';


------------------------------------------------------------------ NODE LISTING
ROOT ======================================  SEQ_NO 2        ONLY CHILD 1
REQUESTS_IN .............. 1
ROWS_OUT ................. 1
EST_OPER_COST ............ 0
EST_TOTAL_COST ........... 0.01
DESCRIPTION
  olt_optimization ....... used
  max_card_est ........... 1
  fragment_id ............ 0
  parent_frag ............ (none)
  fragment_type .......... master
  statement_index ........ 0
  affinity_value ......... 0
  max_max_cardinality .... 1
  total_overflow_size .... 0.00 KB
  xn_access_mode ......... read_only
  xn_autoabort_interval    0
  auto_query_retry ....... enabled
  plan_version ....... 2,600
  embedded_arkcmp ........ used
  IS_SQLCI ............... ON
  LDAP_USERNAME
  MODE_SEABASE ........... ON
  SEABASE_VOLATILE_TABLES  ON
  HBASE_ASYNC_DROP_TABLE   OFF
  SCHEMA ................. TRAFODION.SCH
  HBASE_MAX_COLUMN_NAME_  10
  HBASE_MAX_COLUMN_VAL_L  20
  HBASE_MAX_COLUMN_INFO_  60
  HBASE_SERIALIZATION .... OFF
  HBASE_FILTER_PREDS ..... OFF
  QUERY_CACHE ............ 0
  MDAM_SCAN_METHOD ....... ON
  select_list ............ 1, '1'


TRAFODION_SCAN ============================  SEQ_NO 1        NO CHILDREN
TABLE_NAME ............... T010T1
REQUESTS_IN .............. 1
ROWS_OUT ................. 1
EST_OPER_COST ............ 0.01
EST_TOTAL_COST ........... 0.01
DESCRIPTION
  max_card_est ........... 1
  fragment_id ............ 0
  parent_frag ............ (none)
  fragment_type .......... master
  scan_type .............. subset scan of table TRAFODION.SCH.T010T1
  columns ................ all
  unique_rows ............ 1
  cache_size ........... 100
  probes ................. 1
  rows_accessed .......... 1
  key_columns ............ A
  executor_predicates .... (B = '1')

--- SQL operation complete.
>>
>>-- should see a full hbase SCAN
>>prepare xx from select * from t010t1 where b='1';

--- SQL command prepared.
>>explain xx;

------------------------------------------------------------------ PLAN SUMMARY
MODULE_NAME .............. DYNAMICALLY COMPILED
STATEMENT_NAME ........... XX
PLAN_ID .................. 212277210186739347
ROWS_OUT ................ 10
EST_TOTAL_COST ........... 0.01
STATEMENT ................ select * from t010t1 where b='1';


------------------------------------------------------------------ NODE LISTING
ROOT ======================================  SEQ_NO 2        ONLY CHILD 1
REQUESTS_IN .............. 1
ROWS_OUT ................ 10
EST_OPER_COST ............ 0
EST_TOTAL_COST ........... 0.01
DESCRIPTION
  max_card_est .......... 99
  fragment_id ............ 0
  parent_frag ............ (none)
  fragment_type .......... master
  statement_index ........ 0
  affinity_value ......... 0
  max_max_cardinality ... 10
  total_overflow_size .... 0.00 KB
  xn_access_mode ......... read_only
  xn_autoabort_interval    0
  auto_query_retry ....... enabled
  plan_version ....... 2,600
  embedded_arkcmp ........ used
  IS_SQLCI ............... ON
  LDAP_USERNAME
  MODE_SEABASE ........... ON
  SEABASE_VOLATILE_TABLES  ON
  HBASE_ASYNC_DROP_TABLE   OFF
  SCHEMA ................. TRAFODION.SCH
  HBASE_MAX_COLUMN_NAME_  10
  HBASE_MAX_COLUMN_VAL_L  20
  HBASE_MAX_COLUMN_INFO_  60
  HBASE_SERIALIZATION .... OFF
  HBASE_FILTER_PREDS ..... OFF
  QUERY_CACHE ............ 0
  MDAM_SCAN_METHOD ....... ON
  select_list ............ TRAFODION.SCH.T010T1.A, '1'


TRAFODION_SCAN ============================  SEQ_NO 1        NO CHILDREN
TABLE_NAME ............... T010T1
REQUESTS_IN .............. 1
ROWS_OUT ................ 10
EST_OPER_COST ............ 0.01
EST_TOTAL_COST ........... 0.01
DESCRIPTION
  max_card_est .......... 99
  fragment_id ............ 0
  parent_frag ............ (none)
  fragment_type .......... master
  scan_type .............. subset scan of table TRAFODION.SCH.T010T1
  columns ................ all
  begin_keys(incl)
  end_keys(incl)
  cache_size ........... 100
  probes ................. 1
  rows_accessed ........ 100
  key_columns ............ A
  executor_predicates .... (B = '1')

--- SQL operation complete.
>>
>>-- should see a unique hbase GET 
>>prepare xx from select * from t010t1 where a=1;

--- SQL command prepared.
>>explain xx;

------------------------------------------------------------------ PLAN SUMMARY
MODULE_NAME .............. DYNAMICALLY COMPILED
STATEMENT_NAME ........... XX
PLAN_ID .................. 212277210186784092
ROWS_OUT ................. 1
EST_TOTAL_COST ........... 0.01
STATEMENT ................ select * from t010t1 where a=1;


------------------------------------------------------------------ NODE LISTING
ROOT ======================================  SEQ_NO 2        ONLY CHILD 1
REQUESTS_IN .............. 1
ROWS_OUT ................. 1
EST_OPER_COST ............ 0
EST_TOTAL_COST ........... 0.01
DESCRIPTION
  olt_optimization ....... used
  max_card_est ........... 1
  fragment_id ............ 0
  parent_frag ............ (none)
  fragment_type .......... master
  statement_index ........ 0
  affinity_value ......... 0
  max_max_cardinality .... 1
  total_overflow_size .... 0.00 KB
  xn_access_mode ......... read_only
  xn_autoabort_interval    0
  auto_query_retry ....... enabled
  plan_version ....... 2,600
  embedded_arkcmp ........ used
  IS_SQLCI ............... ON
  LDAP_USERNAME
  MODE_SEABASE ........... ON
  SEABASE_VOLATILE_TABLES  ON
  HBASE_ASYNC_DROP_TABLE   OFF
  SCHEMA ................. TRAFODION.SCH
  HBASE_MAX_COLUMN_NAME_  10
  HBASE_MAX_COLUMN_VAL_L  20
  HBASE_MAX_COLUMN_INFO_  60
  HBASE_SERIALIZATION .... OFF
  HBASE_FILTER_PREDS ..... OFF
  QUERY_CACHE ............ 0
  MDAM_SCAN_METHOD ....... ON
  select_list ............ 1, TRAFODION.SCH.T010T1.B


TRAFODION_SCAN ============================  SEQ_NO 1        NO CHILDREN
TABLE_NAME ............... T010T1
REQUESTS_IN .............. 1
ROWS_OUT ................. 1
EST_OPER_COST ............ 0.01
EST_TOTAL_COST ........... 0.01
DESCRIPTION
  max_card_est ........... 1
  fragment_id ............ 0
  parent_frag ............ (none)
  fragment_type .......... master
  scan_type .............. subset scan of table TRAFODION.SCH.T010T1
  columns ................ all
  unique_rows ............ 1
  cache_size ........... 100
  probes ................. 1
  rows_accessed .......... 1
  key_columns ............ A

--- SQL operation complete.
>>
>>insert into t010t2 values
+>(1, 'a', 1, '1a1'),
+>(1, 'a', 3, '1a3'),
+>(1, 'a', 5, '1a5'),
+>(1, 'c', 1, '1c1'),
+>(2, 'a', 1, '2a1'),
+>(2, 'a', 2, '2a2'),
+>(2, 'c', 3, '2c3'),
+>(4, 'a', 1, '4a1'),
+>(4, 'b', 1, '4b1'),
+>(4, 'b', 2, '4b2');

--- 10 row(s) inserted.
>>
>>insert into t010t3 select * from t010t2;

--- 10 row(s) inserted.
>>
>>prepare x1 from
+>select * from t010t2 where a in (1,4) and b='a' and c = 1;

--- SQL command prepared.
>>
>>execute x1;

A            B           C            D         
-----------  ----------  -----------  ----------

          1  a                     1  1a1       
          4  a                     1  4a1       

--- 2 row(s) selected.
>>-- expect 1a1, 4a1
>>
>>prepare x2 from
+>select * from t010t2 where a in (1,2,4) and b='a' and (c in (1,3) or c>=5);

--- SQL command prepared.
>>execute x2;

A            B           C            D         
-----------  ----------  -----------  ----------

          1  a                     1  1a1       
          1  a                     3  1a3       
          1  a                     5  1a5       
          2  a                     1  2a1       
          4  a                     1  4a1       

--- 5 row(s) selected.
>>-- expect 1a1, 1a3, 1a5, 2a1, 4a1
>>
>>prepare x3 from
+>select * from t010t2 where a in (1,2,4) and b='a' and c in (1,3);

--- SQL command prepared.
>>execute x3;

A            B           C            D         
-----------  ----------  -----------  ----------

          1  a                     1  1a1       
          1  a                     3  1a3       
          2  a                     1  2a1       
          4  a                     1  4a1       

--- 4 row(s) selected.
>>-- expect 1a1, 1a3, 2a1, 4a1
>>
>>prepare x4 from
+>delete from t010t2 where a in (2,4,6) and b='a' and c in (1,3);

--- SQL command prepared.
>>execute x4;

--- 2 row(s) deleted.
>>-- expect 2 rows deleted, 2a1 and 4a1
>>execute x3;

A            B           C            D         
-----------  ----------  -----------  ----------

          1  a                     1  1a1       
          1  a                     3  1a3       

--- 2 row(s) selected.
>>-- expect 1a1, 1a3
>>
>>insert into t010t2 values
+>(2, 'a', 1, '2a1'),
+>(4, 'a', 1, '4a1');

--- 2 row(s) inserted.
>>
>>prepare x5 from 
+>update t010t2 set d='upd' where a=4 and b in ('a', 'b') and c < 2;

--- SQL command prepared.
>>execute x5;

--- 2 row(s) updated.
>>-- execute 2 rows updated, 4a1 and 4b1
>>select * from t010t2;

A            B           C            D         
-----------  ----------  -----------  ----------

          1  a                     1  1a1       
          1  a                     3  1a3       
          1  a                     5  1a5       
          1  c                     1  1c1       
          2  a                     1  2a1       
          2  a                     2  2a2       
          2  c                     3  2c3       
          4  a                     1  upd       
          4  b                     1  upd       
          4  b                     2  4b2       

--- 10 row(s) selected.
>>
>>cqd HBASE_MAX_NUM_SEARCH_KEYS '1';

--- SQL operation complete.
>>
>>prepare y1 from
+>select * from t010t2 where a in (1,4) and b='a' and c = 1;

--- SQL command prepared.
>>execute y1;

A            B           C            D         
-----------  ----------  -----------  ----------

          1  a                     1  1a1       
          4  a                     1  upd       

--- 2 row(s) selected.
>>-- expect 1a1, 4a1
>>
>>prepare y2 from
+>select * from t010t2 where a in (1,2,4) and b='a' and (c in (1,3) or c>=5);

--- SQL command prepared.
>>execute y2;

A            B           C            D         
-----------  ----------  -----------  ----------

          1  a                     1  1a1       
          1  a                     3  1a3       
          1  a                     5  1a5       
          2  a                     1  2a1       
          4  a                     1  upd       

--- 5 row(s) selected.
>>-- expect 1a1, 1a3, 1a5, 2a1, 4a1
>>
>>prepare y3 from
+>select * from t010t2 where a in (1,2,4) and b='a' and c in (1,3);

--- SQL command prepared.
>>execute y3;

A            B           C            D         
-----------  ----------  -----------  ----------

          1  a                     1  1a1       
          1  a                     3  1a3       
          2  a                     1  2a1       
          4  a                     1  upd       

--- 4 row(s) selected.
>>-- expect 1a1, 1a3, 2a1, 4a1
>>
>>prepare y4 from
+>delete from t010t2 where a in (2,4,6) and b='a' and c in (1,3);

--- SQL command prepared.
>>execute y4;

--- 2 row(s) deleted.
>>-- expect 2 rows deleted, 2a1 and 4a1
>>execute y3;

A            B           C            D         
-----------  ----------  -----------  ----------

          1  a                     1  1a1       
          1  a                     3  1a3       

--- 2 row(s) selected.
>>-- expect 1a1, 1a3
>>
>>insert into t010t2 values
+>(2, 'a', 1, '2a1'),
+>(4, 'a', 1, '4a1');

--- 2 row(s) inserted.
>>
>>prepare y5 from 
+>update t010t2 set d='uuu' where a=4 and b in ('a', 'b') and c < 2;

--- SQL command prepared.
>>execute y5;

--- 2 row(s) updated.
>>-- execute 2 rows updated, 4a1 and 4b1
>>select * from t010t2;

A            B           C            D         
-----------  ----------  -----------  ----------

          1  a                     1  1a1       
          1  a                     3  1a3       
          1  a                     5  1a5       
          1  c                     1  1c1       
          2  a                     1  2a1       
          2  a                     2  2a2       
          2  c                     3  2c3       
          4  a                     1  uuu       
          4  b                     1  uuu       
          4  b                     2  4b2       

--- 10 row(s) selected.
>>
>>cqd HBASE_MAX_NUM_SEARCH_KEYS reset;

--- SQL operation complete.
>>
>>explain x1;

------------------------------------------------------------------ PLAN SUMMARY
MODULE_NAME .............. DYNAMICALLY COMPILED
STATEMENT_NAME ........... X1
PLAN_ID .................. 212277210188265243
ROWS_OUT ................. 2
EST_TOTAL_COST ........... 0
STATEMENT ................ select *
                           from t010t2
                           where a in (1,4) and b='a' and c = 1;


------------------------------------------------------------------ NODE LISTING
ROOT ======================================  SEQ_NO 2        ONLY CHILD 1
REQUESTS_IN .............. 1
ROWS_OUT ................. 2
EST_OPER_COST ............ 0
EST_TOTAL_COST ........... 0
DESCRIPTION
  max_card_est .......... 99
  fragment_id ............ 0
  parent_frag ............ (none)
  fragment_type .......... master
  statement_index ........ 0
  affinity_value ......... 0
  max_max_cardinality .... 2
  total_overflow_size .... 0.00 KB
  xn_access_mode ......... read_only
  xn_autoabort_interval    0
  auto_query_retry ....... enabled
  plan_version ....... 2,600
  embedded_arkcmp ........ used
  IS_SQLCI ............... ON
  LDAP_USERNAME
  MODE_SEABASE ........... ON
  SEABASE_VOLATILE_TABLES  ON
  HBASE_ASYNC_DROP_TABLE   OFF
  SCHEMA ................. TRAFODION.SCH
  HBASE_MAX_COLUMN_NAME_  10
  HBASE_MAX_COLUMN_VAL_L  20
  HBASE_MAX_COLUMN_INFO_  60
  HBASE_SERIALIZATION .... OFF
  HBASE_FILTER_PREDS ..... OFF
  QUERY_CACHE ............ 0
  MDAM_SCAN_METHOD ....... ON
  select_list ............ TRAFODION.SCH.T010T2.A, 'a', 1,
                             TRAFODION.SCH.T010T2.D


TRAFODION_SCAN ============================  SEQ_NO 1        NO CHILDREN
TABLE_NAME ............... T010T2
REQUESTS_IN .............. 1
ROWS_OUT ................. 2
EST_OPER_COST ............ 0
EST_TOTAL_COST ........... 0
DESCRIPTION
  max_card_est .......... 99
  fragment_id ............ 0
  parent_frag ............ (none)
  fragment_type .......... master
  scan_type .............. subset scan limited by mdam of table
                             TRAFODION.SCH.T010T2
  cache_size ........... 100
  probes ................. 1
  rows_accessed ........ 100
  key_columns ............ A, B, C
  mdam_disjunct .......... ((A = 1) or (A = 4)) and (B = 'a') and (C = 1)

--- SQL operation complete.
>>explain x2;

------------------------------------------------------------------ PLAN SUMMARY
MODULE_NAME .............. DYNAMICALLY COMPILED
STATEMENT_NAME ........... X2
PLAN_ID .................. 212277210188319158
ROWS_OUT ................. 5
EST_TOTAL_COST ........... 0
STATEMENT ................ select *
                           from t010t2
                           where a in (1,2,4) and b='a' and (c in (1,
                             3) or c>=5);


------------------------------------------------------------------ NODE LISTING
ROOT ======================================  SEQ_NO 2        ONLY CHILD 1
REQUESTS_IN .............. 1
ROWS_OUT ................. 5
EST_OPER_COST ............ 0
EST_TOTAL_COST ........... 0
DESCRIPTION
  max_card_est .......... 99
  fragment_id ............ 0
  parent_frag ............ (none)
  fragment_type .......... master
  statement_index ........ 0
  affinity_value ......... 0
  max_max_cardinality .... 5
  total_overflow_size .... 0.00 KB
  xn_access_mode ......... read_only
  xn_autoabort_interval    0
  auto_query_retry ....... enabled
  plan_version ....... 2,600
  embedded_arkcmp ........ used
  IS_SQLCI ............... ON
  LDAP_USERNAME
  MODE_SEABASE ........... ON
  SEABASE_VOLATILE_TABLES  ON
  HBASE_ASYNC_DROP_TABLE   OFF
  SCHEMA ................. TRAFODION.SCH
  HBASE_MAX_COLUMN_NAME_  10
  HBASE_MAX_COLUMN_VAL_L  20
  HBASE_MAX_COLUMN_INFO_  60
  HBASE_SERIALIZATION .... OFF
  HBASE_FILTER_PREDS ..... OFF
  QUERY_CACHE ............ 0
  MDAM_SCAN_METHOD ....... ON
  select_list ............ TRAFODION.SCH.T010T2.A, 'a', TRAFODION.SCH.T010T2.C,
                             TRAFODION.SCH.T010T2.D


TRAFODION_SCAN ============================  SEQ_NO 1        NO CHILDREN
TABLE_NAME ............... T010T2
REQUESTS_IN .............. 1
ROWS_OUT ................. 5
EST_OPER_COST ............ 0
EST_TOTAL_COST ........... 0
DESCRIPTION
  max_card_est .......... 99
  fragment_id ............ 0
  parent_frag ............ (none)
  fragment_type .......... master
  scan_type .............. subset scan limited by mdam of table
                             TRAFODION.SCH.T010T2
  cache_size ........... 100
  probes ................. 1
  rows_accessed ........ 100
  key_columns ............ A, B, C
  mdam_disjunct .......... (((A = 1) or (A = 2)) or (A = 4)) and (B = 'a') and
                             (((C = 1) or (C = 3)) or (C >= 5))

--- SQL operation complete.
>>explain x3;

------------------------------------------------------------------ PLAN SUMMARY
MODULE_NAME .............. DYNAMICALLY COMPILED
STATEMENT_NAME ........... X3
PLAN_ID .................. 212277210188395696
ROWS_OUT ................. 4
EST_TOTAL_COST ........... 0
STATEMENT ................ select *
                           from t010t2
                           where a in (1,2,4) and b='a' and c in (1,3);


------------------------------------------------------------------ NODE LISTING
ROOT ======================================  SEQ_NO 2        ONLY CHILD 1
REQUESTS_IN .............. 1
ROWS_OUT ................. 4
EST_OPER_COST ............ 0
EST_TOTAL_COST ........... 0
DESCRIPTION
  max_card_est .......... 99
  fragment_id ............ 0
  parent_frag ............ (none)
  fragment_type .......... master
  statement_index ........ 0
  affinity_value ......... 0
  max_max_cardinality .... 4
  total_overflow_size .... 0.00 KB
  xn_access_mode ......... read_only
  xn_autoabort_interval    0
  auto_query_retry ....... enabled
  plan_version ....... 2,600
  embedded_arkcmp ........ used
  IS_SQLCI ............... ON
  LDAP_USERNAME
  MODE_SEABASE ........... ON
  SEABASE_VOLATILE_TABLES  ON
  HBASE_ASYNC_DROP_TABLE   OFF
  SCHEMA ................. TRAFODION.SCH
  HBASE_MAX_COLUMN_NAME_  10
  HBASE_MAX_COLUMN_VAL_L  20
  HBASE_MAX_COLUMN_INFO_  60
  HBASE_SERIALIZATION .... OFF
  HBASE_FILTER_PREDS ..... OFF
  QUERY_CACHE ............ 0
  MDAM_SCAN_METHOD ....... ON
  select_list ............ TRAFODION.SCH.T010T2.A, 'a', TRAFODION.SCH.T010T2.C,
                             TRAFODION.SCH.T010T2.D


TRAFODION_SCAN ============================  SEQ_NO 1        NO CHILDREN
TABLE_NAME ............... T010T2
REQUESTS_IN .............. 1
ROWS_OUT ................. 4
EST_OPER_COST ............ 0
EST_TOTAL_COST ........... 0
DESCRIPTION
  max_card_est .......... 99
  fragment_id ............ 0
  parent_frag ............ (none)
  fragment_type .......... master
  scan_type .............. subset scan limited by mdam of table
                             TRAFODION.SCH.T010T2
  cache_size ........... 100
  probes ................. 1
  rows_accessed ........ 100
  key_columns ............ A, B, C
  mdam_disjunct .......... (((A = 1) or (A = 2)) or (A = 4)) and ((C = 1) or (C
                             = 3)) and (B = 'a')

--- SQL operation complete.
>>explain x4;

------------------------------------------------------------------ PLAN SUMMARY
MODULE_NAME .............. DYNAMICALLY COMPILED
STATEMENT_NAME ........... X4
PLAN_ID .................. 212277210188468872
ROWS_OUT ................. 4
EST_TOTAL_COST ........... 0.01
STATEMENT ................ delete from t010t2
                           where a in (2,4,6) and b='a' and c in (1,3);


------------------------------------------------------------------ NODE LISTING
ROOT ======================================  SEQ_NO 4        ONLY CHILD 3
REQUESTS_IN .............. 1
ROWS_OUT ................. 4
EST_OPER_COST ............ 0
EST_TOTAL_COST ........... 0.01
DESCRIPTION
  max_card_est ........... 4
  fragment_id ............ 0
  parent_frag ............ (none)
  fragment_type .......... master
  statement_index ........ 0
  affinity_value ......... 0
  max_max_cardinality .... 4
  total_overflow_size .... 0.00 KB
  upd_action_on_error .... xn_rollback
  xn_access_mode ......... read_only
  xn_autoabort_interval    0
  auto_query_retry ....... enabled
  plan_version ....... 2,600
  embedded_arkcmp ........ used
  IS_SQLCI ............... ON
  LDAP_USERNAME
  MODE_SEABASE ........... ON
  SEABASE_VOLATILE_TABLES  ON
  HBASE_ASYNC_DROP_TABLE   OFF
  SCHEMA ................. TRAFODION.SCH
  HBASE_MAX_COLUMN_NAME_  10
  HBASE_MAX_COLUMN_VAL_L  20
  HBASE_MAX_COLUMN_INFO_  60
  HBASE_SERIALIZATION .... OFF
  HBASE_FILTER_PREDS ..... OFF
  QUERY_CACHE ............ 0
  MDAM_SCAN_METHOD ....... ON


TUPLE_FLOW ================================  SEQ_NO 3        CHILDREN 1, 2
REQUESTS_IN .............. 1
ROWS_OUT ................. 4
EST_OPER_COST ............ 0.01
EST_TOTAL_COST ........... 0.01
DESCRIPTION
  max_card_est ........... 4
  fragment_id ............ 0
  parent_frag ............ (none)
  fragment_type .......... master
  join_type .............. inner
  join_method ............ in-order nested


TRAFODION_DELETE ==========================  SEQ_NO 2        NO CHILDREN
TABLE_NAME ............... TRAFODION.SCH.T010T2
REQUESTS_IN .............. 1
ROWS_OUT ................. 1
EST_OPER_COST ............ 0
EST_TOTAL_COST ........... 0
DESCRIPTION
  max_card_est .......... 99
  fragment_id ............ 0
  parent_frag ............ (none)
  fragment_type .......... master
  iud_type ............... trafodion_delete TRAFODION.SCH.T010T2
  begin_key .............. (A = A) and (B = 'a') and (C = C)
  end_key ................ (A = A) and (B = 'a') and (C = C)


TRAFODION_SCAN ============================  SEQ_NO 1        NO CHILDREN
TABLE_NAME ............... T010T2
REQUESTS_IN .............. 1
ROWS_OUT ................. 4
EST_OPER_COST ............ 0
EST_TOTAL_COST ........... 0
DESCRIPTION
  max_card_est .......... 99
  fragment_id ............ 0
  parent_frag ............ (none)
  fragment_type .......... master
  scan_type .............. subset scan limited by mdam of table
                             TRAFODION.SCH.T010T2
  cache_size ........... 100
  probes ................. 1
  rows_accessed ........ 100
  key_columns ............ A, B, C
  executor_predicates .... (B = 'a')
  mdam_disjunct .......... (((A = 2) or (A = 4)) or (A = 6)) and ((C = 1) or (C
                             = 3)) and (B = 'a')

--- SQL operation complete.
>>explain x5;

------------------------------------------------------------------ PLAN SUMMARY
MODULE_NAME .............. DYNAMICALLY COMPILED
STATEMENT_NAME ........... X5
PLAN_ID .................. 212277210188597757
ROWS_OUT ................. 2
EST_TOTAL_COST ........... 0
STATEMENT ................ update t010t2
                           set d='upd'
                           where a=4 and b in ('a', 'b') and c < 2;


------------------------------------------------------------------ NODE LISTING
ROOT ======================================  SEQ_NO 2        ONLY CHILD 1
REQUESTS_IN .............. 1
ROWS_OUT ................. 2
EST_OPER_COST ............ 0
EST_TOTAL_COST ........... 0
DESCRIPTION
  olt_optimization ....... used
  max_card_est ........... 2
  fragment_id ............ 0
  parent_frag ............ (none)
  fragment_type .......... master
  statement_index ........ 0
  affinity_value ......... 0
  max_max_cardinality .... 2
  total_overflow_size .... 0.00 KB
  upd_action_on_error .... xn_rollback
  xn_access_mode ......... read_only
  xn_autoabort_interval    0
  auto_query_retry ....... enabled
  plan_version ....... 2,600
  embedded_arkcmp ........ used
  IS_SQLCI ............... ON
  LDAP_USERNAME
  MODE_SEABASE ........... ON
  SEABASE_VOLATILE_TABLES  ON
  HBASE_ASYNC_DROP_TABLE   OFF
  SCHEMA ................. TRAFODION.SCH
  HBASE_MAX_COLUMN_NAME_  10
  HBASE_MAX_COLUMN_VAL_L  20
  HBASE_MAX_COLUMN_INFO_  60
  HBASE_SERIALIZATION .... OFF
  HBASE_FILTER_PREDS ..... OFF
  QUERY_CACHE ............ 0
  MDAM_SCAN_METHOD ....... ON


TRAFODION_UPDATE ==========================  SEQ_NO 1        NO CHILDREN
TABLE_NAME ............... TRAFODION.SCH.T010T2
REQUESTS_IN .............. 1
ROWS_OUT ................. 2
EST_OPER_COST ............ 0
EST_TOTAL_COST ........... 0
DESCRIPTION
  max_card_est ........... 2
  fragment_id ............ 0
  parent_frag ............ (none)
  fragment_type .......... master
  iud_type ............... trafodion_update TRAFODION.SCH.T010T2
  columns ................ all
  begin_keys(incl) ....... 4,a,-2147483648
  end_keys(excl) ......... 4,a,2
  columns ................ all
  begin_keys(incl) ....... 4,b,-2147483648
  end_keys(excl) ......... 4,b,2
  new_rec_expr ........... (D assign 'upd')

--- SQL operation complete.
>>explain y1;

------------------------------------------------------------------ PLAN SUMMARY
MODULE_NAME .............. DYNAMICALLY COMPILED
STATEMENT_NAME ........... Y1
PLAN_ID .................. 212277210188651538
ROWS_OUT ................. 2
EST_TOTAL_COST ........... 0
STATEMENT ................ select *
                           from t010t2
                           where a in (1,4) and b='a' and c = 1;


------------------------------------------------------------------ NODE LISTING
ROOT ======================================  SEQ_NO 2        ONLY CHILD 1
REQUESTS_IN .............. 1
ROWS_OUT ................. 2
EST_OPER_COST ............ 0
EST_TOTAL_COST ........... 0
DESCRIPTION
  max_card_est .......... 99
  fragment_id ............ 0
  parent_frag ............ (none)
  fragment_type .......... master
  statement_index ........ 0
  affinity_value ......... 0
  max_max_cardinality .... 2
  total_overflow_size .... 0.00 KB
  xn_access_mode ......... read_only
  xn_autoabort_interval    0
  auto_query_retry ....... enabled
  plan_version ....... 2,600
  embedded_arkcmp ........ used
  IS_SQLCI ............... ON
  LDAP_USERNAME
  MODE_SEABASE ........... ON
  SEABASE_VOLATILE_TABLES  ON
  HBASE_ASYNC_DROP_TABLE   OFF
  SCHEMA ................. TRAFODION.SCH
  HBASE_MAX_COLUMN_NAME_  10
  HBASE_MAX_COLUMN_VAL_L  20
  HBASE_MAX_COLUMN_INFO_  60
  HBASE_SERIALIZATION .... OFF
  HBASE_FILTER_PREDS ..... OFF
  QUERY_CACHE ............ 0
  MDAM_SCAN_METHOD ....... ON
  HBASE_MAX_NUM_SEARCH_KE  1
  select_list ............ TRAFODION.SCH.T010T2.A, 'a', 1,
                             TRAFODION.SCH.T010T2.D


TRAFODION_SCAN ============================  SEQ_NO 1        NO CHILDREN
TABLE_NAME ............... T010T2
REQUESTS_IN .............. 1
ROWS_OUT ................. 2
EST_OPER_COST ............ 0
EST_TOTAL_COST ........... 0
DESCRIPTION
  max_card_est .......... 99
  fragment_id ............ 0
  parent_frag ............ (none)
  fragment_type .......... master
  scan_type .............. subset scan limited by mdam of table
                             TRAFODION.SCH.T010T2
  cache_size ........... 100
  probes ................. 1
  rows_accessed ........ 100
  key_columns ............ A, B, C
  mdam_disjunct .......... ((A = 1) or (A = 4)) and (B = 'a') and (C = 1)

--- SQL operation complete.
>>explain y2;

------------------------------------------------------------------ PLAN SUMMARY
MODULE_NAME .............. DYNAMICALLY COMPILED
STATEMENT_NAME ........... Y2
PLAN_ID .................. 212277210188705788
ROWS_OUT ................. 5
EST_TOTAL_COST ........... 0
STATEMENT ................ select *
                           from t010t2
                           where a in (1,2,4) and b='a' and (c in (1,
                             3) or c>=5);


------------------------------------------------------------------ NODE LISTING
ROOT ======================================  SEQ_NO 2        ONLY CHILD 1
REQUESTS_IN .............. 1
ROWS_OUT ................. 5
EST_OPER_COST ............ 0
EST_TOTAL_COST ........... 0
DESCRIPTION
  max_card_est .......... 99
  fragment_id ............ 0
  parent_frag ............ (none)
  fragment_type .......... master
  statement_index ........ 0
  affinity_value ......... 0
  max_max_cardinality .... 5
  total_overflow_size .... 0.00 KB
  xn_access_mode ......... read_only
  xn_autoabort_interval    0
  auto_query_retry ....... enabled
  plan_version ....... 2,600
  embedded_arkcmp ........ used
  IS_SQLCI ............... ON
  LDAP_USERNAME
  MODE_SEABASE ........... ON
  SEABASE_VOLATILE_TABLES  ON
  HBASE_ASYNC_DROP_TABLE   OFF
  SCHEMA ................. TRAFODION.SCH
  HBASE_MAX_COLUMN_NAME_  10
  HBASE_MAX_COLUMN_VAL_L  20
  HBASE_MAX_COLUMN_INFO_  60
  HBASE_SERIALIZATION .... OFF
  HBASE_FILTER_PREDS ..... OFF
  QUERY_CACHE ............ 0
  MDAM_SCAN_METHOD ....... ON
  HBASE_MAX_NUM_SEARCH_KE  1
  select_list ............ TRAFODION.SCH.T010T2.A, 'a', TRAFODION.SCH.T010T2.C,
                             TRAFODION.SCH.T010T2.D


TRAFODION_SCAN ============================  SEQ_NO 1        NO CHILDREN
TABLE_NAME ............... T010T2
REQUESTS_IN .............. 1
ROWS_OUT ................. 5
EST_OPER_COST ............ 0
EST_TOTAL_COST ........... 0
DESCRIPTION
  max_card_est .......... 99
  fragment_id ............ 0
  parent_frag ............ (none)
  fragment_type .......... master
  scan_type .............. subset scan limited by mdam of table
                             TRAFODION.SCH.T010T2
  cache_size ........... 100
  probes ................. 1
  rows_accessed ........ 100
  key_columns ............ A, B, C
  mdam_disjunct .......... (((A = 1) or (A = 2)) or (A = 4)) and (B = 'a') and
                             (((C = 1) or (C = 3)) or (C >= 5))

--- SQL operation complete.
>>explain y3;

------------------------------------------------------------------ PLAN SUMMARY
MODULE_NAME .............. DYNAMICALLY COMPILED
STATEMENT_NAME ........... Y3
PLAN_ID .................. 212277210188781637
ROWS_OUT ................. 4
EST_TOTAL_COST ........... 0
STATEMENT ................ select *
                           from t010t2
                           where a in (1,2,4) and b='a' and c in (1,3);


------------------------------------------------------------------ NODE LISTING
ROOT ======================================  SEQ_NO 2        ONLY CHILD 1
REQUESTS_IN .............. 1
ROWS_OUT ................. 4
EST_OPER_COST ............ 0
EST_TOTAL_COST ........... 0
DESCRIPTION
  max_card_est .......... 99
  fragment_id ............ 0
  parent_frag ............ (none)
  fragment_type .......... master
  statement_index ........ 0
  affinity_value ......... 0
  max_max_cardinality .... 4
  total_overflow_size .... 0.00 KB
  xn_access_mode ......... read_only
  xn_autoabort_interval    0
  auto_query_retry ....... enabled
  plan_version ....... 2,600
  embedded_arkcmp ........ used
  IS_SQLCI ............... ON
  LDAP_USERNAME
  MODE_SEABASE ........... ON
  SEABASE_VOLATILE_TABLES  ON
  HBASE_ASYNC_DROP_TABLE   OFF
  SCHEMA ................. TRAFODION.SCH
  HBASE_MAX_COLUMN_NAME_  10
  HBASE_MAX_COLUMN_VAL_L  20
  HBASE_MAX_COLUMN_INFO_  60
  HBASE_SERIALIZATION .... OFF
  HBASE_FILTER_PREDS ..... OFF
  QUERY_CACHE ............ 0
  MDAM_SCAN_METHOD ....... ON
  HBASE_MAX_NUM_SEARCH_KE  1
  select_list ............ TRAFODION.SCH.T010T2.A, 'a', TRAFODION.SCH.T010T2.C,
                             TRAFODION.SCH.T010T2.D


TRAFODION_SCAN ============================  SEQ_NO 1        NO CHILDREN
TABLE_NAME ............... T010T2
REQUESTS_IN .............. 1
ROWS_OUT ................. 4
EST_OPER_COST ............ 0
EST_TOTAL_COST ........... 0
DESCRIPTION
  max_card_est .......... 99
  fragment_id ............ 0
  parent_frag ............ (none)
  fragment_type .......... master
  scan_type .............. subset scan limited by mdam of table
                             TRAFODION.SCH.T010T2
  cache_size ........... 100
  probes ................. 1
  rows_accessed ........ 100
  key_columns ............ A, B, C
  mdam_disjunct .......... (((A = 1) or (A = 2)) or (A = 4)) and ((C = 1) or (C
                             = 3)) and (B = 'a')

--- SQL operation complete.
>>explain y4;

------------------------------------------------------------------ PLAN SUMMARY
MODULE_NAME .............. DYNAMICALLY COMPILED
STATEMENT_NAME ........... Y4
PLAN_ID .................. 212277210188850274
ROWS_OUT ................. 4
EST_TOTAL_COST ........... 0.01
STATEMENT ................ delete from t010t2
                           where a in (2,4,6) and b='a' and c in (1,3);


------------------------------------------------------------------ NODE LISTING
ROOT ======================================  SEQ_NO 4        ONLY CHILD 3
REQUESTS_IN .............. 1
ROWS_OUT ................. 4
EST_OPER_COST ............ 0
EST_TOTAL_COST ........... 0.01
DESCRIPTION
  max_card_est ........... 4
  fragment_id ............ 0
  parent_frag ............ (none)
  fragment_type .......... master
  statement_index ........ 0
  affinity_value ......... 0
  max_max_cardinality .... 4
  total_overflow_size .... 0.00 KB
  upd_action_on_error .... xn_rollback
  xn_access_mode ......... read_only
  xn_autoabort_interval    0
  auto_query_retry ....... enabled
  plan_version ....... 2,600
  embedded_arkcmp ........ used
  IS_SQLCI ............... ON
  LDAP_USERNAME
  MODE_SEABASE ........... ON
  SEABASE_VOLATILE_TABLES  ON
  HBASE_ASYNC_DROP_TABLE   OFF
  SCHEMA ................. TRAFODION.SCH
  HBASE_MAX_COLUMN_NAME_  10
  HBASE_MAX_COLUMN_VAL_L  20
  HBASE_MAX_COLUMN_INFO_  60
  HBASE_SERIALIZATION .... OFF
  HBASE_FILTER_PREDS ..... OFF
  QUERY_CACHE ............ 0
  MDAM_SCAN_METHOD ....... ON
  HBASE_MAX_NUM_SEARCH_KE  1


TUPLE_FLOW ================================  SEQ_NO 3        CHILDREN 1, 2
REQUESTS_IN .............. 1
ROWS_OUT ................. 4
EST_OPER_COST ............ 0.01
EST_TOTAL_COST ........... 0.01
DESCRIPTION
  max_card_est ........... 4
  fragment_id ............ 0
  parent_frag ............ (none)
  fragment_type .......... master
  join_type .............. inner
  join_method ............ in-order nested


TRAFODION_DELETE ==========================  SEQ_NO 2        NO CHILDREN
TABLE_NAME ............... TRAFODION.SCH.T010T2
REQUESTS_IN .............. 1
ROWS_OUT ................. 1
EST_OPER_COST ............ 0
EST_TOTAL_COST ........... 0
DESCRIPTION
  max_card_est .......... 99
  fragment_id ............ 0
  parent_frag ............ (none)
  fragment_type .......... master
  iud_type ............... trafodion_delete TRAFODION.SCH.T010T2
  begin_key .............. (A = A) and (B = 'a') and (C = C)
  end_key ................ (A = A) and (B = 'a') and (C = C)


TRAFODION_SCAN ============================  SEQ_NO 1        NO CHILDREN
TABLE_NAME ............... T010T2
REQUESTS_IN .............. 1
ROWS_OUT ................. 4
EST_OPER_COST ............ 0
EST_TOTAL_COST ........... 0
DESCRIPTION
  max_card_est .......... 99
  fragment_id ............ 0
  parent_frag ............ (none)
  fragment_type .......... master
  scan_type .............. subset scan limited by mdam of table
                             TRAFODION.SCH.T010T2
  cache_size ........... 100
  probes ................. 1
  rows_accessed ........ 100
  key_columns ............ A, B, C
  executor_predicates .... (B = 'a')
  mdam_disjunct .......... (((A = 2) or (A = 4)) or (A = 6)) and ((C = 1) or (C
                             = 3)) and (B = 'a')

--- SQL operation complete.
>>explain y5;

------------------------------------------------------------------ PLAN SUMMARY
MODULE_NAME .............. DYNAMICALLY COMPILED
STATEMENT_NAME ........... Y5
PLAN_ID .................. 212277210188989587
ROWS_OUT ................. 2
EST_TOTAL_COST ........... 0
STATEMENT ................ update t010t2
                           set d='uuu'
                           where a=4 and b in ('a', 'b') and c < 2;


------------------------------------------------------------------ NODE LISTING
ROOT ======================================  SEQ_NO 2        ONLY CHILD 1
REQUESTS_IN .............. 1
ROWS_OUT ................. 2
EST_OPER_COST ............ 0
EST_TOTAL_COST ........... 0
DESCRIPTION
  olt_optimization ....... used
  max_card_est ........... 2
  fragment_id ............ 0
  parent_frag ............ (none)
  fragment_type .......... master
  statement_index ........ 0
  affinity_value ......... 0
  max_max_cardinality .... 2
  total_overflow_size .... 0.00 KB
  upd_action_on_error .... xn_rollback
  xn_access_mode ......... read_only
  xn_autoabort_interval    0
  auto_query_retry ....... enabled
  plan_version ....... 2,600
  embedded_arkcmp ........ used
  IS_SQLCI ............... ON
  LDAP_USERNAME
  MODE_SEABASE ........... ON
  SEABASE_VOLATILE_TABLES  ON
  HBASE_ASYNC_DROP_TABLE   OFF
  SCHEMA ................. TRAFODION.SCH
  HBASE_MAX_COLUMN_NAME_  10
  HBASE_MAX_COLUMN_VAL_L  20
  HBASE_MAX_COLUMN_INFO_  60
  HBASE_SERIALIZATION .... OFF
  HBASE_FILTER_PREDS ..... OFF
  QUERY_CACHE ............ 0
  MDAM_SCAN_METHOD ....... ON
  HBASE_MAX_NUM_SEARCH_KE  1


TRAFODION_UPDATE ==========================  SEQ_NO 1        NO CHILDREN
TABLE_NAME ............... TRAFODION.SCH.T010T2
REQUESTS_IN .............. 1
ROWS_OUT ................. 2
EST_OPER_COST ............ 0
EST_TOTAL_COST ........... 0
DESCRIPTION
  max_card_est ........... 2
  fragment_id ............ 0
  parent_frag ............ (none)
  fragment_type .......... master
  iud_type ............... trafodion_update TRAFODION.SCH.T010T2
  columns ................ all
  begin_keys(incl) ....... 4,,-2147483648
  end_keys(incl) ......... 4,??????????,2
  new_rec_expr ........... (D assign 'uuu')
  predicate .............. ((B = 'a') or (B = 'b')) and (C < 2)

--- SQL operation complete.
>>
>>select "_SALT_", * from t010t3 order by a,b,c;

_SALT_      A            B           C            D         
----------  -----------  ----------  -----------  ----------

         2            1  a                     1  1a1       
         2            1  a                     3  1a3       
         2            1  a                     5  1a5       
         1            1  c                     1  1c1       
         3            2  a                     1  2a1       
         3            2  a                     2  2a2       
         0            2  c                     3  2c3       
         2            4  a                     1  4a1       
         1            4  b                     1  4b1       
         1            4  b                     2  4b2       

--- 10 row(s) selected.
>>select "_SALT_", * from t010t3 where a=1 and b='c';

_SALT_      A            B           C            D         
----------  -----------  ----------  -----------  ----------

         1            1  c                     1  1c1       

--- 1 row(s) selected.
>>
>>update t010t3 set d='2axu' where a=2 and b='a';

--- 2 row(s) updated.
>>-- 2 rows updated
>>update t010t3 set d='4b1u' where a=4 and b='b' and c <= 1;

--- 1 row(s) updated.
>>-- 1 row updated
>>update t010t3 set a=3 where a=2;

--- 3 row(s) updated.
>>-- 3 rows updated
>>delete from t010t3 where a=3 and b='c' and c=3;

--- 1 row(s) deleted.
>>-- 1 row deleted
>>delete from t010t3 where d like '2%u %';

--- 2 row(s) deleted.
>>-- 2 rows deleted
>>select "_SALT_", * from t010t3;

_SALT_      A            B           C            D         
----------  -----------  ----------  -----------  ----------

         1            1  c                     1  1c1       
         1            4  b                     1  4b1u      
         1            4  b                     2  4b2       
         2            1  a                     1  1a1       
         2            1  a                     3  1a3       
         2            1  a                     5  1a5       
         2            4  a                     1  4a1       

--- 7 row(s) selected.
>>-- 7 rows
>>merge into t010t3
+>  using (select * from t010t2) as src
+>  on ((src.a, src.b, src.c) = (a,b,c))
+>when matched
+>  then update set d = src.d
+>when not matched
+>  then insert values (src.a, src.b, src.c, src.d)
+>;

--- 10 row(s) updated.
>>-- 10 rows updated
>>select "_SALT_", * from t010t2 natural join t010t3 order by a,b,c;

_SALT_      A            B           C            D         
----------  -----------  ----------  -----------  ----------

         2            1  a                     1  1a1       
         2            1  a                     3  1a3       
         2            1  a                     5  1a5       
         1            1  c                     1  1c1       
         3            2  a                     1  2a1       
         3            2  a                     2  2a2       
         0            2  c                     3  2c3       
         2            4  a                     1  uuu       
         1            4  b                     1  uuu       
         1            4  b                     2  4b2       

--- 10 row(s) selected.
>>-- expect 10 rows, same as each individual table
>>
>>select "_SALT_", * from table(table t010t3, partition number 4);

_SALT_      A            B           C            D         
----------  -----------  ----------  -----------  ----------

         3            2  a                     1  2a1       
         3            2  a                     2  2a2       

--- 2 row(s) selected.
>>select "_SALT_", * from table(table t010t3, partition number from 1 to 3);

_SALT_      A            B           C            D         
----------  -----------  ----------  -----------  ----------

         0            2  c                     3  2c3       
         1            1  c                     1  1c1       
         1            4  b                     1  uuu       
         1            4  b                     2  4b2       
         2            1  a                     1  1a1       
         2            1  a                     3  1a3       
         2            1  a                     5  1a5       
         2            4  a                     1  uuu       

--- 8 row(s) selected.
>>-- 2 statements above must return 10 rows total
>>
>>
>>-- run with hbase_serialization ON
>>obey TEST010(clean_up);
>>--------------------------------------------------------------------------
>>drop table if exists t010t1;

--- SQL operation complete.
>>drop table if exists t010t2;

--- SQL operation complete.
>>drop table if exists t010t3;

--- SQL operation complete.
>>
>>cqd hbase_serialization 'ON';

--- SQL operation complete.
>>cqd hbase_filter_preds 'ON';

--- SQL operation complete.
>>
>>-- query_cache on(default), mdam_scan_method on(default)
>>cqd query_cache '1024';

--- SQL operation complete.
>>cqd mdam_scan_method 'ON';

--- SQL operation complete.
>>obey TEST010(clean_up);
>>--------------------------------------------------------------------------
>>drop table if exists t010t1;

--- SQL operation complete.
>>drop table if exists t010t2;

--- SQL operation complete.
>>drop table if exists t010t3;

--- SQL operation complete.
>>
>>obey TEST010(tests);
>>--------------------------------------------------------------------------
>>
>>create table if not exists t010t1 (a int not null, b char(10), primary key(a));

--- SQL operation complete.
>>create table if not exists t010t2 (a int not null, b char(10) not null, c int not null, d char(10), primary key(a,b,c));

--- SQL operation complete.
>>create table if not exists t010t3 (a int not null, b char(10) not null, c int not null, d char(10), primary key(a,b,c))
+>  salt using 4 partitions on (a,b);

--- SQL operation complete.
>>
>>invoke t010t1;

-- Definition of Trafodion table TRAFODION.SCH.T010T1
-- Definition current  Thu Sep 11 15:43:31 2014

  (
    A                                INT NO DEFAULT NOT NULL NOT DROPPABLE
  , B                                CHAR(10) CHARACTER SET ISO88591 COLLATE
      DEFAULT DEFAULT NULL
  )

--- SQL operation complete.
>>invoke hbase."_CELL_"."TRAFODION.SCH.T010T1";

-- Definition of Trafodion table HBASE."_CELL_"."TRAFODION.SCH.T010T1"
-- Definition current  Thu Sep 11 15:43:31 2014

  (
    ROW_ID                           VARCHAR(10) CHARACTER SET ISO88591 COLLATE
      DEFAULT NO DEFAULT NOT NULL NOT DROPPABLE
  , COL_FAMILY                       VARCHAR(10) CHARACTER SET ISO88591 COLLATE
      DEFAULT NO DEFAULT NOT NULL NOT DROPPABLE
  , COL_NAME                         VARCHAR(10) CHARACTER SET ISO88591 COLLATE
      DEFAULT NO DEFAULT NOT NULL NOT DROPPABLE
  , COL_TIMESTAMP                    LARGEINT NO DEFAULT NOT NULL NOT DROPPABLE
  , COL_VALUE                        VARCHAR(20) CHARACTER SET ISO88591 COLLATE
      DEFAULT NO DEFAULT NOT NULL NOT DROPPABLE
  )

--- SQL operation complete.
>>invoke hbase."_ROW_"."TRAFODION.SCH.T010T1";

-- Definition of Trafodion table HBASE."_ROW_"."TRAFODION.SCH.T010T1"
-- Definition current  Thu Sep 11 15:43:31 2014

  (
    ROW_ID                           VARCHAR(10) CHARACTER SET ISO88591 COLLATE
      DEFAULT NO DEFAULT NOT NULL NOT DROPPABLE
  , COLUMN_DETAILS                   VARCHAR(60) CHARACTER SET ISO88591 COLLATE
      DEFAULT NO DEFAULT NOT NULL NOT DROPPABLE
  )

--- SQL operation complete.
>>
>>insert into t010t1 values (1, 'a'), (2, 'b'), (3, 'c');

--- 3 row(s) inserted.
>>
>>select * from t010t1;

A            B         
-----------  ----------

          1  a         
          2  b         
          3  c         

--- 3 row(s) selected.
>>
>>select * from t010t1 where a = 2;

A            B         
-----------  ----------

          2  b         

--- 1 row(s) selected.
>>
>>select * from t010t1 where a = 2 or a = 3;

A            B         
-----------  ----------

          2  b         
          3  c         

--- 2 row(s) selected.
>>
>>delete from t010t1 where a = 4;

--- 0 row(s) deleted.
>>
>>select * from t010t1;

A            B         
-----------  ----------

          1  a         
          2  b         
          3  c         

--- 3 row(s) selected.
>>
>>delete from t010t1 where a = 2;

--- 1 row(s) deleted.
>>
>>select * from t010t1;

A            B         
-----------  ----------

          1  a         
          3  c         

--- 2 row(s) selected.
>>
>>select converttohex(cast(row_id as char(4))) rowid,
+>          converttohex(cast(col_family as char(2))) colfamily,
+>          converttohex(cast(col_name as char(1))) colname,
+>          converttohex(cast(col_value as char(4))) colvalue
+>                from hbase."_CELL_"."TRAFODION.SCH.T010T1";

ROWID     COLFAMILY  COLNAME  COLVALUE
--------  ---------  -------  --------

80000001  2331       01       80000001
80000001  2331       02       00612020
80000003  2331       01       80000003
80000003  2331       02       00632020

--- 4 row(s) selected.
>>
>>select converttohex(cast(row_id as char(4))) rowid,
+>          converttohex(cast(col_family as char(2))) colfamily,
+>          converttohex(cast(col_name as char(1))) colname,
+>          converttohex(cast(col_value as char(4))) colvalue
+>                from hbase."_CELL_"."TRAFODION.SCH.T010T1"
+>          where converttohex(cast(row_id as char(4))) = '80000001';

ROWID     COLFAMILY  COLNAME  COLVALUE
--------  ---------  -------  --------

80000001  2331       01       80000001
80000001  2331       02       00612020

--- 2 row(s) selected.
>>
>>select converttohex(cast(row_id as char(4))) rowid,
+>          converttohex(cast(column_details as char(40))) coldetails
+>                 from hbase."_ROW_"."TRAFODION.SCH.T010T1";

ROWID     COLDETAILS
--------  --------------------------------------------------------------------------------

80000001  040023313A010400000080000001040023313A020B00000000612020202020202020202020202020
80000003  040023313A010400000080000003040023313A020B00000000632020202020202020202020202020

--- 2 row(s) selected.
>>select converttohex(cast(row_id as char(4))) rowid,
+>          converttohex(cast(column_details as char(40))) coldetails
+>                 from hbase."_ROW_"."TRAFODION.SCH.T010T1"
+>          where converttohex(cast(row_id as char(4))) = '80000001';

ROWID     COLDETAILS
--------  --------------------------------------------------------------------------------

80000001  040023313A010400000080000001040023313A020B00000000612020202020202020202020202020

--- 1 row(s) selected.
>>
>>-------------------
>>-- check query plan
>>-------------------
>>
>>-- no sort operator should present when order by on primary key column
>>prepare xx from select * from t010t1 order by a;

--- SQL command prepared.
>>explain options 'f' xx;

LC   RC   OP   OPERATOR              OPT       DESCRIPTION           CARD
---- ---- ---- --------------------  --------  --------------------  ---------

1    .    2    root                                                  1.00E+002
.    .    1    trafodion_scan                  T010T1                1.00E+002

--- SQL operation complete.
>>
>>-- should see a sort when order by on non key column
>>prepare xx from select * from t010t1 order by b;

--- SQL command prepared.
>>explain options 'f' xx;

LC   RC   OP   OPERATOR              OPT       DESCRIPTION           CARD
---- ---- ---- --------------------  --------  --------------------  ---------

2    .    3    root                                                  1.00E+002
1    .    2    sort                                                  1.00E+002
.    .    1    trafodion_scan                  T010T1                1.00E+002

--- SQL operation complete.
>>
>>-- selectPred should present due to the 2nd disjunct b='1'
>>prepare xx from select * from t010t1 where a=1 or b='1';

--- SQL command prepared.
>>explain xx;

------------------------------------------------------------------ PLAN SUMMARY
MODULE_NAME .............. DYNAMICALLY COMPILED
STATEMENT_NAME ........... XX
PLAN_ID .................. 212277210211784832
ROWS_OUT ................ 11
EST_TOTAL_COST ........... 0.01
STATEMENT ................ select * from t010t1 where a=1 or b='1';


------------------------------------------------------------------ NODE LISTING
ROOT ======================================  SEQ_NO 2        ONLY CHILD 1
REQUESTS_IN .............. 1
ROWS_OUT ................ 11
EST_OPER_COST ............ 0
EST_TOTAL_COST ........... 0.01
DESCRIPTION
  max_card_est .......... 51
  fragment_id ............ 0
  parent_frag ............ (none)
  fragment_type .......... master
  statement_index ........ 0
  affinity_value ......... 0
  max_max_cardinality ... 11
  total_overflow_size .... 0.00 KB
  xn_access_mode ......... read_only
  xn_autoabort_interval    0
  auto_query_retry ....... enabled
  plan_version ....... 2,600
  embedded_arkcmp ........ used
  IS_SQLCI ............... ON
  LDAP_USERNAME
  MODE_SEABASE ........... ON
  SEABASE_VOLATILE_TABLES  ON
  HBASE_ASYNC_DROP_TABLE   OFF
  SCHEMA ................. TRAFODION.SCH
  HBASE_MAX_COLUMN_NAME_  10
  HBASE_MAX_COLUMN_VAL_L  20
  HBASE_MAX_COLUMN_INFO_  60
  HBASE_SERIALIZATION .... ON
  HBASE_FILTER_PREDS ..... ON
  QUERY_CACHE ........ 1,024
  MDAM_SCAN_METHOD ....... ON
  select_list ............ TRAFODION.SCH.T010T1.A, TRAFODION.SCH.T010T1.B


TRAFODION_SCAN ============================  SEQ_NO 1        NO CHILDREN
TABLE_NAME ............... T010T1
REQUESTS_IN .............. 1
ROWS_OUT ................ 11
EST_OPER_COST ............ 0.01
EST_TOTAL_COST ........... 0.01
DESCRIPTION
  max_card_est .......... 51
  fragment_id ............ 0
  parent_frag ............ (none)
  fragment_type .......... master
  scan_type .............. subset scan of table TRAFODION.SCH.T010T1
  columns ................ all
  begin_keys(incl)
  end_keys(incl)
  cache_size ........... 100
  probes ................. 1
  rows_accessed ........ 100
  key_columns ............ A
  executor_predicates .... ((A = 1) or (B = '1'))

--- SQL operation complete.
>>
>>-- Optimization: with only one disjunct, the selectPred should be empty
>>-- and the executor predicate should contain the non-key predicate
>>prepare xx from select * from t010t1 where a=1 and b='1';

--- SQL command prepared.
>>explain xx;

------------------------------------------------------------------ PLAN SUMMARY
MODULE_NAME .............. DYNAMICALLY COMPILED
STATEMENT_NAME ........... XX
PLAN_ID .................. 212277210211830277
ROWS_OUT ................. 1
EST_TOTAL_COST ........... 0.01
STATEMENT ................ select * from t010t1 where a=1 and b='1';


------------------------------------------------------------------ NODE LISTING
ROOT ======================================  SEQ_NO 2        ONLY CHILD 1
REQUESTS_IN .............. 1
ROWS_OUT ................. 1
EST_OPER_COST ............ 0
EST_TOTAL_COST ........... 0.01
DESCRIPTION
  olt_optimization ....... used
  max_card_est ........... 1
  fragment_id ............ 0
  parent_frag ............ (none)
  fragment_type .......... master
  statement_index ........ 0
  affinity_value ......... 0
  max_max_cardinality .... 1
  total_overflow_size .... 0.00 KB
  xn_access_mode ......... read_only
  xn_autoabort_interval    0
  auto_query_retry ....... enabled
  plan_version ....... 2,600
  embedded_arkcmp ........ used
  IS_SQLCI ............... ON
  LDAP_USERNAME
  MODE_SEABASE ........... ON
  SEABASE_VOLATILE_TABLES  ON
  HBASE_ASYNC_DROP_TABLE   OFF
  SCHEMA ................. TRAFODION.SCH
  HBASE_MAX_COLUMN_NAME_  10
  HBASE_MAX_COLUMN_VAL_L  20
  HBASE_MAX_COLUMN_INFO_  60
  HBASE_SERIALIZATION .... ON
  HBASE_FILTER_PREDS ..... ON
  QUERY_CACHE ........ 1,024
  MDAM_SCAN_METHOD ....... ON
  select_list ............ %(1), %('1')
  input_variables ........ %(1), %('1')


TRAFODION_SCAN ============================  SEQ_NO 1        NO CHILDREN
TABLE_NAME ............... T010T1
REQUESTS_IN .............. 1
ROWS_OUT ................. 1
EST_OPER_COST ............ 0.01
EST_TOTAL_COST ........... 0.01
DESCRIPTION
  max_card_est ........... 1
  fragment_id ............ 0
  parent_frag ............ (none)
  fragment_type .......... master
  scan_type .............. subset scan of table TRAFODION.SCH.T010T1
  cache_size ........... 100
  probes ................. 1
  rows_accessed .......... 1
  key_columns ............ A
  executor_predicates .... (B = %('1'))
  begin_key .............. (A = %(1))
  end_key ................ (A = %(1))

--- SQL operation complete.
>>
>>-- should see a full hbase SCAN
>>prepare xx from select * from t010t1 where b='1';

--- SQL command prepared.
>>explain xx;

------------------------------------------------------------------ PLAN SUMMARY
MODULE_NAME .............. DYNAMICALLY COMPILED
STATEMENT_NAME ........... XX
PLAN_ID .................. 212277210211879782
ROWS_OUT ................ 10
EST_TOTAL_COST ........... 0.01
STATEMENT ................ select * from t010t1 where b='1';


------------------------------------------------------------------ NODE LISTING
ROOT ======================================  SEQ_NO 2        ONLY CHILD 1
REQUESTS_IN .............. 1
ROWS_OUT ................ 10
EST_OPER_COST ............ 0
EST_TOTAL_COST ........... 0.01
DESCRIPTION
  max_card_est .......... 99
  fragment_id ............ 0
  parent_frag ............ (none)
  fragment_type .......... master
  statement_index ........ 0
  affinity_value ......... 0
  max_max_cardinality ... 10
  total_overflow_size .... 0.00 KB
  xn_access_mode ......... read_only
  xn_autoabort_interval    0
  auto_query_retry ....... enabled
  plan_version ....... 2,600
  embedded_arkcmp ........ used
  IS_SQLCI ............... ON
  LDAP_USERNAME
  MODE_SEABASE ........... ON
  SEABASE_VOLATILE_TABLES  ON
  HBASE_ASYNC_DROP_TABLE   OFF
  SCHEMA ................. TRAFODION.SCH
  HBASE_MAX_COLUMN_NAME_  10
  HBASE_MAX_COLUMN_VAL_L  20
  HBASE_MAX_COLUMN_INFO_  60
  HBASE_SERIALIZATION .... ON
  HBASE_FILTER_PREDS ..... ON
  QUERY_CACHE ........ 1,024
  MDAM_SCAN_METHOD ....... ON
  select_list ............ TRAFODION.SCH.T010T1.A, %('1')
  input_variables ........ %('1')


TRAFODION_SCAN ============================  SEQ_NO 1        NO CHILDREN
TABLE_NAME ............... T010T1
REQUESTS_IN .............. 1
ROWS_OUT ................ 10
EST_OPER_COST ............ 0.01
EST_TOTAL_COST ........... 0.01
DESCRIPTION
  max_card_est .......... 99
  fragment_id ............ 0
  parent_frag ............ (none)
  fragment_type .......... master
  scan_type .............. subset scan of table TRAFODION.SCH.T010T1
  columns ................ all
  begin_keys(incl)
  end_keys(incl)
  cache_size ........... 100
  probes ................. 1
  rows_accessed ........ 100
  key_columns ............ A
  executor_predicates .... (B = %('1'))

--- SQL operation complete.
>>
>>-- should see a unique hbase GET 
>>prepare xx from select * from t010t1 where a=1;

--- SQL command prepared.
>>explain xx;

------------------------------------------------------------------ PLAN SUMMARY
MODULE_NAME .............. DYNAMICALLY COMPILED
STATEMENT_NAME ........... XX
PLAN_ID .................. 212277210211551019
ROWS_OUT ................. 1
EST_TOTAL_COST ........... 0.01
STATEMENT ................ select * from t010t1 where a = 2;


------------------------------------------------------------------ NODE LISTING
ROOT ======================================  SEQ_NO 2        ONLY CHILD 1
REQUESTS_IN .............. 1
ROWS_OUT ................. 1
EST_OPER_COST ............ 0
EST_TOTAL_COST ........... 0.01
DESCRIPTION
  olt_optimization ....... used
  max_card_est ........... 1
  fragment_id ............ 0
  parent_frag ............ (none)
  fragment_type .......... master
  statement_index ........ 0
  affinity_value ......... 0
  max_max_cardinality .... 1
  total_overflow_size .... 0.00 KB
  xn_access_mode ......... read_only
  xn_autoabort_interval    0
  auto_query_retry ....... enabled
  plan_version ....... 2,600
  embedded_arkcmp ........ used
  IS_SQLCI ............... ON
  LDAP_USERNAME
  MODE_SEABASE ........... ON
  SEABASE_VOLATILE_TABLES  ON
  HBASE_ASYNC_DROP_TABLE   OFF
  SCHEMA ................. TRAFODION.SCH
  HBASE_MAX_COLUMN_NAME_  10
  HBASE_MAX_COLUMN_VAL_L  20
  HBASE_MAX_COLUMN_INFO_  60
  HBASE_SERIALIZATION .... ON
  HBASE_FILTER_PREDS ..... ON
  QUERY_CACHE ........ 1,024
  MDAM_SCAN_METHOD ....... ON
  select_list ............ %(2), TRAFODION.SCH.T010T1.B
  input_variables ........ %(2)


TRAFODION_SCAN ============================  SEQ_NO 1        NO CHILDREN
TABLE_NAME ............... T010T1
REQUESTS_IN .............. 1
ROWS_OUT ................. 1
EST_OPER_COST ............ 0.01
EST_TOTAL_COST ........... 0.01
DESCRIPTION
  max_card_est ........... 1
  fragment_id ............ 0
  parent_frag ............ (none)
  fragment_type .......... master
  scan_type .............. subset scan of table TRAFODION.SCH.T010T1
  cache_size ........... 100
  probes ................. 1
  rows_accessed .......... 1
  key_columns ............ A
  begin_key .............. (A = %(2))
  end_key ................ (A = %(2))

--- SQL operation complete.
>>
>>insert into t010t2 values
+>(1, 'a', 1, '1a1'),
+>(1, 'a', 3, '1a3'),
+>(1, 'a', 5, '1a5'),
+>(1, 'c', 1, '1c1'),
+>(2, 'a', 1, '2a1'),
+>(2, 'a', 2, '2a2'),
+>(2, 'c', 3, '2c3'),
+>(4, 'a', 1, '4a1'),
+>(4, 'b', 1, '4b1'),
+>(4, 'b', 2, '4b2');

--- 10 row(s) inserted.
>>
>>insert into t010t3 select * from t010t2;

--- 10 row(s) inserted.
>>
>>prepare x1 from
+>select * from t010t2 where a in (1,4) and b='a' and c = 1;

--- SQL command prepared.
>>
>>execute x1;

A            B           C            D         
-----------  ----------  -----------  ----------

          1  a                     1  1a1       
          4  a                     1  4a1       

--- 2 row(s) selected.
>>-- expect 1a1, 4a1
>>
>>prepare x2 from
+>select * from t010t2 where a in (1,2,4) and b='a' and (c in (1,3) or c>=5);

--- SQL command prepared.
>>execute x2;

A            B           C            D         
-----------  ----------  -----------  ----------

          1  a                     1  1a1       
          1  a                     3  1a3       
          1  a                     5  1a5       
          2  a                     1  2a1       
          4  a                     1  4a1       

--- 5 row(s) selected.
>>-- expect 1a1, 1a3, 1a5, 2a1, 4a1
>>
>>prepare x3 from
+>select * from t010t2 where a in (1,2,4) and b='a' and c in (1,3);

--- SQL command prepared.
>>execute x3;

A            B           C            D         
-----------  ----------  -----------  ----------

          1  a                     1  1a1       
          1  a                     3  1a3       
          2  a                     1  2a1       
          4  a                     1  4a1       

--- 4 row(s) selected.
>>-- expect 1a1, 1a3, 2a1, 4a1
>>
>>prepare x4 from
+>delete from t010t2 where a in (2,4,6) and b='a' and c in (1,3);

--- SQL command prepared.
>>execute x4;

--- 2 row(s) deleted.
>>-- expect 2 rows deleted, 2a1 and 4a1
>>execute x3;

A            B           C            D         
-----------  ----------  -----------  ----------

          1  a                     1  1a1       
          1  a                     3  1a3       

--- 2 row(s) selected.
>>-- expect 1a1, 1a3
>>
>>insert into t010t2 values
+>(2, 'a', 1, '2a1'),
+>(4, 'a', 1, '4a1');

--- 2 row(s) inserted.
>>
>>prepare x5 from 
+>update t010t2 set d='upd' where a=4 and b in ('a', 'b') and c < 2;

--- SQL command prepared.
>>execute x5;

--- 2 row(s) updated.
>>-- execute 2 rows updated, 4a1 and 4b1
>>select * from t010t2;

A            B           C            D         
-----------  ----------  -----------  ----------

          1  a                     1  1a1       
          1  a                     3  1a3       
          1  a                     5  1a5       
          1  c                     1  1c1       
          2  a                     1  2a1       
          2  a                     2  2a2       
          2  c                     3  2c3       
          4  a                     1  upd       
          4  b                     1  upd       
          4  b                     2  4b2       

--- 10 row(s) selected.
>>
>>cqd HBASE_MAX_NUM_SEARCH_KEYS '1';

--- SQL operation complete.
>>
>>prepare y1 from
+>select * from t010t2 where a in (1,4) and b='a' and c = 1;

--- SQL command prepared.
>>execute y1;

A            B           C            D         
-----------  ----------  -----------  ----------

          1  a                     1  1a1       
          4  a                     1  upd       

--- 2 row(s) selected.
>>-- expect 1a1, 4a1
>>
>>prepare y2 from
+>select * from t010t2 where a in (1,2,4) and b='a' and (c in (1,3) or c>=5);

--- SQL command prepared.
>>execute y2;

A            B           C            D         
-----------  ----------  -----------  ----------

          1  a                     1  1a1       
          1  a                     3  1a3       
          1  a                     5  1a5       
          2  a                     1  2a1       
          4  a                     1  upd       

--- 5 row(s) selected.
>>-- expect 1a1, 1a3, 1a5, 2a1, 4a1
>>
>>prepare y3 from
+>select * from t010t2 where a in (1,2,4) and b='a' and c in (1,3);

--- SQL command prepared.
>>execute y3;

A            B           C            D         
-----------  ----------  -----------  ----------

          1  a                     1  1a1       
          1  a                     3  1a3       
          2  a                     1  2a1       
          4  a                     1  upd       

--- 4 row(s) selected.
>>-- expect 1a1, 1a3, 2a1, 4a1
>>
>>prepare y4 from
+>delete from t010t2 where a in (2,4,6) and b='a' and c in (1,3);

--- SQL command prepared.
>>execute y4;

--- 2 row(s) deleted.
>>-- expect 2 rows deleted, 2a1 and 4a1
>>execute y3;

A            B           C            D         
-----------  ----------  -----------  ----------

          1  a                     1  1a1       
          1  a                     3  1a3       

--- 2 row(s) selected.
>>-- expect 1a1, 1a3
>>
>>insert into t010t2 values
+>(2, 'a', 1, '2a1'),
+>(4, 'a', 1, '4a1');

--- 2 row(s) inserted.
>>
>>prepare y5 from 
+>update t010t2 set d='uuu' where a=4 and b in ('a', 'b') and c < 2;

--- SQL command prepared.
>>execute y5;

--- 2 row(s) updated.
>>-- execute 2 rows updated, 4a1 and 4b1
>>select * from t010t2;

A            B           C            D         
-----------  ----------  -----------  ----------

          1  a                     1  1a1       
          1  a                     3  1a3       
          1  a                     5  1a5       
          1  c                     1  1c1       
          2  a                     1  2a1       
          2  a                     2  2a2       
          2  c                     3  2c3       
          4  a                     1  uuu       
          4  b                     1  uuu       
          4  b                     2  4b2       

--- 10 row(s) selected.
>>
>>cqd HBASE_MAX_NUM_SEARCH_KEYS reset;

--- SQL operation complete.
>>
>>explain x1;

------------------------------------------------------------------ PLAN SUMMARY
MODULE_NAME .............. DYNAMICALLY COMPILED
STATEMENT_NAME ........... X1
PLAN_ID .................. 212277210213521997
ROWS_OUT ................. 2
EST_TOTAL_COST ........... 0
STATEMENT ................ select *
                           from t010t2
                           where a in (1,4) and b='a' and c = 1;


------------------------------------------------------------------ NODE LISTING
ROOT ======================================  SEQ_NO 2        ONLY CHILD 1
REQUESTS_IN .............. 1
ROWS_OUT ................. 2
EST_OPER_COST ............ 0
EST_TOTAL_COST ........... 0
DESCRIPTION
  max_card_est .......... 99
  fragment_id ............ 0
  parent_frag ............ (none)
  fragment_type .......... master
  statement_index ........ 0
  affinity_value ......... 0
  max_max_cardinality .... 2
  total_overflow_size .... 0.00 KB
  xn_access_mode ......... read_only
  xn_autoabort_interval    0
  auto_query_retry ....... enabled
  plan_version ....... 2,600
  embedded_arkcmp ........ used
  IS_SQLCI ............... ON
  LDAP_USERNAME
  MODE_SEABASE ........... ON
  SEABASE_VOLATILE_TABLES  ON
  HBASE_ASYNC_DROP_TABLE   OFF
  SCHEMA ................. TRAFODION.SCH
  HBASE_MAX_COLUMN_NAME_  10
  HBASE_MAX_COLUMN_VAL_L  20
  HBASE_MAX_COLUMN_INFO_  60
  HBASE_SERIALIZATION .... ON
  HBASE_FILTER_PREDS ..... ON
  QUERY_CACHE ........ 1,024
  MDAM_SCAN_METHOD ....... ON
  select_list ............ TRAFODION.SCH.T010T2.A, %('a'), %(1),
                             TRAFODION.SCH.T010T2.D
  input_variables ........ %('a'), %(1)


TRAFODION_SCAN ============================  SEQ_NO 1        NO CHILDREN
TABLE_NAME ............... T010T2
REQUESTS_IN .............. 1
ROWS_OUT ................. 2
EST_OPER_COST ............ 0
EST_TOTAL_COST ........... 0
DESCRIPTION
  max_card_est .......... 99
  fragment_id ............ 0
  parent_frag ............ (none)
  fragment_type .......... master
  scan_type .............. subset scan limited by mdam of table
                             TRAFODION.SCH.T010T2
  cache_size ........... 100
  probes ................. 1
  rows_accessed ........ 100
  key_columns ............ A, B, C
  mdam_disjunct .......... ((A = 1) or (A = 4)) and (B = %('a')) and (C = %(1))

--- SQL operation complete.
>>explain x2;

------------------------------------------------------------------ PLAN SUMMARY
MODULE_NAME .............. DYNAMICALLY COMPILED
STATEMENT_NAME ........... X2
PLAN_ID .................. 212277210213573667
ROWS_OUT ................. 5
EST_TOTAL_COST ........... 0
STATEMENT ................ select *
                           from t010t2
                           where a in (1,2,4) and b='a' and (c in (1,
                             3) or c>=5);


------------------------------------------------------------------ NODE LISTING
ROOT ======================================  SEQ_NO 2        ONLY CHILD 1
REQUESTS_IN .............. 1
ROWS_OUT ................. 5
EST_OPER_COST ............ 0
EST_TOTAL_COST ........... 0
DESCRIPTION
  max_card_est .......... 99
  fragment_id ............ 0
  parent_frag ............ (none)
  fragment_type .......... master
  statement_index ........ 0
  affinity_value ......... 0
  max_max_cardinality .... 5
  total_overflow_size .... 0.00 KB
  xn_access_mode ......... read_only
  xn_autoabort_interval    0
  auto_query_retry ....... enabled
  plan_version ....... 2,600
  embedded_arkcmp ........ used
  IS_SQLCI ............... ON
  LDAP_USERNAME
  MODE_SEABASE ........... ON
  SEABASE_VOLATILE_TABLES  ON
  HBASE_ASYNC_DROP_TABLE   OFF
  SCHEMA ................. TRAFODION.SCH
  HBASE_MAX_COLUMN_NAME_  10
  HBASE_MAX_COLUMN_VAL_L  20
  HBASE_MAX_COLUMN_INFO_  60
  HBASE_SERIALIZATION .... ON
  HBASE_FILTER_PREDS ..... ON
  QUERY_CACHE ........ 1,024
  MDAM_SCAN_METHOD ....... ON
  select_list ............ TRAFODION.SCH.T010T2.A, %('a'),
                             TRAFODION.SCH.T010T2.C, TRAFODION.SCH.T010T2.D
  input_variables ........ %('a')


TRAFODION_SCAN ============================  SEQ_NO 1        NO CHILDREN
TABLE_NAME ............... T010T2
REQUESTS_IN .............. 1
ROWS_OUT ................. 5
EST_OPER_COST ............ 0
EST_TOTAL_COST ........... 0
DESCRIPTION
  max_card_est .......... 99
  fragment_id ............ 0
  parent_frag ............ (none)
  fragment_type .......... master
  scan_type .............. subset scan limited by mdam of table
                             TRAFODION.SCH.T010T2
  cache_size ........... 100
  probes ................. 1
  rows_accessed ........ 100
  key_columns ............ A, B, C
  mdam_disjunct .......... (((A = 1) or (A = 2)) or (A = 4)) and (B = %('a'))
                             and (((C = 1) or (C = 3)) or (C >= 5))

--- SQL operation complete.
>>explain x3;

------------------------------------------------------------------ PLAN SUMMARY
MODULE_NAME .............. DYNAMICALLY COMPILED
STATEMENT_NAME ........... X3
PLAN_ID .................. 212277210213639418
ROWS_OUT ................. 4
EST_TOTAL_COST ........... 0
STATEMENT ................ select *
                           from t010t2
                           where a in (1,2,4) and b='a' and c in (1,3);


------------------------------------------------------------------ NODE LISTING
ROOT ======================================  SEQ_NO 2        ONLY CHILD 1
REQUESTS_IN .............. 1
ROWS_OUT ................. 4
EST_OPER_COST ............ 0
EST_TOTAL_COST ........... 0
DESCRIPTION
  max_card_est .......... 99
  fragment_id ............ 0
  parent_frag ............ (none)
  fragment_type .......... master
  statement_index ........ 0
  affinity_value ......... 0
  max_max_cardinality .... 4
  total_overflow_size .... 0.00 KB
  xn_access_mode ......... read_only
  xn_autoabort_interval    0
  auto_query_retry ....... enabled
  plan_version ....... 2,600
  embedded_arkcmp ........ used
  IS_SQLCI ............... ON
  LDAP_USERNAME
  MODE_SEABASE ........... ON
  SEABASE_VOLATILE_TABLES  ON
  HBASE_ASYNC_DROP_TABLE   OFF
  SCHEMA ................. TRAFODION.SCH
  HBASE_MAX_COLUMN_NAME_  10
  HBASE_MAX_COLUMN_VAL_L  20
  HBASE_MAX_COLUMN_INFO_  60
  HBASE_SERIALIZATION .... ON
  HBASE_FILTER_PREDS ..... ON
  QUERY_CACHE ........ 1,024
  MDAM_SCAN_METHOD ....... ON
  select_list ............ TRAFODION.SCH.T010T2.A, %('a'),
                             TRAFODION.SCH.T010T2.C, TRAFODION.SCH.T010T2.D
  input_variables ........ %('a')


TRAFODION_SCAN ============================  SEQ_NO 1        NO CHILDREN
TABLE_NAME ............... T010T2
REQUESTS_IN .............. 1
ROWS_OUT ................. 4
EST_OPER_COST ............ 0
EST_TOTAL_COST ........... 0
DESCRIPTION
  max_card_est .......... 99
  fragment_id ............ 0
  parent_frag ............ (none)
  fragment_type .......... master
  scan_type .............. subset scan limited by mdam of table
                             TRAFODION.SCH.T010T2
  cache_size ........... 100
  probes ................. 1
  rows_accessed ........ 100
  key_columns ............ A, B, C
  mdam_disjunct .......... (((A = 1) or (A = 2)) or (A = 4)) and ((C = 1) or (C
                             = 3)) and (B = %('a'))

--- SQL operation complete.
>>explain x4;

------------------------------------------------------------------ PLAN SUMMARY
MODULE_NAME .............. DYNAMICALLY COMPILED
STATEMENT_NAME ........... X4
PLAN_ID .................. 212277210213702501
ROWS_OUT ................. 4
EST_TOTAL_COST ........... 0.01
STATEMENT ................ delete from t010t2
                           where a in (2,4,6) and b='a' and c in (1,3);


------------------------------------------------------------------ NODE LISTING
ROOT ======================================  SEQ_NO 4        ONLY CHILD 3
REQUESTS_IN .............. 1
ROWS_OUT ................. 4
EST_OPER_COST ............ 0
EST_TOTAL_COST ........... 0.01
DESCRIPTION
  max_card_est ........... 4
  fragment_id ............ 0
  parent_frag ............ (none)
  fragment_type .......... master
  statement_index ........ 0
  affinity_value ......... 0
  max_max_cardinality .... 4
  total_overflow_size .... 0.00 KB
  upd_action_on_error .... xn_rollback
  xn_access_mode ......... read_only
  xn_autoabort_interval    0
  auto_query_retry ....... enabled
  plan_version ....... 2,600
  embedded_arkcmp ........ used
  IS_SQLCI ............... ON
  LDAP_USERNAME
  MODE_SEABASE ........... ON
  SEABASE_VOLATILE_TABLES  ON
  HBASE_ASYNC_DROP_TABLE   OFF
  SCHEMA ................. TRAFODION.SCH
  HBASE_MAX_COLUMN_NAME_  10
  HBASE_MAX_COLUMN_VAL_L  20
  HBASE_MAX_COLUMN_INFO_  60
  HBASE_SERIALIZATION .... ON
  HBASE_FILTER_PREDS ..... ON
  QUERY_CACHE ........ 1,024
  MDAM_SCAN_METHOD ....... ON
  input_variables ........ %('a')


TUPLE_FLOW ================================  SEQ_NO 3        CHILDREN 1, 2
REQUESTS_IN .............. 1
ROWS_OUT ................. 4
EST_OPER_COST ............ 0.01
EST_TOTAL_COST ........... 0.01
DESCRIPTION
  max_card_est ........... 4
  fragment_id ............ 0
  parent_frag ............ (none)
  fragment_type .......... master
  join_type .............. inner
  join_method ............ in-order nested


TRAFODION_DELETE ==========================  SEQ_NO 2        NO CHILDREN
TABLE_NAME ............... TRAFODION.SCH.T010T2
REQUESTS_IN .............. 1
ROWS_OUT ................. 1
EST_OPER_COST ............ 0
EST_TOTAL_COST ........... 0
DESCRIPTION
  max_card_est .......... 99
  fragment_id ............ 0
  parent_frag ............ (none)
  fragment_type .......... master
  iud_type ............... trafodion_delete TRAFODION.SCH.T010T2
  begin_key .............. (A = A) and (B = %('a')) and (C = C)
  end_key ................ (A = A) and (B = %('a')) and (C = C)


TRAFODION_SCAN ============================  SEQ_NO 1        NO CHILDREN
TABLE_NAME ............... T010T2
REQUESTS_IN .............. 1
ROWS_OUT ................. 4
EST_OPER_COST ............ 0
EST_TOTAL_COST ........... 0
DESCRIPTION
  max_card_est .......... 99
  fragment_id ............ 0
  parent_frag ............ (none)
  fragment_type .......... master
  scan_type .............. subset scan limited by mdam of table
                             TRAFODION.SCH.T010T2
  cache_size ........... 100
  probes ................. 1
  rows_accessed ........ 100
  key_columns ............ A, B, C
  executor_predicates .... (B = %('a'))
  mdam_disjunct .......... (((A = 2) or (A = 4)) or (A = 6)) and ((C = 1) or (C
                             = 3)) and (B = %('a'))

--- SQL operation complete.
>>explain x5;

------------------------------------------------------------------ PLAN SUMMARY
MODULE_NAME .............. DYNAMICALLY COMPILED
STATEMENT_NAME ........... X5
PLAN_ID .................. 212277210213856968
ROWS_OUT ................. 2
EST_TOTAL_COST ........... 0
STATEMENT ................ update t010t2
                           set d='upd'
                           where a=4 and b in ('a', 'b') and c < 2;


------------------------------------------------------------------ NODE LISTING
ROOT ======================================  SEQ_NO 2        ONLY CHILD 1
REQUESTS_IN .............. 1
ROWS_OUT ................. 2
EST_OPER_COST ............ 0
EST_TOTAL_COST ........... 0
DESCRIPTION
  olt_optimization ....... used
  max_card_est ........... 2
  fragment_id ............ 0
  parent_frag ............ (none)
  fragment_type .......... master
  statement_index ........ 0
  affinity_value ......... 0
  max_max_cardinality .... 2
  total_overflow_size .... 0.00 KB
  upd_action_on_error .... xn_rollback
  xn_access_mode ......... read_only
  xn_autoabort_interval    0
  auto_query_retry ....... enabled
  plan_version ....... 2,600
  embedded_arkcmp ........ used
  IS_SQLCI ............... ON
  LDAP_USERNAME
  MODE_SEABASE ........... ON
  SEABASE_VOLATILE_TABLES  ON
  HBASE_ASYNC_DROP_TABLE   OFF
  SCHEMA ................. TRAFODION.SCH
  HBASE_MAX_COLUMN_NAME_  10
  HBASE_MAX_COLUMN_VAL_L  20
  HBASE_MAX_COLUMN_INFO_  60
  HBASE_SERIALIZATION .... ON
  HBASE_FILTER_PREDS ..... ON
  QUERY_CACHE ........ 1,024
  MDAM_SCAN_METHOD ....... ON
  input_variables ........ %('upd'), %(4)


TRAFODION_UPDATE ==========================  SEQ_NO 1        NO CHILDREN
TABLE_NAME ............... TRAFODION.SCH.T010T2
REQUESTS_IN .............. 1
ROWS_OUT ................. 2
EST_OPER_COST ............ 0
EST_TOTAL_COST ........... 0
DESCRIPTION
  max_card_est ........... 2
  fragment_id ............ 0
  parent_frag ............ (none)
  fragment_type .......... master
  iud_type ............... trafodion_update TRAFODION.SCH.T010T2
  new_rec_expr ........... (D assign %('upd'))
  predicate .............. (C < 2) and ((B = 'a') or (B = 'b'))
  begin_key .............. (A = %(4)) and (B = '<min>') and (C = <min>)
  end_key ................ (A = %(4)) and (B = '<max>') and (C = 2)

--- SQL operation complete.
>>explain y1;

------------------------------------------------------------------ PLAN SUMMARY
MODULE_NAME .............. DYNAMICALLY COMPILED
STATEMENT_NAME ........... Y1
PLAN_ID .................. 212277210213911122
ROWS_OUT ................. 2
EST_TOTAL_COST ........... 0
STATEMENT ................ select *
                           from t010t2
                           where a in (1,4) and b='a' and c = 1;


------------------------------------------------------------------ NODE LISTING
ROOT ======================================  SEQ_NO 2        ONLY CHILD 1
REQUESTS_IN .............. 1
ROWS_OUT ................. 2
EST_OPER_COST ............ 0
EST_TOTAL_COST ........... 0
DESCRIPTION
  max_card_est .......... 99
  fragment_id ............ 0
  parent_frag ............ (none)
  fragment_type .......... master
  statement_index ........ 0
  affinity_value ......... 0
  max_max_cardinality .... 2
  total_overflow_size .... 0.00 KB
  xn_access_mode ......... read_only
  xn_autoabort_interval    0
  auto_query_retry ....... enabled
  plan_version ....... 2,600
  embedded_arkcmp ........ used
  IS_SQLCI ............... ON
  LDAP_USERNAME
  MODE_SEABASE ........... ON
  SEABASE_VOLATILE_TABLES  ON
  HBASE_ASYNC_DROP_TABLE   OFF
  SCHEMA ................. TRAFODION.SCH
  HBASE_MAX_COLUMN_NAME_  10
  HBASE_MAX_COLUMN_VAL_L  20
  HBASE_MAX_COLUMN_INFO_  60
  HBASE_SERIALIZATION .... ON
  HBASE_FILTER_PREDS ..... ON
  QUERY_CACHE ........ 1,024
  MDAM_SCAN_METHOD ....... ON
  HBASE_MAX_NUM_SEARCH_KE  1
  select_list ............ TRAFODION.SCH.T010T2.A, %('a'), %(1),
                             TRAFODION.SCH.T010T2.D
  input_variables ........ %('a'), %(1)


TRAFODION_SCAN ============================  SEQ_NO 1        NO CHILDREN
TABLE_NAME ............... T010T2
REQUESTS_IN .............. 1
ROWS_OUT ................. 2
EST_OPER_COST ............ 0
EST_TOTAL_COST ........... 0
DESCRIPTION
  max_card_est .......... 99
  fragment_id ............ 0
  parent_frag ............ (none)
  fragment_type .......... master
  scan_type .............. subset scan limited by mdam of table
                             TRAFODION.SCH.T010T2
  cache_size ........... 100
  probes ................. 1
  rows_accessed ........ 100
  key_columns ............ A, B, C
  mdam_disjunct .......... ((A = 1) or (A = 4)) and (B = %('a')) and (C = %(1))

--- SQL operation complete.
>>explain y2;

------------------------------------------------------------------ PLAN SUMMARY
MODULE_NAME .............. DYNAMICALLY COMPILED
STATEMENT_NAME ........... Y2
PLAN_ID .................. 212277210213960426
ROWS_OUT ................. 5
EST_TOTAL_COST ........... 0
STATEMENT ................ select *
                           from t010t2
                           where a in (1,2,4) and b='a' and (c in (1,
                             3) or c>=5);


------------------------------------------------------------------ NODE LISTING
ROOT ======================================  SEQ_NO 2        ONLY CHILD 1
REQUESTS_IN .............. 1
ROWS_OUT ................. 5
EST_OPER_COST ............ 0
EST_TOTAL_COST ........... 0
DESCRIPTION
  max_card_est .......... 99
  fragment_id ............ 0
  parent_frag ............ (none)
  fragment_type .......... master
  statement_index ........ 0
  affinity_value ......... 0
  max_max_cardinality .... 5
  total_overflow_size .... 0.00 KB
  xn_access_mode ......... read_only
  xn_autoabort_interval    0
  auto_query_retry ....... enabled
  plan_version ....... 2,600
  embedded_arkcmp ........ used
  IS_SQLCI ............... ON
  LDAP_USERNAME
  MODE_SEABASE ........... ON
  SEABASE_VOLATILE_TABLES  ON
  HBASE_ASYNC_DROP_TABLE   OFF
  SCHEMA ................. TRAFODION.SCH
  HBASE_MAX_COLUMN_NAME_  10
  HBASE_MAX_COLUMN_VAL_L  20
  HBASE_MAX_COLUMN_INFO_  60
  HBASE_SERIALIZATION .... ON
  HBASE_FILTER_PREDS ..... ON
  QUERY_CACHE ........ 1,024
  MDAM_SCAN_METHOD ....... ON
  HBASE_MAX_NUM_SEARCH_KE  1
  select_list ............ TRAFODION.SCH.T010T2.A, %('a'),
                             TRAFODION.SCH.T010T2.C, TRAFODION.SCH.T010T2.D
  input_variables ........ %('a')


TRAFODION_SCAN ============================  SEQ_NO 1        NO CHILDREN
TABLE_NAME ............... T010T2
REQUESTS_IN .............. 1
ROWS_OUT ................. 5
EST_OPER_COST ............ 0
EST_TOTAL_COST ........... 0
DESCRIPTION
  max_card_est .......... 99
  fragment_id ............ 0
  parent_frag ............ (none)
  fragment_type .......... master
  scan_type .............. subset scan limited by mdam of table
                             TRAFODION.SCH.T010T2
  cache_size ........... 100
  probes ................. 1
  rows_accessed ........ 100
  key_columns ............ A, B, C
  mdam_disjunct .......... (((A = 1) or (A = 2)) or (A = 4)) and (B = %('a'))
                             and (((C = 1) or (C = 3)) or (C >= 5))

--- SQL operation complete.
>>explain y3;

------------------------------------------------------------------ PLAN SUMMARY
MODULE_NAME .............. DYNAMICALLY COMPILED
STATEMENT_NAME ........... Y3
PLAN_ID .................. 212277210214028381
ROWS_OUT ................. 4
EST_TOTAL_COST ........... 0
STATEMENT ................ select *
                           from t010t2
                           where a in (1,2,4) and b='a' and c in (1,3);


------------------------------------------------------------------ NODE LISTING
ROOT ======================================  SEQ_NO 2        ONLY CHILD 1
REQUESTS_IN .............. 1
ROWS_OUT ................. 4
EST_OPER_COST ............ 0
EST_TOTAL_COST ........... 0
DESCRIPTION
  max_card_est .......... 99
  fragment_id ............ 0
  parent_frag ............ (none)
  fragment_type .......... master
  statement_index ........ 0
  affinity_value ......... 0
  max_max_cardinality .... 4
  total_overflow_size .... 0.00 KB
  xn_access_mode ......... read_only
  xn_autoabort_interval    0
  auto_query_retry ....... enabled
  plan_version ....... 2,600
  embedded_arkcmp ........ used
  IS_SQLCI ............... ON
  LDAP_USERNAME
  MODE_SEABASE ........... ON
  SEABASE_VOLATILE_TABLES  ON
  HBASE_ASYNC_DROP_TABLE   OFF
  SCHEMA ................. TRAFODION.SCH
  HBASE_MAX_COLUMN_NAME_  10
  HBASE_MAX_COLUMN_VAL_L  20
  HBASE_MAX_COLUMN_INFO_  60
  HBASE_SERIALIZATION .... ON
  HBASE_FILTER_PREDS ..... ON
  QUERY_CACHE ........ 1,024
  MDAM_SCAN_METHOD ....... ON
  HBASE_MAX_NUM_SEARCH_KE  1
  select_list ............ TRAFODION.SCH.T010T2.A, %('a'),
                             TRAFODION.SCH.T010T2.C, TRAFODION.SCH.T010T2.D
  input_variables ........ %('a')


TRAFODION_SCAN ============================  SEQ_NO 1        NO CHILDREN
TABLE_NAME ............... T010T2
REQUESTS_IN .............. 1
ROWS_OUT ................. 4
EST_OPER_COST ............ 0
EST_TOTAL_COST ........... 0
DESCRIPTION
  max_card_est .......... 99
  fragment_id ............ 0
  parent_frag ............ (none)
  fragment_type .......... master
  scan_type .............. subset scan limited by mdam of table
                             TRAFODION.SCH.T010T2
  cache_size ........... 100
  probes ................. 1
  rows_accessed ........ 100
  key_columns ............ A, B, C
  mdam_disjunct .......... (((A = 1) or (A = 2)) or (A = 4)) and ((C = 1) or (C
                             = 3)) and (B = %('a'))

--- SQL operation complete.
>>explain y4;

------------------------------------------------------------------ PLAN SUMMARY
MODULE_NAME .............. DYNAMICALLY COMPILED
STATEMENT_NAME ........... Y4
PLAN_ID .................. 212277210214095460
ROWS_OUT ................. 4
EST_TOTAL_COST ........... 0.01
STATEMENT ................ delete from t010t2
                           where a in (2,4,6) and b='a' and c in (1,3);


------------------------------------------------------------------ NODE LISTING
ROOT ======================================  SEQ_NO 4        ONLY CHILD 3
REQUESTS_IN .............. 1
ROWS_OUT ................. 4
EST_OPER_COST ............ 0
EST_TOTAL_COST ........... 0.01
DESCRIPTION
  max_card_est ........... 4
  fragment_id ............ 0
  parent_frag ............ (none)
  fragment_type .......... master
  statement_index ........ 0
  affinity_value ......... 0
  max_max_cardinality .... 4
  total_overflow_size .... 0.00 KB
  upd_action_on_error .... xn_rollback
  xn_access_mode ......... read_only
  xn_autoabort_interval    0
  auto_query_retry ....... enabled
  plan_version ....... 2,600
  embedded_arkcmp ........ used
  IS_SQLCI ............... ON
  LDAP_USERNAME
  MODE_SEABASE ........... ON
  SEABASE_VOLATILE_TABLES  ON
  HBASE_ASYNC_DROP_TABLE   OFF
  SCHEMA ................. TRAFODION.SCH
  HBASE_MAX_COLUMN_NAME_  10
  HBASE_MAX_COLUMN_VAL_L  20
  HBASE_MAX_COLUMN_INFO_  60
  HBASE_SERIALIZATION .... ON
  HBASE_FILTER_PREDS ..... ON
  QUERY_CACHE ........ 1,024
  MDAM_SCAN_METHOD ....... ON
  HBASE_MAX_NUM_SEARCH_KE  1
  input_variables ........ %('a')


TUPLE_FLOW ================================  SEQ_NO 3        CHILDREN 1, 2
REQUESTS_IN .............. 1
ROWS_OUT ................. 4
EST_OPER_COST ............ 0.01
EST_TOTAL_COST ........... 0.01
DESCRIPTION
  max_card_est ........... 4
  fragment_id ............ 0
  parent_frag ............ (none)
  fragment_type .......... master
  join_type .............. inner
  join_method ............ in-order nested


TRAFODION_DELETE ==========================  SEQ_NO 2        NO CHILDREN
TABLE_NAME ............... TRAFODION.SCH.T010T2
REQUESTS_IN .............. 1
ROWS_OUT ................. 1
EST_OPER_COST ............ 0
EST_TOTAL_COST ........... 0
DESCRIPTION
  max_card_est .......... 99
  fragment_id ............ 0
  parent_frag ............ (none)
  fragment_type .......... master
  iud_type ............... trafodion_delete TRAFODION.SCH.T010T2
  begin_key .............. (A = A) and (B = %('a')) and (C = C)
  end_key ................ (A = A) and (B = %('a')) and (C = C)


TRAFODION_SCAN ============================  SEQ_NO 1        NO CHILDREN
TABLE_NAME ............... T010T2
REQUESTS_IN .............. 1
ROWS_OUT ................. 4
EST_OPER_COST ............ 0
EST_TOTAL_COST ........... 0
DESCRIPTION
  max_card_est .......... 99
  fragment_id ............ 0
  parent_frag ............ (none)
  fragment_type .......... master
  scan_type .............. subset scan limited by mdam of table
                             TRAFODION.SCH.T010T2
  cache_size ........... 100
  probes ................. 1
  rows_accessed ........ 100
  key_columns ............ A, B, C
  executor_predicates .... (B = %('a'))
  mdam_disjunct .......... (((A = 2) or (A = 4)) or (A = 6)) and ((C = 1) or (C
                             = 3)) and (B = %('a'))

--- SQL operation complete.
>>explain y5;

------------------------------------------------------------------ PLAN SUMMARY
MODULE_NAME .............. DYNAMICALLY COMPILED
STATEMENT_NAME ........... Y5
PLAN_ID .................. 212277210214223763
ROWS_OUT ................. 2
EST_TOTAL_COST ........... 0
STATEMENT ................ update t010t2
                           set d='uuu'
                           where a=4 and b in ('a', 'b') and c < 2;


------------------------------------------------------------------ NODE LISTING
ROOT ======================================  SEQ_NO 2        ONLY CHILD 1
REQUESTS_IN .............. 1
ROWS_OUT ................. 2
EST_OPER_COST ............ 0
EST_TOTAL_COST ........... 0
DESCRIPTION
  olt_optimization ....... used
  max_card_est ........... 2
  fragment_id ............ 0
  parent_frag ............ (none)
  fragment_type .......... master
  statement_index ........ 0
  affinity_value ......... 0
  max_max_cardinality .... 2
  total_overflow_size .... 0.00 KB
  upd_action_on_error .... xn_rollback
  xn_access_mode ......... read_only
  xn_autoabort_interval    0
  auto_query_retry ....... enabled
  plan_version ....... 2,600
  embedded_arkcmp ........ used
  IS_SQLCI ............... ON
  LDAP_USERNAME
  MODE_SEABASE ........... ON
  SEABASE_VOLATILE_TABLES  ON
  HBASE_ASYNC_DROP_TABLE   OFF
  SCHEMA ................. TRAFODION.SCH
  HBASE_MAX_COLUMN_NAME_  10
  HBASE_MAX_COLUMN_VAL_L  20
  HBASE_MAX_COLUMN_INFO_  60
  HBASE_SERIALIZATION .... ON
  HBASE_FILTER_PREDS ..... ON
  QUERY_CACHE ........ 1,024
  MDAM_SCAN_METHOD ....... ON
  HBASE_MAX_NUM_SEARCH_KE  1
  input_variables ........ %('uuu'), %(4)


TRAFODION_UPDATE ==========================  SEQ_NO 1        NO CHILDREN
TABLE_NAME ............... TRAFODION.SCH.T010T2
REQUESTS_IN .............. 1
ROWS_OUT ................. 2
EST_OPER_COST ............ 0
EST_TOTAL_COST ........... 0
DESCRIPTION
  max_card_est ........... 2
  fragment_id ............ 0
  parent_frag ............ (none)
  fragment_type .......... master
  iud_type ............... trafodion_update TRAFODION.SCH.T010T2
  new_rec_expr ........... (D assign %('uuu'))
  predicate .............. (C < 2) and ((B = 'a') or (B = 'b'))
  begin_key .............. (A = %(4)) and (B = '<min>') and (C = <min>)
  end_key ................ (A = %(4)) and (B = '<max>') and (C = 2)

--- SQL operation complete.
>>
>>select "_SALT_", * from t010t3 order by a,b,c;

_SALT_      A            B           C            D         
----------  -----------  ----------  -----------  ----------

         2            1  a                     1  1a1       
         2            1  a                     3  1a3       
         2            1  a                     5  1a5       
         1            1  c                     1  1c1       
         3            2  a                     1  2a1       
         3            2  a                     2  2a2       
         0            2  c                     3  2c3       
         2            4  a                     1  4a1       
         1            4  b                     1  4b1       
         1            4  b                     2  4b2       

--- 10 row(s) selected.
>>select "_SALT_", * from t010t3 where a=1 and b='c';

_SALT_      A            B           C            D         
----------  -----------  ----------  -----------  ----------

         1            1  c                     1  1c1       

--- 1 row(s) selected.
>>
>>update t010t3 set d='2axu' where a=2 and b='a';

--- 2 row(s) updated.
>>-- 2 rows updated
>>update t010t3 set d='4b1u' where a=4 and b='b' and c <= 1;

--- 1 row(s) updated.
>>-- 1 row updated
>>update t010t3 set a=3 where a=2;

--- 3 row(s) updated.
>>-- 3 rows updated
>>delete from t010t3 where a=3 and b='c' and c=3;

--- 1 row(s) deleted.
>>-- 1 row deleted
>>delete from t010t3 where d like '2%u %';

--- 2 row(s) deleted.
>>-- 2 rows deleted
>>select "_SALT_", * from t010t3;

_SALT_      A            B           C            D         
----------  -----------  ----------  -----------  ----------

         1            1  c                     1  1c1       
         1            4  b                     1  4b1u      
         1            4  b                     2  4b2       
         2            1  a                     1  1a1       
         2            1  a                     3  1a3       
         2            1  a                     5  1a5       
         2            4  a                     1  4a1       

--- 7 row(s) selected.
>>-- 7 rows
>>merge into t010t3
+>  using (select * from t010t2) as src
+>  on ((src.a, src.b, src.c) = (a,b,c))
+>when matched
+>  then update set d = src.d
+>when not matched
+>  then insert values (src.a, src.b, src.c, src.d)
+>;

--- 10 row(s) updated.
>>-- 10 rows updated
>>select "_SALT_", * from t010t2 natural join t010t3 order by a,b,c;

_SALT_      A            B           C            D         
----------  -----------  ----------  -----------  ----------

         2            1  a                     1  1a1       
         2            1  a                     3  1a3       
         2            1  a                     5  1a5       
         1            1  c                     1  1c1       
         3            2  a                     1  2a1       
         3            2  a                     2  2a2       
         0            2  c                     3  2c3       
         2            4  a                     1  uuu       
         1            4  b                     1  uuu       
         1            4  b                     2  4b2       

--- 10 row(s) selected.
>>-- expect 10 rows, same as each individual table
>>
>>select "_SALT_", * from table(table t010t3, partition number 4);

_SALT_      A            B           C            D         
----------  -----------  ----------  -----------  ----------

         3            2  a                     1  2a1       
         3            2  a                     2  2a2       

--- 2 row(s) selected.
>>select "_SALT_", * from table(table t010t3, partition number from 1 to 3);

_SALT_      A            B           C            D         
----------  -----------  ----------  -----------  ----------

         0            2  c                     3  2c3       
         1            1  c                     1  1c1       
         1            4  b                     1  uuu       
         1            4  b                     2  4b2       
         2            1  a                     1  1a1       
         2            1  a                     3  1a3       
         2            1  a                     5  1a5       
         2            4  a                     1  uuu       

--- 8 row(s) selected.
>>-- 2 statements above must return 10 rows total
>>
>>
>>-- query_cache off, mdam_scan_method on
>>cqd query_cache '0';

--- SQL operation complete.
>>cqd mdam_scan_method 'ON';

--- SQL operation complete.
>>obey TEST010(clean_up);
>>--------------------------------------------------------------------------
>>drop table if exists t010t1;

--- SQL operation complete.
>>drop table if exists t010t2;

--- SQL operation complete.
>>drop table if exists t010t3;

--- SQL operation complete.
>>
>>obey TEST010(tests);
>>--------------------------------------------------------------------------
>>
>>create table if not exists t010t1 (a int not null, b char(10), primary key(a));

--- SQL operation complete.
>>create table if not exists t010t2 (a int not null, b char(10) not null, c int not null, d char(10), primary key(a,b,c));

--- SQL operation complete.
>>create table if not exists t010t3 (a int not null, b char(10) not null, c int not null, d char(10), primary key(a,b,c))
+>  salt using 4 partitions on (a,b);

--- SQL operation complete.
>>
>>invoke t010t1;

-- Definition of Trafodion table TRAFODION.SCH.T010T1
-- Definition current  Thu Sep 11 15:43:55 2014

  (
    A                                INT NO DEFAULT NOT NULL NOT DROPPABLE
  , B                                CHAR(10) CHARACTER SET ISO88591 COLLATE
      DEFAULT DEFAULT NULL
  )

--- SQL operation complete.
>>invoke hbase."_CELL_"."TRAFODION.SCH.T010T1";

-- Definition of Trafodion table HBASE."_CELL_"."TRAFODION.SCH.T010T1"
-- Definition current  Thu Sep 11 15:43:55 2014

  (
    ROW_ID                           VARCHAR(10) CHARACTER SET ISO88591 COLLATE
      DEFAULT NO DEFAULT NOT NULL NOT DROPPABLE
  , COL_FAMILY                       VARCHAR(10) CHARACTER SET ISO88591 COLLATE
      DEFAULT NO DEFAULT NOT NULL NOT DROPPABLE
  , COL_NAME                         VARCHAR(10) CHARACTER SET ISO88591 COLLATE
      DEFAULT NO DEFAULT NOT NULL NOT DROPPABLE
  , COL_TIMESTAMP                    LARGEINT NO DEFAULT NOT NULL NOT DROPPABLE
  , COL_VALUE                        VARCHAR(20) CHARACTER SET ISO88591 COLLATE
      DEFAULT NO DEFAULT NOT NULL NOT DROPPABLE
  )

--- SQL operation complete.
>>invoke hbase."_ROW_"."TRAFODION.SCH.T010T1";

-- Definition of Trafodion table HBASE."_ROW_"."TRAFODION.SCH.T010T1"
-- Definition current  Thu Sep 11 15:43:55 2014

  (
    ROW_ID                           VARCHAR(10) CHARACTER SET ISO88591 COLLATE
      DEFAULT NO DEFAULT NOT NULL NOT DROPPABLE
  , COLUMN_DETAILS                   VARCHAR(60) CHARACTER SET ISO88591 COLLATE
      DEFAULT NO DEFAULT NOT NULL NOT DROPPABLE
  )

--- SQL operation complete.
>>
>>insert into t010t1 values (1, 'a'), (2, 'b'), (3, 'c');

--- 3 row(s) inserted.
>>
>>select * from t010t1;

A            B         
-----------  ----------

          1  a         
          2  b         
          3  c         

--- 3 row(s) selected.
>>
>>select * from t010t1 where a = 2;

A            B         
-----------  ----------

          2  b         

--- 1 row(s) selected.
>>
>>select * from t010t1 where a = 2 or a = 3;

A            B         
-----------  ----------

          2  b         
          3  c         

--- 2 row(s) selected.
>>
>>delete from t010t1 where a = 4;

--- 0 row(s) deleted.
>>
>>select * from t010t1;

A            B         
-----------  ----------

          1  a         
          2  b         
          3  c         

--- 3 row(s) selected.
>>
>>delete from t010t1 where a = 2;

--- 1 row(s) deleted.
>>
>>select * from t010t1;

A            B         
-----------  ----------

          1  a         
          3  c         

--- 2 row(s) selected.
>>
>>select converttohex(cast(row_id as char(4))) rowid,
+>          converttohex(cast(col_family as char(2))) colfamily,
+>          converttohex(cast(col_name as char(1))) colname,
+>          converttohex(cast(col_value as char(4))) colvalue
+>                from hbase."_CELL_"."TRAFODION.SCH.T010T1";

ROWID     COLFAMILY  COLNAME  COLVALUE
--------  ---------  -------  --------

80000001  2331       01       80000001
80000001  2331       02       00612020
80000003  2331       01       80000003
80000003  2331       02       00632020

--- 4 row(s) selected.
>>
>>select converttohex(cast(row_id as char(4))) rowid,
+>          converttohex(cast(col_family as char(2))) colfamily,
+>          converttohex(cast(col_name as char(1))) colname,
+>          converttohex(cast(col_value as char(4))) colvalue
+>                from hbase."_CELL_"."TRAFODION.SCH.T010T1"
+>          where converttohex(cast(row_id as char(4))) = '80000001';

ROWID     COLFAMILY  COLNAME  COLVALUE
--------  ---------  -------  --------

80000001  2331       01       80000001
80000001  2331       02       00612020

--- 2 row(s) selected.
>>
>>select converttohex(cast(row_id as char(4))) rowid,
+>          converttohex(cast(column_details as char(40))) coldetails
+>                 from hbase."_ROW_"."TRAFODION.SCH.T010T1";

ROWID     COLDETAILS
--------  --------------------------------------------------------------------------------

80000001  040023313A010400000080000001040023313A020B00000000612020202020202020202020202020
80000003  040023313A010400000080000003040023313A020B00000000632020202020202020202020202020

--- 2 row(s) selected.
>>select converttohex(cast(row_id as char(4))) rowid,
+>          converttohex(cast(column_details as char(40))) coldetails
+>                 from hbase."_ROW_"."TRAFODION.SCH.T010T1"
+>          where converttohex(cast(row_id as char(4))) = '80000001';

ROWID     COLDETAILS
--------  --------------------------------------------------------------------------------

80000001  040023313A010400000080000001040023313A020B00000000612020202020202020202020202020

--- 1 row(s) selected.
>>
>>-------------------
>>-- check query plan
>>-------------------
>>
>>-- no sort operator should present when order by on primary key column
>>prepare xx from select * from t010t1 order by a;

--- SQL command prepared.
>>explain options 'f' xx;

LC   RC   OP   OPERATOR              OPT       DESCRIPTION           CARD
---- ---- ---- --------------------  --------  --------------------  ---------

1    .    2    root                                                  1.00E+002
.    .    1    trafodion_scan                  T010T1                1.00E+002

--- SQL operation complete.
>>
>>-- should see a sort when order by on non key column
>>prepare xx from select * from t010t1 order by b;

--- SQL command prepared.
>>explain options 'f' xx;

LC   RC   OP   OPERATOR              OPT       DESCRIPTION           CARD
---- ---- ---- --------------------  --------  --------------------  ---------

2    .    3    root                                                  1.00E+002
1    .    2    sort                                                  1.00E+002
.    .    1    trafodion_scan                  T010T1                1.00E+002

--- SQL operation complete.
>>
>>-- selectPred should present due to the 2nd disjunct b='1'
>>prepare xx from select * from t010t1 where a=1 or b='1';

--- SQL command prepared.
>>explain xx;

------------------------------------------------------------------ PLAN SUMMARY
MODULE_NAME .............. DYNAMICALLY COMPILED
STATEMENT_NAME ........... XX
PLAN_ID .................. 212277210236177974
ROWS_OUT ................ 11
EST_TOTAL_COST ........... 0.01
STATEMENT ................ select * from t010t1 where a=1 or b='1';


------------------------------------------------------------------ NODE LISTING
ROOT ======================================  SEQ_NO 2        ONLY CHILD 1
REQUESTS_IN .............. 1
ROWS_OUT ................ 11
EST_OPER_COST ............ 0
EST_TOTAL_COST ........... 0.01
DESCRIPTION
  max_card_est .......... 51
  fragment_id ............ 0
  parent_frag ............ (none)
  fragment_type .......... master
  statement_index ........ 0
  affinity_value ......... 0
  max_max_cardinality ... 11
  total_overflow_size .... 0.00 KB
  xn_access_mode ......... read_only
  xn_autoabort_interval    0
  auto_query_retry ....... enabled
  plan_version ....... 2,600
  embedded_arkcmp ........ used
  IS_SQLCI ............... ON
  LDAP_USERNAME
  MODE_SEABASE ........... ON
  SEABASE_VOLATILE_TABLES  ON
  HBASE_ASYNC_DROP_TABLE   OFF
  SCHEMA ................. TRAFODION.SCH
  HBASE_MAX_COLUMN_NAME_  10
  HBASE_MAX_COLUMN_VAL_L  20
  HBASE_MAX_COLUMN_INFO_  60
  HBASE_SERIALIZATION .... ON
  HBASE_FILTER_PREDS ..... ON
  QUERY_CACHE ............ 0
  MDAM_SCAN_METHOD ....... ON
  select_list ............ TRAFODION.SCH.T010T1.A, TRAFODION.SCH.T010T1.B


TRAFODION_SCAN ============================  SEQ_NO 1        NO CHILDREN
TABLE_NAME ............... T010T1
REQUESTS_IN .............. 1
ROWS_OUT ................ 11
EST_OPER_COST ............ 0.01
EST_TOTAL_COST ........... 0.01
DESCRIPTION
  max_card_est .......... 51
  fragment_id ............ 0
  parent_frag ............ (none)
  fragment_type .......... master
  scan_type .............. subset scan of table TRAFODION.SCH.T010T1
  columns ................ all
  begin_keys(incl)
  end_keys(incl)
  cache_size ........... 100
  probes ................. 1
  rows_accessed ........ 100
  key_columns ............ A
  executor_predicates .... ((A = 1) or (B = '1'))

--- SQL operation complete.
>>
>>-- Optimization: with only one disjunct, the selectPred should be empty
>>-- and the executor predicate should contain the non-key predicate
>>prepare xx from select * from t010t1 where a=1 and b='1';

--- SQL command prepared.
>>explain xx;

------------------------------------------------------------------ PLAN SUMMARY
MODULE_NAME .............. DYNAMICALLY COMPILED
STATEMENT_NAME ........... XX
PLAN_ID .................. 212277210236222121
ROWS_OUT ................. 1
EST_TOTAL_COST ........... 0.01
STATEMENT ................ select * from t010t1 where a=1 and b='1';


------------------------------------------------------------------ NODE LISTING
ROOT ======================================  SEQ_NO 2        ONLY CHILD 1
REQUESTS_IN .............. 1
ROWS_OUT ................. 1
EST_OPER_COST ............ 0
EST_TOTAL_COST ........... 0.01
DESCRIPTION
  olt_optimization ....... used
  max_card_est ........... 1
  fragment_id ............ 0
  parent_frag ............ (none)
  fragment_type .......... master
  statement_index ........ 0
  affinity_value ......... 0
  max_max_cardinality .... 1
  total_overflow_size .... 0.00 KB
  xn_access_mode ......... read_only
  xn_autoabort_interval    0
  auto_query_retry ....... enabled
  plan_version ....... 2,600
  embedded_arkcmp ........ used
  IS_SQLCI ............... ON
  LDAP_USERNAME
  MODE_SEABASE ........... ON
  SEABASE_VOLATILE_TABLES  ON
  HBASE_ASYNC_DROP_TABLE   OFF
  SCHEMA ................. TRAFODION.SCH
  HBASE_MAX_COLUMN_NAME_  10
  HBASE_MAX_COLUMN_VAL_L  20
  HBASE_MAX_COLUMN_INFO_  60
  HBASE_SERIALIZATION .... ON
  HBASE_FILTER_PREDS ..... ON
  QUERY_CACHE ............ 0
  MDAM_SCAN_METHOD ....... ON
  select_list ............ 1, '1'


TRAFODION_SCAN ============================  SEQ_NO 1        NO CHILDREN
TABLE_NAME ............... T010T1
REQUESTS_IN .............. 1
ROWS_OUT ................. 1
EST_OPER_COST ............ 0.01
EST_TOTAL_COST ........... 0.01
DESCRIPTION
  max_card_est ........... 1
  fragment_id ............ 0
  parent_frag ............ (none)
  fragment_type .......... master
  scan_type .............. subset scan of table TRAFODION.SCH.T010T1
  columns ................ all
  unique_rows ............ 1
  cache_size ........... 100
  probes ................. 1
  rows_accessed .......... 1
  key_columns ............ A
  executor_predicates .... (B = '1')

--- SQL operation complete.
>>
>>-- should see a full hbase SCAN
>>prepare xx from select * from t010t1 where b='1';

--- SQL command prepared.
>>explain xx;

------------------------------------------------------------------ PLAN SUMMARY
MODULE_NAME .............. DYNAMICALLY COMPILED
STATEMENT_NAME ........... XX
PLAN_ID .................. 212277210236264808
ROWS_OUT ................ 10
EST_TOTAL_COST ........... 0.01
STATEMENT ................ select * from t010t1 where b='1';


------------------------------------------------------------------ NODE LISTING
ROOT ======================================  SEQ_NO 2        ONLY CHILD 1
REQUESTS_IN .............. 1
ROWS_OUT ................ 10
EST_OPER_COST ............ 0
EST_TOTAL_COST ........... 0.01
DESCRIPTION
  max_card_est .......... 99
  fragment_id ............ 0
  parent_frag ............ (none)
  fragment_type .......... master
  statement_index ........ 0
  affinity_value ......... 0
  max_max_cardinality ... 10
  total_overflow_size .... 0.00 KB
  xn_access_mode ......... read_only
  xn_autoabort_interval    0
  auto_query_retry ....... enabled
  plan_version ....... 2,600
  embedded_arkcmp ........ used
  IS_SQLCI ............... ON
  LDAP_USERNAME
  MODE_SEABASE ........... ON
  SEABASE_VOLATILE_TABLES  ON
  HBASE_ASYNC_DROP_TABLE   OFF
  SCHEMA ................. TRAFODION.SCH
  HBASE_MAX_COLUMN_NAME_  10
  HBASE_MAX_COLUMN_VAL_L  20
  HBASE_MAX_COLUMN_INFO_  60
  HBASE_SERIALIZATION .... ON
  HBASE_FILTER_PREDS ..... ON
  QUERY_CACHE ............ 0
  MDAM_SCAN_METHOD ....... ON
  select_list ............ TRAFODION.SCH.T010T1.A, '1'


TRAFODION_SCAN ============================  SEQ_NO 1        NO CHILDREN
TABLE_NAME ............... T010T1
REQUESTS_IN .............. 1
ROWS_OUT ................ 10
EST_OPER_COST ............ 0.01
EST_TOTAL_COST ........... 0.01
DESCRIPTION
  max_card_est .......... 99
  fragment_id ............ 0
  parent_frag ............ (none)
  fragment_type .......... master
  scan_type .............. subset scan of table TRAFODION.SCH.T010T1
  columns ................ all
  begin_keys(incl)
  end_keys(incl)
  cache_size ........... 100
  probes ................. 1
  rows_accessed ........ 100
  key_columns ............ A
  executor_predicates .... (B = '1')

--- SQL operation complete.
>>
>>-- should see a unique hbase GET 
>>prepare xx from select * from t010t1 where a=1;

--- SQL command prepared.
>>explain xx;

------------------------------------------------------------------ PLAN SUMMARY
MODULE_NAME .............. DYNAMICALLY COMPILED
STATEMENT_NAME ........... XX
PLAN_ID .................. 212277210236308506
ROWS_OUT ................. 1
EST_TOTAL_COST ........... 0.01
STATEMENT ................ select * from t010t1 where a=1;


------------------------------------------------------------------ NODE LISTING
ROOT ======================================  SEQ_NO 2        ONLY CHILD 1
REQUESTS_IN .............. 1
ROWS_OUT ................. 1
EST_OPER_COST ............ 0
EST_TOTAL_COST ........... 0.01
DESCRIPTION
  olt_optimization ....... used
  max_card_est ........... 1
  fragment_id ............ 0
  parent_frag ............ (none)
  fragment_type .......... master
  statement_index ........ 0
  affinity_value ......... 0
  max_max_cardinality .... 1
  total_overflow_size .... 0.00 KB
  xn_access_mode ......... read_only
  xn_autoabort_interval    0
  auto_query_retry ....... enabled
  plan_version ....... 2,600
  embedded_arkcmp ........ used
  IS_SQLCI ............... ON
  LDAP_USERNAME
  MODE_SEABASE ........... ON
  SEABASE_VOLATILE_TABLES  ON
  HBASE_ASYNC_DROP_TABLE   OFF
  SCHEMA ................. TRAFODION.SCH
  HBASE_MAX_COLUMN_NAME_  10
  HBASE_MAX_COLUMN_VAL_L  20
  HBASE_MAX_COLUMN_INFO_  60
  HBASE_SERIALIZATION .... ON
  HBASE_FILTER_PREDS ..... ON
  QUERY_CACHE ............ 0
  MDAM_SCAN_METHOD ....... ON
  select_list ............ 1, TRAFODION.SCH.T010T1.B


TRAFODION_SCAN ============================  SEQ_NO 1        NO CHILDREN
TABLE_NAME ............... T010T1
REQUESTS_IN .............. 1
ROWS_OUT ................. 1
EST_OPER_COST ............ 0.01
EST_TOTAL_COST ........... 0.01
DESCRIPTION
  max_card_est ........... 1
  fragment_id ............ 0
  parent_frag ............ (none)
  fragment_type .......... master
  scan_type .............. subset scan of table TRAFODION.SCH.T010T1
  columns ................ all
  unique_rows ............ 1
  cache_size ........... 100
  probes ................. 1
  rows_accessed .......... 1
  key_columns ............ A

--- SQL operation complete.
>>
>>insert into t010t2 values
+>(1, 'a', 1, '1a1'),
+>(1, 'a', 3, '1a3'),
+>(1, 'a', 5, '1a5'),
+>(1, 'c', 1, '1c1'),
+>(2, 'a', 1, '2a1'),
+>(2, 'a', 2, '2a2'),
+>(2, 'c', 3, '2c3'),
+>(4, 'a', 1, '4a1'),
+>(4, 'b', 1, '4b1'),
+>(4, 'b', 2, '4b2');

--- 10 row(s) inserted.
>>
>>insert into t010t3 select * from t010t2;

--- 10 row(s) inserted.
>>
>>prepare x1 from
+>select * from t010t2 where a in (1,4) and b='a' and c = 1;

--- SQL command prepared.
>>
>>execute x1;

A            B           C            D         
-----------  ----------  -----------  ----------

          1  a                     1  1a1       
          4  a                     1  4a1       

--- 2 row(s) selected.
>>-- expect 1a1, 4a1
>>
>>prepare x2 from
+>select * from t010t2 where a in (1,2,4) and b='a' and (c in (1,3) or c>=5);

--- SQL command prepared.
>>execute x2;

A            B           C            D         
-----------  ----------  -----------  ----------

          1  a                     1  1a1       
          1  a                     3  1a3       
          1  a                     5  1a5       
          2  a                     1  2a1       
          4  a                     1  4a1       

--- 5 row(s) selected.
>>-- expect 1a1, 1a3, 1a5, 2a1, 4a1
>>
>>prepare x3 from
+>select * from t010t2 where a in (1,2,4) and b='a' and c in (1,3);

--- SQL command prepared.
>>execute x3;

A            B           C            D         
-----------  ----------  -----------  ----------

          1  a                     1  1a1       
          1  a                     3  1a3       
          2  a                     1  2a1       
          4  a                     1  4a1       

--- 4 row(s) selected.
>>-- expect 1a1, 1a3, 2a1, 4a1
>>
>>prepare x4 from
+>delete from t010t2 where a in (2,4,6) and b='a' and c in (1,3);

--- SQL command prepared.
>>execute x4;

--- 2 row(s) deleted.
>>-- expect 2 rows deleted, 2a1 and 4a1
>>execute x3;

A            B           C            D         
-----------  ----------  -----------  ----------

          1  a                     1  1a1       
          1  a                     3  1a3       

--- 2 row(s) selected.
>>-- expect 1a1, 1a3
>>
>>insert into t010t2 values
+>(2, 'a', 1, '2a1'),
+>(4, 'a', 1, '4a1');

--- 2 row(s) inserted.
>>
>>prepare x5 from 
+>update t010t2 set d='upd' where a=4 and b in ('a', 'b') and c < 2;

--- SQL command prepared.
>>execute x5;

--- 2 row(s) updated.
>>-- execute 2 rows updated, 4a1 and 4b1
>>select * from t010t2;

A            B           C            D         
-----------  ----------  -----------  ----------

          1  a                     1  1a1       
          1  a                     3  1a3       
          1  a                     5  1a5       
          1  c                     1  1c1       
          2  a                     1  2a1       
          2  a                     2  2a2       
          2  c                     3  2c3       
          4  a                     1  upd       
          4  b                     1  upd       
          4  b                     2  4b2       

--- 10 row(s) selected.
>>
>>cqd HBASE_MAX_NUM_SEARCH_KEYS '1';

--- SQL operation complete.
>>
>>prepare y1 from
+>select * from t010t2 where a in (1,4) and b='a' and c = 1;

--- SQL command prepared.
>>execute y1;

A            B           C            D         
-----------  ----------  -----------  ----------

          1  a                     1  1a1       
          4  a                     1  upd       

--- 2 row(s) selected.
>>-- expect 1a1, 4a1
>>
>>prepare y2 from
+>select * from t010t2 where a in (1,2,4) and b='a' and (c in (1,3) or c>=5);

--- SQL command prepared.
>>execute y2;

A            B           C            D         
-----------  ----------  -----------  ----------

          1  a                     1  1a1       
          1  a                     3  1a3       
          1  a                     5  1a5       
          2  a                     1  2a1       
          4  a                     1  upd       

--- 5 row(s) selected.
>>-- expect 1a1, 1a3, 1a5, 2a1, 4a1
>>
>>prepare y3 from
+>select * from t010t2 where a in (1,2,4) and b='a' and c in (1,3);

--- SQL command prepared.
>>execute y3;

A            B           C            D         
-----------  ----------  -----------  ----------

          1  a                     1  1a1       
          1  a                     3  1a3       
          2  a                     1  2a1       
          4  a                     1  upd       

--- 4 row(s) selected.
>>-- expect 1a1, 1a3, 2a1, 4a1
>>
>>prepare y4 from
+>delete from t010t2 where a in (2,4,6) and b='a' and c in (1,3);

--- SQL command prepared.
>>execute y4;

--- 2 row(s) deleted.
>>-- expect 2 rows deleted, 2a1 and 4a1
>>execute y3;

A            B           C            D         
-----------  ----------  -----------  ----------

          1  a                     1  1a1       
          1  a                     3  1a3       

--- 2 row(s) selected.
>>-- expect 1a1, 1a3
>>
>>insert into t010t2 values
+>(2, 'a', 1, '2a1'),
+>(4, 'a', 1, '4a1');

--- 2 row(s) inserted.
>>
>>prepare y5 from 
+>update t010t2 set d='uuu' where a=4 and b in ('a', 'b') and c < 2;

--- SQL command prepared.
>>execute y5;

--- 2 row(s) updated.
>>-- execute 2 rows updated, 4a1 and 4b1
>>select * from t010t2;

A            B           C            D         
-----------  ----------  -----------  ----------

          1  a                     1  1a1       
          1  a                     3  1a3       
          1  a                     5  1a5       
          1  c                     1  1c1       
          2  a                     1  2a1       
          2  a                     2  2a2       
          2  c                     3  2c3       
          4  a                     1  uuu       
          4  b                     1  uuu       
          4  b                     2  4b2       

--- 10 row(s) selected.
>>
>>cqd HBASE_MAX_NUM_SEARCH_KEYS reset;

--- SQL operation complete.
>>
>>explain x1;

------------------------------------------------------------------ PLAN SUMMARY
MODULE_NAME .............. DYNAMICALLY COMPILED
STATEMENT_NAME ........... X1
PLAN_ID .................. 212277210237814078
ROWS_OUT ................. 2
EST_TOTAL_COST ........... 0
STATEMENT ................ select *
                           from t010t2
                           where a in (1,4) and b='a' and c = 1;


------------------------------------------------------------------ NODE LISTING
ROOT ======================================  SEQ_NO 2        ONLY CHILD 1
REQUESTS_IN .............. 1
ROWS_OUT ................. 2
EST_OPER_COST ............ 0
EST_TOTAL_COST ........... 0
DESCRIPTION
  max_card_est .......... 99
  fragment_id ............ 0
  parent_frag ............ (none)
  fragment_type .......... master
  statement_index ........ 0
  affinity_value ......... 0
  max_max_cardinality .... 2
  total_overflow_size .... 0.00 KB
  xn_access_mode ......... read_only
  xn_autoabort_interval    0
  auto_query_retry ....... enabled
  plan_version ....... 2,600
  embedded_arkcmp ........ used
  IS_SQLCI ............... ON
  LDAP_USERNAME
  MODE_SEABASE ........... ON
  SEABASE_VOLATILE_TABLES  ON
  HBASE_ASYNC_DROP_TABLE   OFF
  SCHEMA ................. TRAFODION.SCH
  HBASE_MAX_COLUMN_NAME_  10
  HBASE_MAX_COLUMN_VAL_L  20
  HBASE_MAX_COLUMN_INFO_  60
  HBASE_SERIALIZATION .... ON
  HBASE_FILTER_PREDS ..... ON
  QUERY_CACHE ............ 0
  MDAM_SCAN_METHOD ....... ON
  select_list ............ TRAFODION.SCH.T010T2.A, 'a', 1,
                             TRAFODION.SCH.T010T2.D


TRAFODION_SCAN ============================  SEQ_NO 1        NO CHILDREN
TABLE_NAME ............... T010T2
REQUESTS_IN .............. 1
ROWS_OUT ................. 2
EST_OPER_COST ............ 0
EST_TOTAL_COST ........... 0
DESCRIPTION
  max_card_est .......... 99
  fragment_id ............ 0
  parent_frag ............ (none)
  fragment_type .......... master
  scan_type .............. subset scan limited by mdam of table
                             TRAFODION.SCH.T010T2
  cache_size ........... 100
  probes ................. 1
  rows_accessed ........ 100
  key_columns ............ A, B, C
  mdam_disjunct .......... ((A = 1) or (A = 4)) and (B = 'a') and (C = 1)

--- SQL operation complete.
>>explain x2;

------------------------------------------------------------------ PLAN SUMMARY
MODULE_NAME .............. DYNAMICALLY COMPILED
STATEMENT_NAME ........... X2
PLAN_ID .................. 212277210237866224
ROWS_OUT ................. 5
EST_TOTAL_COST ........... 0
STATEMENT ................ select *
                           from t010t2
                           where a in (1,2,4) and b='a' and (c in (1,
                             3) or c>=5);


------------------------------------------------------------------ NODE LISTING
ROOT ======================================  SEQ_NO 2        ONLY CHILD 1
REQUESTS_IN .............. 1
ROWS_OUT ................. 5
EST_OPER_COST ............ 0
EST_TOTAL_COST ........... 0
DESCRIPTION
  max_card_est .......... 99
  fragment_id ............ 0
  parent_frag ............ (none)
  fragment_type .......... master
  statement_index ........ 0
  affinity_value ......... 0
  max_max_cardinality .... 5
  total_overflow_size .... 0.00 KB
  xn_access_mode ......... read_only
  xn_autoabort_interval    0
  auto_query_retry ....... enabled
  plan_version ....... 2,600
  embedded_arkcmp ........ used
  IS_SQLCI ............... ON
  LDAP_USERNAME
  MODE_SEABASE ........... ON
  SEABASE_VOLATILE_TABLES  ON
  HBASE_ASYNC_DROP_TABLE   OFF
  SCHEMA ................. TRAFODION.SCH
  HBASE_MAX_COLUMN_NAME_  10
  HBASE_MAX_COLUMN_VAL_L  20
  HBASE_MAX_COLUMN_INFO_  60
  HBASE_SERIALIZATION .... ON
  HBASE_FILTER_PREDS ..... ON
  QUERY_CACHE ............ 0
  MDAM_SCAN_METHOD ....... ON
  select_list ............ TRAFODION.SCH.T010T2.A, 'a', TRAFODION.SCH.T010T2.C,
                             TRAFODION.SCH.T010T2.D


TRAFODION_SCAN ============================  SEQ_NO 1        NO CHILDREN
TABLE_NAME ............... T010T2
REQUESTS_IN .............. 1
ROWS_OUT ................. 5
EST_OPER_COST ............ 0
EST_TOTAL_COST ........... 0
DESCRIPTION
  max_card_est .......... 99
  fragment_id ............ 0
  parent_frag ............ (none)
  fragment_type .......... master
  scan_type .............. subset scan limited by mdam of table
                             TRAFODION.SCH.T010T2
  cache_size ........... 100
  probes ................. 1
  rows_accessed ........ 100
  key_columns ............ A, B, C
  mdam_disjunct .......... (((A = 1) or (A = 2)) or (A = 4)) and (B = 'a') and
                             (((C = 1) or (C = 3)) or (C >= 5))

--- SQL operation complete.
>>explain x3;

------------------------------------------------------------------ PLAN SUMMARY
MODULE_NAME .............. DYNAMICALLY COMPILED
STATEMENT_NAME ........... X3
PLAN_ID .................. 212277210237932786
ROWS_OUT ................. 4
EST_TOTAL_COST ........... 0
STATEMENT ................ select *
                           from t010t2
                           where a in (1,2,4) and b='a' and c in (1,3);


------------------------------------------------------------------ NODE LISTING
ROOT ======================================  SEQ_NO 2        ONLY CHILD 1
REQUESTS_IN .............. 1
ROWS_OUT ................. 4
EST_OPER_COST ............ 0
EST_TOTAL_COST ........... 0
DESCRIPTION
  max_card_est .......... 99
  fragment_id ............ 0
  parent_frag ............ (none)
  fragment_type .......... master
  statement_index ........ 0
  affinity_value ......... 0
  max_max_cardinality .... 4
  total_overflow_size .... 0.00 KB
  xn_access_mode ......... read_only
  xn_autoabort_interval    0
  auto_query_retry ....... enabled
  plan_version ....... 2,600
  embedded_arkcmp ........ used
  IS_SQLCI ............... ON
  LDAP_USERNAME
  MODE_SEABASE ........... ON
  SEABASE_VOLATILE_TABLES  ON
  HBASE_ASYNC_DROP_TABLE   OFF
  SCHEMA ................. TRAFODION.SCH
  HBASE_MAX_COLUMN_NAME_  10
  HBASE_MAX_COLUMN_VAL_L  20
  HBASE_MAX_COLUMN_INFO_  60
  HBASE_SERIALIZATION .... ON
  HBASE_FILTER_PREDS ..... ON
  QUERY_CACHE ............ 0
  MDAM_SCAN_METHOD ....... ON
  select_list ............ TRAFODION.SCH.T010T2.A, 'a', TRAFODION.SCH.T010T2.C,
                             TRAFODION.SCH.T010T2.D


TRAFODION_SCAN ============================  SEQ_NO 1        NO CHILDREN
TABLE_NAME ............... T010T2
REQUESTS_IN .............. 1
ROWS_OUT ................. 4
EST_OPER_COST ............ 0
EST_TOTAL_COST ........... 0
DESCRIPTION
  max_card_est .......... 99
  fragment_id ............ 0
  parent_frag ............ (none)
  fragment_type .......... master
  scan_type .............. subset scan limited by mdam of table
                             TRAFODION.SCH.T010T2
  cache_size ........... 100
  probes ................. 1
  rows_accessed ........ 100
  key_columns ............ A, B, C
  mdam_disjunct .......... (((A = 1) or (A = 2)) or (A = 4)) and ((C = 1) or (C
                             = 3)) and (B = 'a')

--- SQL operation complete.
>>explain x4;

------------------------------------------------------------------ PLAN SUMMARY
MODULE_NAME .............. DYNAMICALLY COMPILED
STATEMENT_NAME ........... X4
PLAN_ID .................. 212277210237996654
ROWS_OUT ................. 4
EST_TOTAL_COST ........... 0.01
STATEMENT ................ delete from t010t2
                           where a in (2,4,6) and b='a' and c in (1,3);


------------------------------------------------------------------ NODE LISTING
ROOT ======================================  SEQ_NO 4        ONLY CHILD 3
REQUESTS_IN .............. 1
ROWS_OUT ................. 4
EST_OPER_COST ............ 0
EST_TOTAL_COST ........... 0.01
DESCRIPTION
  max_card_est ........... 4
  fragment_id ............ 0
  parent_frag ............ (none)
  fragment_type .......... master
  statement_index ........ 0
  affinity_value ......... 0
  max_max_cardinality .... 4
  total_overflow_size .... 0.00 KB
  upd_action_on_error .... xn_rollback
  xn_access_mode ......... read_only
  xn_autoabort_interval    0
  auto_query_retry ....... enabled
  plan_version ....... 2,600
  embedded_arkcmp ........ used
  IS_SQLCI ............... ON
  LDAP_USERNAME
  MODE_SEABASE ........... ON
  SEABASE_VOLATILE_TABLES  ON
  HBASE_ASYNC_DROP_TABLE   OFF
  SCHEMA ................. TRAFODION.SCH
  HBASE_MAX_COLUMN_NAME_  10
  HBASE_MAX_COLUMN_VAL_L  20
  HBASE_MAX_COLUMN_INFO_  60
  HBASE_SERIALIZATION .... ON
  HBASE_FILTER_PREDS ..... ON
  QUERY_CACHE ............ 0
  MDAM_SCAN_METHOD ....... ON


TUPLE_FLOW ================================  SEQ_NO 3        CHILDREN 1, 2
REQUESTS_IN .............. 1
ROWS_OUT ................. 4
EST_OPER_COST ............ 0.01
EST_TOTAL_COST ........... 0.01
DESCRIPTION
  max_card_est ........... 4
  fragment_id ............ 0
  parent_frag ............ (none)
  fragment_type .......... master
  join_type .............. inner
  join_method ............ in-order nested


TRAFODION_DELETE ==========================  SEQ_NO 2        NO CHILDREN
TABLE_NAME ............... TRAFODION.SCH.T010T2
REQUESTS_IN .............. 1
ROWS_OUT ................. 1
EST_OPER_COST ............ 0
EST_TOTAL_COST ........... 0
DESCRIPTION
  max_card_est .......... 99
  fragment_id ............ 0
  parent_frag ............ (none)
  fragment_type .......... master
  iud_type ............... trafodion_delete TRAFODION.SCH.T010T2
  begin_key .............. (A = A) and (B = 'a') and (C = C)
  end_key ................ (A = A) and (B = 'a') and (C = C)


TRAFODION_SCAN ============================  SEQ_NO 1        NO CHILDREN
TABLE_NAME ............... T010T2
REQUESTS_IN .............. 1
ROWS_OUT ................. 4
EST_OPER_COST ............ 0
EST_TOTAL_COST ........... 0
DESCRIPTION
  max_card_est .......... 99
  fragment_id ............ 0
  parent_frag ............ (none)
  fragment_type .......... master
  scan_type .............. subset scan limited by mdam of table
                             TRAFODION.SCH.T010T2
  cache_size ........... 100
  probes ................. 1
  rows_accessed ........ 100
  key_columns ............ A, B, C
  executor_predicates .... (B = 'a')
  mdam_disjunct .......... (((A = 2) or (A = 4)) or (A = 6)) and ((C = 1) or (C
                             = 3)) and (B = 'a')

--- SQL operation complete.
>>explain x5;

------------------------------------------------------------------ PLAN SUMMARY
MODULE_NAME .............. DYNAMICALLY COMPILED
STATEMENT_NAME ........... X5
PLAN_ID .................. 212277210238105510
ROWS_OUT ................. 2
EST_TOTAL_COST ........... 0
STATEMENT ................ update t010t2
                           set d='upd'
                           where a=4 and b in ('a', 'b') and c < 2;


------------------------------------------------------------------ NODE LISTING
ROOT ======================================  SEQ_NO 2        ONLY CHILD 1
REQUESTS_IN .............. 1
ROWS_OUT ................. 2
EST_OPER_COST ............ 0
EST_TOTAL_COST ........... 0
DESCRIPTION
  olt_optimization ....... used
  max_card_est ........... 2
  fragment_id ............ 0
  parent_frag ............ (none)
  fragment_type .......... master
  statement_index ........ 0
  affinity_value ......... 0
  max_max_cardinality .... 2
  total_overflow_size .... 0.00 KB
  upd_action_on_error .... xn_rollback
  xn_access_mode ......... read_only
  xn_autoabort_interval    0
  auto_query_retry ....... enabled
  plan_version ....... 2,600
  embedded_arkcmp ........ used
  IS_SQLCI ............... ON
  LDAP_USERNAME
  MODE_SEABASE ........... ON
  SEABASE_VOLATILE_TABLES  ON
  HBASE_ASYNC_DROP_TABLE   OFF
  SCHEMA ................. TRAFODION.SCH
  HBASE_MAX_COLUMN_NAME_  10
  HBASE_MAX_COLUMN_VAL_L  20
  HBASE_MAX_COLUMN_INFO_  60
  HBASE_SERIALIZATION .... ON
  HBASE_FILTER_PREDS ..... ON
  QUERY_CACHE ............ 0
  MDAM_SCAN_METHOD ....... ON


TRAFODION_UPDATE ==========================  SEQ_NO 1        NO CHILDREN
TABLE_NAME ............... TRAFODION.SCH.T010T2
REQUESTS_IN .............. 1
ROWS_OUT ................. 2
EST_OPER_COST ............ 0
EST_TOTAL_COST ........... 0
DESCRIPTION
  max_card_est ........... 2
  fragment_id ............ 0
  parent_frag ............ (none)
  fragment_type .......... master
  iud_type ............... trafodion_update TRAFODION.SCH.T010T2
  columns ................ all
  begin_keys(incl) ....... 4,a,-2147483648
  end_keys(excl) ......... 4,a,2
  columns ................ all
  begin_keys(incl) ....... 4,b,-2147483648
  end_keys(excl) ......... 4,b,2
  new_rec_expr ........... (D assign 'upd')

--- SQL operation complete.
>>explain y1;

------------------------------------------------------------------ PLAN SUMMARY
MODULE_NAME .............. DYNAMICALLY COMPILED
STATEMENT_NAME ........... Y1
PLAN_ID .................. 212277210238153092
ROWS_OUT ................. 2
EST_TOTAL_COST ........... 0
STATEMENT ................ select *
                           from t010t2
                           where a in (1,4) and b='a' and c = 1;


------------------------------------------------------------------ NODE LISTING
ROOT ======================================  SEQ_NO 2        ONLY CHILD 1
REQUESTS_IN .............. 1
ROWS_OUT ................. 2
EST_OPER_COST ............ 0
EST_TOTAL_COST ........... 0
DESCRIPTION
  max_card_est .......... 99
  fragment_id ............ 0
  parent_frag ............ (none)
  fragment_type .......... master
  statement_index ........ 0
  affinity_value ......... 0
  max_max_cardinality .... 2
  total_overflow_size .... 0.00 KB
  xn_access_mode ......... read_only
  xn_autoabort_interval    0
  auto_query_retry ....... enabled
  plan_version ....... 2,600
  embedded_arkcmp ........ used
  IS_SQLCI ............... ON
  LDAP_USERNAME
  MODE_SEABASE ........... ON
  SEABASE_VOLATILE_TABLES  ON
  HBASE_ASYNC_DROP_TABLE   OFF
  SCHEMA ................. TRAFODION.SCH
  HBASE_MAX_COLUMN_NAME_  10
  HBASE_MAX_COLUMN_VAL_L  20
  HBASE_MAX_COLUMN_INFO_  60
  HBASE_SERIALIZATION .... ON
  HBASE_FILTER_PREDS ..... ON
  QUERY_CACHE ............ 0
  MDAM_SCAN_METHOD ....... ON
  HBASE_MAX_NUM_SEARCH_KE  1
  select_list ............ TRAFODION.SCH.T010T2.A, 'a', 1,
                             TRAFODION.SCH.T010T2.D


TRAFODION_SCAN ============================  SEQ_NO 1        NO CHILDREN
TABLE_NAME ............... T010T2
REQUESTS_IN .............. 1
ROWS_OUT ................. 2
EST_OPER_COST ............ 0
EST_TOTAL_COST ........... 0
DESCRIPTION
  max_card_est .......... 99
  fragment_id ............ 0
  parent_frag ............ (none)
  fragment_type .......... master
  scan_type .............. subset scan limited by mdam of table
                             TRAFODION.SCH.T010T2
  cache_size ........... 100
  probes ................. 1
  rows_accessed ........ 100
  key_columns ............ A, B, C
  mdam_disjunct .......... ((A = 1) or (A = 4)) and (B = 'a') and (C = 1)

--- SQL operation complete.
>>explain y2;

------------------------------------------------------------------ PLAN SUMMARY
MODULE_NAME .............. DYNAMICALLY COMPILED
STATEMENT_NAME ........... Y2
PLAN_ID .................. 212277210238202254
ROWS_OUT ................. 5
EST_TOTAL_COST ........... 0
STATEMENT ................ select *
                           from t010t2
                           where a in (1,2,4) and b='a' and (c in (1,
                             3) or c>=5);


------------------------------------------------------------------ NODE LISTING
ROOT ======================================  SEQ_NO 2        ONLY CHILD 1
REQUESTS_IN .............. 1
ROWS_OUT ................. 5
EST_OPER_COST ............ 0
EST_TOTAL_COST ........... 0
DESCRIPTION
  max_card_est .......... 99
  fragment_id ............ 0
  parent_frag ............ (none)
  fragment_type .......... master
  statement_index ........ 0
  affinity_value ......... 0
  max_max_cardinality .... 5
  total_overflow_size .... 0.00 KB
  xn_access_mode ......... read_only
  xn_autoabort_interval    0
  auto_query_retry ....... enabled
  plan_version ....... 2,600
  embedded_arkcmp ........ used
  IS_SQLCI ............... ON
  LDAP_USERNAME
  MODE_SEABASE ........... ON
  SEABASE_VOLATILE_TABLES  ON
  HBASE_ASYNC_DROP_TABLE   OFF
  SCHEMA ................. TRAFODION.SCH
  HBASE_MAX_COLUMN_NAME_  10
  HBASE_MAX_COLUMN_VAL_L  20
  HBASE_MAX_COLUMN_INFO_  60
  HBASE_SERIALIZATION .... ON
  HBASE_FILTER_PREDS ..... ON
  QUERY_CACHE ............ 0
  MDAM_SCAN_METHOD ....... ON
  HBASE_MAX_NUM_SEARCH_KE  1
  select_list ............ TRAFODION.SCH.T010T2.A, 'a', TRAFODION.SCH.T010T2.C,
                             TRAFODION.SCH.T010T2.D


TRAFODION_SCAN ============================  SEQ_NO 1        NO CHILDREN
TABLE_NAME ............... T010T2
REQUESTS_IN .............. 1
ROWS_OUT ................. 5
EST_OPER_COST ............ 0
EST_TOTAL_COST ........... 0
DESCRIPTION
  max_card_est .......... 99
  fragment_id ............ 0
  parent_frag ............ (none)
  fragment_type .......... master
  scan_type .............. subset scan limited by mdam of table
                             TRAFODION.SCH.T010T2
  cache_size ........... 100
  probes ................. 1
  rows_accessed ........ 100
  key_columns ............ A, B, C
  mdam_disjunct .......... (((A = 1) or (A = 2)) or (A = 4)) and (B = 'a') and
                             (((C = 1) or (C = 3)) or (C >= 5))

--- SQL operation complete.
>>explain y3;

------------------------------------------------------------------ PLAN SUMMARY
MODULE_NAME .............. DYNAMICALLY COMPILED
STATEMENT_NAME ........... Y3
PLAN_ID .................. 212277210238269786
ROWS_OUT ................. 4
EST_TOTAL_COST ........... 0
STATEMENT ................ select *
                           from t010t2
                           where a in (1,2,4) and b='a' and c in (1,3);


------------------------------------------------------------------ NODE LISTING
ROOT ======================================  SEQ_NO 2        ONLY CHILD 1
REQUESTS_IN .............. 1
ROWS_OUT ................. 4
EST_OPER_COST ............ 0
EST_TOTAL_COST ........... 0
DESCRIPTION
  max_card_est .......... 99
  fragment_id ............ 0
  parent_frag ............ (none)
  fragment_type .......... master
  statement_index ........ 0
  affinity_value ......... 0
  max_max_cardinality .... 4
  total_overflow_size .... 0.00 KB
  xn_access_mode ......... read_only
  xn_autoabort_interval    0
  auto_query_retry ....... enabled
  plan_version ....... 2,600
  embedded_arkcmp ........ used
  IS_SQLCI ............... ON
  LDAP_USERNAME
  MODE_SEABASE ........... ON
  SEABASE_VOLATILE_TABLES  ON
  HBASE_ASYNC_DROP_TABLE   OFF
  SCHEMA ................. TRAFODION.SCH
  HBASE_MAX_COLUMN_NAME_  10
  HBASE_MAX_COLUMN_VAL_L  20
  HBASE_MAX_COLUMN_INFO_  60
  HBASE_SERIALIZATION .... ON
  HBASE_FILTER_PREDS ..... ON
  QUERY_CACHE ............ 0
  MDAM_SCAN_METHOD ....... ON
  HBASE_MAX_NUM_SEARCH_KE  1
  select_list ............ TRAFODION.SCH.T010T2.A, 'a', TRAFODION.SCH.T010T2.C,
                             TRAFODION.SCH.T010T2.D


TRAFODION_SCAN ============================  SEQ_NO 1        NO CHILDREN
TABLE_NAME ............... T010T2
REQUESTS_IN .............. 1
ROWS_OUT ................. 4
EST_OPER_COST ............ 0
EST_TOTAL_COST ........... 0
DESCRIPTION
  max_card_est .......... 99
  fragment_id ............ 0
  parent_frag ............ (none)
  fragment_type .......... master
  scan_type .............. subset scan limited by mdam of table
                             TRAFODION.SCH.T010T2
  cache_size ........... 100
  probes ................. 1
  rows_accessed ........ 100
  key_columns ............ A, B, C
  mdam_disjunct .......... (((A = 1) or (A = 2)) or (A = 4)) and ((C = 1) or (C
                             = 3)) and (B = 'a')

--- SQL operation complete.
>>explain y4;

------------------------------------------------------------------ PLAN SUMMARY
MODULE_NAME .............. DYNAMICALLY COMPILED
STATEMENT_NAME ........... Y4
PLAN_ID .................. 212277210238330692
ROWS_OUT ................. 4
EST_TOTAL_COST ........... 0.01
STATEMENT ................ delete from t010t2
                           where a in (2,4,6) and b='a' and c in (1,3);


------------------------------------------------------------------ NODE LISTING
ROOT ======================================  SEQ_NO 4        ONLY CHILD 3
REQUESTS_IN .............. 1
ROWS_OUT ................. 4
EST_OPER_COST ............ 0
EST_TOTAL_COST ........... 0.01
DESCRIPTION
  max_card_est ........... 4
  fragment_id ............ 0
  parent_frag ............ (none)
  fragment_type .......... master
  statement_index ........ 0
  affinity_value ......... 0
  max_max_cardinality .... 4
  total_overflow_size .... 0.00 KB
  upd_action_on_error .... xn_rollback
  xn_access_mode ......... read_only
  xn_autoabort_interval    0
  auto_query_retry ....... enabled
  plan_version ....... 2,600
  embedded_arkcmp ........ used
  IS_SQLCI ............... ON
  LDAP_USERNAME
  MODE_SEABASE ........... ON
  SEABASE_VOLATILE_TABLES  ON
  HBASE_ASYNC_DROP_TABLE   OFF
  SCHEMA ................. TRAFODION.SCH
  HBASE_MAX_COLUMN_NAME_  10
  HBASE_MAX_COLUMN_VAL_L  20
  HBASE_MAX_COLUMN_INFO_  60
  HBASE_SERIALIZATION .... ON
  HBASE_FILTER_PREDS ..... ON
  QUERY_CACHE ............ 0
  MDAM_SCAN_METHOD ....... ON
  HBASE_MAX_NUM_SEARCH_KE  1


TUPLE_FLOW ================================  SEQ_NO 3        CHILDREN 1, 2
REQUESTS_IN .............. 1
ROWS_OUT ................. 4
EST_OPER_COST ............ 0.01
EST_TOTAL_COST ........... 0.01
DESCRIPTION
  max_card_est ........... 4
  fragment_id ............ 0
  parent_frag ............ (none)
  fragment_type .......... master
  join_type .............. inner
  join_method ............ in-order nested


TRAFODION_DELETE ==========================  SEQ_NO 2        NO CHILDREN
TABLE_NAME ............... TRAFODION.SCH.T010T2
REQUESTS_IN .............. 1
ROWS_OUT ................. 1
EST_OPER_COST ............ 0
EST_TOTAL_COST ........... 0
DESCRIPTION
  max_card_est .......... 99
  fragment_id ............ 0
  parent_frag ............ (none)
  fragment_type .......... master
  iud_type ............... trafodion_delete TRAFODION.SCH.T010T2
  begin_key .............. (A = A) and (B = 'a') and (C = C)
  end_key ................ (A = A) and (B = 'a') and (C = C)


TRAFODION_SCAN ============================  SEQ_NO 1        NO CHILDREN
TABLE_NAME ............... T010T2
REQUESTS_IN .............. 1
ROWS_OUT ................. 4
EST_OPER_COST ............ 0
EST_TOTAL_COST ........... 0
DESCRIPTION
  max_card_est .......... 99
  fragment_id ............ 0
  parent_frag ............ (none)
  fragment_type .......... master
  scan_type .............. subset scan limited by mdam of table
                             TRAFODION.SCH.T010T2
  cache_size ........... 100
  probes ................. 1
  rows_accessed ........ 100
  key_columns ............ A, B, C
  executor_predicates .... (B = 'a')
  mdam_disjunct .......... (((A = 2) or (A = 4)) or (A = 6)) and ((C = 1) or (C
                             = 3)) and (B = 'a')

--- SQL operation complete.
>>explain y5;

------------------------------------------------------------------ PLAN SUMMARY
MODULE_NAME .............. DYNAMICALLY COMPILED
STATEMENT_NAME ........... Y5
PLAN_ID .................. 212277210238453448
ROWS_OUT ................. 2
EST_TOTAL_COST ........... 0
STATEMENT ................ update t010t2
                           set d='uuu'
                           where a=4 and b in ('a', 'b') and c < 2;


------------------------------------------------------------------ NODE LISTING
ROOT ======================================  SEQ_NO 2        ONLY CHILD 1
REQUESTS_IN .............. 1
ROWS_OUT ................. 2
EST_OPER_COST ............ 0
EST_TOTAL_COST ........... 0
DESCRIPTION
  olt_optimization ....... used
  max_card_est ........... 2
  fragment_id ............ 0
  parent_frag ............ (none)
  fragment_type .......... master
  statement_index ........ 0
  affinity_value ......... 0
  max_max_cardinality .... 2
  total_overflow_size .... 0.00 KB
  upd_action_on_error .... xn_rollback
  xn_access_mode ......... read_only
  xn_autoabort_interval    0
  auto_query_retry ....... enabled
  plan_version ....... 2,600
  embedded_arkcmp ........ used
  IS_SQLCI ............... ON
  LDAP_USERNAME
  MODE_SEABASE ........... ON
  SEABASE_VOLATILE_TABLES  ON
  HBASE_ASYNC_DROP_TABLE   OFF
  SCHEMA ................. TRAFODION.SCH
  HBASE_MAX_COLUMN_NAME_  10
  HBASE_MAX_COLUMN_VAL_L  20
  HBASE_MAX_COLUMN_INFO_  60
  HBASE_SERIALIZATION .... ON
  HBASE_FILTER_PREDS ..... ON
  QUERY_CACHE ............ 0
  MDAM_SCAN_METHOD ....... ON
  HBASE_MAX_NUM_SEARCH_KE  1


TRAFODION_UPDATE ==========================  SEQ_NO 1        NO CHILDREN
TABLE_NAME ............... TRAFODION.SCH.T010T2
REQUESTS_IN .............. 1
ROWS_OUT ................. 2
EST_OPER_COST ............ 0
EST_TOTAL_COST ........... 0
DESCRIPTION
  max_card_est ........... 2
  fragment_id ............ 0
  parent_frag ............ (none)
  fragment_type .......... master
  iud_type ............... trafodion_update TRAFODION.SCH.T010T2
  columns ................ all
  begin_keys(incl) ....... 4,,-2147483648
  end_keys(incl) ......... 4,??????????,2
  new_rec_expr ........... (D assign 'uuu')
  predicate .............. ((B = 'a') or (B = 'b')) and (C < 2)

--- SQL operation complete.
>>
>>select "_SALT_", * from t010t3 order by a,b,c;

_SALT_      A            B           C            D         
----------  -----------  ----------  -----------  ----------

         2            1  a                     1  1a1       
         2            1  a                     3  1a3       
         2            1  a                     5  1a5       
         1            1  c                     1  1c1       
         3            2  a                     1  2a1       
         3            2  a                     2  2a2       
         0            2  c                     3  2c3       
         2            4  a                     1  4a1       
         1            4  b                     1  4b1       
         1            4  b                     2  4b2       

--- 10 row(s) selected.
>>select "_SALT_", * from t010t3 where a=1 and b='c';

_SALT_      A            B           C            D         
----------  -----------  ----------  -----------  ----------

         1            1  c                     1  1c1       

--- 1 row(s) selected.
>>
>>update t010t3 set d='2axu' where a=2 and b='a';

--- 2 row(s) updated.
>>-- 2 rows updated
>>update t010t3 set d='4b1u' where a=4 and b='b' and c <= 1;

--- 1 row(s) updated.
>>-- 1 row updated
>>update t010t3 set a=3 where a=2;

--- 3 row(s) updated.
>>-- 3 rows updated
>>delete from t010t3 where a=3 and b='c' and c=3;

--- 1 row(s) deleted.
>>-- 1 row deleted
>>delete from t010t3 where d like '2%u %';

--- 2 row(s) deleted.
>>-- 2 rows deleted
>>select "_SALT_", * from t010t3;

_SALT_      A            B           C            D         
----------  -----------  ----------  -----------  ----------

         1            1  c                     1  1c1       
         1            4  b                     1  4b1u      
         1            4  b                     2  4b2       
         2            1  a                     1  1a1       
         2            1  a                     3  1a3       
         2            1  a                     5  1a5       
         2            4  a                     1  4a1       

--- 7 row(s) selected.
>>-- 7 rows
>>merge into t010t3
+>  using (select * from t010t2) as src
+>  on ((src.a, src.b, src.c) = (a,b,c))
+>when matched
+>  then update set d = src.d
+>when not matched
+>  then insert values (src.a, src.b, src.c, src.d)
+>;

--- 10 row(s) updated.
>>-- 10 rows updated
>>select "_SALT_", * from t010t2 natural join t010t3 order by a,b,c;

_SALT_      A            B           C            D         
----------  -----------  ----------  -----------  ----------

         2            1  a                     1  1a1       
         2            1  a                     3  1a3       
         2            1  a                     5  1a5       
         1            1  c                     1  1c1       
         3            2  a                     1  2a1       
         3            2  a                     2  2a2       
         0            2  c                     3  2c3       
         2            4  a                     1  uuu       
         1            4  b                     1  uuu       
         1            4  b                     2  4b2       

--- 10 row(s) selected.
>>-- expect 10 rows, same as each individual table
>>
>>select "_SALT_", * from table(table t010t3, partition number 4);

_SALT_      A            B           C            D         
----------  -----------  ----------  -----------  ----------

         3            2  a                     1  2a1       
         3            2  a                     2  2a2       

--- 2 row(s) selected.
>>select "_SALT_", * from table(table t010t3, partition number from 1 to 3);

_SALT_      A            B           C            D         
----------  -----------  ----------  -----------  ----------

         0            2  c                     3  2c3       
         1            1  c                     1  1c1       
         1            4  b                     1  uuu       
         1            4  b                     2  4b2       
         2            1  a                     1  1a1       
         2            1  a                     3  1a3       
         2            1  a                     5  1a5       
         2            4  a                     1  uuu       

--- 8 row(s) selected.
>>-- 2 statements above must return 10 rows total
>>
>>
>>-- other mdam queries
>>cqd mdam_scan_method 'ON';

--- SQL operation complete.
>>cqd query_cache '1024';

--- SQL operation complete.
>>obey TEST010(otherMdam);
>>drop table if exists minotaur.events_load75;

--- SQL operation complete.
>>CREATE TABLE if not exists TRAFODION.MINOTAUR.EVENTS_LOAD75
+>  (
+>    SRCIP                            CHAR(45) CHARACTER SET ISO88591 COLLATE
+>      DEFAULT NO DEFAULT NOT NULL NOT DROPPABLE
+>  , SRCPORT                          INT NO DEFAULT NOT NULL NOT DROPPABLE
+>  , DSTIP                            VARCHAR(45) CHARACTER SET ISO88591 COLLATE
+>      DEFAULT NO DEFAULT NOT NULL NOT DROPPABLE
+>  , DSTPORT                          INT NO DEFAULT NOT NULL NOT DROPPABLE
+>  , AGENTRECEIPTTIME                 TIMESTAMP(0) NO DEFAULT NOT NULL NOT
+>      DROPPABLE
+>  , CATEGORYOUTCOME                  VARCHAR(30) CHARACTER SET ISO88591 COLLATE
+>      DEFAULT NO DEFAULT NOT NULL NOT DROPPABLE
+>  , CATEGORYSIGNIFICANCE             VARCHAR(30) CHARACTER SET ISO88591 COLLATE
+>      DEFAULT NO DEFAULT NOT NULL NOT DROPPABLE
+>  , DEVICESEVERITY                   VARCHAR(30) CHARACTER SET ISO88591 COLLATE
+>      DEFAULT NO DEFAULT NOT NULL NOT DROPPABLE
+>  , CATEGORYDEVICETYPE               VARCHAR(30) CHARACTER SET ISO88591 COLLATE
+>      DEFAULT NO DEFAULT NOT NULL NOT DROPPABLE
+>  , DEVICECUSTOMSTRING1              VARCHAR(30) CHARACTER SET ISO88591 COLLATE
+>      DEFAULT NO DEFAULT NOT NULL NOT DROPPABLE
+>  , FLEXSTRING1                      VARCHAR(30) CHARACTER SET ISO88591 COLLATE
+>      DEFAULT NO DEFAULT NOT NULL NOT DROPPABLE
+>  , EVENT_ID                         LARGEINT NO DEFAULT NOT NULL NOT DROPPABLE
+>  , PRIMARY KEY (EVENT_ID ASC,SRCIP ASC, AGENTRECEIPTTIME ASC)
+>  )
+>  SALT USING 75 PARTITIONS
+>  hbase_options (blockcache = 'TRUE', TTL = '1000')
+>;

--- SQL operation complete.
>>
>>prepare s from
+>select * from minotaur.events_load75<<+ cardinality 10e6 >>  where srcip = '120.120.120.1' and agentreceipttime = timestamp '2014-05-28 15:10:33';

--- SQL command prepared.
>>
>>execute s;

--- 0 row(s) selected.
>>
>>showddl TRAFODION.MINOTAUR.EVENTS_LOAD75;

CREATE TABLE TRAFODION.MINOTAUR.EVENTS_LOAD75
  (
    SRCIP                            CHAR(45) CHARACTER SET ISO88591 COLLATE
      DEFAULT NO DEFAULT NOT NULL NOT DROPPABLE
  , SRCPORT                          INT NO DEFAULT NOT NULL NOT DROPPABLE
  , DSTIP                            VARCHAR(45) CHARACTER SET ISO88591 COLLATE
      DEFAULT NO DEFAULT NOT NULL NOT DROPPABLE
  , DSTPORT                          INT NO DEFAULT NOT NULL NOT DROPPABLE
  , AGENTRECEIPTTIME                 TIMESTAMP(0) NO DEFAULT NOT NULL NOT
      DROPPABLE
  , CATEGORYOUTCOME                  VARCHAR(30) CHARACTER SET ISO88591 COLLATE
      DEFAULT NO DEFAULT NOT NULL NOT DROPPABLE
  , CATEGORYSIGNIFICANCE             VARCHAR(30) CHARACTER SET ISO88591 COLLATE
      DEFAULT NO DEFAULT NOT NULL NOT DROPPABLE
  , DEVICESEVERITY                   VARCHAR(30) CHARACTER SET ISO88591 COLLATE
      DEFAULT NO DEFAULT NOT NULL NOT DROPPABLE
  , CATEGORYDEVICETYPE               VARCHAR(30) CHARACTER SET ISO88591 COLLATE
      DEFAULT NO DEFAULT NOT NULL NOT DROPPABLE
  , DEVICECUSTOMSTRING1              VARCHAR(30) CHARACTER SET ISO88591 COLLATE
      DEFAULT NO DEFAULT NOT NULL NOT DROPPABLE
  , FLEXSTRING1                      VARCHAR(30) CHARACTER SET ISO88591 COLLATE
      DEFAULT NO DEFAULT NOT NULL NOT DROPPABLE
  , EVENT_ID                         LARGEINT NO DEFAULT NOT NULL NOT DROPPABLE
  , PRIMARY KEY (EVENT_ID ASC, SRCIP ASC, AGENTRECEIPTTIME ASC)
  )
  SALT USING 75 PARTITIONS
  HBASE_OPTIONS
  (
    BLOCKCACHE = 'TRUE',
    TTL = '1000'
  )
;

--- SQL operation complete.
>>
>>log;
