>>obey TEST056(tests1);
>>showddl T056t10;

CREATE TABLE TRAFODION.SCH.T056T10
  (
    SWALLOW                          INT DEFAULT 121 NOT NULL NOT DROPPABLE
  , BARNOWL                          INT DEFAULT 1000 NOT NULL NOT DROPPABLE
  )
 ATTRIBUTES ALIGNED FORMAT
;

CREATE UNIQUE INDEX T056IN5 ON TRAFODION.SCH.T056T10
  (
    BARNOWL ASC
  )
;

--- SQL operation complete.
>>-- For debugging, the showlabel command can be use to view
>>-- the contents of the label before and after adding columns.
>>-- For example,
>>--showlabel table T056t10,detail;
>>--showlabel index T056in5,detail;
>>showddl T056t11;

CREATE TABLE TRAFODION.SCH.T056T11
  (
    WREN                             INT NO DEFAULT NOT NULL NOT DROPPABLE
  , JUNCO                            INT NO DEFAULT NOT NULL NOT DROPPABLE
  , BLACKBIRD                        INT DEFAULT NULL
  , PRIMARY KEY (WREN ASC, JUNCO ASC)
  )
 ATTRIBUTES ALIGNED FORMAT
;

CREATE UNIQUE INDEX T056IN6 ON TRAFODION.SCH.T056T11
  (
    BLACKBIRD ASC
  )
;

--- SQL operation complete.
>>
>>cqd traf_alter_add_pkey_as_unique_constraint 'ON';

--- SQL operation complete.
>>alter table T056t10 add column duck int default 20 
+>  not null no heading 
+>constraint duck_PK PRIMARY KEY desc
+>;

--- SQL operation complete.
>>cqd traf_alter_add_pkey_as_unique_constraint reset;

--- SQL operation complete.
>>
>>insert into T056t10 (swallow,barnowl,duck) values (10,1,201);

--- 1 row(s) inserted.
>>alter table T056t10 add column gosling int default 700 
+>  heading 'goose';

--- SQL operation complete.
>>insert into T056t10 (swallow,barnowl,duck) values (11,2,203);

--- 1 row(s) inserted.
>>alter table T056t11 add column bluejay int default 203
+>#ifMX
+>  constraint T056t11_nn not null not droppable constraint T056t11_ck check (bluejay >0)
+>  constraint T056t11_rf references T056t10 (duck)
+>  constraint bluejay_cons2 check (bluejay < 5000)
+>#ifMX
+>;

--- SQL operation complete.
>>
>>insert into T056t11 (wren,junco,blackbird,bluejay) values (179,579,555,203);

--- 1 row(s) inserted.
>>alter table T056t11 add column raven int default null;

--- SQL operation complete.
>>insert into T056t11 (wren,junco,blackbird,bluejay) values (12,112,222,203);

--- 1 row(s) inserted.
>>alter table T056t11 add column seagull int default 400
+>  not null ;

--- SQL operation complete.
>>insert into T056t11 (wren,junco,blackbird,bluejay) values (9,59,333,203);

--- 1 row(s) inserted.
>>alter table T056t11 add column robin int default 410
+>  not null 
+>#ifMX
+>droppable
+>#ifMX
+>;

--- SQL operation complete.
>>
>>insert into T056t11 (wren,junco,blackbird,bluejay) values (39,539,444,203);

--- 1 row(s) inserted.
>>create view T056vw12 as
+>select duck,raven,swallow,wren
+>from T056t10,T056t11;

--- SQL operation complete.
>>
>>showddl T056t10;

CREATE TABLE TRAFODION.SCH.T056T10
  (
    SWALLOW                          INT DEFAULT 121 NOT NULL NOT DROPPABLE
  , BARNOWL                          INT DEFAULT 1000 NOT NULL NOT DROPPABLE
  , DUCK                             INT DEFAULT 20 NOT NULL NOT DROPPABLE
      /*added_col*/
  , GOSLING                          INT DEFAULT 700 HEADING 'goose'
      /*added_col*/
  )
 ATTRIBUTES ALIGNED FORMAT
;

-- The following index is a system created index --
CREATE UNIQUE INDEX DUCK_PK ON TRAFODION.SCH.T056T10
  (
    DUCK DESC
  )
;

CREATE UNIQUE INDEX T056IN5 ON TRAFODION.SCH.T056T10
  (
    BARNOWL ASC
  )
;

ALTER TABLE TRAFODION.SCH.T056T10 ADD CONSTRAINT TRAFODION.SCH.DUCK_PK UNIQUE
  (
    DUCK
  )
;

--- SQL operation complete.
>>showddl T056t11;

CREATE TABLE TRAFODION.SCH.T056T11
  (
    WREN                             INT NO DEFAULT NOT NULL NOT DROPPABLE
  , JUNCO                            INT NO DEFAULT NOT NULL NOT DROPPABLE
  , BLACKBIRD                        INT DEFAULT NULL
  , BLUEJAY                          INT DEFAULT 203 NOT NULL NOT DROPPABLE
      /*added_col*/
  , RAVEN                            INT DEFAULT NULL /*added_col*/
  , SEAGULL                          INT DEFAULT 400 NOT NULL NOT DROPPABLE
      /*added_col*/
  , ROBIN                            INT DEFAULT 410 /*added_col*/
  , PRIMARY KEY (WREN ASC, JUNCO ASC)
  )
 ATTRIBUTES ALIGNED FORMAT
;

CREATE UNIQUE INDEX T056IN6 ON TRAFODION.SCH.T056T11
  (
    BLACKBIRD ASC
  )
;

-- The following index is a system created index --
CREATE INDEX T056T11_RF ON TRAFODION.SCH.T056T11
  (
    BLUEJAY ASC
  )
;

ALTER TABLE TRAFODION.SCH.T056T11 ADD CONSTRAINT TRAFODION.SCH.T056T11_RF
  FOREIGN KEY
  (
    BLUEJAY
  )
 REFERENCES TRAFODION.SCH.T056T10
  (
    DUCK
  )
;

ALTER TABLE TRAFODION.SCH.T056T11 ADD CONSTRAINT TRAFODION.SCH.BLUEJAY_CONS2
  CHECK (TRAFODION.SCH.T056T11.BLUEJAY < 5000)

ALTER TABLE TRAFODION.SCH.T056T11 ADD CONSTRAINT TRAFODION.SCH.T056T11_CK
  CHECK (TRAFODION.SCH.T056T11.BLUEJAY > 0)

--- SQL operation complete.
>>
>>#ifMX
>>showddl T056vw12;

CREATE VIEW TRAFODION.SCH.T056VW12 AS
  SELECT TRAFODION.SCH.T056T10.DUCK, TRAFODION.SCH.T056T11.RAVEN,
    TRAFODION.SCH.T056T10.SWALLOW, TRAFODION.SCH.T056T11.WREN FROM
    TRAFODION.SCH.T056T10, TRAFODION.SCH.T056T11 ;

--- SQL operation complete.
>>#ifMX
>>#ifMP
>>invoke t056vw12;
>>#ifMP
>>
>>select count (*) from T056vw12;

(EXPR)              
--------------------

                  32

--- 1 row(s) selected.
>>drop index T056in5;

--- SQL operation complete.
>>drop index T056in6;

--- SQL operation complete.
>>
>>-- Add columns to an empty table.
>>alter table T056t27 add column N10 NUMERIC(10,5) default 21;

--- SQL operation complete.
>>alter table T056t27 add column N2 NUMERIC(2) default 22;

--- SQL operation complete.
>>insert into T056t27 (N2) values (-99),(-1),(0),(1),(99);

--- 5 row(s) inserted.
>>alter table T056t27 add column N3 NUMERIC(3) default 23;

--- SQL operation complete.
>>insert into T056t27 (N3) values (0),(1),(50),(999);

--- 4 row(s) inserted.
>>alter table T056t27 add column N7 NUMERIC(7) default 24;

--- SQL operation complete.
>>insert into T056t27 (N7) values (-9999999),(-1),(0),(1),(6),(9999999);

--- 6 row(s) inserted.
>>alter table T056t27 add column N7U NUMERIC(7) UNSIGNED default 25;

--- SQL operation complete.
>>insert into T056t27 (N7U) values (0),(1),(50),(9999999);

--- 4 row(s) inserted.
>>alter table T056t27 add column N2S NUMERIC(2) SIGNED default 26;

--- SQL operation complete.
>>alter table T056t27 add column N15S NUMERIC(15) SIGNED default 27;

--- SQL operation complete.
>>insert into T056t27 (N15S) values (-999999999999999),(-1),(0),(1),(6),(999999999999999);

--- 6 row(s) inserted.
>>alter table T056t27 add column N3U NUMERIC(3) UNSIGNED default 28;

--- SQL operation complete.
>>insert into T056t27 (C1) values ('jk');

--- 1 row(s) inserted.
>>insert into T056t27 default values;

--- 1 row(s) inserted.
>>select * from T056t27;

C1  N10                    N2    N3      N7           N7U         N2S   N15S                  N3U
--  ---------------------  ----  ------  -----------  ----------  ----  --------------------  -----

kk               21.00000   -99      23           24          25    26                    27     28
kk               21.00000    -1      23           24          25    26                    27     28
kk               21.00000     0      23           24          25    26                    27     28
kk               21.00000     1      23           24          25    26                    27     28
kk               21.00000    99      23           24          25    26                    27     28
kk               21.00000    22       0           24          25    26                    27     28
kk               21.00000    22       1           24          25    26                    27     28
kk               21.00000    22      50           24          25    26                    27     28
kk               21.00000    22     999           24          25    26                    27     28
kk               21.00000    22      23     -9999999          25    26                    27     28
kk               21.00000    22      23           -1          25    26                    27     28
kk               21.00000    22      23            0          25    26                    27     28
kk               21.00000    22      23            1          25    26                    27     28
kk               21.00000    22      23            6          25    26                    27     28
kk               21.00000    22      23      9999999          25    26                    27     28
kk               21.00000    22      23           24           0    26                    27     28
kk               21.00000    22      23           24           1    26                    27     28
kk               21.00000    22      23           24          50    26                    27     28
kk               21.00000    22      23           24     9999999    26                    27     28
kk               21.00000    22      23           24          25    26      -999999999999999     28
kk               21.00000    22      23           24          25    26                    -1     28
kk               21.00000    22      23           24          25    26                     0     28
kk               21.00000    22      23           24          25    26                     1     28
kk               21.00000    22      23           24          25    26                     6     28
kk               21.00000    22      23           24          25    26       999999999999999     28
jk               21.00000    22      23           24          25    26                    27     28
kk               21.00000    22      23           24          25    26                    27     28

--- 27 row(s) selected.
>>
>>-- Add columns to an empty table.
>>alter table T056t28 add column RL REAL default 31;

--- SQL operation complete.
>>insert into T056t28 (RL) values (-3e38),(-100),(-1),(0),(1),(50),(3e38);

--- 7 row(s) inserted.
>>alter table T056t28 add column FLT FLOAT default 32;

--- SQL operation complete.
>>alter table T056t28 add column F30 FLOAT(30) default 33;

--- SQL operation complete.
>>alter table T056t28 add column DBLP DOUBLE PRECISION default 34;

--- SQL operation complete.
>>insert into T056t28 (DBLP) values (-4e70),(-100),(-1),(0),(1),(50),(4e70);

--- 7 row(s) inserted.
>>insert into T056t28 (C1) values ('jk');

--- 1 row(s) inserted.
>>insert into T056t28 default values;

--- 1 row(s) inserted.
>>select * from T056t28;

C1  RL               FLT                        F30                        DBLP
--  ---------------  -------------------------  -------------------------  -------------------------

pp  -3.0000000E+038   3.20000000000000000E+001   3.30000000000000000E+001   3.40000000000000064E+001
pp  -1.0000000E+002   3.20000000000000000E+001   3.30000000000000000E+001   3.40000000000000064E+001
pp  -1.0000000E+000   3.20000000000000000E+001   3.30000000000000000E+001   3.40000000000000064E+001
pp   0.0000000E+000   3.20000000000000000E+001   3.30000000000000000E+001   3.40000000000000064E+001
pp   1.0000000E+000   3.20000000000000000E+001   3.30000000000000000E+001   3.40000000000000064E+001
pp   5.0000000E+001   3.20000000000000000E+001   3.30000000000000000E+001   3.40000000000000064E+001
pp   3.0000000E+038   3.20000000000000000E+001   3.30000000000000000E+001   3.40000000000000064E+001
pp   3.1000000E+001   3.20000000000000000E+001   3.30000000000000000E+001  -4.00000000000000000E+070
pp   3.1000000E+001   3.20000000000000000E+001   3.30000000000000000E+001  -1.00000000000000000E+002
pp   3.1000000E+001   3.20000000000000000E+001   3.30000000000000000E+001  -1.00000000000000000E+000
pp   3.1000000E+001   3.20000000000000000E+001   3.30000000000000000E+001   0.00000000000000000E+000
pp   3.1000000E+001   3.20000000000000000E+001   3.30000000000000000E+001   1.00000000000000000E+000
pp   3.1000000E+001   3.20000000000000000E+001   3.30000000000000000E+001   5.00000000000000000E+001
pp   3.1000000E+001   3.20000000000000000E+001   3.30000000000000000E+001   4.00000000000000000E+070
jk   3.1000000E+001   3.20000000000000000E+001   3.30000000000000000E+001   3.40000000000000064E+001
pp   3.1000000E+001   3.20000000000000000E+001   3.30000000000000000E+001   3.40000000000000064E+001

--- 16 row(s) selected.
>>
>>-- Add columns to a table that already has rows.
>>alter table T056t127 add column N10 NUMERIC(10,5) default 21;

--- SQL operation complete.
>>alter table T056t127 add column N2 NUMERIC(2) default 22;

--- SQL operation complete.
>>insert into T056t127 (N2) values (-99),(-1),(0),(1),(99);

--- 5 row(s) inserted.
>>alter table T056t127 add column N3 NUMERIC(3) default 23;

--- SQL operation complete.
>>insert into T056t127 (N3) values (0),(1),(50),(999);

--- 4 row(s) inserted.
>>alter table T056t127 add column N7 NUMERIC(7) default 24;

--- SQL operation complete.
>>insert into T056t127 (N7) values (-9999999),(-1),(0),(1),(6),(9999999);

--- 6 row(s) inserted.
>>alter table T056t127 add column N7U NUMERIC(7) UNSIGNED default 25;

--- SQL operation complete.
>>insert into T056t127 (N7U) values (0),(1),(50),(9999999);

--- 4 row(s) inserted.
>>alter table T056t127 add column N2S NUMERIC(2) SIGNED default 26;

--- SQL operation complete.
>>alter table T056t127 add column N15S NUMERIC(15) SIGNED default 27;

--- SQL operation complete.
>>insert into T056t127 (N15S) values (-999999999999999),(-1),(0),(1),(6),(999999999999999);

--- 6 row(s) inserted.
>>alter table T056t127 add column N3U NUMERIC(3) UNSIGNED default 28;

--- SQL operation complete.
>>insert into T056t127 (C1) values ('jk');

--- 1 row(s) inserted.
>>insert into T056t127 default values;

--- 1 row(s) inserted.
>>select * from T056t127;

C1  N10                    N2    N3      N7           N7U         N2S   N15S                  N3U
--  ---------------------  ----  ------  -----------  ----------  ----  --------------------  -----

qq               21.00000    22      23           24          25    26                    27     28
rr               21.00000    22      23           24          25    26                    27     28
ss               21.00000    22      23           24          25    26                    27     28
kk               21.00000   -99      23           24          25    26                    27     28
kk               21.00000    -1      23           24          25    26                    27     28
kk               21.00000     0      23           24          25    26                    27     28
kk               21.00000     1      23           24          25    26                    27     28
kk               21.00000    99      23           24          25    26                    27     28
kk               21.00000    22       0           24          25    26                    27     28
kk               21.00000    22       1           24          25    26                    27     28
kk               21.00000    22      50           24          25    26                    27     28
kk               21.00000    22     999           24          25    26                    27     28
kk               21.00000    22      23     -9999999          25    26                    27     28
kk               21.00000    22      23           -1          25    26                    27     28
kk               21.00000    22      23            0          25    26                    27     28
kk               21.00000    22      23            1          25    26                    27     28
kk               21.00000    22      23            6          25    26                    27     28
kk               21.00000    22      23      9999999          25    26                    27     28
kk               21.00000    22      23           24           0    26                    27     28
kk               21.00000    22      23           24           1    26                    27     28
kk               21.00000    22      23           24          50    26                    27     28
kk               21.00000    22      23           24     9999999    26                    27     28
kk               21.00000    22      23           24          25    26      -999999999999999     28
kk               21.00000    22      23           24          25    26                    -1     28
kk               21.00000    22      23           24          25    26                     0     28
kk               21.00000    22      23           24          25    26                     1     28
kk               21.00000    22      23           24          25    26                     6     28
kk               21.00000    22      23           24          25    26       999999999999999     28
jk               21.00000    22      23           24          25    26                    27     28
kk               21.00000    22      23           24          25    26                    27     28

--- 30 row(s) selected.
>>
>>-- Add columns to a table that already has rows.
>>alter table T056t128 add column RL REAL default 31;

--- SQL operation complete.
>>insert into T056t128 (RL) values (-3e38),(-100),(-1),(0),(1),(50),(3e38);

--- 7 row(s) inserted.
>>alter table T056t128 add column FLT FLOAT default 32;

--- SQL operation complete.
>>alter table T056t128 add column F30 FLOAT(30) default 33;

--- SQL operation complete.
>>alter table T056t128 add column DBLP DOUBLE PRECISION default 34;

--- SQL operation complete.
>>insert into T056t128 (DBLP) values (-4e70),(-100),(-1),(0),(1),(50),(4e70);

--- 7 row(s) inserted.
>>insert into T056t128 (C1) values ('jk');

--- 1 row(s) inserted.
>>insert into T056t128 default values;

--- 1 row(s) inserted.
>>select * from T056t128;

C1  RL               FLT                        F30                        DBLP
--  ---------------  -------------------------  -------------------------  -------------------------

qq   3.1000000E+001   3.20000000000000000E+001   3.30000000000000000E+001   3.40000000000000064E+001
rr   3.1000000E+001   3.20000000000000000E+001   3.30000000000000000E+001   3.40000000000000064E+001
ss   3.1000000E+001   3.20000000000000000E+001   3.30000000000000000E+001   3.40000000000000064E+001
pp  -3.0000000E+038   3.20000000000000000E+001   3.30000000000000000E+001   3.40000000000000064E+001
pp  -1.0000000E+002   3.20000000000000000E+001   3.30000000000000000E+001   3.40000000000000064E+001
pp  -1.0000000E+000   3.20000000000000000E+001   3.30000000000000000E+001   3.40000000000000064E+001
pp   0.0000000E+000   3.20000000000000000E+001   3.30000000000000000E+001   3.40000000000000064E+001
pp   1.0000000E+000   3.20000000000000000E+001   3.30000000000000000E+001   3.40000000000000064E+001
pp   5.0000000E+001   3.20000000000000000E+001   3.30000000000000000E+001   3.40000000000000064E+001
pp   3.0000000E+038   3.20000000000000000E+001   3.30000000000000000E+001   3.40000000000000064E+001
pp   3.1000000E+001   3.20000000000000000E+001   3.30000000000000000E+001  -4.00000000000000000E+070
pp   3.1000000E+001   3.20000000000000000E+001   3.30000000000000000E+001  -1.00000000000000000E+002
pp   3.1000000E+001   3.20000000000000000E+001   3.30000000000000000E+001  -1.00000000000000000E+000
pp   3.1000000E+001   3.20000000000000000E+001   3.30000000000000000E+001   0.00000000000000000E+000
pp   3.1000000E+001   3.20000000000000000E+001   3.30000000000000000E+001   1.00000000000000000E+000
pp   3.1000000E+001   3.20000000000000000E+001   3.30000000000000000E+001   5.00000000000000000E+001
pp   3.1000000E+001   3.20000000000000000E+001   3.30000000000000000E+001   4.00000000000000000E+070
jk   3.1000000E+001   3.20000000000000000E+001   3.30000000000000000E+001   3.40000000000000064E+001
pp   3.1000000E+001   3.20000000000000000E+001   3.30000000000000000E+001   3.40000000000000064E+001

--- 19 row(s) selected.
>>
>>obey TEST056(tests2);
>>-- T056T30 tests   C1 varchar(8)
>>--                 add a fixed field C2 int
>>--    key C1 gets shifted from offset 8 to offset 14
>>select * from T056t30;

C1      
--------

aa      
bbb     
cccc    
dddddd  

--- 4 row(s) selected.
>>
>>alter table T056t30 add column C2 int default 0;

--- SQL operation complete.
>>insert into T056t30 values ('eeeeeeee', 10), ('f', 30), ('gg', NULL);

--- 3 row(s) inserted.
>>
>>select C2 from T056t30 where C2 is not NULL;

C2         
-----------

          0
          0
          0
          0
         10
         30

--- 6 row(s) selected.
>>select C2, C1 from T056t30 where C1 like 'cc%';

C2           C1      
-----------  --------

          0  cccc    

--- 1 row(s) selected.
>>select * from T056t30 where C1 = 'gg';

C1        C2         
--------  -----------

gg                  ?

--- 1 row(s) selected.
>>
>>-- T056t31 tests   C1 Varchar(10), C2 int
>>--                 add another varchar field
>>--   key gets shifted over due to another VOA
>>select * from T056t31;

C1          C2         
----------  -----------

Rolling               2
Stones                5
are                   7
back                  9

--- 4 row(s) selected.
>>alter table T056t31 add column C3 varchar(15) default 'BAZ' ;

--- SQL operation complete.
>>select * from T056t31;

C1          C2           C3             
----------  -----------  ---------------

Rolling               2  BAZ            
Stones                5  BAZ            
are                   7  BAZ            
back                  9  BAZ            

--- 4 row(s) selected.
>>select C2, C1 from T056t31 where C2 > 4;

C2           C1        
-----------  ----------

          5  Stones    
          7  are       
          9  back      

--- 3 row(s) selected.
>>select C2, C1 from T056t31 where C2 > 3 and C2 < 6;

C2           C1        
-----------  ----------

          5  Stones    

--- 1 row(s) selected.
>>
>>insert into T056t31 values ('foo', 8, 'bar');

--- 1 row(s) inserted.
>>
>>select C2 from T056t31 where C2 < 5;

C2         
-----------

          2

--- 1 row(s) selected.
>>select C2 from T056t31 where C2 > 4;

C2         
-----------

          5
          7
          9
          8

--- 4 row(s) selected.
>>select C3, C2 from T056t31 where C3 is not NULL;

C3               C2         
---------------  -----------

BAZ                        2
BAZ                        5
BAZ                        7
BAZ                        9
bar                        8

--- 5 row(s) selected.
>>select C3, C2 from T056t31 where C3 is NULL;

--- 0 row(s) selected.
>>
>>-- T056t32 tests   C1 int, C2 int
>>--                 add a varchar field
>>--   key gets shifted over due to the new VOA
>>select * from T056t32;

C1           C2         
-----------  -----------

          1           10
          3           30
          5           50
          7           70
          9           90

--- 5 row(s) selected.
>>alter table T056t32 add column C3 varchar(10) default NULL;

--- SQL operation complete.
>>select * from T056t32;

C1           C2           C3        
-----------  -----------  ----------

          1           10  ?         
          3           30  ?         
          5           50  ?         
          7           70  ?         
          9           90  ?         

--- 5 row(s) selected.
>>select C2, C1, C3 from T056t32 where C2 > 20 and C2 < 60;

C2           C1           C3        
-----------  -----------  ----------

         30            3  ?         
         50            5  ?         

--- 2 row(s) selected.
>>select * from T056t32 where C1 > 4 and C1 < 9;

C1           C2           C3        
-----------  -----------  ----------

          5           50  ?         
          7           70  ?         

--- 2 row(s) selected.
>>select C2, C1 from T056t32 where C3 is null;

C2           C1         
-----------  -----------

         10            1
         30            3
         50            5
         70            7
         90            9

--- 5 row(s) selected.
>>
>>insert into T056t32 values (11, 110, 'ali'), (13, 130, 'babba');

--- 2 row(s) inserted.
>>
>>select * from T056t32 where C3 is not null;

C1           C2           C3        
-----------  -----------  ----------

         11          110  ali       
         13          130  babba     

--- 2 row(s) selected.
>>select C2, C1, C3 from T056t32 where C2 > 20 and C2 < 60;

C2           C1           C3        
-----------  -----------  ----------

         30            3  ?         
         50            5  ?         

--- 2 row(s) selected.
>>select * from T056t32 where C1 > 4 and C1 < 9;

C1           C2           C3        
-----------  -----------  ----------

          5           50  ?         
          7           70  ?         

--- 2 row(s) selected.
>>
>>-- T056t33 tests   4 fixed fields with key C1, C2
>>--                 add a varchar field
>>--   key gets shifted over due to the new VOA
>>--   Run some MDAM type queries
>>select * from T056t33;

A       B       C       D     
------  ------  ------  ------

     0       0       0       0
     1       0       0       0
     2       0       0       0
     3       0       0       0
     4       0       0       0
     5       0       0       0
     6       0       0       0
     7       0       0       0
     8       0       0       0
     9       0       0       0

--- 10 row(s) selected.
>>alter table T056t33 add column e varchar(8) default NULL;

--- SQL operation complete.
>>
>>insert into T056t33 values (-6,-8,0,0, 'the'),
+>                         (11,12,0,0, 'FCS'),
+>                         (-30,40,0,0, 'date is'),
+>                         (25,-6,0,0,  'drawing'),
+>                         (50,-26,0,0, 'near');

--- 5 row(s) inserted.
>>
>>--------------------------------------------------------------------
>>--   2 disjuncts, one interval in each, 1st precedes 2nd
>>-- expect rows (1,0),(2,0),(3,0),(5,1),(6,1),(7,1),(8,1)  (7 rows)
>>--------------------------------------------------------------------
>>select * from T056t33
+>  where (b = 0 and a > 0 and a < 4)
+>         or
+>        (b = 1 and a >= 5 and a <= 8);

A       B       C       D       E       
------  ------  ------  ------  --------

     1       0       0       0  ?       
     2       0       0       0  ?       
     3       0       0       0  ?       

--- 3 row(s) selected.
>>
>>--------------------------------------------------------------------
>>--   2 disjuncts, one interval in each, 1st follows 2nd
>>-- expect rows (1,1),(2,1),(3,1),(5,0),(6,0),(7,0),(8,0)  (7 rows)
>>--------------------------------------------------------------------
>>select * from T056t33
+>  where (b = 0 and a >= 5 and a <= 8)
+>         or
+>        (b = 1 and a > 0 and a < 4);

A       B       C       D       E       
------  ------  ------  ------  --------

     5       0       0       0  ?       
     6       0       0       0  ?       
     7       0       0       0  ?       
     8       0       0       0  ?       

--- 4 row(s) selected.
>>
>>--------------------------------------------------------------------
>>--   2 disjuncts, two intervals in each, 1st precedes 2nd
>>-- expect rows (0,0),(4,0),(9,1),(12,1)  (4 rows)
>>--------------------------------------------------------------------
>>select * from T056t33
+>  where (b = 0 and a in (0,4))
+>         or
+>        (b = 1 and a in (9,12));

A       B       C       D       E       
------  ------  ------  ------  --------

     0       0       0       0  ?       
     4       0       0       0  ?       

--- 2 row(s) selected.
>>
>>--------------------------------------------------------------------
>>--   2 disjuncts, two intervals in each, 1st follows 2nd
>>-- expect rows (0,1),(4,1),(9,0),(12,0)  (4 rows)
>>--------------------------------------------------------------------
>>select * from T056t33
+>  where (b = 0 and a in (9,12))
+>         or
+>        (b = 1 and a in (0,4));

A       B       C       D       E       
------  ------  ------  ------  --------

     9       0       0       0  ?       

--- 1 row(s) selected.
>>
>>------------------------------------------------------------------------
>>--   2 disjuncts, two intervals in each, lists interleave thus: 0 1 0 1
>>-- expect rows (0,0),(4,1),(9,0),(12,1)  (4 rows)
>>------------------------------------------------------------------------
>>select * from T056t33
+>  where (b = 0 and a in (0,9))
+>         or
+>        (b = 1 and a in (4,12));

A       B       C       D       E       
------  ------  ------  ------  --------

     0       0       0       0  ?       
     9       0       0       0  ?       

--- 2 row(s) selected.
>>
>>------------------------------------------------------------------------
>>--   2 disjuncts, two intervals in each, lists interleave thus: 1 0 1 0
>>-- expect rows (0,1),(4,0),(9,1),(12,0)  (4 rows)
>>------------------------------------------------------------------------
>>select * from T056t33
+>  where (b = 0 and a in (4,12))
+>         or
+>        (b = 1 and a in (0,9));

A       B       C       D       E       
------  ------  ------  ------  --------

     4       0       0       0  ?       

--- 1 row(s) selected.
>>
>>------------------------------------------------------------------------
>>--   2 disjuncts, two intervals in each, lists interleave thus: 0 1 1 0
>>-- expect rows (0,0),(4,1),(9,1),(12,0)  (4 rows)
>>------------------------------------------------------------------------
>>select * from T056t33
+>  where (b = 0 and a in (0,12))
+>         or
+>        (b = 1 and a in (4,9));

A       B       C       D       E       
------  ------  ------  ------  --------

     0       0       0       0  ?       

--- 1 row(s) selected.
>>
>>------------------------------------------------------------------------
>>--   2 disjuncts, two intervals in each, lists interleave thus: 1 0 0 1
>>-- expect rows (0,1),(4,0),(9,0),(12,1)  (4 rows)
>>------------------------------------------------------------------------
>>select * from T056t33
+>  where (b = 0 and a in (4,9))
+>         or
+>        (b = 1 and a in (0,12));

A       B       C       D       E       
------  ------  ------  ------  --------

     4       0       0       0  ?       
     9       0       0       0  ?       

--- 2 row(s) selected.
>>
>>------------------------------------------------------------------------
>>--   2 disjuncts, long lists just for fun, lists interleave thus:
>>--   1 1 0 0 1 0 1 0 1 1 1 0
>>-- expect rows (0,1),(2,1),(4,0),(6,0),(8,1),(10,0),
>>--             (12,1),(14,0),(16,1),(18,1),(20,1),(22,0)  (12 rows)
>>------------------------------------------------------------------------
>>select * from T056t33
+>  where (b = 0 and a in (4,6,10,14,22))
+>     or
+>        (b = 1 and a in (0,2,8,12,16,18,20));

A       B       C       D       E       
------  ------  ------  ------  --------

     4       0       0       0  ?       
     6       0       0       0  ?       

--- 2 row(s) selected.
>>
>>update T056t33 set c = 10
+>  where (b = 0 and a in (4,6,10,14,22))
+>     or
+>        (b = 1 and a in (0,2,8,12,16,18,20));

--- 2 row(s) updated.
>>
>>select * from T056t33
+>  where (b = 0 and a in (4,6,10,14,22))
+>     or
+>        (b = 1 and a in (0,2,8,12,16,18,20));

A       B       C       D       E       
------  ------  ------  ------  --------

     4       0      10       0  ?       
     6       0      10       0  ?       

--- 2 row(s) selected.
>>
>>begin work;

--- SQL operation complete.
>>update T056t33 set c = 99
+>  where (b = 0 and a > 0 and a < 4)
+>         or
+>        (b = 1 and a >= 5 and a <= 8);

--- 3 row(s) updated.
>>select * from T056t33;

A       B       C       D       E       
------  ------  ------  ------  --------

   -30      40       0       0  date is 
    -6      -8       0       0  the     
     0       0       0       0  ?       
     1       0      99       0  ?       
     2       0      99       0  ?       
     3       0      99       0  ?       
     4       0      10       0  ?       
     5       0       0       0  ?       
     6       0      10       0  ?       
     7       0       0       0  ?       
     8       0       0       0  ?       
     9       0       0       0  ?       
    11      12       0       0  FCS     
    25      -6       0       0  drawing 
    50     -26       0       0  near    

--- 15 row(s) selected.
>>rollback work;

--- SQL operation complete.
>>
>>select * from T056t33;

A       B       C       D       E       
------  ------  ------  ------  --------

   -30      40       0       0  date is 
    -6      -8       0       0  the     
     0       0       0       0  ?       
     1       0       0       0  ?       
     2       0       0       0  ?       
     3       0       0       0  ?       
     4       0      10       0  ?       
     5       0       0       0  ?       
     6       0      10       0  ?       
     7       0       0       0  ?       
     8       0       0       0  ?       
     9       0       0       0  ?       
    11      12       0       0  FCS     
    25      -6       0       0  drawing 
    50     -26       0       0  near    

--- 15 row(s) selected.
>>
>>select * from T056t33
+>  where (b = 0 and a > 0 and a < 4)
+>         or
+>        (b = 1 and a >= 5 and a <= 8);

A       B       C       D       E       
------  ------  ------  ------  --------

     1       0       0       0  ?       
     2       0       0       0  ?       
     3       0       0       0  ?       

--- 3 row(s) selected.
>>
>>#ifMX
>>------------------------------------------------------------------------
>>-- Vary random insert, update, deletes with rollback and 
>>-- many 'alter table add column' statements (17 total)
>>-- with some within the begin work  and rollback.
>>------------------------------------------------------------------------
>>alter table T056t34 add column num1 NUMERIC (9,2) UNSIGNED 
+>  default null no heading;

--- SQL operation complete.
>>
>>insert into T056t34 values (11,'k',1.01);

--- 1 row(s) inserted.
>>insert into T056t34 (orders, ch1) values (12,'l');

--- 1 row(s) inserted.
>>
>>select * from T056t34;

ORDERS       CH1  NUM1       
-----------  ---  -----------

          1  a              ?
          2  b              ?
          3  c              ?
         11  k           1.01
         12  l              ?

--- 5 row(s) selected.
>>
>>alter table T056t34 add vch1 char varying(1) heading '';

--- SQL operation complete.
>>
>>insert into T056t34 (orders, ch1) values (16,'p');

--- 1 row(s) inserted.
>>insert into T056t34 (orders, ch1, num1) values (17,'p',4.04);

--- 1 row(s) inserted.
>>insert into T056t34 (orders) values (18);

--- 1 row(s) inserted.
>>
>>insert into T056t34 values (20,'r',6.00,'C');

--- 1 row(s) inserted.
>>
>>select orders, num1 from T056t34;

ORDERS       NUM1       
-----------  -----------

          1            ?
          2            ?
          3            ?
         11         1.01
         12            ?
         16            ?
         17         4.04
         18            ?
         20         6.00

--- 9 row(s) selected.
>>
>>begin work;

--- SQL operation complete.
>>
>>update T056t34 set vch1 = '6' where num1 = 6;

--- 1 row(s) updated.
>>
>>update T056t34 set num1 = num1 * num1 where vch1 is null;

--- 8 row(s) updated.
>>
>>commit work;

--- SQL operation complete.
>>
>>alter table T056t34 add column sma1 SMALLINT UNSIGNED DEFAULT NULL
+>  heading 'SmallInt';

--- SQL operation complete.
>>
>>insert into T056t34 (orders, sma1) values (51,21);

--- 1 row(s) inserted.
>>
>>insert into T056t34 values (52,'S',5.01,'D',22);

--- 1 row(s) inserted.
>>
>>alter table T056t34 add vch2 CHARACTER VARYING(255);

--- SQL operation complete.
>>
>>insert into T056t34 (orders, vch2) values (61,'character varying(255)');

--- 1 row(s) inserted.
>>
>>insert into T056t34 values (62,'V',5.02,'E',23,'variable length column');

--- 1 row(s) inserted.
>>
>>insert into T056t34 (orders, num1, sma1, vch2)
+>   values (63, 5.03, 24, 'variable length column vch2');

--- 1 row(s) inserted.
>>
>>update T056t34 set sma1 = 99 where vch2 like '%vch2';

--- 1 row(s) updated.
>>
>>select orders, sma1, vch1, vch2 from T056t34;

ORDERS       SmallInt  VCH1  VCH2
-----------  --------  ----  ---------------------------------------------------------------------------------------------------------------------------------------------------------------------------------------------------------------------------------------------------------------

          1         ?  ?     ?                                                                                                                                                                                                                                                              
          2         ?  ?     ?                                                                                                                                                                                                                                                              
          3         ?  ?     ?                                                                                                                                                                                                                                                              
         11         ?  ?     ?                                                                                                                                                                                                                                                              
         12         ?  ?     ?                                                                                                                                                                                                                                                              
         16         ?  ?     ?                                                                                                                                                                                                                                                              
         17         ?  ?     ?                                                                                                                                                                                                                                                              
         18         ?  ?     ?                                                                                                                                                                                                                                                              
         20         ?  6     ?                                                                                                                                                                                                                                                              
         51        21  ?     ?                                                                                                                                                                                                                                                              
         52        22  D     ?                                                                                                                                                                                                                                                              
         61         ?  ?     character varying(255)                                                                                                                                                                                                                                         
         62        23  E     variable length column                                                                                                                                                                                                                                         
         63        99  ?     variable length column vch2                                                                                                                                                                                                                                    

--- 14 row(s) selected.
>>
>>begin work;

--- SQL operation complete.
>>
>>update T056t34 set vch1 = 'v' where num1 > 10;

--- 1 row(s) updated.
>>
>>update T056t34 set num1 = num1 + 10 where vch2 is null;

--- 11 row(s) updated.
>>
>>update T056t34 set sma1 = 100,
+>                   vch1 = 'a',
+>                   vch2 = 'Z'
+>               where orders < 10;

--- 3 row(s) updated.
>>
>>alter table T056t34 add vch3 varchar(3) default 'neo';

--- SQL operation complete.
>>
>>update T056t34 set vch3 = 'new' where vch1 = 'v';

--- 1 row(s) updated.
>>
>>rollback;

--- SQL operation complete.
>>
>>-- this should return error. Col vch3 will be removed as part of rollback.
>>update T056t34 set vch3 = 'new' where vch1 = 'v';

*** ERROR[4001] Column VCH3 is not found.  Tables in scope: TRAFODION.SCH.T056T34.  Default schema: TRAFODION.SCH.

*** ERROR[8822] The statement was not prepared.

>>
>>delete from T056t34 where orders > 2 and orders < 12
+>                       or orders = 51;

--- 3 row(s) deleted.
>>
>>select orders, sma1, vch1, vch2 from T056t34;

ORDERS       SmallInt  VCH1  VCH2
-----------  --------  ----  ---------------------------------------------------------------------------------------------------------------------------------------------------------------------------------------------------------------------------------------------------------------

          1         ?  ?     ?                                                                                                                                                                                                                                                              
          2         ?  ?     ?                                                                                                                                                                                                                                                              
         12         ?  ?     ?                                                                                                                                                                                                                                                              
         16         ?  ?     ?                                                                                                                                                                                                                                                              
         17         ?  ?     ?                                                                                                                                                                                                                                                              
         18         ?  ?     ?                                                                                                                                                                                                                                                              
         20         ?  6     ?                                                                                                                                                                                                                                                              
         52        22  D     ?                                                                                                                                                                                                                                                              
         61         ?  ?     character varying(255)                                                                                                                                                                                                                                         
         62        23  E     variable length column                                                                                                                                                                                                                                         
         63        99  ?     variable length column vch2                                                                                                                                                                                                                                    

--- 11 row(s) selected.
>>
>>alter table T056t34 add column int1 int unsigned 
+>  constraint int_uniq check (int1 < 10000);

--- SQL operation complete.
>>
>>insert into T056t34 values 
+>  (71, 'I', 7.02, 'F', 700, 'VARCHAR', 100);

--- 1 row(s) inserted.
>>
>>insert into T056t34 (orders, int1) values (72,200);

--- 1 row(s) inserted.
>>
>>insert into T056t34 (orders, vch2, int1) values (73,'VCH2', 300);

--- 1 row(s) inserted.
>>
>>insert into T056t34 (orders, vch1, sma1, int1) values (74, '2', 72, 400);

--- 1 row(s) inserted.
>>
>>alter table T056t34 add vch3 CHARACTER VARYING(2) heading 'VARYING(2)';

--- SQL operation complete.
>>
>>insert into T056t34 (orders, num1, sma1, int1) 
+>  values (81,8.08,81,81);

--- 1 row(s) inserted.
>>
>>insert into T056t34 (orders, vch3) values (82,'AB');

--- 1 row(s) inserted.
>>
>>insert into T056t34 (orders, ch1, vch1, vch2, vch3) 
+>   values (83,'8','8','vch2_83','83');

--- 1 row(s) inserted.
>>
>>update T056t34 set vch3 = 'CD' where ch1 = 'k';

--- 0 row(s) updated.
>>
>>insert into T056t34 values
+>   (84,'8', 8.234, '8', 84, 
+>   'Bill and Joe ran softly near one of the hill. Some birds sprinted over Madelyn! Racoons and cats and blue birds. Oh My! Violet and Fred rushed sadly towards some door! Genelle and Janine split steadily across one of the string???',
+>    84, '83');

--- 1 row(s) inserted.
>>
>>-- expected 25 rows
>>select orders, num1, vch3, int1 from T056t34;

ORDERS       NUM1         VARYING(2)  INT1      
-----------  -----------  ----------  ----------

          1            ?  ?                    ?
          2            ?  ?                    ?
         12            ?  ?                    ?
         16            ?  ?                    ?
         17        16.32  ?                    ?
         18            ?  ?                    ?
         20         6.00  ?                    ?
         52         5.01  ?                    ?
         61            ?  ?                    ?
         62         5.02  ?                    ?
         63         5.03  ?                    ?
         71         7.02  ?                  100
         72            ?  ?                  200
         73            ?  ?                  300
         74            ?  ?                  400
         81         8.08  ?                   81
         82            ?  AB                   ?
         83            ?  83                   ?
         84         8.23  83                  84

--- 19 row(s) selected.
>>
>>alter table T056t34 add column dec1 DEC(9,2) UNSIGNED;

--- SQL operation complete.
>>
>>insert into T056t34 values 
+>  (91,'9',9.1,'9',91,
+>  'EEEEEEEEEEEEEEEEEEEEEEEEEEEEEEEEEEEEEEEEE007P6RRT Mom sprinted beneath those worms??? A few horses got out beside Derek??? Those dogs ambled across dad??? An American and Ben leaped neatly over those string??? ',
+>  91, '91', 9.1);

--- 1 row(s) inserted.
>>
>>insert into T056t34 (orders, dec1) values (92,9.20);

--- 1 row(s) inserted.
>>
>>select count(*) from T056t34;

(EXPR)              
--------------------

                  21

--- 1 row(s) selected.
>>
>>select orders, vch2, int1 from T056t34 where ch1 is NULL and int1 > 300;

ORDERS       VCH2                                                                                                                                                                                                                                                             INT1
-----------  ---------------------------------------------------------------------------------------------------------------------------------------------------------------------------------------------------------------------------------------------------------------  ----------

         74  ?                                                                                                                                                                                                                                                                       400

--- 1 row(s) selected.
>>
>>select orders, vch2, int1 from T056t34 where dec1 is NOT NULL;

ORDERS       VCH2                                                                                                                                                                                                                                                             INT1
-----------  ---------------------------------------------------------------------------------------------------------------------------------------------------------------------------------------------------------------------------------------------------------------  ----------

         91  EEEEEEEEEEEEEEEEEEEEEEEEEEEEEEEEEEEEEEEEE007P6RRT Mom sprinted beneath those worms??? A few horses got out beside Derek??? Those dogs ambled across dad??? An American and Ben leaped neatly over those string???                                                        91
         92  ?                                                                                                                                                                                                                                                                         ?

--- 2 row(s) selected.
>>
>>select orders, vch3 from T056t34 where dec1 < 10;

ORDERS       VARYING(2)
-----------  ----------

         91  91        
         92  ?         

--- 2 row(s) selected.
>>
>>select orders, int1, sma1, vch1, vch2, vch3 from T056t34 where vch3 = 'AB';

ORDERS       INT1        SmallInt  VCH1  VCH2                                                                                                                                                                                                                                                             VARYING(2)
-----------  ----------  --------  ----  ---------------------------------------------------------------------------------------------------------------------------------------------------------------------------------------------------------------------------------------------------------------  ----------

         82           ?         ?  ?     ?                                                                                                                                                                                                                                                                AB        

--- 1 row(s) selected.
>>
>>update T056t34 set vch2 = 'VVCCHH2',
+>               vch3 = 'VV',
+>               sma1 = 65535,
+>               dec1 = 1234567.89
+>       where orders < 20 ;

--- 6 row(s) updated.
>>
>>select avg(num1), sum(sma1), max(dec1) from T056t34;

(EXPR)                 (EXPR)                (EXPR)    
---------------------  --------------------  ----------

                 7.75                394382  1234567.89

--- 1 row(s) selected.
>>
>>delete from T056t34 where num1 = 7.02 and ch1 = 'I';

--- 1 row(s) deleted.
>>
>>select orders, sma1, vch2, vch3 from T056t34 where orders < 20;

ORDERS       SmallInt  VCH2                                                                                                                                                                                                                                                             VARYING(2)
-----------  --------  ---------------------------------------------------------------------------------------------------------------------------------------------------------------------------------------------------------------------------------------------------------------  ----------

          1     65535  VVCCHH2                                                                                                                                                                                                                                                          VV        
          2     65535  VVCCHH2                                                                                                                                                                                                                                                          VV        
         12     65535  VVCCHH2                                                                                                                                                                                                                                                          VV        
         16     65535  VVCCHH2                                                                                                                                                                                                                                                          VV        
         17     65535  VVCCHH2                                                                                                                                                                                                                                                          VV        
         18     65535  VVCCHH2                                                                                                                                                                                                                                                          VV        

--- 6 row(s) selected.
>>
>>alter table T056t34 add num10 NUMERIC (9,2) SIGNED default 7.2 
+>  heading 'num_10';

--- SQL operation complete.
>>
>>insert into T056t34 (orders,num1) values (101,1.01);

--- 1 row(s) inserted.
>>
>>insert into T056t34 (orders,ch1,vch2,num10) 
+>  values (102,'A','VCH6',1.02);

--- 1 row(s) inserted.
>>
>>#ifndef SEABASE_REGRESS
>>begin work;
>>
>>alter table T056t34 add vch11 char varying(1) default 'a' heading 'vch11';
>>
>>insert into T056t34 (orders,ch1,num1,vch1,sma1,vch2,int1,vch3,dec1,num10)
+>  values (103,'A',3.03,'A',303,'VCHAR_6',3030,'EE',33.03, 333.33);
>>insert into T056t34 (orders, num10, vch11) values (104,1.04,'4');
>>insert into T056t34 values 
+>  (106,'A',1.06,'A',106,'VVV_VVV',1060,'66',10.06, 106.00,'a');
>>
>>rollback;
>>#endif
>>
>>select orders, vch2, vch3, num10 from T056t34;

ORDERS       VCH2                                                                                                                                                                                                                                                             VARYING(2)  num_10
-----------  ---------------------------------------------------------------------------------------------------------------------------------------------------------------------------------------------------------------------------------------------------------------  ----------  ------------

          1  VVCCHH2                                                                                                                                                                                                                                                          VV                  7.20
          2  VVCCHH2                                                                                                                                                                                                                                                          VV                  7.20
         12  VVCCHH2                                                                                                                                                                                                                                                          VV                  7.20
         16  VVCCHH2                                                                                                                                                                                                                                                          VV                  7.20
         17  VVCCHH2                                                                                                                                                                                                                                                          VV                  7.20
         18  VVCCHH2                                                                                                                                                                                                                                                          VV                  7.20
         20  ?                                                                                                                                                                                                                                                                ?                   7.20
         52  ?                                                                                                                                                                                                                                                                ?                   7.20
         61  character varying(255)                                                                                                                                                                                                                                           ?                   7.20
         62  variable length column                                                                                                                                                                                                                                           ?                   7.20
         63  variable length column vch2                                                                                                                                                                                                                                      ?                   7.20
         72  ?                                                                                                                                                                                                                                                                ?                   7.20
         73  VCH2                                                                                                                                                                                                                                                             ?                   7.20
         74  ?                                                                                                                                                                                                                                                                ?                   7.20
         81  ?                                                                                                                                                                                                                                                                ?                   7.20
         82  ?                                                                                                                                                                                                                                                                AB                  7.20
         83  vch2_83                                                                                                                                                                                                                                                          83                  7.20
         84  Bill and Joe ran softly near one of the hill. Some birds sprinted over Madelyn! Racoons and cats and blue birds. Oh My! Violet and Fred rushed sadly towards some door! Genelle and Janine split steadily across one of the string???                            83                  7.20
         91  EEEEEEEEEEEEEEEEEEEEEEEEEEEEEEEEEEEEEEEEE007P6RRT Mom sprinted beneath those worms??? A few horses got out beside Derek??? Those dogs ambled across dad??? An American and Ben leaped neatly over those string???                                                91                  7.20
         92  ?                                                                                                                                                                                                                                                                ?                   7.20
        101  ?                                                                                                                                                                                                                                                                ?                   7.20
        102  VCH6                                                                                                                                                                                                                                                             ?                   1.02

--- 22 row(s) selected.
>>
>>select orders, vch3, num10 from T056t34 where vch3 = 'EE';

--- 0 row(s) selected.
>>
>>select orders, vch2, vch3, num10 from T056t34 where num10 < 2.00;

ORDERS       VCH2                                                                                                                                                                                                                                                             VARYING(2)  num_10
-----------  ---------------------------------------------------------------------------------------------------------------------------------------------------------------------------------------------------------------------------------------------------------------  ----------  ------------

        102  VCH6                                                                                                                                                                                                                                                             ?                   1.02

--- 1 row(s) selected.
>>
>>update T056t34 set num10 = num10 + 10.10,
+>                    vch3 = 'NN' where dec1 is NOT NULL;

--- 8 row(s) updated.
>>
>>select orders, num10, vch3, dec1 from T056t34;

ORDERS       num_10        VARYING(2)  DEC1      
-----------  ------------  ----------  ----------

          1         17.30  NN          1234567.89
          2         17.30  NN          1234567.89
         12         17.30  NN          1234567.89
         16         17.30  NN          1234567.89
         17         17.30  NN          1234567.89
         18         17.30  NN          1234567.89
         20          7.20  ?                    ?
         52          7.20  ?                    ?
         61          7.20  ?                    ?
         62          7.20  ?                    ?
         63          7.20  ?                    ?
         72          7.20  ?                    ?
         73          7.20  ?                    ?
         74          7.20  ?                    ?
         81          7.20  ?                    ?
         82          7.20  AB                   ?
         83          7.20  83                   ?
         84          7.20  83                   ?
         91         17.30  NN                9.10
         92         17.30  NN                9.20
        101          7.20  ?                    ?
        102          1.02  ?                    ?

--- 22 row(s) selected.
>>
>>alter table T056t34 add vch11 char varying(1) heading 'col11';

--- SQL operation complete.
>>
>>set param ?a02 '0';
>>set param ?i02 0;
>>
>>update T056t34 set vch11 = ?a02,
+>  num1 = ?i02, sma1 = ?i02, int1 = ?i02, dec1 = ?i02 where orders = 1;

--- 1 row(s) updated.
>>
>>select orders, vch11, num1, sma1, int1, dec1 from T056t34 where orders < 3;

ORDERS       col11  NUM1         SmallInt  INT1        DEC1      
-----------  -----  -----------  --------  ----------  ----------

          1  0              .00         0           0         .00
          2  ?                ?     65535           ?  1234567.89

--- 2 row(s) selected.
>>
>>select orders, vch3, num10, vch11, dec1 from T056t34;

ORDERS       VARYING(2)  num_10        col11  DEC1      
-----------  ----------  ------------  -----  ----------

          1  NN                 17.30  0             .00
          2  NN                 17.30  ?      1234567.89
         12  NN                 17.30  ?      1234567.89
         16  NN                 17.30  ?      1234567.89
         17  NN                 17.30  ?      1234567.89
         18  NN                 17.30  ?      1234567.89
         20  ?                   7.20  ?               ?
         52  ?                   7.20  ?               ?
         61  ?                   7.20  ?               ?
         62  ?                   7.20  ?               ?
         63  ?                   7.20  ?               ?
         72  ?                   7.20  ?               ?
         73  ?                   7.20  ?               ?
         74  ?                   7.20  ?               ?
         81  ?                   7.20  ?               ?
         82  AB                  7.20  ?               ?
         83  83                  7.20  ?               ?
         84  83                  7.20  ?               ?
         91  NN                 17.30  ?            9.10
         92  NN                 17.30  ?            9.20
        101  ?                   7.20  ?               ?
        102  ?                   1.02  ?               ?

--- 22 row(s) selected.
>>
>>alter table T056t34 add column sma12 SMALLINT SIGNED default -1
+>  check (sma12 < 65535 and sma12 > -100);

--- SQL operation complete.
>>
>>insert into T056t34 (orders, sma1, vch3) values (112,12,'12');

--- 1 row(s) inserted.
>>
>>insert into T056t34 (orders, sma12) values (113, 113);

--- 1 row(s) inserted.
>>
>>#ifndef SEABASE_REGRESS
>>begin work;
>>#endif
>>
>>alter table T056t34 add column vch13 CHARACTER VARYING(255) 
+>  default 'xxx';

--- SQL operation complete.
>>
>>#ifndef SEABASE_REGRESS
>>-- this insert should return a uniq constraint violation. Not supported on Seabase yet.
>>insert into T056t34 (orders, vch1, int1, sma12) values (114,'A',11400, 2000);
>>#endif
>>
>>update T056t34 set vch13 = vch2 where orders = 61;

--- 1 row(s) updated.
>>
>>#ifndef SEABASE_REGRESS
>>commit work;
>>#endif
>>
>>select orders, substring(vch13,1,10), substring(vch2,1,20) 
+>  from T056t34 where orders = 61 or orders <= 115 and orders >= 110;

ORDERS       (EXPR)      (EXPR)              
-----------  ----------  --------------------

         61  character   character varying(25
        112  xxx         ?                   
        113  xxx         ?                   

--- 3 row(s) selected.
>>
>>alter table T056t34 add column int14 int signed default -100 
+>  constraint int14_c check (int14 < 1234567890);

--- SQL operation complete.
>>
>>insert into T056t34 values 
+>  (115, 'A', 7.02, 'A', 700, 'VARCHAR', 100,'VV',9.02,
+>   9.02,'Y', 1, 'COL_14_VCH13', 100);

--- 1 row(s) inserted.
>>
>>insert into T056t34 (orders, int1, vch11) values (116,116,'Z');

--- 1 row(s) inserted.
>>
>>update T056t34 set int14 = int14 - 1, sma12 = sma12 + 100 
+>  where orders < 50 or orders > 100;

--- 13 row(s) updated.
>>
>>select orders, int14, sma12 from T056t34 where orders between 50 and 100;

ORDERS       INT14        SMA12 
-----------  -----------  ------

         52         -100      -1
         61         -100      -1
         62         -100      -1
         63         -100      -1
         72         -100      -1
         73         -100      -1
         74         -100      -1
         81         -100      -1
         82         -100      -1
         83         -100      -1
         84         -100      -1
         91         -100      -1
         92         -100      -1

--- 13 row(s) selected.
>>
>>alter table T056t34 add column vch15 CHARACTER VARYING(2) default 'zz';

--- SQL operation complete.
>>
>>insert into T056t34 (orders, num10, vch3, int14, ch1) 
+>  values (120,1.20,'V8',120, 'y');

--- 1 row(s) inserted.
>>
>>insert into T056t34 (orders, ch1, vch1, vch2, vch3, vch11) 
+>   values (121,'X','x','vch2_varchar255','xx','x');

--- 1 row(s) inserted.
>>
>>insert into T056t34 (orders,vch13) values (123,'the following are eligible for membership: non-profit organizations, educational institutions, market researchers, publishers, consultants, governments, and organizations and businesses who do not create, market or sell computer products or services.');

--- 1 row(s) inserted.
>>
>>update T056t34 set vch15 = 'CD' where ch1 in ('8','A','y');

--- 5 row(s) updated.
>>
>>select orders, vch15, ch1 from T056t34;

ORDERS       VCH15  CH1
-----------  -----  ---

          1  zz     a  
          2  zz     b  
         12  zz     l  
         16  zz     p  
         17  zz     p  
         18  zz     ?  
         20  zz     r  
         52  zz     S  
         61  zz     ?  
         62  zz     V  
         63  zz     ?  
         72  zz     ?  
         73  zz     ?  
         74  zz     ?  
         81  zz     ?  
         82  zz     ?  
         83  CD     8  
         84  CD     8  
         91  zz     9  
         92  zz     ?  
        101  zz     ?  
        102  CD     A  
        112  zz     ?  
        113  zz     ?  
        115  CD     A  
        116  zz     ?  
        120  CD     y  
        121  zz     X  
        123  zz     ?  

--- 29 row(s) selected.
>>
>>alter table T056t34 add column dec16 DEC(9,7) SIGNED default -9.99;

--- SQL operation complete.
>>
>>delete from T056t34
+>   where orders > 80 and orders < 100 and vch15 = 'zz'
+>      or orders < 65 and ch1 is null;

--- 7 row(s) deleted.
>>
>>insert into T056t34 values 
+>  (124,'B',12.4,'b',124,'VCH6_COL16',1240,'Bb',1.24,
+>   11.24,'b',1124,'VCH13_COL16',11240,'bB',12.1234567);

--- 1 row(s) inserted.
>>
>>insert into T056t34 (orders, dec16) values (125,-1.00001);

--- 1 row(s) inserted.
>>
>>select orders, num1, vch3, sma12, vch15 from T056t34 where ch1 = '8';

ORDERS       NUM1         VARYING(2)  SMA12   VCH15
-----------  -----------  ----------  ------  -----

         83            ?  83              -1  CD   
         84         8.23  83              -1  CD   

--- 2 row(s) selected.
>>
>>select orders, int1, sma1, vch11, vch13, vch15 from T056t34 where vch1 = 'x';

ORDERS       INT1        SmallInt  col11  VCH13                                                                                                                                                                                                                                                            VCH15
-----------  ----------  --------  -----  ---------------------------------------------------------------------------------------------------------------------------------------------------------------------------------------------------------------------------------------------------------------  -----

        121           ?         ?  x      xxx                                                                                                                                                                                                                                                              zz   

--- 1 row(s) selected.
>>
>>update T056t34 set 
+>    ch1   = 'q',
+>    num1  = 1.23,
+>    vch1  = 'Q',
+>    vch2  = 'Such book shall be kept at the principal office of the Corporation and shall be subject to the rights of inspection required by law as set forth in Section 2.9 of these Bylaws. The Administrator shall be responsible for maintaining such book.',
+>    vch11 = 'q',
+>    sma1  = 123,
+>    vch13 = 'Such book shall be kept at the principal office of the Corporation and shall be subject to the rights of inspection required by law as set forth in Section 2.9 of these Bylaws. The Administrator shall be responsible for maintaining such book.',
+>    int14 = 123456789
+>  where orders = 123;

--- 1 row(s) updated.
>>
>>select vch1, vch11, sma1, int14 from T056t34 where orders = 123;

VCH1  col11  SmallInt  INT14      
----  -----  --------  -----------

Q     q           123    123456789

--- 1 row(s) selected.
>>
>>alter table T056t34 add column vch17 varchar(80) upshift default 'vch17';

--- SQL operation complete.
>>
>>#ifndef SEABASE_REGRESS
>>begin work;
>>
>>insert into T056t34 (orders, ch1, vch15, vch17) 
+>  values (128, 'J', 'jj', '12345678901234567890123456789012345678901234567890123456789012345678901234567890');
>>
>>
>>update T056t34 set vch17 = 'vahalla' where orders < 110;
>>
>>rollback;
>>#endif
>>
>>select orders, dec1, ch1, int1, vch15 from T056t34 where orders > 123;

ORDERS       DEC1        CH1  INT1        VCH15
-----------  ----------  ---  ----------  -----

        124        1.24  B          1240  bB   
        125           ?  ?             ?  zz   

--- 2 row(s) selected.
>>
>>#ifndef SEABASE_REGRESS
>>begin work;
>>
>>delete from T056t34 where num1 is NULL
+>   and sma12 = -1 and int14 = -100 and orders > 100;
>>
>>update T056t34 set vch17 = 'denali' where orders > 100;
>>
>>rollback;
>>
>>begin work;
>>
>>delete from T056t34 where orders < 100 and vch17 = 'VCH17';
>>
>>insert into T056t34 (orders, vch17) values (1, 'row_1');
>>insert into T056t34 (orders, vch15) values (3, 'XP');
>>
>>select orders, vch15, vch17 from T056t34 where orders < 5;
>>
>>rollback;
>>
>>select orders, vch15, vch17 from T056t34;
>>
>>begin work;
>>
>>delete from T056t34 where vch15 = 'zz';
>>select vch15, vch17, vch1 from T056t34;
>>
>>rollback work;
>>#endif
>>
>>select orders, vch15 from T056t34 where vch15 like 'z%';

ORDERS       VCH15
-----------  -----

          1  zz   
          2  zz   
         12  zz   
         16  zz   
         17  zz   
         20  zz   
         52  zz   
         62  zz   
         72  zz   
         73  zz   
         74  zz   
        101  zz   
        112  zz   
        113  zz   
        116  zz   
        121  zz   
        123  zz   
        125  zz   

--- 18 row(s) selected.
>>delete from T056t34 where vch15 = 'zz';

--- 18 row(s) deleted.
>>select orders, vch15, vch17 from T056t34 where vch15 = 'zz';

--- 0 row(s) selected.
>>
>>#ifMX
>>
>>obey TEST056(tests3);
>>------------------------------------------------
>>-- Test cases for Genesis case 10-021115-6165 --
>>------------------------------------------------
>>
>>-- Expecting an error message; number of significant digits (to the left of the
>>-- decimal point) is greater than 3 (7 - 4 = 3).
>>create table t056t50 (t056t50_col1 decimal (7,4) default 12345.67 not null primary key);

*** ERROR[8411] A numeric overflow occurred during an arithmetic computation or data conversion. Conversion of Source Type:LARGEINT(REC_BIN64_SIGNED) Source Value:123456700 to Target Type:DECIMAL SIGNED(REC_DECIMAL_LSE).

*** ERROR[1186] Column T056T50_COL1 is of type DECIMAL(7,4) SIGNED which is not compatible with the default value's type, 12345.67.

--- SQL operation failed with errors.
>>
>>create table t056t51 (t056t51_col1 decimal (7,4) default 123.67 not null primary key);

--- SQL operation complete.
>>insert into t056t51 default values;

--- 1 row(s) inserted.
>>
>>select * from t056t51;

T056T51_COL1
------------

    123.6700

--- 1 row(s) selected.
>>
>>alter table t056t51 add column t056t51_col2 decimal(8,5) unsigned default + 00321.123456;

--- SQL operation complete.
>>alter table t056t51 add column t056t51_col3 numeric(4,4) default - 0.123456;

--- SQL operation complete.
>>alter table t056t51 add column t056t51_col4 numeric(7,4) unsigned default 123.12;

--- SQL operation complete.
>>alter table t056t51 add column t056t51_col5 decimal(2,2) unsigned default 0.67;

--- SQL operation complete.
>>
>>select * from t056t51;

T056T51_COL1  T056T51_COL2  T056T51_COL3  T056T51_COL4  T056T51_COL5
------------  ------------  ------------  ------------  ------------

    123.6700     321.12345        -.1234      123.1200           .67

--- 1 row(s) selected.
>>
>>-- Expecting an error message
>>alter table t056t51 add column t056t51_bad_col numeric (5,4) default 12345.67;

*** ERROR[8411] A numeric overflow occurred during an arithmetic computation or data conversion. Source Type:LARGEINT(MBIN64S) Source Value:123456700 Target Type:LARGEINT(IBIN64S) Max Target Value:99999. Instruction:RANGE_HIGH_S64S64 Operation:RANGE_HIGH.

*** ERROR[1186] Column T056T51_BAD_COL is of type NUMERIC(5,4) SIGNED which is not compatible with the default value's type, 12345.67.

--- SQL operation failed with errors.
>>alter table t056t51 add column t056t51_bad_col smallint unsigned default 999999.12;

*** ERROR[8411] A numeric overflow occurred during an arithmetic computation or data conversion. Conversion of Source Type:LARGEINT(REC_BIN64_SIGNED) Source Value:9999.99 to Target Type:SMALLINT UNSIGNED(REC_BIN16_UNSIGNED).

*** ERROR[1186] Column T056T51_BAD_COL is of type SMALLINT UNSIGNED which is not compatible with the default value's type, 999999.12.

--- SQL operation failed with errors.
>>-- The following test case got an internal error message which is not desirable...
>>alter table t056t51 add column t056t51_bad_col decimal(8,5) unsigned default -123.456789;

*** ERROR[8432] A negative value cannot be converted to an unsigned numeric datatype.

*** ERROR[1186] Column T056T51_BAD_COL is of type DECIMAL(8,5) UNSIGNED which is not compatible with the default value's type, -123.456789.

--- SQL operation failed with errors.
>>
>>create table t056t52 (t056t52_col int not null primary key);

--- SQL operation complete.
>>insert into t056t52 values (10), (2);

--- 2 row(s) inserted.
>>alter table t056t52 add column t056t52_col2 pic 999v999 default 123.67;

--- SQL operation complete.
>>select * from t056t52;

T056T52_COL  T056T52_COL2
-----------  ------------

          2       123.670
         10       123.670

--- 2 row(s) selected.
>>insert into t056t52 values (1, default), (20, 222);

--- 2 row(s) inserted.
>>select * from t056t52;

T056T52_COL  T056T52_COL2
-----------  ------------

          1       123.670
          2       123.670
         10       123.670
         20       222.000

--- 4 row(s) selected.
>>
>>create table t056t53 (t056t53_col decimal (7,4) default 00345.67 not null primary key);

--- SQL operation complete.
>>insert into t056t53 default values;

--- 1 row(s) inserted.
>>select * from t056t53;

T056T53_COL
-----------

   345.6700

--- 1 row(s) selected.
>>alter table t056t53 add column t056t53_col2 int unsigned default 123.456789;

--- SQL operation complete.
>>alter table t056t53 add column t056t53_col3 bigint default -123.;

--- SQL operation complete.
>>select * from t056t53;

T056T53_COL  T056T53_COL2  T056T53_COL3        
-----------  ------------  --------------------

   345.6700           123                  -123

--- 1 row(s) selected.
>>
>>create table t056t54 (t056t54_col pic s9(3)v9(4) default - 00000123.456
+>                      not null primary key);

--- SQL operation complete.
>>insert into t056t54 default values;

--- 1 row(s) inserted.
>>select * from t056t54;

T056T54_COL
-----------

  -123.4560

--- 1 row(s) selected.
>>
>>create table t056t55 (t056t55_col pic 9(0)v9(4) default 0.67 not null primary key);

--- SQL operation complete.
>>insert into t056t55 default values;

--- 1 row(s) inserted.
>>select * from t056t55;

T056T55_COL
-----------

      .6700

--- 1 row(s) selected.
>>
>>create table t056t56 (t056t56_col numeric(10,2)
+>                      default - 00000000 not null primary key);

--- SQL operation complete.
>>insert into t056t56 default values;

--- 1 row(s) inserted.
>>select * from t056t56;

T056T56_COL          
---------------------

                  .00

--- 1 row(s) selected.
>>alter table t056t56 add column t056t56_col2 int default 0.0;

--- SQL operation complete.
>>alter table t056t56 add column t056t56_col3 pic 9 default +00;

--- SQL operation complete.
>>alter table t056t56 add column t056t56_col4 decimal default 0;

--- SQL operation complete.
>>select * from t056t56;

T056T56_COL            T056T56_COL2  T056T56_COL3  T056T56_COL4
---------------------  ------------  ------------  ------------

                  .00             0             0             0

--- 1 row(s) selected.
>>
>>create table t056t57 (a1 numeric(2,2) signed default 0 not null);

--- SQL operation complete.
>>showddl t056t57;

CREATE TABLE TRAFODION.SCH.T056T57
  (
    A1                               NUMERIC(2, 2) DEFAULT 0 NOT NULL NOT
      DROPPABLE
  )
 ATTRIBUTES ALIGNED FORMAT
;

--- SQL operation complete.
>>insert into t056t57 default values;

--- 1 row(s) inserted.
>>select * from t056t57;

A1   
-----

  .00

--- 1 row(s) selected.
>>
>>create table t056t58 (a1 decimal(4,4) signed default -0.0000 not null);

--- SQL operation complete.
>>showddl t056t58;

CREATE TABLE TRAFODION.SCH.T056T58
  (
    A1                               DECIMAL(4, 4) DEFAULT -0.0000 NOT NULL NOT
      DROPPABLE
  )
 ATTRIBUTES ALIGNED FORMAT
;

--- SQL operation complete.
>>insert into t056t58 default values;

--- 1 row(s) inserted.
>>select * from t056t58;

A1    
------

 .0000

--- 1 row(s) selected.
>>
>>create table t056t59 (a1 decimal(3,3) signed default - 0000.12 not null);

--- SQL operation complete.
>>showddl t056t59;

CREATE TABLE TRAFODION.SCH.T056T59
  (
    A1                               DECIMAL(3, 3) DEFAULT -0000.12 NOT NULL
      NOT DROPPABLE
  )
 ATTRIBUTES ALIGNED FORMAT
;

--- SQL operation complete.
>>insert into t056t59 default values;

--- 1 row(s) inserted.
>>select * from t056t59;

A1   
-----

-.120

--- 1 row(s) selected.
>>
>>create table t056t60 (a1 numeric(2,2) unsigned default 0.00 not null);

--- SQL operation complete.
>>showddl t056t60;

CREATE TABLE TRAFODION.SCH.T056T60
  (
    A1                               NUMERIC(2, 2)  UNSIGNED DEFAULT 0.00 NOT
      NULL NOT DROPPABLE
  )
 ATTRIBUTES ALIGNED FORMAT
;

--- SQL operation complete.
>>insert into t056t60 default values;

--- 1 row(s) inserted.
>>select * from t056t60;

A1  
----

 .00

--- 1 row(s) selected.
>>
>>create table t056t61 (a1 numeric(2,2) default -0.0 not null);

--- SQL operation complete.
>>showddl t056t61;

CREATE TABLE TRAFODION.SCH.T056T61
  (
    A1                               NUMERIC(2, 2) DEFAULT -0.0 NOT NULL NOT
      DROPPABLE
  )
 ATTRIBUTES ALIGNED FORMAT
;

--- SQL operation complete.
>>insert into t056t61 default values;

--- 1 row(s) inserted.
>>select * from t056t61;

A1   
-----

  .00

--- 1 row(s) selected.
>>
>>obey TEST056(tests4);
>>obey test056(test4OLTops);
>>obey test056(test4ddl);
>>------------------------------------------------
>>-- Test cases for Genesis case 10-081121-3272 --
>>-- Add column + OLT fetch/update/delete tests --
>>------------------------------------------------
>>create table t056t62 (i1 numeric(18) default 71 not null,
+>                      i2 numeric(18,7) default 69, 
+>                      i3 largeint default 39 
+>                        primary key desc not null)
+>                      location $DATA;

--- SQL operation complete.
>>
>>create table t056t63 (i2 numeric (7,0)
+>                        primary key desc not null,
+>                      i3 double precision default 16 not null,
+>                      s0Integer PIC S9(4) default 85 not null,
+>                      i1 decimal(18) default 12734 not null)
+>                      store by primary key
+>                      location $DATA2;

--- SQL operation complete.
>>
>>obey test056(test4data);
>>insert into t056t62 values (204, 1.3815032111910257E9, 33);

--- 1 row(s) inserted.
>>insert into t056t62 values (207, 3.019297491424696E8,  39);

--- 1 row(s) inserted.
>>insert into t056t62 values (216, 1.5142273252355876E9, 38);

--- 1 row(s) inserted.
>>alter table t056t62 add column s0Integer decimal (4,0) default -421;

--- SQL operation complete.
>>insert into t056t62 values (188, null, 59, 250);

--- 1 row(s) inserted.
>>insert into t056t62 values (216, null, 68, 147);

--- 1 row(s) inserted.
>>
>>insert into t056t63 values (16, 4714.74, 14, 12734);

--- 1 row(s) inserted.
>>
>>obey test056(test4OLTfetch);
>>-- expect 5 rows
>>select * from t056t62;

I1                    I2                     I3                    S0INTEGER
--------------------  ---------------------  --------------------  ---------

                 216                      ?                    68        147
                 188                      ?                    59        250
                 207      301929749.1424696                    39       -421
                 216     1514227325.2355876                    38       -421
                 204     1381503211.1910258                    33       -421

--- 5 row(s) selected.
>>prepare x from select count(*) from t056t62 where i3 = ?p and i1 > 100;

--- SQL command prepared.
>>set param ?p 59;
>>execute x;

(EXPR)              
--------------------

                   1

--- 1 row(s) selected.
>>set param ?p 39;
>>execute x;

(EXPR)              
--------------------

                   1

--- 1 row(s) selected.
>>-- expect the same 5 rows
>>select * from t056t62;

I1                    I2                     I3                    S0INTEGER
--------------------  ---------------------  --------------------  ---------

                 216                      ?                    68        147
                 188                      ?                    59        250
                 207      301929749.1424696                    39       -421
                 216     1514227325.2355876                    38       -421
                 204     1381503211.1910258                    33       -421

--- 5 row(s) selected.
>>
>>obey test056(test4cleanup);
>>drop table t056t62;

--- SQL operation complete.
>>drop table t056t63;

--- SQL operation complete.
>>
>>
>>obey test056(test4ddl);
>>------------------------------------------------
>>-- Test cases for Genesis case 10-081121-3272 --
>>-- Add column + OLT fetch/update/delete tests --
>>------------------------------------------------
>>create table t056t62 (i1 numeric(18) default 71 not null,
+>                      i2 numeric(18,7) default 69, 
+>                      i3 largeint default 39 
+>                        primary key desc not null)
+>                      location $DATA;

--- SQL operation complete.
>>
>>create table t056t63 (i2 numeric (7,0)
+>                        primary key desc not null,
+>                      i3 double precision default 16 not null,
+>                      s0Integer PIC S9(4) default 85 not null,
+>                      i1 decimal(18) default 12734 not null)
+>                      store by primary key
+>                      location $DATA2;

--- SQL operation complete.
>>
>>obey test056(test4data);
>>insert into t056t62 values (204, 1.3815032111910257E9, 33);

--- 1 row(s) inserted.
>>insert into t056t62 values (207, 3.019297491424696E8,  39);

--- 1 row(s) inserted.
>>insert into t056t62 values (216, 1.5142273252355876E9, 38);

--- 1 row(s) inserted.
>>alter table t056t62 add column s0Integer decimal (4,0) default -421;

--- SQL operation complete.
>>insert into t056t62 values (188, null, 59, 250);

--- 1 row(s) inserted.
>>insert into t056t62 values (216, null, 68, 147);

--- 1 row(s) inserted.
>>
>>insert into t056t63 values (16, 4714.74, 14, 12734);

--- 1 row(s) inserted.
>>
>>obey test056(test4OLTupdate);
>>-- expect 5 rows
>>select * from t056t62;

I1                    I2                     I3                    S0INTEGER
--------------------  ---------------------  --------------------  ---------

                 216                      ?                    68        147
                 188                      ?                    59        250
                 207      301929749.1424696                    39       -421
                 216     1514227325.2355876                    38       -421
                 204     1381503211.1910258                    33       -421

--- 5 row(s) selected.
>>prepare x from update t056t62 set i2 = 0 where i3 = ?p and i1 > 100;

--- SQL command prepared.
>>set param ?p 59;
>>execute x;

--- 1 row(s) updated.
>>set param ?p 39;
>>execute x;

--- 1 row(s) updated.
>>-- expect 5 rows with only I2 col updated for 2 rows
>>select * from t056t62;

I1                    I2                     I3                    S0INTEGER
--------------------  ---------------------  --------------------  ---------

                 216                      ?                    68        147
                 188               .0000000                    59        250
                 207               .0000000                    39       -421
                 216     1514227325.2355876                    38       -421
                 204     1381503211.1910258                    33       -421

--- 5 row(s) selected.
>>
>>obey test056(test4cleanup);
>>drop table t056t62;

--- SQL operation complete.
>>drop table t056t63;

--- SQL operation complete.
>>
>>
>>obey test056(test4ddl);
>>------------------------------------------------
>>-- Test cases for Genesis case 10-081121-3272 --
>>-- Add column + OLT fetch/update/delete tests --
>>------------------------------------------------
>>create table t056t62 (i1 numeric(18) default 71 not null,
+>                      i2 numeric(18,7) default 69, 
+>                      i3 largeint default 39 
+>                        primary key desc not null)
+>                      location $DATA;

--- SQL operation complete.
>>
>>create table t056t63 (i2 numeric (7,0)
+>                        primary key desc not null,
+>                      i3 double precision default 16 not null,
+>                      s0Integer PIC S9(4) default 85 not null,
+>                      i1 decimal(18) default 12734 not null)
+>                      store by primary key
+>                      location $DATA2;

--- SQL operation complete.
>>
>>obey test056(test4data);
>>insert into t056t62 values (204, 1.3815032111910257E9, 33);

--- 1 row(s) inserted.
>>insert into t056t62 values (207, 3.019297491424696E8,  39);

--- 1 row(s) inserted.
>>insert into t056t62 values (216, 1.5142273252355876E9, 38);

--- 1 row(s) inserted.
>>alter table t056t62 add column s0Integer decimal (4,0) default -421;

--- SQL operation complete.
>>insert into t056t62 values (188, null, 59, 250);

--- 1 row(s) inserted.
>>insert into t056t62 values (216, null, 68, 147);

--- 1 row(s) inserted.
>>
>>insert into t056t63 values (16, 4714.74, 14, 12734);

--- 1 row(s) inserted.
>>
>>obey test056(test4OLTdelete);
>>-- expect 5 rows
>>select count(*) from t056t62;

(EXPR)              
--------------------

                   5

--- 1 row(s) selected.
>>delete from t056t62 where ( not (i1) in
+>                             (select count(*) from t056t63 t2
+>                             where ( 6 < 3 ) group by t2.i2) );

--- 5 row(s) deleted.
>>-- expect 0 rows							 
>>select count(*) from t056t62;

(EXPR)              
--------------------

                   0

--- 1 row(s) selected.
>>
>>obey test056(test4cleanup);
>>drop table t056t62;

--- SQL operation complete.
>>drop table t056t63;

--- SQL operation complete.
>>
>>
>>obey test056(test4OLTops);
>>obey test056(test4ddl);
>>------------------------------------------------
>>-- Test cases for Genesis case 10-081121-3272 --
>>-- Add column + OLT fetch/update/delete tests --
>>------------------------------------------------
>>create table t056t62 (i1 numeric(18) default 71 not null,
+>                      i2 numeric(18,7) default 69, 
+>                      i3 largeint default 39 
+>                        primary key desc not null)
+>                      location $DATA;

--- SQL operation complete.
>>
>>create table t056t63 (i2 numeric (7,0)
+>                        primary key desc not null,
+>                      i3 double precision default 16 not null,
+>                      s0Integer PIC S9(4) default 85 not null,
+>                      i1 decimal(18) default 12734 not null)
+>                      store by primary key
+>                      location $DATA2;

--- SQL operation complete.
>>
>>obey test056(test4data);
>>insert into t056t62 values (204, 1.3815032111910257E9, 33);

--- 1 row(s) inserted.
>>insert into t056t62 values (207, 3.019297491424696E8,  39);

--- 1 row(s) inserted.
>>insert into t056t62 values (216, 1.5142273252355876E9, 38);

--- 1 row(s) inserted.
>>alter table t056t62 add column s0Integer decimal (4,0) default -421;

--- SQL operation complete.
>>insert into t056t62 values (188, null, 59, 250);

--- 1 row(s) inserted.
>>insert into t056t62 values (216, null, 68, 147);

--- 1 row(s) inserted.
>>
>>insert into t056t63 values (16, 4714.74, 14, 12734);

--- 1 row(s) inserted.
>>
>>obey test056(test4OLTfetch);
>>-- expect 5 rows
>>select * from t056t62;

I1                    I2                     I3                    S0INTEGER
--------------------  ---------------------  --------------------  ---------

                 216                      ?                    68        147
                 188                      ?                    59        250
                 207      301929749.1424696                    39       -421
                 216     1514227325.2355876                    38       -421
                 204     1381503211.1910258                    33       -421

--- 5 row(s) selected.
>>prepare x from select count(*) from t056t62 where i3 = ?p and i1 > 100;

--- SQL command prepared.
>>set param ?p 59;
>>execute x;

(EXPR)              
--------------------

                   1

--- 1 row(s) selected.
>>set param ?p 39;
>>execute x;

(EXPR)              
--------------------

                   1

--- 1 row(s) selected.
>>-- expect the same 5 rows
>>select * from t056t62;

I1                    I2                     I3                    S0INTEGER
--------------------  ---------------------  --------------------  ---------

                 216                      ?                    68        147
                 188                      ?                    59        250
                 207      301929749.1424696                    39       -421
                 216     1514227325.2355876                    38       -421
                 204     1381503211.1910258                    33       -421

--- 5 row(s) selected.
>>
>>obey test056(test4cleanup);
>>drop table t056t62;

--- SQL operation complete.
>>drop table t056t63;

--- SQL operation complete.
>>
>>
>>obey test056(test4ddl);
>>------------------------------------------------
>>-- Test cases for Genesis case 10-081121-3272 --
>>-- Add column + OLT fetch/update/delete tests --
>>------------------------------------------------
>>create table t056t62 (i1 numeric(18) default 71 not null,
+>                      i2 numeric(18,7) default 69, 
+>                      i3 largeint default 39 
+>                        primary key desc not null)
+>                      location $DATA;

--- SQL operation complete.
>>
>>create table t056t63 (i2 numeric (7,0)
+>                        primary key desc not null,
+>                      i3 double precision default 16 not null,
+>                      s0Integer PIC S9(4) default 85 not null,
+>                      i1 decimal(18) default 12734 not null)
+>                      store by primary key
+>                      location $DATA2;

--- SQL operation complete.
>>
>>obey test056(test4data);
>>insert into t056t62 values (204, 1.3815032111910257E9, 33);

--- 1 row(s) inserted.
>>insert into t056t62 values (207, 3.019297491424696E8,  39);

--- 1 row(s) inserted.
>>insert into t056t62 values (216, 1.5142273252355876E9, 38);

--- 1 row(s) inserted.
>>alter table t056t62 add column s0Integer decimal (4,0) default -421;

--- SQL operation complete.
>>insert into t056t62 values (188, null, 59, 250);

--- 1 row(s) inserted.
>>insert into t056t62 values (216, null, 68, 147);

--- 1 row(s) inserted.
>>
>>insert into t056t63 values (16, 4714.74, 14, 12734);

--- 1 row(s) inserted.
>>
>>obey test056(test4OLTupdate);
>>-- expect 5 rows
>>select * from t056t62;

I1                    I2                     I3                    S0INTEGER
--------------------  ---------------------  --------------------  ---------

                 216                      ?                    68        147
                 188                      ?                    59        250
                 207      301929749.1424696                    39       -421
                 216     1514227325.2355876                    38       -421
                 204     1381503211.1910258                    33       -421

--- 5 row(s) selected.
>>prepare x from update t056t62 set i2 = 0 where i3 = ?p and i1 > 100;

--- SQL command prepared.
>>set param ?p 59;
>>execute x;

--- 1 row(s) updated.
>>set param ?p 39;
>>execute x;

--- 1 row(s) updated.
>>-- expect 5 rows with only I2 col updated for 2 rows
>>select * from t056t62;

I1                    I2                     I3                    S0INTEGER
--------------------  ---------------------  --------------------  ---------

                 216                      ?                    68        147
                 188               .0000000                    59        250
                 207               .0000000                    39       -421
                 216     1514227325.2355876                    38       -421
                 204     1381503211.1910258                    33       -421

--- 5 row(s) selected.
>>
>>obey test056(test4cleanup);
>>drop table t056t62;

--- SQL operation complete.
>>drop table t056t63;

--- SQL operation complete.
>>
>>
>>obey test056(test4ddl);
>>------------------------------------------------
>>-- Test cases for Genesis case 10-081121-3272 --
>>-- Add column + OLT fetch/update/delete tests --
>>------------------------------------------------
>>create table t056t62 (i1 numeric(18) default 71 not null,
+>                      i2 numeric(18,7) default 69, 
+>                      i3 largeint default 39 
+>                        primary key desc not null)
+>                      location $DATA;

--- SQL operation complete.
>>
>>create table t056t63 (i2 numeric (7,0)
+>                        primary key desc not null,
+>                      i3 double precision default 16 not null,
+>                      s0Integer PIC S9(4) default 85 not null,
+>                      i1 decimal(18) default 12734 not null)
+>                      store by primary key
+>                      location $DATA2;

--- SQL operation complete.
>>
>>obey test056(test4data);
>>insert into t056t62 values (204, 1.3815032111910257E9, 33);

--- 1 row(s) inserted.
>>insert into t056t62 values (207, 3.019297491424696E8,  39);

--- 1 row(s) inserted.
>>insert into t056t62 values (216, 1.5142273252355876E9, 38);

--- 1 row(s) inserted.
>>alter table t056t62 add column s0Integer decimal (4,0) default -421;

--- SQL operation complete.
>>insert into t056t62 values (188, null, 59, 250);

--- 1 row(s) inserted.
>>insert into t056t62 values (216, null, 68, 147);

--- 1 row(s) inserted.
>>
>>insert into t056t63 values (16, 4714.74, 14, 12734);

--- 1 row(s) inserted.
>>
>>obey test056(test4OLTdelete);
>>-- expect 5 rows
>>select count(*) from t056t62;

(EXPR)              
--------------------

                   5

--- 1 row(s) selected.
>>delete from t056t62 where ( not (i1) in
+>                             (select count(*) from t056t63 t2
+>                             where ( 6 < 3 ) group by t2.i2) );

--- 5 row(s) deleted.
>>-- expect 0 rows							 
>>select count(*) from t056t62;

(EXPR)              
--------------------

                   0

--- 1 row(s) selected.
>>
>>obey test056(test4cleanup);
>>drop table t056t62;

--- SQL operation complete.
>>drop table t056t63;

--- SQL operation complete.
>>
>>
>>
>>obey TEST056(tests5);
>>------------------------------------------------
>>-- Test cases for add column with no
>>-- expandShortRow() called on them. 
>>------------------------------------------------
>>obey test056(test5NoExpandShortRow);
>>obey test056(test5SyskeyOneVarchar);
>>-- test for syskey + only varchar fields + pad bytes before syskey
>>create table t056t5 (i1 varchar(8) not null not droppable) store by (i1);

--- SQL operation complete.
>>insert into t056t5 values ('a');

--- 1 row(s) inserted.
>>alter table t056t5 add column i2 varchar(4) default '1234' not null;

--- SQL operation complete.
>>insert into t056t5 values ('b','1234');

--- 1 row(s) inserted.
>>select i2 from t056t5;

I2  
----

1234
1234

--- 2 row(s) selected.
>>drop table t056t5;

--- SQL operation complete.
>>
>>obey test056(test5SyskeyAllFixed);
>>-- test for syskey + all fixed fields + padding bytes
>>create table t056t5 ( 
+>    a1 decimal (18) not null not droppable,
+>    a2 numeric (9, 2) default 49,
+>    a4 decimal (9,0) ) 
+>    location $DATA2
+>    store by (a1 asc);

--- SQL operation complete.
>>insert into t056t5 values ( 1, 66.22, null);

--- 1 row(s) inserted.
>>alter table t056t5 add column b1 decimal (18) default 1580 not null not droppable;

--- SQL operation complete.
>>insert into t056t5 values ( 2, 66.22, 12123, 34343);

--- 1 row(s) inserted.
>>select b1 from t056t5;

B1                 
-------------------

               1580
              34343

--- 2 row(s) selected.
>>drop table t056t5;

--- SQL operation complete.
>>
>>
>>obey test056(test5NoExpandShortRow);
>>obey test056(test5SyskeyOneVarchar);
>>-- test for syskey + only varchar fields + pad bytes before syskey
>>create table t056t5 (i1 varchar(8) not null not droppable) store by (i1);

--- SQL operation complete.
>>insert into t056t5 values ('a');

--- 1 row(s) inserted.
>>alter table t056t5 add column i2 varchar(4) default '1234' not null;

--- SQL operation complete.
>>insert into t056t5 values ('b','1234');

--- 1 row(s) inserted.
>>select i2 from t056t5;

I2  
----

1234
1234

--- 2 row(s) selected.
>>drop table t056t5;

--- SQL operation complete.
>>
>>obey test056(test5SyskeyAllFixed);
>>-- test for syskey + all fixed fields + padding bytes
>>create table t056t5 ( 
+>    a1 decimal (18) not null not droppable,
+>    a2 numeric (9, 2) default 49,
+>    a4 decimal (9,0) ) 
+>    location $DATA2
+>    store by (a1 asc);

--- SQL operation complete.
>>insert into t056t5 values ( 1, 66.22, null);

--- 1 row(s) inserted.
>>alter table t056t5 add column b1 decimal (18) default 1580 not null not droppable;

--- SQL operation complete.
>>insert into t056t5 values ( 2, 66.22, 12123, 34343);

--- 1 row(s) inserted.
>>select b1 from t056t5;

B1                 
-------------------

               1580
              34343

--- 2 row(s) selected.
>>drop table t056t5;

--- SQL operation complete.
>>
>>
>>
>>obey TEST056(testbugfix);
>>
>>obey test056(testExpandShortRowSyskey);
>>-- case 10-090423-0104 
>>
>>create table t056syskey
+>  (
+>    vch1 varchar(3)
+>  , vch2 varchar(1) 
+>  ) no partition;

--- SQL operation complete.
>>
>>insert into t056syskey (vch2) values ('a');

--- 1 row(s) inserted.
>>alter table t056syskey add column ch4 char(3);

--- SQL operation complete.
>>select vch1,vch2 from t056syskey;

VCH1  VCH2
----  ----

?     a   

--- 1 row(s) selected.
>>
>>-- In the above test, there are two nullable varchars and the added column
>>-- is a nullable fixed column. This added column causes 1 bit shift in how
>>-- null bits will be interpreted in a short row. evalClauses() does not 
>>-- handle shifts in null bits due to added columns. The fix is to expand the
>>-- short row in syskey case too.
>>
>>obey test056(testPaddingChar4to2);
>>-- case 10-090505-4165 
>>-- Table with 4 bytes padding characters after bitmap
>>
>>create table t056pc4to2
+> (
+>    i largeint not null not droppable primary key,
+>    vch1 varchar(3)
+>  , vch2 varchar(1)
+>  ) no partition;

--- SQL operation complete.
>>
>>insert into t056pc4to2 values (1,'000','a');

--- 1 row(s) inserted.
>>
>>alter table t056pc4to2 add column vch3 varchar(8) default 'Z';

--- SQL operation complete.
>>
>>-- After alter table, one VO3 has been inserted before bitmap, padding
>>-- characters after bitmap should be changed from 4 bytes to 2 bytes.
>>
>>select * from t056pc4to2;

I                     VCH1  VCH2  VCH3    
--------------------  ----  ----  --------

                   1  000   a     Z       

--- 1 row(s) selected.
>>
>>
>>obey TEST056(tests6);
>>-- insert tests with nullable indirect varchars
>>-- for aligned and packed format.
>>obey test056(test6NullVarchar);
>>drop table t056t64;

*** ERROR[1389] Object TRAFODION.SCH.T056T64 does not exist in Trafodion.

--- SQL operation failed with errors.
>>create table t056t64
+>  (
+>     a int not null not droppable primary key,
+>     b varchar(10),
+>     c varchar(20)
+>  ) no partitions;

--- SQL operation complete.
>>
>>insert into t056t64 values (1, 'abc', null);

--- 1 row(s) inserted.
>>insert into t056t64 values (2, null, 'abc');

--- 1 row(s) inserted.
>>insert into t056t64 values (3, null, null);

--- 1 row(s) inserted.
>>insert into t056t64 values (4, 'abc', 'abc');

--- 1 row(s) inserted.
>>insert into t056t64 (c, b, a) values (null, null, 5);

--- 1 row(s) inserted.
>>
>>select * from t056t64;

A            B           C                   
-----------  ----------  --------------------

          1  abc         ?                   
          2  ?           abc                 
          3  ?           ?                   
          4  abc         abc                 
          5  ?           ?                   

--- 5 row(s) selected.
>>alter table t056t64 add column d varchar(30) default 'pqr';

--- SQL operation complete.
>>insert into t056t64 (d, c, b, a) values (null, null, null, 6);

--- 1 row(s) inserted.
>>select * from t056t64;

A            B           C                     D
-----------  ----------  --------------------  ------------------------------

          1  abc         ?                     pqr                           
          2  ?           abc                   pqr                           
          3  ?           ?                     pqr                           
          4  abc         abc                   pqr                           
          5  ?           ?                     pqr                           
          6  ?           ?                     ?                             

--- 6 row(s) selected.
>>alter table t056t64 add column e varchar(30) default null;

--- SQL operation complete.
>>insert into t056t64 (d, c, e, b, a) values (null, null, 'foo', null, 7);

--- 1 row(s) inserted.
>>select * from t056t64;

A            B           C                     D                               E
-----------  ----------  --------------------  ------------------------------  ------------------------------

          1  abc         ?                     pqr                             ?                             
          2  ?           abc                   pqr                             ?                             
          3  ?           ?                     pqr                             ?                             
          4  abc         abc                   pqr                             ?                             
          5  ?           ?                     pqr                             ?                             
          6  ?           ?                     ?                               ?                             
          7  ?           ?                     ?                               foo                           

--- 7 row(s) selected.
>>update t056t64 set b = null;

--- 7 row(s) updated.
>>update t056t64 set c = null;

--- 7 row(s) updated.
>>update t056t64 set d = '';

--- 7 row(s) updated.
>>select * from t056t64;

A            B           C                     D                               E
-----------  ----------  --------------------  ------------------------------  ------------------------------

          1  ?           ?                                                     ?                             
          2  ?           ?                                                     ?                             
          3  ?           ?                                                     ?                             
          4  ?           ?                                                     ?                             
          5  ?           ?                                                     ?                             
          6  ?           ?                                                     ?                             
          7  ?           ?                                                     foo                           

--- 7 row(s) selected.
>>
>>obey test056(test6NullVarchar);
>>drop table t056t64;

--- SQL operation complete.
>>create table t056t64
+>  (
+>     a int not null not droppable primary key,
+>     b varchar(10),
+>     c varchar(20)
+>  ) no partitions;

--- SQL operation complete.
>>
>>insert into t056t64 values (1, 'abc', null);

--- 1 row(s) inserted.
>>insert into t056t64 values (2, null, 'abc');

--- 1 row(s) inserted.
>>insert into t056t64 values (3, null, null);

--- 1 row(s) inserted.
>>insert into t056t64 values (4, 'abc', 'abc');

--- 1 row(s) inserted.
>>insert into t056t64 (c, b, a) values (null, null, 5);

--- 1 row(s) inserted.
>>
>>select * from t056t64;

A            B           C                   
-----------  ----------  --------------------

          1  abc         ?                   
          2  ?           abc                 
          3  ?           ?                   
          4  abc         abc                 
          5  ?           ?                   

--- 5 row(s) selected.
>>alter table t056t64 add column d varchar(30) default 'pqr';

--- SQL operation complete.
>>insert into t056t64 (d, c, b, a) values (null, null, null, 6);

--- 1 row(s) inserted.
>>select * from t056t64;

A            B           C                     D
-----------  ----------  --------------------  ------------------------------

          1  abc         ?                     pqr                           
          2  ?           abc                   pqr                           
          3  ?           ?                     pqr                           
          4  abc         abc                   pqr                           
          5  ?           ?                     pqr                           
          6  ?           ?                     ?                             

--- 6 row(s) selected.
>>alter table t056t64 add column e varchar(30) default null;

--- SQL operation complete.
>>insert into t056t64 (d, c, e, b, a) values (null, null, 'foo', null, 7);

--- 1 row(s) inserted.
>>select * from t056t64;

A            B           C                     D                               E
-----------  ----------  --------------------  ------------------------------  ------------------------------

          1  abc         ?                     pqr                             ?                             
          2  ?           abc                   pqr                             ?                             
          3  ?           ?                     pqr                             ?                             
          4  abc         abc                   pqr                             ?                             
          5  ?           ?                     pqr                             ?                             
          6  ?           ?                     ?                               ?                             
          7  ?           ?                     ?                               foo                           

--- 7 row(s) selected.
>>update t056t64 set b = null;

--- 7 row(s) updated.
>>update t056t64 set c = null;

--- 7 row(s) updated.
>>update t056t64 set d = '';

--- 7 row(s) updated.
>>select * from t056t64;

A            B           C                     D                               E
-----------  ----------  --------------------  ------------------------------  ------------------------------

          1  ?           ?                                                     ?                             
          2  ?           ?                                                     ?                             
          3  ?           ?                                                     ?                             
          4  ?           ?                                                     ?                             
          5  ?           ?                                                     ?                             
          6  ?           ?                                                     ?                             
          7  ?           ?                                                     foo                           

--- 7 row(s) selected.
>>
>>
>>log;
