>>
>>cqd traf_tinyint_support 'ON';

--- SQL operation complete.
>>cqd traf_tinyint_return_values 'ON';

--- SQL operation complete.
>>cqd traf_tinyint_input_params 'ON';

--- SQL operation complete.
>>
>>obey TEST003(setup_tiny);
>>create table t003t1(a tinyint not null primary key, b tinyint, 
+>                    c tinyint unsigned default 10 not null, d tinyint unsigned);

--- SQL operation complete.
>>invoke t003t1;

-- Definition of Trafodion table TRAFODION.SCH.T003T1
-- Definition current  Sat Jun 25 16:24:14 2016

  (
    A                                TINYINT NO DEFAULT NOT NULL NOT DROPPABLE
  , B                                TINYINT DEFAULT NULL
  , C                                TINYINT UNSIGNED DEFAULT 10 NOT NULL NOT
      DROPPABLE
  , D                                TINYINT UNSIGNED DEFAULT NULL
  )
  PRIMARY KEY (A ASC)

--- SQL operation complete.
>>
>>create table t003t1_like like t003t1;

--- SQL operation complete.
>>invoke t003t1_like;

-- Definition of Trafodion table TRAFODION.SCH.T003T1_LIKE
-- Definition current  Sat Jun 25 16:24:23 2016

  (
    A                                TINYINT NO DEFAULT NOT NULL NOT DROPPABLE
  , B                                TINYINT DEFAULT NULL
  , C                                TINYINT UNSIGNED DEFAULT 10 NOT NULL NOT
      DROPPABLE
  , D                                TINYINT UNSIGNED DEFAULT NULL
  )
  PRIMARY KEY (A ASC)

--- SQL operation complete.
>>
>>create table t003t1_as primary key (a) as select * from t003t1;

--- 0 row(s) inserted.
>>invoke t003t1_as;

-- Definition of Trafodion table TRAFODION.SCH.T003T1_AS
-- Definition current  Sat Jun 25 16:24:27 2016

  (
    A                                TINYINT NO DEFAULT NOT NULL NOT DROPPABLE
  , B                                TINYINT DEFAULT NULL
  , C                                TINYINT UNSIGNED NO DEFAULT NOT NULL NOT
      DROPPABLE
  , D                                TINYINT UNSIGNED DEFAULT NULL
  )
  PRIMARY KEY (A ASC)

--- SQL operation complete.
>>
>>obey TEST003(dml_tiny);
>>insert into t003t1 values (1, 2, 3, 4);

--- 1 row(s) inserted.
>>insert into t003t1 values (-1, -2, 255, 255);

--- 1 row(s) inserted.
>>insert into t003t1 values (-128, 127, 0, 0);

--- 1 row(s) inserted.
>>
>>select * from t003t1;

A     B     C    D  
----  ----  ---  ---

-128   127    0    0
  -1    -2  255  255
   1     2    3    4

--- 3 row(s) selected.
>>
>>insert into t003t1_as select * from t003t1;

--- 3 row(s) inserted.
>>select * from t003t1_as;

A     B     C    D  
----  ----  ---  ---

-128   127    0    0
  -1    -2  255  255
   1     2    3    4

--- 3 row(s) selected.
>>
>>select * from t003t1 where a = 1;

A     B     C    D  
----  ----  ---  ---

   1     2    3    4

--- 1 row(s) selected.
>>select * from t003t1 where a = -1;

A     B     C    D  
----  ----  ---  ---

  -1    -2  255  255

--- 1 row(s) selected.
>>select * from t003t1 where a < 1;

A     B     C    D  
----  ----  ---  ---

-128   127    0    0
  -1    -2  255  255

--- 2 row(s) selected.
>>select * from t003t1 where a <= -1;

A     B     C    D  
----  ----  ---  ---

-128   127    0    0
  -1    -2  255  255

--- 2 row(s) selected.
>>select * from t003t1 where a < 1000;

A     B     C    D  
----  ----  ---  ---

-128   127    0    0
  -1    -2  255  255
   1     2    3    4

--- 3 row(s) selected.
>>select * from t003t1 where a > -1000;

A     B     C    D  
----  ----  ---  ---

-128   127    0    0
  -1    -2  255  255
   1     2    3    4

--- 3 row(s) selected.
>>
>>select * from t003t1 where d = 4;

A     B     C    D  
----  ----  ---  ---

   1     2    3    4

--- 1 row(s) selected.
>>select * from t003t1 where d < -1;

--- 0 row(s) selected.
>>select * from t003t1 where d < 1000;

A     B     C    D  
----  ----  ---  ---

-128   127    0    0
  -1    -2  255  255
   1     2    3    4

--- 3 row(s) selected.
>>select * from t003t1 where d > -1000;

A     B     C    D  
----  ----  ---  ---

-128   127    0    0
  -1    -2  255  255
   1     2    3    4

--- 3 row(s) selected.
>>
>>select a+10 from t003t1 where a = 1 or a = -1;

(EXPR)
------

     9
    11

--- 2 row(s) selected.
>>
>>select cast(100 as tinyint unsigned) from (values(1)) x(a);

(EXPR)
------

   100

--- 1 row(s) selected.
>>select cast(-100 as tinyint) from (values(1)) x(a);

(EXPR)
------

  -100

--- 1 row(s) selected.
>>
>>select cast(a as char(10)), cast (b as varchar(11)) from t003t1;

(EXPR)      (EXPR)     
----------  -----------

-128        127        
-1          -2         
1           2          

--- 3 row(s) selected.
>>
>>prepare s from insert into t003t1 values (?, ?, ?, ?);

--- SQL command prepared.
>>execute s using -3, 10, 251, 0;

--- 1 row(s) inserted.
>>select * from t003t1;

A     B     C    D  
----  ----  ---  ---

-128   127    0    0
  -3    10  251    0
  -1    -2  255  255
   1     2    3    4

--- 4 row(s) selected.
>>
>>begin work;

--- SQL operation complete.
>>delete from t003t1 where b = -2;

--- 1 row(s) deleted.
>>select * from t003t1;

A     B     C    D  
----  ----  ---  ---

-128   127    0    0
  -3    10  251    0
   1     2    3    4

--- 3 row(s) selected.
>>rollback work;

--- SQL operation complete.
>>
>>begin work;

--- SQL operation complete.
>>update t003t1 set b = b + 1 where b <> 127;

--- 3 row(s) updated.
>>select * from t003t1;

A     B     C    D  
----  ----  ---  ---

-128   127    0    0
  -3    11  251    0
  -1    -1  255  255
   1     3    3    4

--- 4 row(s) selected.
>>rollback work;

--- SQL operation complete.
>>
>>obey TEST003(hive_tiny);
>>sh echo "drop table ttiny;" > TEST003_junk;
>>sh regrhive.ksh -f TEST003_junk;
>>
>>sh echo "create table ttiny(a tinyint, b tinyint);" > TEST003_junk;
>>sh regrhive.ksh -f TEST003_junk;
>>
>>sh echo "insert into ttiny values (1, -1);" > TEST003_junk;
>>sh regrhive.ksh -f TEST003_junk;
>>
>>invoke hive.hive.ttiny;

-- Definition of hive table TTINY
-- Definition current  Sat Jun 25 16:25:08 2016

  (
    A                                TINYINT
  , B                                TINYINT
  )
  /* stored as textfile */

--- SQL operation complete.
>>select * from hive.hive.ttiny;

A     B   
----  ----

   1    -1

--- 1 row(s) selected.
>>insert into hive.hive.ttiny values (127, 10), (-128, -50);

--- 2 row(s) inserted.
>>select * from hive.hive.ttiny;

A     B   
----  ----

   1    -1
 127    10
-128   -50

--- 3 row(s) selected.
>>insert overwrite table hive.hive.ttiny select a, b from t003t1;

--- 4 row(s) inserted.
>>select * from hive.hive.ttiny;

A     B   
----  ----

-128   127
  -3    10
  -1    -2
   1     2

--- 4 row(s) selected.
>>
>>obey TEST003(errors_tiny);
>>update t003t1 set b = b + 1;

*** ERROR[8411] A numeric overflow occurred during an arithmetic computation or data conversion. Conversion of Source Type:SMALLINT SIGNED(REC_BIN16_SIGNED) Source Value:128 to Target Type:TINYINT SIGNED(REC_BIN8_SIGNED).

--- 0 row(s) updated.
>>
>>delete from t003t1;

--- 4 row(s) deleted.
>>
>>insert into t003t1 values (128, 2, 3, 4);

*** ERROR[8411] A numeric overflow occurred during an arithmetic computation or data conversion. Conversion of Source Type:SMALLINT SIGNED(REC_BIN16_SIGNED) Source Value:128 to Target Type:TINYINT SIGNED(REC_BIN8_SIGNED).

--- 0 row(s) inserted.
>>insert into t003t1 values (2, -129, 3, 4);

*** ERROR[8411] A numeric overflow occurred during an arithmetic computation or data conversion. Conversion of Source Type:SMALLINT SIGNED(REC_BIN16_SIGNED) Source Value:-129 to Target Type:TINYINT SIGNED(REC_BIN8_SIGNED).

--- 0 row(s) inserted.
>>insert into t003t1 values (3, 4, 256, 4);

*** ERROR[8411] A numeric overflow occurred during an arithmetic computation or data conversion. Conversion of Source Type:SMALLINT SIGNED(REC_BIN16_SIGNED) Source Value:256 to Target Type:TINYINT UNSIGNED(REC_BIN8_UNSIGNED).

--- 0 row(s) inserted.
>>insert into t003t1 values (4, 4, 256, -4);

*** ERROR[8411] A numeric overflow occurred during an arithmetic computation or data conversion. Conversion of Source Type:SMALLINT SIGNED(REC_BIN16_SIGNED) Source Value:256 to Target Type:TINYINT UNSIGNED(REC_BIN8_UNSIGNED).

--- 0 row(s) inserted.
>>
>>select cast(-1 as tinyint unsigned) from (values(1)) x(a);

*** ERROR[8432] A negative value cannot be converted to an unsigned numeric datatype.

--- 0 row(s) selected.
>>select cast(256 as tinyint unsigned) from (values(1)) x(a);

*** ERROR[8411] A numeric overflow occurred during an arithmetic computation or data conversion. Conversion of Source Type:SMALLINT SIGNED(REC_BIN16_SIGNED) Source Value:256 to Target Type:TINYINT UNSIGNED(REC_BIN8_UNSIGNED).

--- 0 row(s) selected.
>>select cast(-129 as tinyint) from (values(1)) x(a);

*** ERROR[8411] A numeric overflow occurred during an arithmetic computation or data conversion. Conversion of Source Type:SMALLINT SIGNED(REC_BIN16_SIGNED) Source Value:-129 to Target Type:TINYINT SIGNED(REC_BIN8_SIGNED).

--- 0 row(s) selected.
>>select cast(128 as tinyint) from (values(1)) x(a);

*** ERROR[8411] A numeric overflow occurred during an arithmetic computation or data conversion. Conversion of Source Type:SMALLINT SIGNED(REC_BIN16_SIGNED) Source Value:128 to Target Type:TINYINT SIGNED(REC_BIN8_SIGNED).

--- 0 row(s) selected.
>>
>>prepare s from insert into t003t1 values (?, ?, ?, ?);

--- SQL command prepared.
>>execute s using 128, 2, 3, 4;

*** ERROR[8411] A numeric overflow occurred during an arithmetic computation or data conversion. Conversion of Source Type:CHAR(REC_BYTE_F_ASCII) Source Value:0x313238 to Target Type:TINYINT SIGNED(REC_BIN8_SIGNED).

*** ERROR[15015] PARAM ?(UNNAMED_1) (value 128) cannot be converted to type TINYINT.

--- 0 row(s) inserted.
>>execute s using 4, 4, 256, -4;

*** ERROR[8411] A numeric overflow occurred during an arithmetic computation or data conversion. Conversion of Source Type:CHAR(REC_BYTE_F_ASCII) Source Value:0x323536 to Target Type:TINYINT UNSIGNED(REC_BIN8_UNSIGNED).

*** ERROR[15015] PARAM ?(UNNAMED_3) (value 256) cannot be converted to type TINYINT UNSIGNED.

*** ERROR[8411] A numeric overflow occurred during an arithmetic computation or data conversion. Conversion of Source Type:CHAR(REC_BYTE_F_ASCII) Source Value:0x2D34 to Target Type:TINYINT UNSIGNED(REC_BIN8_UNSIGNED).

*** ERROR[15015] PARAM ?(UNNAMED_4) (value -4) cannot be converted to type TINYINT UNSIGNED.

--- 0 row(s) inserted.
>>
>>
>>
>>cqd traf_largeint_unsigned_io 'ON';

--- SQL operation complete.
>>cqd traf_create_signed_numeric_literal 'ON';

--- SQL operation complete.
>>obey TEST003(setup_lu);
>>drop table if exists t003t2;

--- SQL operation complete.
>>drop table if exists t003t2_like;

--- SQL operation complete.
>>drop table if exists t003t2_as;

--- SQL operation complete.
>>
>>create table t003t2(a largeint unsigned not null primary key, b largeint unsigned);

--- SQL operation complete.
>>invoke t003t2;

-- Definition of Trafodion table TRAFODION.SCH.T003T2
-- Definition current  Sat Jun 25 16:25:17 2016

  (
    A                                LARGEINT UNSIGNED NO DEFAULT NOT NULL NOT
      DROPPABLE
  , B                                LARGEINT UNSIGNED DEFAULT NULL
  )
  PRIMARY KEY (A ASC)

--- SQL operation complete.
>>
>>create table t003t2_like like t003t2;

--- SQL operation complete.
>>invoke t003t2_like;

-- Definition of Trafodion table TRAFODION.SCH.T003T2_LIKE
-- Definition current  Sat Jun 25 16:25:22 2016

  (
    A                                LARGEINT UNSIGNED NO DEFAULT NOT NULL NOT
      DROPPABLE
  , B                                LARGEINT UNSIGNED DEFAULT NULL
  )
  PRIMARY KEY (A ASC)

--- SQL operation complete.
>>
>>create table t003t2_as primary key(a) as select * from t003t2;

--- 0 row(s) inserted.
>>invoke t003t2_as;

-- Definition of Trafodion table TRAFODION.SCH.T003T2_AS
-- Definition current  Sat Jun 25 16:25:25 2016

  (
    A                                LARGEINT UNSIGNED NO DEFAULT NOT NULL NOT
      DROPPABLE
  , B                                LARGEINT UNSIGNED DEFAULT NULL
  )
  PRIMARY KEY (A ASC)

--- SQL operation complete.
>>
>>obey TEST003(dml_lu);
>>insert into t003t2 values (1, 2);

--- 1 row(s) inserted.
>>insert into t003t2 values (18446744073709551615, 18446744073709551615);

--- 1 row(s) inserted.
>>
>>select * from t003t2;

A                     B                   
--------------------  --------------------

                   1                     2
18446744073709551615  18446744073709551615

--- 2 row(s) selected.
>>
>>insert into t003t2_as select * from t003t2;

--- 2 row(s) inserted.
>>select * from t003t2_as;

A                     B                   
--------------------  --------------------

                   1                     2
18446744073709551615  18446744073709551615

--- 2 row(s) selected.
>>
>>select * from t003t2 where a = 1;

A                     B                   
--------------------  --------------------

                   1                     2

--- 1 row(s) selected.
>>select * from t003t2 where a = -1;

--- 0 row(s) selected.
>>select * from t003t2 where a < 1;

--- 0 row(s) selected.
>>select * from t003t2 where a <= -1;

--- 0 row(s) selected.
>>select * from t003t2 where a < 1000;

A                     B                   
--------------------  --------------------

                   1                     2

--- 1 row(s) selected.
>>select * from t003t2 where a > -1000;

A                     B                   
--------------------  --------------------

                   1                     2
18446744073709551615  18446744073709551615

--- 2 row(s) selected.
>>select * from t003t2 where a = 18446744073709551615;

A                     B                   
--------------------  --------------------

18446744073709551615  18446744073709551615

--- 1 row(s) selected.
>>
>>select * from t003t2 where b = 2;

A                     B                   
--------------------  --------------------

                   1                     2

--- 1 row(s) selected.
>>select * from t003t2 where b < -1;

--- 0 row(s) selected.
>>select * from t003t2 where b < 1000;

A                     B                   
--------------------  --------------------

                   1                     2

--- 1 row(s) selected.
>>select * from t003t2 where b > -1000;

A                     B                   
--------------------  --------------------

                   1                     2
18446744073709551615  18446744073709551615

--- 2 row(s) selected.
>>select * from t003t2 where b = 18446744073709551615;

A                     B                   
--------------------  --------------------

18446744073709551615  18446744073709551615

--- 1 row(s) selected.
>>
>>select a, cast(cast(a as varchar(40)) as largeint unsigned) from t003t2;

A                     (EXPR)              
--------------------  --------------------

                   1                     1
18446744073709551615  18446744073709551615

--- 2 row(s) selected.
>>
>>select a+10 from t003t2 where a = 1 or a = -1;

(EXPR)              
--------------------

                  11

--- 1 row(s) selected.
>>
>>select cast(100 as largeint unsigned) from (values(1)) x(a);

(EXPR)              
--------------------

                 100

--- 1 row(s) selected.
>>
>>select cast(a as char(21)), cast (b as varchar(22)) from t003t2;

(EXPR)                 (EXPR)                
---------------------  ----------------------

1                      2                     
18446744073709551615   18446744073709551615  

--- 2 row(s) selected.
>>
>>prepare s from insert into t003t2 values (?, ?);

--- SQL command prepared.
>>execute s using 251, 0;

--- 1 row(s) inserted.
>>execute s using 11, 18446744073709551615;

--- 1 row(s) inserted.
>>select * from t003t2;

A                     B                   
--------------------  --------------------

                   1                     2
                  11  18446744073709551615
                 251                     0
18446744073709551615  18446744073709551615

--- 4 row(s) selected.
>>
>>begin work;

--- SQL operation complete.
>>delete from t003t2 where b = 1;

--- 0 row(s) deleted.
>>select * from t003t2;

A                     B                   
--------------------  --------------------

                   1                     2
                  11  18446744073709551615
                 251                     0
18446744073709551615  18446744073709551615

--- 4 row(s) selected.
>>rollback work;

--- SQL operation complete.
>>
>>begin work;

--- SQL operation complete.
>>update t003t2 set b = b + 1 where b = 2;

--- 1 row(s) updated.
>>select * from t003t2;

A                     B                   
--------------------  --------------------

                   1                     3
                  11  18446744073709551615
                 251                     0
18446744073709551615  18446744073709551615

--- 4 row(s) selected.
>>rollback work;

--- SQL operation complete.
>>
>>obey TEST003(errors_lu);
>>update t003t2 set b = b + 1;

*** ERROR[8411] A numeric overflow occurred during an arithmetic computation or data conversion. Conversion of Source Type:NUMERIC(REC_NUM_BIG_SIGNED) Source Value:0x00000000000000000100 to Target Type:LARGEINT UNSIGNED(REC_BIN64_UNSIGNED).

--- 0 row(s) updated.
>>
>>delete from t003t2;

--- 4 row(s) deleted.
>>
>>insert into t003t2 values (18446744073709551616, 2);

*** ERROR[8411] A numeric overflow occurred during an arithmetic computation or data conversion. Conversion of Source Type:NUMERIC(REC_NUM_BIG_SIGNED) Source Value:0x00000000000000000100 to Target Type:LARGEINT UNSIGNED(REC_BIN64_UNSIGNED).

--- 0 row(s) inserted.
>>insert into t003t2 values (2, 18446744073709551616);

*** ERROR[8411] A numeric overflow occurred during an arithmetic computation or data conversion. Conversion of Source Type:NUMERIC(REC_NUM_BIG_SIGNED) Source Value:0x00000000000000000100 to Target Type:LARGEINT UNSIGNED(REC_BIN64_UNSIGNED).

--- 0 row(s) inserted.
>>insert into t003t2 values (-1, 1);

*** ERROR[8432] A negative value cannot be converted to an unsigned numeric datatype.

--- 0 row(s) inserted.
>>
>>select cast(-1 as largeint unsigned) from (values(1)) x(a);

*** ERROR[8432] A negative value cannot be converted to an unsigned numeric datatype.

--- 0 row(s) selected.
>>select cast(18446744073709551616 as largeint unsigned) from (values(1)) x(a);

*** ERROR[8411] A numeric overflow occurred during an arithmetic computation or data conversion. Conversion of Source Type:NUMERIC(REC_NUM_BIG_SIGNED) Source Value:0x00000000000000000100 to Target Type:LARGEINT UNSIGNED(REC_BIN64_UNSIGNED).

--- 0 row(s) selected.
>>
>>prepare s from insert into t003t2 values (?, ?);

--- SQL command prepared.
>>execute s using 18446744073709551616, 2;

*** ERROR[8411] A numeric overflow occurred during an arithmetic computation or data conversion. Conversion of Source Type:CHAR(REC_BYTE_F_ASCII,20 BYTES,ISO88591) Source Value:18446744073709551616 to Target Type:LARGEINT(REC_BIN64_SIGNED).

*** ERROR[15015] PARAM ?(UNNAMED_1) (value 18446744073709551616) cannot be converted to type LARGEINT UNSIGNED.

--- 0 row(s) inserted.
>>
>>
>>
>>cqd traf_create_signed_numeric_literal 'OFF';

--- SQL operation complete.
>>obey TEST003(setup_lu);
>>drop table if exists t003t2;

--- SQL operation complete.
>>drop table if exists t003t2_like;

--- SQL operation complete.
>>drop table if exists t003t2_as;

--- SQL operation complete.
>>
>>create table t003t2(a largeint unsigned not null primary key, b largeint unsigned);

--- SQL operation complete.
>>invoke t003t2;

-- Definition of Trafodion table TRAFODION.SCH.T003T2
-- Definition current  Sat Jun 25 16:25:51 2016

  (
    A                                LARGEINT UNSIGNED NO DEFAULT NOT NULL NOT
      DROPPABLE
  , B                                LARGEINT UNSIGNED DEFAULT NULL
  )
  PRIMARY KEY (A ASC)

--- SQL operation complete.
>>
>>create table t003t2_like like t003t2;

--- SQL operation complete.
>>invoke t003t2_like;

-- Definition of Trafodion table TRAFODION.SCH.T003T2_LIKE
-- Definition current  Sat Jun 25 16:25:55 2016

  (
    A                                LARGEINT UNSIGNED NO DEFAULT NOT NULL NOT
      DROPPABLE
  , B                                LARGEINT UNSIGNED DEFAULT NULL
  )
  PRIMARY KEY (A ASC)

--- SQL operation complete.
>>
>>create table t003t2_as primary key(a) as select * from t003t2;

--- 0 row(s) inserted.
>>invoke t003t2_as;

-- Definition of Trafodion table TRAFODION.SCH.T003T2_AS
-- Definition current  Sat Jun 25 16:25:58 2016

  (
    A                                LARGEINT UNSIGNED NO DEFAULT NOT NULL NOT
      DROPPABLE
  , B                                LARGEINT UNSIGNED DEFAULT NULL
  )
  PRIMARY KEY (A ASC)

--- SQL operation complete.
>>
>>obey TEST003(dml_lu);
>>insert into t003t2 values (1, 2);

--- 1 row(s) inserted.
>>insert into t003t2 values (18446744073709551615, 18446744073709551615);

--- 1 row(s) inserted.
>>
>>select * from t003t2;

A                     B                   
--------------------  --------------------

                   1                     2
18446744073709551615  18446744073709551615

--- 2 row(s) selected.
>>
>>insert into t003t2_as select * from t003t2;

--- 2 row(s) inserted.
>>select * from t003t2_as;

A                     B                   
--------------------  --------------------

                   1                     2
18446744073709551615  18446744073709551615

--- 2 row(s) selected.
>>
>>select * from t003t2 where a = 1;

A                     B                   
--------------------  --------------------

                   1                     2

--- 1 row(s) selected.
>>select * from t003t2 where a = -1;

--- 0 row(s) selected.
>>select * from t003t2 where a < 1;

--- 0 row(s) selected.
>>select * from t003t2 where a <= -1;

--- 0 row(s) selected.
>>select * from t003t2 where a < 1000;

A                     B                   
--------------------  --------------------

                   1                     2

--- 1 row(s) selected.
>>select * from t003t2 where a > -1000;

A                     B                   
--------------------  --------------------

                   1                     2
18446744073709551615  18446744073709551615

--- 2 row(s) selected.
>>select * from t003t2 where a = 18446744073709551615;

A                     B                   
--------------------  --------------------

18446744073709551615  18446744073709551615

--- 1 row(s) selected.
>>
>>select * from t003t2 where b = 2;

A                     B                   
--------------------  --------------------

                   1                     2

--- 1 row(s) selected.
>>select * from t003t2 where b < -1;

--- 0 row(s) selected.
>>select * from t003t2 where b < 1000;

A                     B                   
--------------------  --------------------

                   1                     2

--- 1 row(s) selected.
>>select * from t003t2 where b > -1000;

A                     B                   
--------------------  --------------------

                   1                     2
18446744073709551615  18446744073709551615

--- 2 row(s) selected.
>>select * from t003t2 where b = 18446744073709551615;

A                     B                   
--------------------  --------------------

18446744073709551615  18446744073709551615

--- 1 row(s) selected.
>>
>>select a, cast(cast(a as varchar(40)) as largeint unsigned) from t003t2;

A                     (EXPR)              
--------------------  --------------------

                   1                     1
18446744073709551615  18446744073709551615

--- 2 row(s) selected.
>>
>>select a+10 from t003t2 where a = 1 or a = -1;

(EXPR)              
--------------------

                  11

--- 1 row(s) selected.
>>
>>select cast(100 as largeint unsigned) from (values(1)) x(a);

(EXPR)              
--------------------

                 100

--- 1 row(s) selected.
>>
>>select cast(a as char(21)), cast (b as varchar(22)) from t003t2;

(EXPR)                 (EXPR)                
---------------------  ----------------------

1                      2                     
18446744073709551615   18446744073709551615  

--- 2 row(s) selected.
>>
>>prepare s from insert into t003t2 values (?, ?);

--- SQL command prepared.
>>execute s using 251, 0;

--- 1 row(s) inserted.
>>execute s using 11, 18446744073709551615;

--- 1 row(s) inserted.
>>select * from t003t2;

A                     B                   
--------------------  --------------------

                   1                     2
                  11  18446744073709551615
                 251                     0
18446744073709551615  18446744073709551615

--- 4 row(s) selected.
>>
>>begin work;

--- SQL operation complete.
>>delete from t003t2 where b = 1;

--- 0 row(s) deleted.
>>select * from t003t2;

A                     B                   
--------------------  --------------------

                   1                     2
                  11  18446744073709551615
                 251                     0
18446744073709551615  18446744073709551615

--- 4 row(s) selected.
>>rollback work;

--- SQL operation complete.
>>
>>begin work;

--- SQL operation complete.
>>update t003t2 set b = b + 1 where b = 2;

--- 1 row(s) updated.
>>select * from t003t2;

A                     B                   
--------------------  --------------------

                   1                     3
                  11  18446744073709551615
                 251                     0
18446744073709551615  18446744073709551615

--- 4 row(s) selected.
>>rollback work;

--- SQL operation complete.
>>
>>obey TEST003(errors_lu);
>>update t003t2 set b = b + 1;

*** ERROR[8411] A numeric overflow occurred during an arithmetic computation or data conversion. Conversion of Source Type:NUMERIC(REC_NUM_BIG_SIGNED) Source Value:0x00000000000000000100 to Target Type:LARGEINT UNSIGNED(REC_BIN64_UNSIGNED).

--- 0 row(s) updated.
>>
>>delete from t003t2;

--- 4 row(s) deleted.
>>
>>insert into t003t2 values (18446744073709551616, 2);

*** ERROR[8411] A numeric overflow occurred during an arithmetic computation or data conversion. Conversion of Source Type:NUMERIC(REC_NUM_BIG_SIGNED) Source Value:0x00000000000000000100 to Target Type:LARGEINT UNSIGNED(REC_BIN64_UNSIGNED).

--- 0 row(s) inserted.
>>insert into t003t2 values (2, 18446744073709551616);

*** ERROR[8411] A numeric overflow occurred during an arithmetic computation or data conversion. Conversion of Source Type:NUMERIC(REC_NUM_BIG_SIGNED) Source Value:0x00000000000000000100 to Target Type:LARGEINT UNSIGNED(REC_BIN64_UNSIGNED).

--- 0 row(s) inserted.
>>insert into t003t2 values (-1, 1);

*** ERROR[8432] A negative value cannot be converted to an unsigned numeric datatype.

--- 0 row(s) inserted.
>>
>>select cast(-1 as largeint unsigned) from (values(1)) x(a);

*** ERROR[8432] A negative value cannot be converted to an unsigned numeric datatype.

--- 0 row(s) selected.
>>select cast(18446744073709551616 as largeint unsigned) from (values(1)) x(a);

*** ERROR[8411] A numeric overflow occurred during an arithmetic computation or data conversion. Conversion of Source Type:NUMERIC(REC_NUM_BIG_SIGNED) Source Value:0x00000000000000000100 to Target Type:LARGEINT UNSIGNED(REC_BIN64_UNSIGNED).

--- 0 row(s) selected.
>>
>>prepare s from insert into t003t2 values (?, ?);

--- SQL command prepared.
>>execute s using 18446744073709551616, 2;

*** ERROR[8411] A numeric overflow occurred during an arithmetic computation or data conversion. Conversion of Source Type:CHAR(REC_BYTE_F_ASCII,20 BYTES,ISO88591) Source Value:18446744073709551616 to Target Type:LARGEINT(REC_BIN64_SIGNED).

*** ERROR[15015] PARAM ?(UNNAMED_1) (value 18446744073709551616) cannot be converted to type LARGEINT UNSIGNED.

--- 0 row(s) inserted.
>>
>>
>>
>>cqd traf_create_signed_numeric_literal 'ON';

--- SQL operation complete.
>>cqd traf_largeint_unsigned_io 'OFF';

--- SQL operation complete.
>>obey TEST003(setup_lu);
>>drop table if exists t003t2;

--- SQL operation complete.
>>drop table if exists t003t2_like;

--- SQL operation complete.
>>drop table if exists t003t2_as;

--- SQL operation complete.
>>
>>create table t003t2(a largeint unsigned not null primary key, b largeint unsigned);

--- SQL operation complete.
>>invoke t003t2;

-- Definition of Trafodion table TRAFODION.SCH.T003T2
-- Definition current  Sat Jun 25 16:26:23 2016

  (
    A                                LARGEINT UNSIGNED NO DEFAULT NOT NULL NOT
      DROPPABLE
  , B                                LARGEINT UNSIGNED DEFAULT NULL
  )
  PRIMARY KEY (A ASC)

--- SQL operation complete.
>>
>>create table t003t2_like like t003t2;

--- SQL operation complete.
>>invoke t003t2_like;

-- Definition of Trafodion table TRAFODION.SCH.T003T2_LIKE
-- Definition current  Sat Jun 25 16:26:28 2016

  (
    A                                LARGEINT UNSIGNED NO DEFAULT NOT NULL NOT
      DROPPABLE
  , B                                LARGEINT UNSIGNED DEFAULT NULL
  )
  PRIMARY KEY (A ASC)

--- SQL operation complete.
>>
>>create table t003t2_as primary key(a) as select * from t003t2;

--- 0 row(s) inserted.
>>invoke t003t2_as;

-- Definition of Trafodion table TRAFODION.SCH.T003T2_AS
-- Definition current  Sat Jun 25 16:26:31 2016

  (
    A                                LARGEINT UNSIGNED NO DEFAULT NOT NULL NOT
      DROPPABLE
  , B                                LARGEINT UNSIGNED DEFAULT NULL
  )
  PRIMARY KEY (A ASC)

--- SQL operation complete.
>>
>>obey TEST003(dml_lu);
>>insert into t003t2 values (1, 2);

--- 1 row(s) inserted.
>>insert into t003t2 values (18446744073709551615, 18446744073709551615);

--- 1 row(s) inserted.
>>
>>select * from t003t2;

A                      B                    
---------------------  ---------------------

                    1                      2
 18446744073709551615   18446744073709551615

--- 2 row(s) selected.
>>
>>insert into t003t2_as select * from t003t2;

--- 2 row(s) inserted.
>>select * from t003t2_as;

A                      B                    
---------------------  ---------------------

                    1                      2
 18446744073709551615   18446744073709551615

--- 2 row(s) selected.
>>
>>select * from t003t2 where a = 1;

A                      B                    
---------------------  ---------------------

                    1                      2

--- 1 row(s) selected.
>>select * from t003t2 where a = -1;

--- 0 row(s) selected.
>>select * from t003t2 where a < 1;

--- 0 row(s) selected.
>>select * from t003t2 where a <= -1;

--- 0 row(s) selected.
>>select * from t003t2 where a < 1000;

A                      B                    
---------------------  ---------------------

                    1                      2

--- 1 row(s) selected.
>>select * from t003t2 where a > -1000;

A                      B                    
---------------------  ---------------------

                    1                      2
 18446744073709551615   18446744073709551615

--- 2 row(s) selected.
>>select * from t003t2 where a = 18446744073709551615;

A                      B                    
---------------------  ---------------------

 18446744073709551615   18446744073709551615

--- 1 row(s) selected.
>>
>>select * from t003t2 where b = 2;

A                      B                    
---------------------  ---------------------

                    1                      2

--- 1 row(s) selected.
>>select * from t003t2 where b < -1;

--- 0 row(s) selected.
>>select * from t003t2 where b < 1000;

A                      B                    
---------------------  ---------------------

                    1                      2

--- 1 row(s) selected.
>>select * from t003t2 where b > -1000;

A                      B                    
---------------------  ---------------------

                    1                      2
 18446744073709551615   18446744073709551615

--- 2 row(s) selected.
>>select * from t003t2 where b = 18446744073709551615;

A                      B                    
---------------------  ---------------------

 18446744073709551615   18446744073709551615

--- 1 row(s) selected.
>>
>>select a, cast(cast(a as varchar(40)) as largeint unsigned) from t003t2;

A                      (EXPR)               
---------------------  ---------------------

                    1                      1
 18446744073709551615   18446744073709551615

--- 2 row(s) selected.
>>
>>select a+10 from t003t2 where a = 1 or a = -1;

(EXPR)              
--------------------

                  11

--- 1 row(s) selected.
>>
>>select cast(100 as largeint unsigned) from (values(1)) x(a);

(EXPR)               
---------------------

                  100

--- 1 row(s) selected.
>>
>>select cast(a as char(21)), cast (b as varchar(22)) from t003t2;

(EXPR)                 (EXPR)                
---------------------  ----------------------

1                      2                     
18446744073709551615   18446744073709551615  

--- 2 row(s) selected.
>>
>>prepare s from insert into t003t2 values (?, ?);

--- SQL command prepared.
>>execute s using 251, 0;

--- 1 row(s) inserted.
>>execute s using 11, 18446744073709551615;

--- 1 row(s) inserted.
>>select * from t003t2;

A                      B                    
---------------------  ---------------------

                    1                      2
                   11   18446744073709551615
                  251                      0
 18446744073709551615   18446744073709551615

--- 4 row(s) selected.
>>
>>begin work;

--- SQL operation complete.
>>delete from t003t2 where b = 1;

--- 0 row(s) deleted.
>>select * from t003t2;

A                      B                    
---------------------  ---------------------

                    1                      2
                   11   18446744073709551615
                  251                      0
 18446744073709551615   18446744073709551615

--- 4 row(s) selected.
>>rollback work;

--- SQL operation complete.
>>
>>begin work;

--- SQL operation complete.
>>update t003t2 set b = b + 1 where b = 2;

--- 1 row(s) updated.
>>select * from t003t2;

A                      B                    
---------------------  ---------------------

                    1                      3
                   11   18446744073709551615
                  251                      0
 18446744073709551615   18446744073709551615

--- 4 row(s) selected.
>>rollback work;

--- SQL operation complete.
>>
>>obey TEST003(errors_lu);
>>update t003t2 set b = b + 1;

*** ERROR[8411] A numeric overflow occurred during an arithmetic computation or data conversion. Conversion of Source Type:NUMERIC(REC_NUM_BIG_SIGNED) Source Value:0x00000000000000000100 to Target Type:LARGEINT UNSIGNED(REC_BIN64_UNSIGNED).

--- 0 row(s) updated.
>>
>>delete from t003t2;

--- 4 row(s) deleted.
>>
>>insert into t003t2 values (18446744073709551616, 2);

*** ERROR[8411] A numeric overflow occurred during an arithmetic computation or data conversion. Conversion of Source Type:NUMERIC(REC_NUM_BIG_SIGNED) Source Value:0x00000000000000000100 to Target Type:LARGEINT UNSIGNED(REC_BIN64_UNSIGNED).

--- 0 row(s) inserted.
>>insert into t003t2 values (2, 18446744073709551616);

*** ERROR[8411] A numeric overflow occurred during an arithmetic computation or data conversion. Conversion of Source Type:NUMERIC(REC_NUM_BIG_SIGNED) Source Value:0x00000000000000000100 to Target Type:LARGEINT UNSIGNED(REC_BIN64_UNSIGNED).

--- 0 row(s) inserted.
>>insert into t003t2 values (-1, 1);

*** ERROR[8432] A negative value cannot be converted to an unsigned numeric datatype.

--- 0 row(s) inserted.
>>
>>select cast(-1 as largeint unsigned) from (values(1)) x(a);

*** ERROR[8432] A negative value cannot be converted to an unsigned numeric datatype.

--- 0 row(s) selected.
>>select cast(18446744073709551616 as largeint unsigned) from (values(1)) x(a);

*** ERROR[8411] A numeric overflow occurred during an arithmetic computation or data conversion. Conversion of Source Type:NUMERIC(REC_NUM_BIG_SIGNED) Source Value:0x00000000000000000100 to Target Type:LARGEINT UNSIGNED(REC_BIN64_UNSIGNED).

--- 0 row(s) selected.
>>
>>prepare s from insert into t003t2 values (?, ?);

--- SQL command prepared.
>>execute s using 18446744073709551616, 2;

*** ERROR[8411] A numeric overflow occurred during an arithmetic computation or data conversion. Conversion of Source Type:NUMERIC(REC_NUM_BIG_SIGNED) Source Value:0x00000000000000000100 to Target Type:LARGEINT UNSIGNED(REC_BIN64_UNSIGNED).

--- 0 row(s) inserted.
>>
>>
>>
>>log;
