>>
>>drop table if exists t035t1 cascade;

--- SQL operation complete.
>>drop table if exists t035t2 cascade;

--- SQL operation complete.
>>
>>create table t035t1 (a int, b int, c int, d int not null) attribute super table system;

--- SQL operation complete.
>>create table t035t2 (a int, b int, c int, d int not null) attribute super table system;

--- SQL operation complete.
>>insert into t035t1 values (1,2,3,4),(2,3,4,5),(3,3,3,3),(3,3,4,5),(1,3,3,3),
+>   (6,6,6,6);

--- 6 row(s) inserted.
>>insert into t035t2 values (1,2,3,4),(2,3,4,5),(3,3,3,3),(3,3,4,5),(1,3,3,3),
+>   (6,6,null,6);

--- 6 row(s) inserted.
>>
>>
>>select * from t035t1 order by 1,2,3,4;

A            B            C            D          
-----------  -----------  -----------  -----------

          1            2            3            4
          1            3            3            3
          2            3            4            5
          3            3            3            3
          3            3            4            5
          6            6            6            6

--- 6 row(s) selected.
>>select * from t035t1 where b = 2;

A            B            C            D          
-----------  -----------  -----------  -----------

          1            2            3            4

--- 1 row(s) selected.
>>update t035t1 set c = 3 ;

--- 6 row(s) updated.
>>update t035t1 set c = 0 where b =3;

--- 4 row(s) updated.
>>select * from t035t1;

A            B            C            D          
-----------  -----------  -----------  -----------

          1            2            3            4
          2            3            0            5
          3            3            0            3
          3            3            0            5
          1            3            0            3
          6            6            3            6

--- 6 row(s) selected.
>>select * from t035t2;

A            B            C            D          
-----------  -----------  -----------  -----------

          1            2            3            4
          2            3            4            5
          3            3            3            3
          3            3            4            5
          1            3            3            3
          6            6            ?            6

--- 6 row(s) selected.
>>delete from t035t1 where a > 2;

--- 3 row(s) deleted.
>>select * from t035t1;

A            B            C            D          
-----------  -----------  -----------  -----------

          1            2            3            4
          2            3            0            5
          1            3            0            3

--- 3 row(s) selected.
>>select * from t035t2;

A            B            C            D          
-----------  -----------  -----------  -----------

          1            2            3            4
          2            3            4            5
          3            3            3            3
          3            3            4            5
          1            3            3            3
          6            6            ?            6

--- 6 row(s) selected.
>>delete from t035t2;

--- 6 row(s) deleted.
>>select * from t035t2;

--- 0 row(s) selected.
>>select * from t035t1;

A            B            C            D          
-----------  -----------  -----------  -----------

          1            2            3            4
          2            3            0            5
          1            3            0            3

--- 3 row(s) selected.
>>
>>drop table t035t1;

--- SQL operation complete.
>>drop table t035t2;

--- SQL operation complete.
>>
>>log;
