>>
>>cqd TRAF_MULTI_COL_FAM 'ON';

--- SQL operation complete.
>>
>>drop table if exists t027t01;

--- SQL operation complete.
>>create table t027t01 (a int not null primary key);

--- SQL operation complete.
>>invoke t027t01;

-- Definition of Trafodion table TRAFODION.SCH027.T027T01
-- Definition current  Tue Nov 10 19:18:48 2015

  (
    A                                INT NO DEFAULT NOT NULL NOT DROPPABLE
  )

--- SQL operation complete.
>>showddl t027t01;

CREATE TABLE TRAFODION.SCH027.T027T01
  (
    A                                INT NO DEFAULT NOT NULL NOT DROPPABLE
  , PRIMARY KEY (A ASC)
  )
;

--- SQL operation complete.
>>
>>drop table if exists t027t01;

--- SQL operation complete.
>>create table t027t01 (a int not null primary key) attribute default column family 'cf';

--- SQL operation complete.
>>invoke t027t01;

-- Definition of Trafodion table TRAFODION.SCH027.T027T01
-- Definition current  Tue Nov 10 19:18:55 2015

  (
    "cf".A                           INT NO DEFAULT NOT NULL NOT DROPPABLE
  )

--- SQL operation complete.
>>showddl t027t01;

CREATE TABLE TRAFODION.SCH027.T027T01
  (
    "cf".A                           INT NO DEFAULT NOT NULL NOT DROPPABLE
  , PRIMARY KEY (A ASC)
  )
 ATTRIBUTES DEFAULT COLUMN FAMILY 'cf'
;

--- SQL operation complete.
>>
>>drop table if exists t027t01;

--- SQL operation complete.
>>create table t027t01 (a int not null primary key, "cf2".b int) attribute default column family 'cf';

--- SQL operation complete.
>>invoke t027t01;

-- Definition of Trafodion table TRAFODION.SCH027.T027T01
-- Definition current  Tue Nov 10 19:19:04 2015

  (
    "cf".A                           INT NO DEFAULT NOT NULL NOT DROPPABLE
  , "cf2".B                          INT DEFAULT NULL
  )

--- SQL operation complete.
>>showddl t027t01;

CREATE TABLE TRAFODION.SCH027.T027T01
  (
    "cf".A                           INT NO DEFAULT NOT NULL NOT DROPPABLE
  , "cf2".B                          INT DEFAULT NULL
  , PRIMARY KEY (A ASC)
  )
 ATTRIBUTES DEFAULT COLUMN FAMILY 'cf'
;

--- SQL operation complete.
>>
>>drop table if exists t027t01;

--- SQL operation complete.
>>create table t027t01 (a int not null primary key, "cf2".b int, cf3.c int) 
+>       attribute default column family 'cf';

--- SQL operation complete.
>>invoke t027t01;

-- Definition of Trafodion table TRAFODION.SCH027.T027T01
-- Definition current  Tue Nov 10 19:19:14 2015

  (
    "cf".A                           INT NO DEFAULT NOT NULL NOT DROPPABLE
  , "cf2".B                          INT DEFAULT NULL
  , CF3.C                            INT DEFAULT NULL
  )

--- SQL operation complete.
>>showddl t027t01;

CREATE TABLE TRAFODION.SCH027.T027T01
  (
    "cf".A                           INT NO DEFAULT NOT NULL NOT DROPPABLE
  , "cf2".B                          INT DEFAULT NULL
  , CF3.C                            INT DEFAULT NULL
  , PRIMARY KEY (A ASC)
  )
 ATTRIBUTES DEFAULT COLUMN FAMILY 'cf'
;

--- SQL operation complete.
>>
>>create index t027t01i1 on t027t01(b);

--- SQL operation complete.
>>invoke t027t01;

-- Definition of Trafodion table TRAFODION.SCH027.T027T01
-- Definition current  Tue Nov 10 19:19:19 2015

  (
    "cf".A                           INT NO DEFAULT NOT NULL NOT DROPPABLE
  , "cf2".B                          INT DEFAULT NULL
  , CF3.C                            INT DEFAULT NULL
  )

--- SQL operation complete.
>>showddl t027t01;

CREATE TABLE TRAFODION.SCH027.T027T01
  (
    "cf".A                           INT NO DEFAULT NOT NULL NOT DROPPABLE
  , "cf2".B                          INT DEFAULT NULL
  , CF3.C                            INT DEFAULT NULL
  , PRIMARY KEY (A ASC)
  )
 ATTRIBUTES DEFAULT COLUMN FAMILY 'cf'
;

CREATE INDEX T027T01I1 ON TRAFODION.SCH027.T027T01
  (
    B ASC
  )
;

--- SQL operation complete.
>>
>>insert into t027t01 values (1,2,3);

--- 1 row(s) inserted.
>>select * from t027t01;

A            B            C          
-----------  -----------  -----------

          1            2            3

--- 1 row(s) selected.
>>update t027t01 set c = 33 where a = 1;

--- 1 row(s) updated.
>>select * from t027t01;

A            B            C          
-----------  -----------  -----------

          1            2           33

--- 1 row(s) selected.
>>delete from t027t01;

--- 1 row(s) deleted.
>>select * from t027t01;

--- 0 row(s) selected.
>>
>>alter table t027t01 add column "cf2".d int;

--- SQL operation complete.
>>invoke t027t01;

-- Definition of Trafodion table TRAFODION.SCH027.T027T01
-- Definition current  Tue Nov 10 19:19:22 2015

  (
    "cf".A                           INT NO DEFAULT NOT NULL NOT DROPPABLE
  , "cf2".B                          INT DEFAULT NULL
  , CF3.C                            INT DEFAULT NULL
  , "cf2".D                          INT DEFAULT NULL /* added col */
  )

--- SQL operation complete.
>>showddl t027t01;

CREATE TABLE TRAFODION.SCH027.T027T01
  (
    "cf".A                           INT NO DEFAULT NOT NULL NOT DROPPABLE
  , "cf2".B                          INT DEFAULT NULL
  , CF3.C                            INT DEFAULT NULL
  , "cf2".D                          INT DEFAULT NULL /* added col */
  , PRIMARY KEY (A ASC)
  )
 ATTRIBUTES DEFAULT COLUMN FAMILY 'cf'
;

CREATE INDEX T027T01I1 ON TRAFODION.SCH027.T027T01
  (
    B ASC
  )
;

--- SQL operation complete.
>>
>>alter table t027t01 add column "cf4".e int;

--- SQL operation complete.
>>invoke t027t01;

-- Definition of Trafodion table TRAFODION.SCH027.T027T01
-- Definition current  Tue Nov 10 19:19:29 2015

  (
    "cf".A                           INT NO DEFAULT NOT NULL NOT DROPPABLE
  , "cf2".B                          INT DEFAULT NULL
  , CF3.C                            INT DEFAULT NULL
  , "cf2".D                          INT DEFAULT NULL /* added col */
  , "cf4".E                          INT DEFAULT NULL /* added col */
  )

--- SQL operation complete.
>>showddl t027t01;

CREATE TABLE TRAFODION.SCH027.T027T01
  (
    "cf".A                           INT NO DEFAULT NOT NULL NOT DROPPABLE
  , "cf2".B                          INT DEFAULT NULL
  , CF3.C                            INT DEFAULT NULL
  , "cf2".D                          INT DEFAULT NULL /* added col */
  , "cf4".E                          INT DEFAULT NULL /* added col */
  , PRIMARY KEY (A ASC)
  )
 ATTRIBUTES DEFAULT COLUMN FAMILY 'cf'
;

CREATE INDEX T027T01I1 ON TRAFODION.SCH027.T027T01
  (
    B ASC
  )
;

--- SQL operation complete.
>>
>>alter table t027t01 drop column d;

--- SQL operation complete.
>>invoke t027t01;

-- Definition of Trafodion table TRAFODION.SCH027.T027T01
-- Definition current  Tue Nov 10 19:19:31 2015

  (
    "cf".A                           INT NO DEFAULT NOT NULL NOT DROPPABLE
  , "cf2".B                          INT DEFAULT NULL
  , CF3.C                            INT DEFAULT NULL
  , "cf4".E                          INT DEFAULT NULL /* added col */
  )

--- SQL operation complete.
>>showddl t027t01;

CREATE TABLE TRAFODION.SCH027.T027T01
  (
    "cf".A                           INT NO DEFAULT NOT NULL NOT DROPPABLE
  , "cf2".B                          INT DEFAULT NULL
  , CF3.C                            INT DEFAULT NULL
  , "cf4".E                          INT DEFAULT NULL /* added col */
  , PRIMARY KEY (A ASC)
  )
 ATTRIBUTES DEFAULT COLUMN FAMILY 'cf'
;

CREATE INDEX T027T01I1 ON TRAFODION.SCH027.T027T01
  (
    B ASC
  )
;

--- SQL operation complete.
>>
>>alter table t027t01 add column "cf2".d int;

--- SQL operation complete.
>>invoke t027t01;

-- Definition of Trafodion table TRAFODION.SCH027.T027T01
-- Definition current  Tue Nov 10 19:19:36 2015

  (
    "cf".A                           INT NO DEFAULT NOT NULL NOT DROPPABLE
  , "cf2".B                          INT DEFAULT NULL
  , CF3.C                            INT DEFAULT NULL
  , "cf4".E                          INT DEFAULT NULL /* added col */
  , "cf2".D                          INT DEFAULT NULL /* added col */
  )

--- SQL operation complete.
>>showddl t027t01;

CREATE TABLE TRAFODION.SCH027.T027T01
  (
    "cf".A                           INT NO DEFAULT NOT NULL NOT DROPPABLE
  , "cf2".B                          INT DEFAULT NULL
  , CF3.C                            INT DEFAULT NULL
  , "cf4".E                          INT DEFAULT NULL /* added col */
  , "cf2".D                          INT DEFAULT NULL /* added col */
  , PRIMARY KEY (A ASC)
  )
 ATTRIBUTES DEFAULT COLUMN FAMILY 'cf'
;

CREATE INDEX T027T01I1 ON TRAFODION.SCH027.T027T01
  (
    B ASC
  )
;

--- SQL operation complete.
>>
>>create table t027t011 like t027t01;

--- SQL operation complete.
>>invoke t027t011;

-- Definition of Trafodion table TRAFODION.SCH027.T027T011
-- Definition current  Tue Nov 10 19:19:47 2015

  (
    "cf".A                           INT NO DEFAULT NOT NULL NOT DROPPABLE
  , "cf2".B                          INT DEFAULT NULL
  , CF3.C                            INT DEFAULT NULL
  , "cf4".E                          INT DEFAULT NULL
  , "cf2".D                          INT DEFAULT NULL
  )

--- SQL operation complete.
>>showddl t027t011;

CREATE TABLE TRAFODION.SCH027.T027T011
  (
    "cf".A                           INT NO DEFAULT NOT NULL NOT DROPPABLE
  , "cf2".B                          INT DEFAULT NULL
  , CF3.C                            INT DEFAULT NULL
  , "cf4".E                          INT DEFAULT NULL
  , "cf2".D                          INT DEFAULT NULL
  , PRIMARY KEY (A ASC)
  )
 ATTRIBUTES DEFAULT COLUMN FAMILY 'cf'
;

--- SQL operation complete.
>>
>>insert into t027t011 values (1, 2, 3, 4, 5);

--- 1 row(s) inserted.
>>select * from t027t011;

A            B            C            E            D          
-----------  -----------  -----------  -----------  -----------

          1            2            3            4            5

--- 1 row(s) selected.
>>purgedata t027t011;

--- SQL operation complete.
>>invoke t027t011;

-- Definition of Trafodion table TRAFODION.SCH027.T027T011
-- Definition current  Tue Nov 10 19:19:53 2015

  (
    "cf".A                           INT NO DEFAULT NOT NULL NOT DROPPABLE
  , "cf2".B                          INT DEFAULT NULL
  , CF3.C                            INT DEFAULT NULL
  , "cf4".E                          INT DEFAULT NULL
  , "cf2".D                          INT DEFAULT NULL
  )

--- SQL operation complete.
>>showddl t027t011;

CREATE TABLE TRAFODION.SCH027.T027T011
  (
    "cf".A                           INT NO DEFAULT NOT NULL NOT DROPPABLE
  , "cf2".B                          INT DEFAULT NULL
  , CF3.C                            INT DEFAULT NULL
  , "cf4".E                          INT DEFAULT NULL
  , "cf2".D                          INT DEFAULT NULL
  , PRIMARY KEY (A ASC)
  )
 ATTRIBUTES DEFAULT COLUMN FAMILY 'cf'
;

--- SQL operation complete.
>>select * from t027t011;

--- 0 row(s) selected.
>>
>>drop table t027t011;

--- SQL operation complete.
>>create table t027t011 as select * from t027t01;

--- 0 row(s) inserted.
>>invoke t027t011;

-- Definition of Trafodion table TRAFODION.SCH027.T027T011
-- Definition current  Tue Nov 10 19:20:03 2015

  (
    A                                INT NO DEFAULT NOT NULL NOT DROPPABLE
  , B                                INT DEFAULT NULL
  , C                                INT DEFAULT NULL
  , E                                INT DEFAULT NULL
  , D                                INT DEFAULT NULL
  )

--- SQL operation complete.
>>showddl t027t011;

CREATE TABLE TRAFODION.SCH027.T027T011
  (
    A                                INT NO DEFAULT NOT NULL NOT DROPPABLE
  , B                                INT DEFAULT NULL
  , C                                INT DEFAULT NULL
  , E                                INT DEFAULT NULL
  , D                                INT DEFAULT NULL
  )
;

--- SQL operation complete.
>>
>>drop table t027t011;

--- SQL operation complete.
>>create table t027t011("cf".a, "cf2".b, cf3.c, "cf4".e, "cf2".d) as select * from t027t01;

--- 0 row(s) inserted.
>>invoke t027t011;

-- Definition of Trafodion table TRAFODION.SCH027.T027T011
-- Definition current  Tue Nov 10 19:20:07 2015

  (
    "cf".A                           INT NO DEFAULT NOT NULL NOT DROPPABLE
  , "cf2".B                          INT DEFAULT NULL
  , CF3.C                            INT DEFAULT NULL
  , "cf4".E                          INT DEFAULT NULL
  , "cf2".D                          INT DEFAULT NULL
  )

--- SQL operation complete.
>>showddl t027t011;

CREATE TABLE TRAFODION.SCH027.T027T011
  (
    "cf".A                           INT NO DEFAULT NOT NULL NOT DROPPABLE
  , "cf2".B                          INT DEFAULT NULL
  , CF3.C                            INT DEFAULT NULL
  , "cf4".E                          INT DEFAULT NULL
  , "cf2".D                          INT DEFAULT NULL
  )
;

--- SQL operation complete.
>>
>>create volatile table t027t03 ("cf1".a int, "cf2".b int, c int);

--- SQL operation complete.
>>invoke t027t03;

-- Definition of Trafodion volatile table T027T03
-- Definition current  Tue Nov 10 19:20:14 2015

  (
    "cf1".A                          INT NO DEFAULT NOT NULL NOT DROPPABLE
  , "cf2".B                          INT DEFAULT NULL
  , C                                INT DEFAULT NULL
  )

--- SQL operation complete.
>>showddl t027t03;

CREATE VOLATILE TABLE T027T03
  (
    "cf1".A                          INT NO DEFAULT NOT NULL NOT DROPPABLE
  , "cf2".B                          INT DEFAULT NULL
  , C                                INT DEFAULT NULL
  , PRIMARY KEY (A ASC)
  )
;

--- SQL operation complete.
>>
>>drop volatile table t027t03;

--- SQL operation complete.
>>create volatile table t027t03 ("cf1".a int, "cf2".b int, c int) attribute default column family 'cf';

--- SQL operation complete.
>>invoke t027t03;

-- Definition of Trafodion volatile table T027T03
-- Definition current  Tue Nov 10 19:20:36 2015

  (
    "cf1".A                          INT NO DEFAULT NOT NULL NOT DROPPABLE
  , "cf2".B                          INT DEFAULT NULL
  , "cf".C                           INT DEFAULT NULL
  )

--- SQL operation complete.
>>showddl t027t03;

CREATE VOLATILE TABLE T027T03
  (
    "cf1".A                          INT NO DEFAULT NOT NULL NOT DROPPABLE
  , "cf2".B                          INT DEFAULT NULL
  , "cf".C                           INT DEFAULT NULL
  , PRIMARY KEY (A ASC)
  )
 ATTRIBUTES DEFAULT COLUMN FAMILY 'cf'
;

--- SQL operation complete.
>>
>>drop table if exists t027t02;

--- SQL operation complete.
>>create table t027t02 (
+>     a0.a0 int, a1.a1 int, a2.a2 int, a3.a3 int, a4.a4 int, a5.a5 int, a6.a6 int, a7.a7 int, a8.a8 int, a9.a9 int,
+>     a10.a10 int, a11.a11 int, a12.a12 int, a13.a13 int, a14.a14 int, a15.a15 int, a16.a16 int, a17.a17 int, a18.a18 int, a19.a19 int,
+>     a20.a20 int, a21.a21 int, a22.a22 int, a23.a23 int, a24.a24 int, a25.a25 int, a26.a26 int, a27.a27 int, a28.a28 int, a29.a29 int,
+>    a30.a30 int) attribute default column family 'cf';

--- SQL operation complete.
>>
>>drop table if exists t027t02;

--- SQL operation complete.
>>create table t027t02 (
+>     "cf".a0a0 int, "cf".a1a1 int, "cf".a2a2 int, "cf".a3a3 int, "cf".a4a4 int, "cf".a5a5 int, "cf".a6a6 int, "cf".a7a7 int, "cf".a8a8 int, "cf".a9a9 int,
+>     "cf".a10a10 int, "cf".a11a11 int, "cf".a12a12 int, "cf".a13a13 int, "cf".a14a14 int, "cf".a15a15 int, "cf".a16a16 int, "cf".a17a17 int, "cf".a18a18 int, "cf".a19a19 int,
+>     "cf".a20a20 int, "cf".a21a21 int, "cf".a22a22 int, "cf".a23a23 int, "cf".a24a24 int, "cf".a25a25 int, "cf".a26a26 int, "cf".a27a27 int, "cf".a28a28 int, "cf".a29a29 int,
+>    "cf".a30a30 int, "cf".a31a31 int, "cf".a32a32 int, "cf".a33a33 int) 
+>attribute default column family 'cf';

--- SQL operation complete.
>>invoke t027t02;

-- Definition of Trafodion table TRAFODION.SCH027.T027T02
-- Definition current  Tue Nov 10 19:20:58 2015

  (
    "cf".A0A0                        INT DEFAULT NULL
  , "cf".A1A1                        INT DEFAULT NULL
  , "cf".A2A2                        INT DEFAULT NULL
  , "cf".A3A3                        INT DEFAULT NULL
  , "cf".A4A4                        INT DEFAULT NULL
  , "cf".A5A5                        INT DEFAULT NULL
  , "cf".A6A6                        INT DEFAULT NULL
  , "cf".A7A7                        INT DEFAULT NULL
  , "cf".A8A8                        INT DEFAULT NULL
  , "cf".A9A9                        INT DEFAULT NULL
  , "cf".A10A10                      INT DEFAULT NULL
  , "cf".A11A11                      INT DEFAULT NULL
  , "cf".A12A12                      INT DEFAULT NULL
  , "cf".A13A13                      INT DEFAULT NULL
  , "cf".A14A14                      INT DEFAULT NULL
  , "cf".A15A15                      INT DEFAULT NULL
  , "cf".A16A16                      INT DEFAULT NULL
  , "cf".A17A17                      INT DEFAULT NULL
  , "cf".A18A18                      INT DEFAULT NULL
  , "cf".A19A19                      INT DEFAULT NULL
  , "cf".A20A20                      INT DEFAULT NULL
  , "cf".A21A21                      INT DEFAULT NULL
  , "cf".A22A22                      INT DEFAULT NULL
  , "cf".A23A23                      INT DEFAULT NULL
  , "cf".A24A24                      INT DEFAULT NULL
  , "cf".A25A25                      INT DEFAULT NULL
  , "cf".A26A26                      INT DEFAULT NULL
  , "cf".A27A27                      INT DEFAULT NULL
  , "cf".A28A28                      INT DEFAULT NULL
  , "cf".A29A29                      INT DEFAULT NULL
  , "cf".A30A30                      INT DEFAULT NULL
  , "cf".A31A31                      INT DEFAULT NULL
  , "cf".A32A32                      INT DEFAULT NULL
  , "cf".A33A33                      INT DEFAULT NULL
  )

--- SQL operation complete.
>>
>>drop table if exists t027t03;

--- SQL operation complete.
>>create table t027t03("cf1".a int not null, "cf2".b int not null, c int not null, d int not null, 
+> primary key (a, b));

--- SQL operation complete.
>>invoke t027t03;

-- Definition of Trafodion table TRAFODION.SCH027.T027T03
-- Definition current  Tue Nov 10 19:21:19 2015

  (
    "cf1".A                          INT NO DEFAULT NOT NULL NOT DROPPABLE
  , "cf2".B                          INT NO DEFAULT NOT NULL NOT DROPPABLE
  , C                                INT NO DEFAULT NOT NULL NOT DROPPABLE
  , D                                INT NO DEFAULT NOT NULL NOT DROPPABLE
  )

--- SQL operation complete.
>>insert into t027t03 values (1,1,1,1);

--- 1 row(s) inserted.
>>insert into t027t03 values (1,2,2,2);

--- 1 row(s) inserted.
>>select * from t027t03;

A            B            C            D          
-----------  -----------  -----------  -----------

          1            1            1            1
          1            2            2            2

--- 2 row(s) selected.
>>
>>-- create table like metadata table
>>drop table if exists t027t02;

--- SQL operation complete.
>>create table t027t02 like "_MD_".keys;

--- SQL operation complete.
>>invoke t027t02;

-- Definition of Trafodion table TRAFODION.SCH027.T027T02
-- Definition current  Tue Nov 10 19:21:35 2015

  (
    OBJECT_UID                       LARGEINT NO DEFAULT NOT NULL NOT DROPPABLE
  , COLUMN_NAME                      VARCHAR(256 BYTES) CHARACTER SET UTF8
      COLLATE DEFAULT NO DEFAULT NOT NULL NOT DROPPABLE
  , KEYSEQ_NUMBER                    INT NO DEFAULT NOT NULL NOT DROPPABLE
  , COLUMN_NUMBER                    INT NO DEFAULT NOT NULL NOT DROPPABLE
  , ORDERING                         INT NO DEFAULT NOT NULL NOT DROPPABLE
  , NONKEYCOL                        INT NO DEFAULT NOT NULL NOT DROPPABLE
  , FLAGS                            LARGEINT NO DEFAULT NOT NULL NOT DROPPABLE
  )

--- SQL operation complete.
>>select * from t027t02;

--- 0 row(s) selected.
>>
>>-- negative tests
>>drop table if exists t027t02;

--- SQL operation complete.
>>
>>-- cannot have 3 part col name
>>create table t027t02 (a.a.a  int);

*** ERROR[15001] A syntax error occurred at or before: 
create table t027t02 (a.a.a  int);
                                ^ (33 characters from start of SQL statement)

*** ERROR[8822] The statement was not prepared.

>>
>>-- cannot have col fam for aligned format tables
>>create table t027t02 ("cf".a int) attribute aligned format;

*** ERROR[4223] Column Family specification on columns of an aligned format table is not supported in this software version.

--- SQL operation failed with errors.
>>
>>-- cannot specify col fam for dropped cols
>>alter table t027t01 drop column "cf2".d;

*** ERROR[15001] A syntax error occurred at or before: 
alter table t027t01 drop column "cf2".d;
                                     ^ (38 characters from start of SQL statement)

*** ERROR[8822] The statement was not prepared.

>>
>>-- cannot create a different col fam for an index col
>>create index t027t01i2 on t027t01("cf2".b);

*** ERROR[15001] A syntax error occurred at or before: 
create index t027t01i2 on t027t01("cf2".b);
                                       ^ (40 characters from start of SQL statement)

*** ERROR[8822] The statement was not prepared.

>>
>>-- cannot use col fam in dml stmts 
>>select * from t027t01 where "cf".a = 1;

*** ERROR[4002] Column "cf".A is not found.  Table "cf" not exposed.  Tables in scope: TRAFODION.SCH027.T027T01.  Default schema: TRAFODION.SCH027.

*** ERROR[8822] The statement was not prepared.

>>
>>-- cannot have > 32 col families
>>create table t027t02 (
+>     a0.a0 int, a1.a1 int, a2.a2 int, a3.a3 int, a4.a4 int, a5.a5 int, a6.a6 int, a7.a7 int, a8.a8 int, a9.a9 int,
+>     a10.a10 int, a11.a11 int, a12.a12 int, a13.a13 int, a14.a14 int, a15.a15 int, a16.a16 int, a17.a17 int, a18.a18 int, a19.a19 int,
+>     a20.a20 int, a21.a21 int, a22.a22 int, a23.a23 int, a24.a24 int, a25.a25 int, a26.a26 int, a27.a27 int, a28.a28 int, a29.a29 int,
+>    a30.a30 int, a31.a31 int, a32.a32 int not null primary key);

*** ERROR[4225] Number of column families cannot exceed 32.

--- SQL operation failed with errors.
>>
>>create table t027t02 (
+>     a0.a0 int, a1.a1 int, a2.a2 int, a3.a3 int, a4.a4 int, a5.a5 int, a6.a6 int, a7.a7 int, a8.a8 int, a9.a9 int,
+>     a10.a10 int, a11.a11 int, a12.a12 int, a13.a13 int, a14.a14 int, a15.a15 int, a16.a16 int, a17.a17 int, a18.a18 int, a19.a19 int,
+>     a20.a20 int, a21.a21 int, a22.a22 int, a23.a23 int, a24.a24 int, a25.a25 int, a26.a26 int, a27.a27 int, a28.a28 int, a29.a29 int,
+>    a30.a30 int, a31.a31 int);

*** ERROR[4225] Number of column families cannot exceed 32.

--- SQL operation failed with errors.
>>
>>create table t027t02 (
+>     a0.a0 int, a1.a1 int, a2.a2 int, a3.a3 int, a4.a4 int, a5.a5 int, a6.a6 int, a7.a7 int, a8.a8 int, a9.a9 int,
+>     a10.a10 int, a11.a11 int, a12.a12 int, a13.a13 int, a14.a14 int, a15.a15 int, a16.a16 int, a17.a17 int, a18.a18 int, a19.a19 int,
+>     a20.a20 int, a21.a21 int, a22.a22 int, a23.a23 int, a24.a24 int, a25.a25 int, a26.a26 int, a27.a27 int, a28.a28 int, a29.a29 int,
+>    a30.a30 int, a31.a31 int) attribute default column family 'cf';

*** ERROR[4225] Number of column families cannot exceed 32.

--- SQL operation failed with errors.
>>
>>
>>-- cleanup
>>drop table if exists t027t01;

--- SQL operation complete.
>>drop table if exists t027t02;

--- SQL operation complete.
>>drop table if exists t027t011;

--- SQL operation complete.
>>drop table if exists t027t03;

--- SQL operation complete.
>>
>>log;
