-- @@@ START COPYRIGHT @@@
--
-- (C) Copyright 2014-2015 Hewlett-Packard Development Company, L.P.
--
--  Licensed under the Apache License, Version 2.0 (the "License");
--  you may not use this file except in compliance with the License.
--  You may obtain a copy of the License at
--
--      http://www.apache.org/licenses/LICENSE-2.0
--
--  Unless required by applicable law or agreed to in writing, software
--  distributed under the License is distributed on an "AS IS" BASIS,
--  WITHOUT WARRANTIES OR CONDITIONS OF ANY KIND, either express or implied.
--  See the License for the specific language governing permissions and
--  limitations under the License.
--
-- @@@ END COPYRIGHT @@@
>>
>>set schema CAT1.SCHM;

--- SQL operation complete.
>>obey TEST_4_1_5(set_up);
>>
>>create trigger bt1 before insert on tab1b
+>	referencing new as my_new
+>	for each row
+>	SIGNAL SQLSTATE 's7777' ('Gotcha!');

--- SQL operation complete.
>>
>>obey TEST_4_1_5(tests);
>>
>>--------------------------------------------------------
>>-- TEST CASE
>>--------------------------------------------------------
>>-- This should fail with a Signal message.
>>insert into tab1b values (1,1);

*** ERROR[3193] SIGNAL SQLSTATE=s7777, Message: Gotcha!.

--- 0 row(s) inserted.
>>
>>
>>create trigger bt2 before insert on tab1b
+>	referencing new as my_new
+>	for each row
+>	SET my_new.a = 99;

--- SQL operation complete.
>>
>>
>>-- This too should fail with a Signal message,
>>insert into tab1b values (2,2);

*** ERROR[3193] SIGNAL SQLSTATE=s7777, Message: Gotcha!.

--- 0 row(s) inserted.
>>
>>-- tab1b should be empty!!
>>select * from tab1b order by a;

--- 0 row(s) selected.
>>--------------------------------------------------------
>>obey TEST_4_1_5(clean_up);
>>
>>drop trigger bt1;

--- SQL operation complete.
>>drop trigger bt2;

--- SQL operation complete.
>>delete from tab1b;

--- 0 row(s) deleted.
>>
>>
>>-- switch schemas
>>set schema CAT1.SCHM_ALT;

--- SQL operation complete.
>>obey TEST_4_1_5(set_up);
>>
>>create trigger bt1 before insert on tab1b
+>	referencing new as my_new
+>	for each row
+>	SIGNAL SQLSTATE 's7777' ('Gotcha!');

--- SQL operation complete.
>>
>>obey TEST_4_1_5(tests);
>>
>>--------------------------------------------------------
>>-- TEST CASE
>>--------------------------------------------------------
>>-- This should fail with a Signal message.
>>insert into tab1b values (1,1);

*** ERROR[3193] SIGNAL SQLSTATE=s7777, Message: Gotcha!.

--- 0 row(s) inserted.
>>
>>
>>create trigger bt2 before insert on tab1b
+>	referencing new as my_new
+>	for each row
+>	SET my_new.a = 99;

--- SQL operation complete.
>>
>>
>>-- This too should fail with a Signal message,
>>insert into tab1b values (2,2);

*** ERROR[3193] SIGNAL SQLSTATE=s7777, Message: Gotcha!.

--- 0 row(s) inserted.
>>
>>-- tab1b should be empty!!
>>select * from tab1b order by a;

--- 0 row(s) selected.
>>--------------------------------------------------------
>>obey TEST_4_1_5(clean_up);
>>
>>drop trigger bt1;

--- SQL operation complete.
>>drop trigger bt2;

--- SQL operation complete.
>>delete from tab1b;

--- 0 row(s) deleted.
>>
>>
>>-- make trig temp tables partitioned
>>set schema CAT1.SCHM_ALT;

--- SQL operation complete.
>>control query default TEMPORARY_TABLE_HASH_PARTITIONS $$TrigTempTablePartition1$$;

--- SQL operation complete.
>>obey TEST_4_1_5(set_up);
>>
>>create trigger bt1 before insert on tab1b
+>	referencing new as my_new
+>	for each row
+>	SIGNAL SQLSTATE 's7777' ('Gotcha!');

--- SQL operation complete.
>>
>>obey TEST_4_1_5(tests);
>>
>>--------------------------------------------------------
>>-- TEST CASE
>>--------------------------------------------------------
>>-- This should fail with a Signal message.
>>insert into tab1b values (1,1);

*** ERROR[3193] SIGNAL SQLSTATE=s7777, Message: Gotcha!.

--- 0 row(s) inserted.
>>
>>
>>create trigger bt2 before insert on tab1b
+>	referencing new as my_new
+>	for each row
+>	SET my_new.a = 99;

--- SQL operation complete.
>>
>>
>>-- This too should fail with a Signal message,
>>insert into tab1b values (2,2);

*** ERROR[3193] SIGNAL SQLSTATE=s7777, Message: Gotcha!.

--- 0 row(s) inserted.
>>
>>-- tab1b should be empty!!
>>select * from tab1b order by a;

--- 0 row(s) selected.
>>--------------------------------------------------------
>>
>>-- end logging
>>LOG;
