-- @@@ START COPYRIGHT @@@
--
-- (C) Copyright 2014-2015 Hewlett-Packard Development Company, L.P.
--
--  Licensed under the Apache License, Version 2.0 (the "License");
--  you may not use this file except in compliance with the License.
--  You may obtain a copy of the License at
--
--      http://www.apache.org/licenses/LICENSE-2.0
--
--  Unless required by applicable law or agreed to in writing, software
--  distributed under the License is distributed on an "AS IS" BASIS,
--  WITHOUT WARRANTIES OR CONDITIONS OF ANY KIND, either express or implied.
--  See the License for the specific language governing permissions and
--  limitations under the License.
--
-- @@@ END COPYRIGHT @@@
>>obey TEST_SPJC_STX_001(tests);
>>
>>------------------------------------------------------------------
>>-- TEST CASE 01
>>-- Result: success
>>------------------------------------------------------------------
>>CREATE TRIGGER TRIG01_SPJC_STX_001 AFTER UPDATE ON
+>TAB01_SPJC_STX_001
+>REFERENCING OLD ROW AS O, NEW ROW AS N
+>FOR EACH ROW
+>	INSERT INTO TAB02_SPJC_STX_001 values(O.A, O.D);

--- SQL operation complete.
>>------------------------------------------------------------------
>>
>>select * from TAB01_SPJC_STX_001;

A            B            C            D          
-----------  -----------  -----------  -----------

          1            2            3            4
          2            3            4            5
          3            4            5            6
          4            5            6            7

--- 4 row(s) selected.
>>
>>update TAB01_SPJC_STX_001 set a = a + d;

--- 4 row(s) updated.
>>
>>select * from TAB01_SPJC_STX_001;

A            B            C            D          
-----------  -----------  -----------  -----------

          5            2            3            4
          7            3            4            5
          9            4            5            6
         11            5            6            7

--- 4 row(s) selected.
>>
>>-- RESULT: Four rows with a = {1, 2, 3, 4}
>>select * from TAB02_SPJC_STX_001;

X            Y          
-----------  -----------

          1            4
          2            5
          3            6
          4            7

--- 4 row(s) selected.
>>------------------------------------------------------------------
>>LOG;
