-- @@@ START COPYRIGHT @@@
--
-- (C) Copyright 2014-2015 Hewlett-Packard Development Company, L.P.
--
--  Licensed under the Apache License, Version 2.0 (the "License");
--  you may not use this file except in compliance with the License.
--  You may obtain a copy of the License at
--
--      http://www.apache.org/licenses/LICENSE-2.0
--
--  Unless required by applicable law or agreed to in writing, software
--  distributed under the License is distributed on an "AS IS" BASIS,
--  WITHOUT WARRANTIES OR CONDITIONS OF ANY KIND, either express or implied.
--  See the License for the specific language governing permissions and
--  limitations under the License.
--
-- @@@ END COPYRIGHT @@@
>>obey TEST_SPJC_STX_003(tests);
>>
>>------------------------------------------------------------------
>>-- TEST CASE 01: Row trigger
>>-- Result: Success
>>------------------------------------------------------------------
>>CREATE TRIGGER TRIG01_SPJC_STX_003 AFTER UPDATE ON
+>TAB01_SPJC_STX_003
+>FOR EACH ROW
+>	INSERT INTO TAB02_SPJC_STX_003 VALUES (1, 2);

--- SQL operation complete.
>>------------------------------------------------------------------
>>
>>
>>update TAB01_SPJC_STX_003 set a = a + 1;

--- 4 row(s) updated.
>>
>>-- Result: 4
>>select sum(x) from TAB02_SPJC_STX_003;

(EXPR)              
--------------------

                   4

--- 1 row(s) selected.
>>
>>
>>------------------------------------------------------------------
>>-- TEST CASE 02: Statement trigger
>>-- Result: Success
>>------------------------------------------------------------------
>>CREATE TRIGGER TRIG02_SPJC_STX_003 AFTER UPDATE ON
+>TAB03_SPJC_STX_003
+>FOR EACH STATEMENT
+>	INSERT INTO TAB04_SPJC_STX_003 VALUES(1, 2);

--- SQL operation complete.
>>
>>update TAB03_SPJC_STX_003 set a = a + 1;

--- 4 row(s) updated.
>>
>>-- Result: 1
>>select sum(x) from TAB04_SPJC_STX_003;

(EXPR)              
--------------------

                   1

--- 1 row(s) selected.
>>------------------------------------------------------------------
>>LOG;
