-- @@@ START COPYRIGHT @@@
--
-- (C) Copyright 2014-2015 Hewlett-Packard Development Company, L.P.
--
--  Licensed under the Apache License, Version 2.0 (the "License");
--  you may not use this file except in compliance with the License.
--  You may obtain a copy of the License at
--
--      http://www.apache.org/licenses/LICENSE-2.0
--
--  Unless required by applicable law or agreed to in writing, software
--  distributed under the License is distributed on an "AS IS" BASIS,
--  WITHOUT WARRANTIES OR CONDITIONS OF ANY KIND, either express or implied.
--  See the License for the specific language governing permissions and
--  limitations under the License.
--
-- @@@ END COPYRIGHT @@@
>>obey TEST_7_1_1(tests);
>>
>>------------------------------------------------------------------
>>--          TEST CASE
>>------------------------------------------------------------------
>>
>>DELETE FROM tab1A WHERE a=3;

--- 1 row(s) deleted.
>>
>>SELECT * FROM tab1A ORDER BY a;

A            B            C            D            
-----------  -----------  -----------  -----------  

          1            1            1            1  
          2            1            1            1  

--- 2 row(s) selected.
>> -- check result
>>
>>SELECT * FROM tab1B ORDER BY a;

A            B            
-----------  -----------  

          1            2  
          3            4  

--- 2 row(s) selected.
>> -- check result
>>
>>-----------------------------------------------------------
>>
>>DELETE FROM tab1A WHERE a=2;

*** ERROR[8103] The operation is prevented by referential integrity constraint CAT1.SCHM_ALT.REF_CONSTR on table CAT1.SCHM_ALT.TAB1B.

*** ERROR[11028] Action statement of trigger CAT1.SCHM_ALT.ATRIG711 on table CAT1.SCHM_ALT.TAB1A has failed.

--- 0 row(s) deleted.
>>
>>SELECT * FROM tab1A ORDER BY a;

A            B            C            D            
-----------  -----------  -----------  -----------  

          1            1            1            1  
          2            1            1            1  

--- 2 row(s) selected.
>> -- check result
>>
>>SELECT * FROM tab1B ORDER BY a;

A            B            
-----------  -----------  

          1            2  
          3            4  

--- 2 row(s) selected.
>> -- check result
>>
>>------------------------------------------------------------------
>>--           END
>>------------------------------------------------------------------
>>LOG;
