>>log LOG129;
>>create schema us4;

--- SQL operation complete.
>>set schema us4;

--- SQL operation complete.
>>
>>create table t1 (col1 int not null primary key, col2 int, col3 int) no partition;

--- SQL operation complete.
>>insert into t1 values (1,1,1), (2,2,2), (5,5,5), (7,7,7);

--- 4 row(s) inserted.
>>create view v1(vc1,vc2,vc3) as select * from t1 ;

--- SQL operation complete.
>>
>>grant update on t1 to sql_user1 ;

--- SQL operation complete.
>>grant select(col3) on t1 to sql_user1;

--- SQL operation complete.
>>grant select on v1 to sql_user1;

--- SQL operation complete.
>>grant update(vc1) on v1 to sql_user1 ;

--- SQL operation complete.
>>grant insert(vc1) on v1 to sql_user1 ;

--- SQL operation complete.
>>
>>grant select on t1 to sql_user2;

--- SQL operation complete.
>>grant update (col3) on t1 to sql_user2 ;

--- SQL operation complete.
>>grant update(col2) on t1 to sql_user2;

--- SQL operation complete.
>>
>>grant update(col1) on t1 to $$SQLUSER3X$$;

--- SQL operation complete.
>>grant select(col1) on t1 to $$SQLUSER3X$$;

--- SQL operation complete.
>>showddl t1;

CREATE TABLE TRAFODION.US4.T1
  (
    COL1                             INT NO DEFAULT NOT NULL NOT DROPPABLE
  , COL2                             INT DEFAULT NULL
  , COL3                             INT DEFAULT NULL
  , PRIMARY KEY (COL1 ASC)
  )
;

-- GRANT SELECT, INSERT, DELETE, UPDATE, REFERENCES ON TRAFODION.US4.T1 TO SQL_USER4 WITH GRANT OPTION;
  GRANT UPDATE ON TRAFODION.US4.T1 TO SQL_USER1;
GRANT SELECT ON
  TRAFODION.US4.T1 TO SQL_USER2;
GRANT SELECT(COL3) ON TRAFODION.US4.T1 TO
  SQL_USER1;
GRANT UPDATE(COL2, COL3) ON TRAFODION.US4.T1 TO SQL_USER2;
GRANT
  SELECT(COL1), UPDATE(COL1) ON TRAFODION.US4.T1 TO SQL_USER3;

--- SQL operation complete.
>>
>>create table t2( a int not null primary key, b int default null, c int default null) ;

--- SQL operation complete.
>>grant insert on t2 to sql_user1;

--- SQL operation complete.
>>grant select on t2 to sql_user1;

--- SQL operation complete.
>>grant insert(a,b) on t2 to sql_user2 ;

--- SQL operation complete.
>>grant select(a,b) on t2 to sql_user2 ;

--- SQL operation complete.
>>grant insert(a) on t2 to sql_user3;

--- SQL operation complete.
>>grant select(a) on t2 to sql_user3;

--- SQL operation complete.
>>showddl t2;

CREATE TABLE TRAFODION.US4.T2
  (
    A                                INT NO DEFAULT NOT NULL NOT DROPPABLE
  , B                                INT DEFAULT NULL
  , C                                INT DEFAULT NULL
  , PRIMARY KEY (A ASC)
  )
;

-- GRANT SELECT, INSERT, DELETE, UPDATE, REFERENCES ON TRAFODION.US4.T2 TO SQL_USER4 WITH GRANT OPTION;
  GRANT SELECT, INSERT ON TRAFODION.US4.T2 TO SQL_USER1;
GRANT SELECT(A, B),
  INSERT(A, B) ON TRAFODION.US4.T2 TO SQL_USER2;
GRANT SELECT(A), INSERT(A) ON
  TRAFODION.US4.T2 TO SQL_USER3;

--- SQL operation complete.
>>
>>create table t129_starter (a int not null, primary key(a) NOT DROPPABLE )no partition;

--- SQL operation complete.
>>insert into  t129_starter values (1);

--- 1 row(s) inserted.
>>
>>create table t129_a
+>  (uniq int not null,
+>   c100  int not null,
+>   c10   int not null,
+>   c1    int not null,
+>   filler char(4000) default 'a',
+>   primary key (uniq)
+>   NOT DROPPABLE
+>  ) no partition ;

--- SQL operation complete.
>>
>>insert into t129_a (uniq,c100,c10,c1)
+>  select
+>   0 + (100 * x100) + (10 * x10) + (1 * x1),
+>   0 + (10 * x10) + (1 * x1),
+>   0 + (1 * x1),
+>   0
+>  from t129_starter
+>    transpose 0,1,2,3,4,5,6,7,8,9 as x100
+>    transpose 0,1,2,3,4,5,6,7,8,9 as x10
+>    transpose 0,1,2,3,4,5,6,7,8,9 as x1
+>  ;

--- 1000 row(s) inserted.
>>
>>update statistics for table t129_a on uniq ;

--- SQL operation complete.
>>
>>grant select on t129_a to sql_user1 ;

--- SQL operation complete.
>>grant select on t129_starter to sql_user1 ;

--- SQL operation complete.
>>
>>-- Testing creating views based on Column-level select privilege
>>--grant create_view on schema cat.us4 to sql_user3;
>>
>>create table t3 (a int not null not droppable, b int, c int, d int, primary key (a));

--- SQL operation complete.
>>create table t4 (e int not null not droppable, f int, g int, h int, primary key (e));

--- SQL operation complete.
>>
>>grant select (b,d) on t3 to sql_user3 with grant option;

--- SQL operation complete.
>>grant select (f,g) on t4 to sql_user3;

--- SQL operation complete.
>>
>>showddl t3;

CREATE TABLE TRAFODION.US4.T3
  (
    A                                INT NO DEFAULT NOT NULL NOT DROPPABLE
  , B                                INT DEFAULT NULL
  , C                                INT DEFAULT NULL
  , D                                INT DEFAULT NULL
  , PRIMARY KEY (A ASC)
  )
;

-- GRANT SELECT, INSERT, DELETE, UPDATE, REFERENCES ON TRAFODION.US4.T3 TO SQL_USER4 WITH GRANT OPTION;
  GRANT SELECT(B, D) ON TRAFODION.US4.T3 TO SQL_USER3 WITH GRANT OPTION;

--- SQL operation complete.
>>showddl t4;

CREATE TABLE TRAFODION.US4.T4
  (
    E                                INT NO DEFAULT NOT NULL NOT DROPPABLE
  , F                                INT DEFAULT NULL
  , G                                INT DEFAULT NULL
  , H                                INT DEFAULT NULL
  , PRIMARY KEY (E ASC)
  )
;

-- GRANT SELECT, INSERT, DELETE, UPDATE, REFERENCES ON TRAFODION.US4.T4 TO SQL_USER4 WITH GRANT OPTION;
  GRANT SELECT(F, G) ON TRAFODION.US4.T4 TO SQL_USER3;

--- SQL operation complete.
>>
>>insert into t3 values (1,2,3,4), (5,6,7,8);

--- 2 row(s) inserted.
>>insert into t4 values (11,22,33,44), (55,66,77,88);

--- 2 row(s) inserted.
>>
>>exit;

End of MXCI Session

>>-- As user1, should fail
>>select * from us4.t1 ;

*** ERROR[4481] The user does not have SELECT privilege on table or view TRAFODION.US4.T1.

*** ERROR[8822] The statement was not prepared.

>>delete from us4.t1;

*** ERROR[4481] The user does not have DELETE privilege on table or view TRAFODION.US4.T1.

*** ERROR[8822] The statement was not prepared.

>>insert into us4.t1 values (1,1,1);

*** ERROR[4481] The user does not have INSERT privilege on table or view TRAFODION.US4.T1.

*** ERROR[8822] The statement was not prepared.

>>update us4.t2 set b = c ;

*** ERROR[4481] The user does not have UPDATE privilege on table or view TRAFODION.US4.T2.

*** ERROR[8822] The statement was not prepared.

>>update us4.v1 set vc2 = vc1 ;

*** ERROR[4481] The user does not have UPDATE privilege on table or view TRAFODION.US4.V1.

*** ERROR[8822] The statement was not prepared.

>>insert into us4.v1(vc1,vc2) values (10,10) ;

*** ERROR[4481] The user does not have INSERT privilege on table or view TRAFODION.US4.V1.

*** ERROR[8822] The statement was not prepared.

>>
>>-- As user1, should succeed
>>update us4.t1 set col3 = 2 ;

*** ERROR[4481] The user does not have SELECT privilege on table or view TRAFODION.US4.T1.

*** ERROR[8822] The statement was not prepared.

>>select * from us4.v1 order by vc1;

VC1          VC2          VC3        
-----------  -----------  -----------

          1            1            1
          2            2            2
          5            5            5
          7            7            7

--- 4 row(s) selected.
>>insert into us4.t2 values (5,5,5);

--- 1 row(s) inserted.
>>update us4.v1 set vc1 = vc1 ;

*** ERROR[4481] The user does not have UPDATE privilege on table or view TRAFODION.US4.V1.

*** ERROR[8822] The statement was not prepared.

>>insert into us4.v1(vc1) values (10) ;

*** ERROR[4481] The user does not have INSERT privilege on table or view TRAFODION.US4.V1.

*** ERROR[8822] The statement was not prepared.

>>
>>delete all from table(querycache()) ;

*** ERROR[15001] A syntax error occurred at or before: 
delete all from table(querycache()) ;
                                 ^ (34 characters from start of SQL statement)

*** ERROR[8822] The statement was not prepared.

>>delete all from table(natablecache());

--- 0 row(s) deleted.
>>select * from table(querycacheentries());

*** ERROR[15001] A syntax error occurred at or before: 
select * from table(querycacheentries());
                                      ^ (39 characters from start of SQL statement)

*** ERROR[8822] The statement was not prepared.

>>select * from table(natablecache()) ;

*** ERROR[15001] A syntax error occurred at or before: 
select * from table(natablecache()) ;
                                 ^ (34 characters from start of SQL statement)

*** ERROR[8822] The statement was not prepared.

>>
>>log;
>>-- As user1, should fail
>>select * from us4.t1 ;

*** ERROR[4481] The user does not have SELECT privilege on table or view TRAFODION.US4.T1.

*** ERROR[8822] The statement was not prepared.

>>delete from us4.t1;

*** ERROR[4481] The user does not have DELETE privilege on table or view TRAFODION.US4.T1.

*** ERROR[8822] The statement was not prepared.

>>insert into us4.t1 values (1,1,1);

*** ERROR[4481] The user does not have INSERT privilege on table or view TRAFODION.US4.T1.

*** ERROR[8822] The statement was not prepared.

>>update us4.t2 set b = c ;

*** ERROR[4481] The user does not have UPDATE privilege on table or view TRAFODION.US4.T2.

*** ERROR[8822] The statement was not prepared.

>>update us4.v1 set vc2 = vc1 ;

*** ERROR[4481] The user does not have UPDATE privilege on table or view TRAFODION.US4.V1.

*** ERROR[8822] The statement was not prepared.

>>insert into us4.v1(vc1,vc2) values (10,10) ;

*** ERROR[4481] The user does not have INSERT privilege on table or view TRAFODION.US4.V1.

*** ERROR[8822] The statement was not prepared.

>>
>>-- As user1, should succeed
>>update us4.t1 set col3 = 2 ;

*** ERROR[4481] The user does not have SELECT privilege on table or view TRAFODION.US4.T1.

*** ERROR[8822] The statement was not prepared.

>>select * from us4.v1 order by vc1;

VC1          VC2          VC3        
-----------  -----------  -----------

          1            1            1
          2            2            2
          5            5            5
          7            7            7

--- 4 row(s) selected.
>>insert into us4.t2 values (5,5,5);

*** ERROR[8102] The operation is prevented by a unique constraint.

--- 0 row(s) inserted.
>>update us4.v1 set vc1 = vc1 ;

*** ERROR[4481] The user does not have UPDATE privilege on table or view TRAFODION.US4.V1.

*** ERROR[8822] The statement was not prepared.

>>insert into us4.v1(vc1) values (10) ;

*** ERROR[4481] The user does not have INSERT privilege on table or view TRAFODION.US4.V1.

*** ERROR[8822] The statement was not prepared.

>>
>>delete all from table(querycache()) ;

*** ERROR[15001] A syntax error occurred at or before: 
delete all from table(querycache()) ;
                                 ^ (34 characters from start of SQL statement)

*** ERROR[8822] The statement was not prepared.

>>delete all from table(natablecache());

--- 0 row(s) deleted.
>>select * from table(querycacheentries());

*** ERROR[15001] A syntax error occurred at or before: 
select * from table(querycacheentries());
                                      ^ (39 characters from start of SQL statement)

*** ERROR[8822] The statement was not prepared.

>>select * from table(natablecache()) ;

*** ERROR[15001] A syntax error occurred at or before: 
select * from table(natablecache()) ;
                                 ^ (34 characters from start of SQL statement)

*** ERROR[8822] The statement was not prepared.

>>
>>log;
>>-- Testing revoke for column-level SELECT
>>-- as user4
>>
>>set schema us4;

--- SQL operation complete.
>>
>>grant select (b,d) on t3 to sql_user3 with grant option;

--- SQL operation complete.
>>grant select (f,g) on t4 to sql_user3;

--- SQL operation complete.
>>showddl t3;

CREATE TABLE TRAFODION.US4.T3
  (
    A                                INT NO DEFAULT NOT NULL NOT DROPPABLE
  , B                                INT DEFAULT NULL
  , C                                INT DEFAULT NULL
  , D                                INT DEFAULT NULL
  , PRIMARY KEY (A ASC)
  )
;

--- SQL operation complete.
>>showddl t4;

CREATE TABLE TRAFODION.US4.T4
  (
    E                                INT NO DEFAULT NOT NULL NOT DROPPABLE
  , F                                INT DEFAULT NULL
  , G                                INT DEFAULT NULL
  , H                                INT DEFAULT NULL
  , PRIMARY KEY (E ASC)
  )
;

--- SQL operation complete.
>>
>>-- Negative tests: revoking from table
>>revoke select (c) on t3 from sql_user3;

*** ERROR[1018] Grant of role or privilege SELECT on TRAFODION.US4.T3 from SQL_USER4 to SQL_USER3 not found, revoke request ignored.

--- SQL operation failed with errors.
>>revoke select (b) on t3 from sql_user3;

--- SQL operation complete.
>>
>>revoke grant option for select (c) on t3 from sql_user3;

*** ERROR[1018] Grant of role or privilege SELECT on TRAFODION.US4.T3 from SQL_USER4 to SQL_USER3 not found, revoke request ignored.

--- SQL operation failed with errors.
>>
>>revoke grant option for select (d) on t3 from sql_user3;

--- SQL operation complete.
>>
>>revoke grant option for select (b) on t3 from sql_user3;

*** ERROR[1018] Grant of role or privilege SELECT on TRAFODION.US4.T3 from SQL_USER4 to SQL_USER3 not found, revoke request ignored.

--- SQL operation failed with errors.
>>revoke grant option for select (b) on t3 from sql_user3 cascade;

*** ERROR[1018] Grant of role or privilege SELECT on TRAFODION.US4.T3 from SQL_USER4 to SQL_USER3 not found, revoke request ignored.

--- SQL operation failed with errors.
>>showddl t3;

CREATE TABLE TRAFODION.US4.T3
  (
    A                                INT NO DEFAULT NOT NULL NOT DROPPABLE
  , B                                INT DEFAULT NULL
  , C                                INT DEFAULT NULL
  , D                                INT DEFAULT NULL
  , PRIMARY KEY (A ASC)
  )
;

--- SQL operation complete.
>>
>>exit;

End of MXCI Session

