>>
>>obey TEST122(test_drop_tab);
>>
>>create table t122t1 ( a int not null );

--- SQL operation complete.
>>
>>prepare s1 from insert into t122t1 values
+>  (0)
+>, (5)
+>, (1)
+>;

--- SQL command prepared.
>>
>>obey TEST122(uid_in_plan);
>>log;
look for one uid only
  ObjectUIDs .......
look for more than one uid
>>
>>
>>execute s1;

--- 3 row(s) inserted.
>>
>>prepare s1 from select * from t122t1;

--- SQL command prepared.
>>
>>obey TEST122(uid_in_plan);
>>log;
look for one uid only
  ObjectUIDs .......
look for more than one uid
>>
>>
>>execute s1;

A          
-----------

          0
          5
          1

--- 3 row(s) selected.
>>
>>invoke t122t1;

-- Definition of Trafodion table TRAFODION.SCH.T122T1
-- Definition current  Fri Nov 14 22:15:35 2014

  (
    A                                INT NO DEFAULT NOT NULL NOT DROPPABLE
  )

--- SQL operation complete.
>>
>>select count(*) from t122t1;

(EXPR)              
--------------------

                   3

--- 1 row(s) selected.
>>
>>update t122t1 set a = 55 where a = 5;

--- 1 row(s) updated.
>>
>>delete from t122t1 where a = 55;

--- 1 row(s) deleted.
>>
>>sh sqlci -i"TEST122(drop_tab)";
>>
>>drop table t122t1;

--- SQL operation complete.
>>
>>create table t122t1 ( a char(4) not null );

--- SQL operation complete.
>>
>>insert into t122t1 values ('i'), ('ii'), ('iii'), ('iv');

--- 4 row(s) inserted.
>>
>>exit;

End of MXCI Session

>>
>>select * from t122t1;

A   
----

i   
ii  
iii 
iv  

--- 4 row(s) selected.
>>
>>invoke t122t1;

-- Definition of Trafodion table TRAFODION.SCH.T122T1
-- Definition current  Fri Nov 14 22:15:49 2014

  (
    A                                CHAR(4) CHARACTER SET ISO88591 COLLATE
      DEFAULT NO DEFAULT NOT NULL NOT DROPPABLE
  )

--- SQL operation complete.
>>
>>insert into t122t1 values ('i'), ('ii'), ('iii'), ('iv');

--- 4 row(s) inserted.
>>
>>select count(*) from t122t1;

(EXPR)              
--------------------

                   8

--- 1 row(s) selected.
>>
>>update t122t1 set a = 'ix' where a = 'ii';

--- 2 row(s) updated.
>>
>>delete from t122t1 where a = 'i';

--- 2 row(s) deleted.
>>
>>
>>obey TEST122(test_alter_tab);
>>
>>create table t122t3 (c1 int not null primary key, c2 int);

--- SQL operation complete.
>>insert into t122t3 values (1,1), (2,2), (3,3), (4,4), (5,5), (6,6), (7,7);

--- 7 row(s) inserted.
>>select * from t122t3;

C1           C2         
-----------  -----------

          1            1
          2            2
          3            3
          4            4
          5            5
          6            6
          7            7

--- 7 row(s) selected.
>>
>>create table t122t3_col (c1 int not null primary key, c2 int);

--- SQL operation complete.
>>insert into t122t3_col values (1,1), (2,2), (3,3), (4,4), (5,5), (6,6), (7,7);

--- 7 row(s) inserted.
>>select * from t122t3_col;

C1           C2         
-----------  -----------

          1            1
          2            2
          3            3
          4            4
          5            5
          6            6
          7            7

--- 7 row(s) selected.
>>
>>create table t122t3_ck (c1 int not null primary key, c2 int);

--- SQL operation complete.
>>insert into t122t3_ck values (1,1), (2,2), (3,3), (4,4), (5,5), (6,6), (7,7);

--- 7 row(s) inserted.
>>select * from t122t3_ck;

C1           C2         
-----------  -----------

          1            1
          2            2
          3            3
          4            4
          5            5
          6            6
          7            7

--- 7 row(s) selected.
>>
>>create table t122t3_unique (c1 int not null primary key, c2 int);

--- SQL operation complete.
>>insert into t122t3_unique values (1,1), (2,2), (3,3), (4,4), (5,5), (6,6), (7,7);

--- 7 row(s) inserted.
>>select * from t122t3_unique;

C1           C2         
-----------  -----------

          1            1
          2            2
          3            3
          4            4
          5            5
          6            6
          7            7

--- 7 row(s) selected.
>>
>>create table t122t3_ri (c1 int not null primary key, c2 int);

--- SQL operation complete.
>>insert into t122t3_ri values (1,1), (2,2), (3,3), (4,4), (5,5), (6,6), (7,7);

--- 7 row(s) inserted.
>>select * from t122t3_ri;

C1           C2         
-----------  -----------

          1            1
          2            2
          3            3
          4            4
          5            5
          6            6
          7            7

--- 7 row(s) selected.
>>
>>create table t122t4 (c1 int, c2 int);

--- SQL operation complete.
>>insert into t122t4 values (1,1), (2,2), (3,3), (4,4), (5,5), (6,6), (7,7);

--- 7 row(s) inserted.
>>select * from t122t4;

C1           C2         
-----------  -----------

          1            1
          2            2
          3            3
          4            4
          5            5
          6            6
          7            7

--- 7 row(s) selected.
>>
>>create table t122t4_pk (c1 int, c2 int);

--- SQL operation complete.
>>insert into t122t4_pk values (1,1), (2,2), (3,3), (4,4), (5,5), (6,6), (7,7);

--- 7 row(s) inserted.
>>select * from t122t4_pk;

C1           C2         
-----------  -----------

          1            1
          2            2
          3            3
          4            4
          5            5
          6            6
          7            7

--- 7 row(s) selected.
>>
>>create table t122t4_fk (c1 int, c2 int);

--- SQL operation complete.
>>insert into t122t4_fk values (1,1), (2,2), (3,3), (4,4), (5,5), (6,6), (7,7);

--- 7 row(s) inserted.
>>select * from t122t4_fk;

C1           C2         
-----------  -----------

          1            1
          2            2
          3            3
          4            4
          5            5
          6            6
          7            7

--- 7 row(s) selected.
>>
>>
>>sh sqlci -i "TEST122(alter_tbl_add)"
+>
+>control query default AUTO_QUERY_RETRY_WARNINGS 'ON';
>>-- add columns, constraints, and indexes
>>alter table t122t3_col add column c3 int default 0;

--- SQL operation complete.
>>alter table t122t3_ck add constraint t122_ck check (c2 > 0);

--- SQL operation complete.
>>alter table t122t3_unique add constraint t122_uq unique (c2);

--- SQL operation complete.
>>alter table t122t4_pk add constraint t122_pk primary key (c1);

--- SQL operation complete.
>>alter table t122t4_fk add constraint t122_fk foreign key (c2) references t122t3_ri;

--- SQL operation complete.
>>create index t122t3_index on t122t3(c2);

--- SQL operation complete.
>>
>>exit;

End of MXCI Session

>>
>>-- see new column in t122t3_col;
>>select * from t122t3_col;

C1           C2           C3         
-----------  -----------  -----------

          1            1            0
          2            2            0
          3            3            0
          4            4            0
          5            5            0
          6            6            0
          7            7            0

--- 7 row(s) selected.
>>
>>-- see new constraint in t122t3_ck
>>insert into t122t3_ck values (11,1), (12,2), (13,3), (14,4), (15,5), (16,6), (17,0);

*** ERROR[8101] The operation is prevented by check constraint TRAFODION.SCH.T122_CK on table TRAFODION.SCH.T122T3_CK.

--- 0 row(s) inserted.
>>
>>-- see new unique constraint in t122t3_unique 
>>explain options 'f' 
+>insert into t122t3_unique values (11,1), (12,2), (13,3), (14,4), (15,5), (16,6), (17,7);

LC   RC   OP   OPERATOR              OPT       DESCRIPTION           CARD
---- ---- ---- --------------------  --------  --------------------  ---------

5    .    6    root                            x                     7.00E+000
3    4    5    nested_join                                           7.00E+000
.    .    4    trafodion_insert                T122_UQ               1.00E+000
1    2    3    nested_join                                           7.00E+000
.    .    2    trafodion_insert                T122T3_UNIQUE         1.00E+000
.    .    1    tuplelist                                             7.00E+000

--- SQL operation complete.
>>insert into t122t3_unique values (11,1), (12,2), (13,3), (14,4), (15,5), (16,6), (17,7);

*** ERROR[8102] The operation is prevented by a unique constraint.

--- 0 row(s) inserted.
>>
>>-- see new pk in t122t4_pk 
>>explain options 'f' 
+>insert into t122t4_pk values (11,1), (12,2), (13,3), (14,4), (15,5), (16,6), (7,17);

LC   RC   OP   OPERATOR              OPT       DESCRIPTION           CARD
---- ---- ---- --------------------  --------  --------------------  ---------

5    .    6    root                            x                     7.00E+000
3    4    5    nested_join                                           7.00E+000
.    .    4    trafodion_insert                T122_PK               1.00E+000
1    2    3    nested_join                                           7.00E+000
.    .    2    trafodion_insert                T122T4_PK             1.00E+000
.    .    1    tuplelist                                             7.00E+000

--- SQL operation complete.
>>insert into t122t4_pk values (11,1), (12,2), (13,3), (14,4), (15,5), (16,6), (7,17);

*** ERROR[8102] The operation is prevented by a unique constraint.

--- 0 row(s) inserted.
>>
>>-- see new ri in t122t4_fk
>>explain options 'f'
+>insert into t122t4_fk values (1,1), (2,2), (3,3), (4,4), (5,5), (6,6), (7,0);

LC   RC   OP   OPERATOR              OPT       DESCRIPTION           CARD
---- ---- ---- --------------------  --------  --------------------  ---------

8    .    9    root                            x                     1.39E+001
3    7    8    nested_join                                           1.39E+001
4    6    7    merge_union                                           2.00E+000
5    .    6    sort_scalar_aggr                                      1.00E+000
.    .    5    trafodion_scan                  T122T3_RI             1.00E+002
.    .    4    trafodion_insert                T122_FK               1.00E+000
1    2    3    nested_join                                           7.00E+000
.    .    2    trafodion_insert                T122T4_FK             1.00E+000
.    .    1    tuplelist                                             7.00E+000

--- SQL operation complete.
>>insert into t122t4_fk values (1,1), (2,2), (3,3), (4,4), (5,5), (6,6), (7,0);

*** ERROR[8103] The operation is prevented by referential integrity constraint TRAFODION.SCH.T122_FK on table TRAFODION.SCH.T122T4_FK.

--- 0 row(s) inserted.
>>
>>-- see new index in t122t3
>>explain options 'f'
+>insert into t122t3 values (1,1), (2,2), (3,3), (4,4), (5,5), (6,6), (7,0);

LC   RC   OP   OPERATOR              OPT       DESCRIPTION           CARD
---- ---- ---- --------------------  --------  --------------------  ---------

5    .    6    root                            x                     7.00E+000
3    4    5    nested_join                                           7.00E+000
.    .    4    trafodion_insert                T122T3_INDEX          1.00E+000
1    2    3    nested_join                                           7.00E+000
.    .    2    trafodion_insert                T122T3                1.00E+000
.    .    1    tuplelist                                             7.00E+000

--- SQL operation complete.
>>
>>sh sqlci -i "TEST122(alter_tbl_drop)"
+>
+>control query default AUTO_QUERY_RETRY_WARNINGS 'ON';
>>-- drop columns, constraints, and indexes
>>alter table t122t3_col drop column c3;

--- SQL operation complete.
>>alter table t122t3_ck drop constraint t122_ck;

--- SQL operation complete.
>>alter table t122t3_unique drop constraint t122_uq;

--- SQL operation complete.
>>alter table t122t4_pk drop constraint t122_pk;

--- SQL operation complete.
>>alter table t122t4_fk drop constraint t122_fk;

--- SQL operation complete.
>>drop index t122t3_index;

--- SQL operation complete.
>>
>>
>>
>>
>>exit;

End of MXCI Session

>>
>>-- see only 2 columns in t122t3_col;
>>select * from t122t3_col;

C1           C2         
-----------  -----------

          1            1
          2            2
          3            3
          4            4
          5            5
          6            6
          7            7

--- 7 row(s) selected.
>>
>>-- no more check constraint in t122t3_ck
>>insert into t122t3_ck values (11,1), (12,2), (13,3), (14,4), (15,5), (16,6), (17,0);

--- 7 row(s) inserted.
>>
>>-- no more unique constraint in t122t3_unique 
>>explain options 'f' 
+>insert into t122t3_unique values (11,1), (12,2), (13,3), (14,4), (15,5), (16,6), (17,7);

LC   RC   OP   OPERATOR              OPT       DESCRIPTION           CARD
---- ---- ---- --------------------  --------  --------------------  ---------

3    .    4    root                            x                     7.00E+000
1    2    3    tuple_flow                                            7.00E+000
.    .    2    trafodion_insert                T122T3_UNIQUE         1.00E+000
.    .    1    tuplelist                                             7.00E+000

--- SQL operation complete.
>>insert into t122t3_unique values (11,1), (12,2), (13,3), (14,4), (15,5), (16,6), (17,7);

--- 7 row(s) inserted.
>>
>>-- no more pk in t122t4_pk 
>>explain options 'f' 
+>insert into t122t4_pk values (11,1), (12,2), (13,3), (14,4), (15,5), (16,6), (7,17);

LC   RC   OP   OPERATOR              OPT       DESCRIPTION           CARD
---- ---- ---- --------------------  --------  --------------------  ---------

3    .    4    root                            x                     7.00E+000
1    2    3    tuple_flow                                            7.00E+000
.    .    2    trafodion_insert                T122T4_PK             1.00E+000
.    .    1    tuplelist                                             7.00E+000

--- SQL operation complete.
>>insert into t122t4_pk values (11,1), (12,2), (13,3), (14,4), (15,5), (16,6), (7,17);

--- 7 row(s) inserted.
>>
>>-- no ri contraint in t122t4_fk
>>explain options 'f'
+>insert into t122t4_fk values (1,1), (2,2), (3,3), (4,4), (5,5), (6,6), (7,0);

LC   RC   OP   OPERATOR              OPT       DESCRIPTION           CARD
---- ---- ---- --------------------  --------  --------------------  ---------

3    .    4    root                            x                     7.00E+000
1    2    3    tuple_flow                                            7.00E+000
.    .    2    trafodion_insert                T122T4_FK             1.00E+000
.    .    1    tuplelist                                             7.00E+000

--- SQL operation complete.
>>insert into t122t4_fk values (1,1), (2,2), (3,3), (4,4), (5,5), (6,6), (7,0);

--- 7 row(s) inserted.
>>
>>-- no more index in t122t3
>>explain options 'f'
+>insert into t122t3 values (1,1), (2,2), (3,3), (4,4), (5,5), (6,6), (7,0);

LC   RC   OP   OPERATOR              OPT       DESCRIPTION           CARD
---- ---- ---- --------------------  --------  --------------------  ---------

3    .    4    root                            x                     7.00E+000
1    2    3    tuple_flow                                            7.00E+000
.    .    2    trafodion_insert                T122T3                1.00E+000
.    .    1    tuplelist                                             7.00E+000

--- SQL operation complete.
>>
>>
>>
>>obey TEST122(clnup);
>>
>>drop table t122t1 cascade;

--- SQL operation complete.
>>drop table t122t3 cascade;

--- SQL operation complete.
>>drop table t122t3_col cascade;

--- SQL operation complete.
>>drop table t122t3_ck cascade;

--- SQL operation complete.
>>drop table t122t3_unique cascade;

--- SQL operation complete.
>>drop table t122t3_ri cascade;

--- SQL operation failed with errors.
>>drop table t122t4 cascade;

--- SQL operation complete.
>>drop table t122t4_pk cascade;

--- SQL operation complete.
>>drop table t122t4_fk cascade;

--- SQL operation complete.
>>
>>
>>exit;

End of MXCI Session

