>>
>>obey TEST122(test1);
>>
>>obey TEST122(crdb);
>>
>>create table t122t1 ( a int not null );

--- SQL operation complete.
>>
>>
>>prepare s1 from insert into t122t1 values
+>  (0)
+>, (5)
+>, (1)
+>;

--- SQL command prepared.
>>
>>obey TEST122(uid_in_plan);
>>log;
look for one uid only
  ObjectUIDs .......
look for more than one uid
>>
>>
>>execute s1;

--- 3 row(s) inserted.
>>
>>prepare s1 from select * from t122t1;

--- SQL command prepared.
>>
>>obey TEST122(uid_in_plan);
>>log;
look for one uid only
  ObjectUIDs .......
look for more than one uid
>>
>>
>>execute s1;

A          
-----------

          0
          5
          1

--- 3 row(s) selected.
>>
>>invoke t122t1;

-- Definition of Trafodion table TRAFODION.SCH.T122T1
-- Definition current  Thu Nov  6 22:00:11 2014

  (
    A                                INT NO DEFAULT NOT NULL NOT DROPPABLE
  )

--- SQL operation complete.
>>
>>select count(*) from t122t1;

(EXPR)              
--------------------

                   3

--- 1 row(s) selected.
>>
>>update t122t1 set a = 55 where a = 5;

--- 1 row(s) updated.
>>
>>delete from t122t1 where a = 55;

--- 1 row(s) deleted.
>>
>>sh sqlci -i"TEST122(redefine1)";
>>
>>drop table t122t1;

--- SQL operation complete.
>>
>>create table t122t1 ( a char(4) not null );

--- SQL operation complete.
>>
>>insert into t122t1 values ('i'), ('ii'), ('iii'), ('iv');

--- 4 row(s) inserted.
>>
>>exit;

End of MXCI Session

>>
>>select * from t122t1;

A   
----

i   
ii  
iii 
iv  

--- 4 row(s) selected.
>>
>>invoke t122t1;

-- Definition of Trafodion table TRAFODION.SCH.T122T1
-- Definition current  Thu Nov  6 22:00:31 2014

  (
    A                                CHAR(4) CHARACTER SET ISO88591 COLLATE
      DEFAULT NO DEFAULT NOT NULL NOT DROPPABLE
  )

--- SQL operation complete.
>>
>>insert into t122t1 values ('i'), ('ii'), ('iii'), ('iv');

--- 4 row(s) inserted.
>>
>>select count(*) from t122t1;

(EXPR)              
--------------------

                   8

--- 1 row(s) selected.
>>
>>update t122t1 set a = 'ix' where a = 'ii';

--- 2 row(s) updated.
>>
>>delete from t122t1 where a = 'i';

--- 2 row(s) deleted.
>>
>>
>>obey TEST122(clnup);
>>
>>drop table t122t1 cascade;

--- SQL operation complete.
>>
>>
>>exit;

End of MXCI Session

