>>obey TEST130(setup);
>>
>>create table t130lob1 (c1 blob);

--- SQL operation complete.
>>create table t130lob2 (c1 int not null, c2 blob , primary key (c1));

--- SQL operation complete.
>>create table t130lob3 (c1 int not null,
+>c2 blob, c3 blob, primary key (c1));

--- SQL operation complete.
>>create table t130lob4 (c1 int not null,
+>c2 char(10), c3 clob, primary key (c1));

--- SQL operation complete.
>>
>>
>>obey TEST130(dml_insert);
>>insert into t130lob1 values(NULL);

--- 1 row(s) inserted.
>>select * from t130lob1;

C1
----------------------------------------------------------------------------------------------------

?                                                                                                   

--- 1 row(s) selected.
>>
>>insert into t130lob2 values(1,stringtolob('inserted row11'));

--- 1 row(s) inserted.
>>insert into t130lob2 values(2,stringtolob('inserted row12'));

--- 1 row(s) inserted.
>>insert into t130lob2 values(3,stringtolob('inserted row13'));

--- 1 row(s) inserted.
>>insert into t130lob2 values(3,stringtolob('xxxx'));

*** ERROR[8102] The operation is prevented by a unique constraint.

--- 0 row(s) inserted.
>>select * from t130lob2;

C1           C2
-----------  ----------------------------------------------------------------------------------------------------

          1  LOBH000002000100013579647185009197177606709209127596718212300980818700469017"TRAFODION"."SCH"       
          2  LOBH000002000100013579647185009197177606709209460413718212300980822060824017"TRAFODION"."SCH"       
          3  LOBH000002000100013579647185009197177606709209768095018212300980825169591017"TRAFODION"."SCH"       

--- 3 row(s) selected.
>>
>>
>>select lobtostring(c2,10) from t130lob2;

(EXPR)    
----------

inserted r
inserted r
inserted r

--- 3 row(s) selected.
>>select lobtostring(c2,2) from t130lob2;

(EXPR)
------

in    
in    
in    

--- 3 row(s) selected.
>>select c1,lobtostring(c2) from t130lob2;

C1           (EXPR)
-----------  ----------------------------------------------------------------------------------------------------------------------------------------------------------------------------------------------------------------------------------------------------------------------------------------------------------------------------------------------------------------------------------------------------------------------------------------------------------------------------------------------------------------------------------------------------------------------------------------------------------------------------------------------------------------------------------------------------------------------------------------------------------------------------------------------------------------------------------------------------------------------------------------------------------------------------------------------------------------------------------------------------------------------------------------

          1  inserted row11                                                                                                                                                                                                                                                                                                                                                                                                                                                                                                                                                                                                                                                                                                                                                                                                                                                                                                                                                                                                                          
          2  inserted row12                                                                                                                                                                                                                                                                                                                                                                                                                                                                                                                                                                                                                                                                                                                                                                                                                                                                                                                                                                                                                          
          3  inserted row13                                                                                                                                                                                                                                                                                                                                                                                                                                                                                                                                                                                                                                                                                                                                                                                                                                                                                                                                                                                                                          

--- 3 row(s) selected.
>>
>>
>>obey TEST130(dml_join);
>>insert into t130lob3 values (1,stringtolob('inserted row21a'),stringtolob('inserted row21b'));

--- 1 row(s) inserted.
>>insert into t130lob3 values (2,stringtolob('inserted row22a'),stringtolob('inserted row22b'));

--- 1 row(s) inserted.
>>insert into t130lob3 values (3,stringtolob('inserted row23a'),stringtolob('inserted row23b'));

--- 1 row(s) inserted.
>>insert into t130lob3 values (4,stringtolob('inserted row24a'),stringtolob('inserted row24b'));

--- 1 row(s) inserted.
>>
>>prepare s from 
+>select c1, lobtostring(c2,25), lobtostring(c3,25)  from t130lob3;

--- SQL command prepared.
>>
>>
>>
>>select lobtostring(t130lob2.c2,30) from t130lob2, t130lob3 where t130lob2.c1 = t130lob3.c1;

(EXPR)                        
------------------------------

inserted row11                
inserted row12                
inserted row13                

--- 3 row(s) selected.
>>
>>
>>
>>obey TEST130(dml_update);
>>
>>update t130lob2 set c2=stringtolob('updated c2 in all rows');

--- 3 row(s) updated.
>>select c1, lobtostring(c2,30) from t130lob2;

C1           (EXPR)                        
-----------  ------------------------------

          1  updated c2 in all rows        
          2  updated c2 in all rows        
          3  updated c2 in all rows        

--- 3 row(s) selected.
>>
>>update t130lob2 set c2=stringtolob('updated row21a') where c1=1;

--- 1 row(s) updated.
>>select c1, lobtostring(c2,30) from t130lob2;

C1           (EXPR)                        
-----------  ------------------------------

          1  updated row21a                
          2  updated c2 in all rows        
          3  updated c2 in all rows        

--- 3 row(s) selected.
>>select c1, lobtostring(c2,30) from t130lob2 where c1=1;

C1           (EXPR)                        
-----------  ------------------------------

          1  updated row21a                

--- 1 row(s) selected.
>>
>>obey TEST130(dml_update_append);
>>
>>update t130lob2 set c2=stringtolob('appended row21a',append) where c1=1;

--- 1 row(s) updated.
>>select c1, lobtostring(c2) from t130lob2;

C1           (EXPR)
-----------  ----------------------------------------------------------------------------------------------------------------------------------------------------------------------------------------------------------------------------------------------------------------------------------------------------------------------------------------------------------------------------------------------------------------------------------------------------------------------------------------------------------------------------------------------------------------------------------------------------------------------------------------------------------------------------------------------------------------------------------------------------------------------------------------------------------------------------------------------------------------------------------------------------------------------------------------------------------------------------------------------------------------------------------------

          1  updated row21aappended row21a                                                                                                                                                                                                                                                                                                                                                                                                                                                                                                                                                                                                                                                                                                                                                                                                                                                                                                                                                                                                           
          2  updated c2 in all rows                                                                                                                                                                                                                                                                                                                                                                                                                                                                                                                                                                                                                                                                                                                                                                                                                                                                                                                                                                                                                  
          3  updated c2 in all rows                                                                                                                                                                                                                                                                                                                                                                                                                                                                                                                                                                                                                                                                                                                                                                                                                                                                                                                                                                                                                  

--- 3 row(s) selected.
>>select c1, lobtostring(c2) from t130lob2 where c1=1;

C1           (EXPR)
-----------  ----------------------------------------------------------------------------------------------------------------------------------------------------------------------------------------------------------------------------------------------------------------------------------------------------------------------------------------------------------------------------------------------------------------------------------------------------------------------------------------------------------------------------------------------------------------------------------------------------------------------------------------------------------------------------------------------------------------------------------------------------------------------------------------------------------------------------------------------------------------------------------------------------------------------------------------------------------------------------------------------------------------------------------------

          1  updated row21aappended row21a                                                                                                                                                                                                                                                                                                                                                                                                                                                                                                                                                                                                                                                                                                                                                                                                                                                                                                                                                                                                           

--- 1 row(s) selected.
>>
>>
>>update t130lob2 set c2=stringtolob(' appended c2 to all rows',append);

--- 3 row(s) updated.
>>select c1, lobtostring(c2,50) from t130lob2;

C1           (EXPR)                                            
-----------  --------------------------------------------------

          1  updated row21aappended row21a appended c2 to all r
          2  updated c2 in all rows appended c2 to all rows    
          3  updated c2 in all rows appended c2 to all rows    

--- 3 row(s) selected.
>>
>>obey TEST130(dml_delete);
>>
>>delete from t130lob3 where c1=1;

--- 1 row(s) deleted.
>>select c1, lobtostring(c2,30), lobtostring(c3,30)  from t130lob3;

C1           (EXPR)                          (EXPR)
-----------  ------------------------------  ------------------------------

          2  inserted row22a                 inserted row22b               
          3  inserted row23a                 inserted row23b               
          4  inserted row24a                 inserted row24b               

--- 3 row(s) selected.
>>
>>delete from t130lob2 ;

--- 3 row(s) deleted.
>>select * from t130lob2;

--- 0 row(s) selected.
>>
>>log;
